ltable_title,ltable_authors,ltable_venue,ltable_year,rtable_title,rtable_authors,rtable_venue,rtable_year,Truth
the sift information dissemination system,"daniel a. keim , alexander hinneburg",sigmod record,2001 ,iterative spatial join,"james clifford , albert croker , alexander tuzhilin",acm sigmod record,2001 ,1
materialization : a powerful and ubiquitous abstraction pattern,"ricky k. taira , ion tim ieong , wesley w. chu",acm trans . database syst .,1995 ,materialization : a powerful and ubiquitous abstraction pattern,"vipul kashyap , amit sheth",acm transactions on database systems ( tods ),1995 ,1
improved query performance with variant indexes,"raghu ramakrishnan , yannis e. ioannidis",sigmod conference,2002 ,improved query performance with variant indexes,"laks v. s. lakshmanan , fereidoon sadri , iyer n. subramanian",international conference on management of data,2002 ,1
applying update streams in a soft real-time database system,"panos constantopoulos , yannis vassiliou , matthias jarke , john mylopoulos",sigmod record,2001 ,cost estimation of user-defined methods in object-relational database systems,"anastassia ailamaki , david j. dewitt , mark d. hill , marios skounakis",acm sigmod record,2001 ,1
naos - efficient and modular reactive capabilities in an object-oriented database system,"dengfeng gao , eileen tien lin , jun rao , ihab f. ilyas , guy m. lohman",sigmod record,2001 ,implementing lazy database updates for an object database system,"mahesh v. joshi , ramesh c. agarwal , vipin kumar",acm sigmod record,2001 ,1
toward autonomic computing with db2 universal database,"steffen staab , rudi studer , york sure",sigmod conference,2002 ,toward autonomic computing with db2 universal database,"yoshiharu ishikawa , ravishankar subramanya , christos faloutsos",international conference on management of data,2002 ,1
benchmarking spatial join operations with spatial output,"h. olivie , r. maelbrancke",acm trans . database syst .,1995 ,locating and accessing data repositories with websemantics,,acm transactions on database systems ( tods ),1995 ,1
declarative updates of relational databases,"jeff pavel , luis gravano , aleksandr voskoboynik , eugene agichtein , viktoriya sokolova",sigmod conference,1995 ,declarative updates of relational databases,"yannis e. ioannidis , viswanath poosala",acm sigmod record,1995 ,1
visual coko : a debugger for query optimizer development,"mario piattini , francisco ruiz , coral calero",sigmod conference,2001 ,visual coko : a debugger for query optimizer development,"nicolas bruno , surajit chaudhuri",international conference on management of data,2001 ,1
a consumer viewpoint on mediator languages - a proposal for a standard,"scott shenker , christos h. papadimitriou , richard m. karp",sigmod record,2001 ,on completeness of historical relational query languages,,acm sigmod record,2001 ,1
why decision support fails and how to fix it,richard t. snodgrass,sigmod record,1995 ,expiring data in a warehouse,richard taylor,acm sigmod record,1995 ,1
semantic integration of semistructured and structured data sources,"boon thau loo , jennifer widom , chris olston",sigmod record,2001 ,query rewriting for semistructured data,"bj &#246; rn blohsfeld , dieter korus , bernhard seeger",acm sigmod record,2001 ,1
a taxonomy for secure object-oriented databases,"laks v. s. lakshmanan , raymond t. ng , theodore johnson",sigmod record,2001 ,a database approach to quality of service specification in video databases,"mark papiani , jasmin l. wason , alistair n. dunlop , denis a. nicole",acm sigmod record,2001 ,1
efficient computation of iceberg cubes with complex measures,"nevzat hurkan balkir , gultekin özsoyoglu",sigmod conference,2002 ,applying formal methods to semantic-based decomposition of transactions,"nevzat hurkan balkir , gultekin ozsoyoglu",acm sigmod record,2002 ,1
report on the 5th international workshop on the design and management of data warehouses ( dmdw ' 03 ),"andrew eisenberg , jim melton",sigmod record,2003 ,controlling data warehouses with knowledge networks,"andrew eisenberg , jim melton",acm sigmod record,2003 ,1
xbase : making your gigabyte disk queriable,"robert rees , luis-felipe cabrera , wayne hineman",sigmod conference,2002 ,xbase : making your gigabyte disk queriable,"thomas eiter , james j. lu , thomas lukasiewicz , v. s. subrahmanian",international conference on management of data,2002 ,1
integrating symbolic images into a multimedia database system using classification and abstraction approaches,"elaheh pourabbas , maurizio rafanelli",sigmod conference,2001 ,picodmbs : scaling down database techniques for the smartcard,"elaheh pourabbas , maurizio rafanelli",international conference on management of data,2001 ,1
contorting high dimensional data for efficient main memory processing,"andreas koeller , amy j. lee , xin zhang , anisoara nica , elke a. rundensteiner , amber van wyk , yong li",sigmod conference,2002 ,contorting high dimensional data for efficient main memory knn processing,"andreas paepcke , hector garcia-molina , gerard rodriguez-mula , junghoo cho",international conference on management of data,2002 ,1
finding intensional knowledge of distance-based outliers,"florian krebs , christian böhm , bernhard braunmüller , hans-peter kriegel",acm trans . database syst .,1995 ,finding intensional knowledge of distance-based outliers,"walid aref , daniel barbar &#225; , padmavathi vallabhaneni",very large data bases,1995 ,1
concurrency in the data warehouse,"daniel barbará , sushil jajodia , ningning wu , julia couto",sigmod record,2001 ,devise ( demo abstract ) : integrated querying and visual exploration of large datasets,"daniel barbar &#225; , julia couto , sushil jajodia , ningning wu",acm sigmod record,2001 ,1
the software information base : a server for reuse,"barbara liskov , atul adya , robert gruber , umesh maheshwari",sigmod record,2001 ,the software information base : a server for reuse,"fabio casati , ming-chien shan , dimitrios georgakopoulos",acm sigmod record,2001 ,1
data partitioning and load balancing in parallel disk systems,"carole a. goble , brian j. read",sigmod record,1994 ,data partitioning and load balancing in parallel disk systems,"brigitta k &#246; nig-ries , peter c. lockermann",acm sigmod record,1995 ,1
hierarchies and relative operators in the olap environment,charly kleissner,acm trans . database syst .,1995 ,query optimization for xml,charly kleissner,acm transactions on database systems ( tods ),1995 ,1
optimization of constrained frequent set queries with 2-variable constraints,"piero fraternali , stefano paraboschi , stefano ceri",sigmod record,2001 ,containment of conjunctive queries : beyond relations as sets,"peter buneman , leonid libkin , dan suciu , val tannen , limsoon wong",acm sigmod record,2001 ,1
data warehouse configuration,"dan suciu , ioana manolescu , daniela florescu , alon y. levy",sigmod record,2001 ,databases and visualization,"serge abiteboul , bernd amann , sophie cluet , adi eyal , laurent mignet , tova milo",acm sigmod record,2001 ,1
query by diagram : a graphical environment for querying databases,"stefan deßloch , joachim thomas , nelson mendonça mattos",sigmod record,1999 ,oodb bulk loading revisited : the partitioned-list approach,"stefan de &#223; loch , nelson mendon &#231; a mattos",acm sigmod record,1999 ,1
microsoft site server ( commerce edition ),"chris clifton , yücel saygin , vassilios s. verykios",sigmod record,2001 ,database management systems and the internet,"y &#252; cel saygin , vassilios s. verykios , chris clifton",acm sigmod record,2001 ,1
determining text databases to search in the internet,"hector garcia-molina , luis gravano , anthony tomasic",acm trans . database syst .,1995 ,determining text databases to search in the internet,"vincent oria , m. tamer &#214; zsu , paul j. iglinski , shu lin , bin yao",acm transactions on database systems ( tods ),1995 ,1
sap r/3 : a database application system ( tutorial ),alon y. halevy,acm trans . database syst .,1996 ,orthogonally persistent object systems,alon y. halevy,very large data bases,1996 ,1
efficient dynamic mining of constrained frequent sets,"daniela florescu , alberto o. mendelzon , alon y. levy",sigmod record,1994 ,efficient numerical error bounding for replicated network services,"julie basu , jos &#233; alberto fern &#225; ndez , olga peschansky",acm sigmod record,1994 ,1
ansi sql hierarchical processing can fully integrate native xml,"piyush goel , balakrishna r. iyer",sigmod record,2003 ,ansi sql hierarchical processing can fully integrate native xml,dan suciu,acm sigmod record,2003 ,1
exploiting statistics on query expressions for optimization,"ethan l. miller , theodore johnson",acm trans . database syst .,1995 ,exploiting statistics on query expressions for optimization,"mark levene , george loizou",acm transactions on database systems ( tods ),1995 ,1
an axiomatic model of dynamic schema evolution in objectbase systems,"denis gouin , henry kucera , christian larouche , gilles clement , paul morin",acm trans . database syst .,1995 ,an axiomatic model of dynamic schema evolution in objectbase systems,"narayanan shivakumar , hector garcia-molina , chandra chekuri",acm transactions on database systems ( tods ),1995 ,1
designing and mining multi-terabyte astronomy archives : the sloan digital sky survey,"stefan manegold , peter a. boncz , martin l. kersten",sigmod record,1995 ,on the semantics of now in databases,"peter a. boncz , stefan manegold , martin l. kersten",acm sigmod record,1995 ,1
agflow : agent-based cross-enterprise workflow management system,"alexandros nanopoulos , yannis manolopoulos",sigmod conference,2001 ,agflow : agent-based cross-enterprise workflow management system,"a. maedche , b. motik , l. stojanovic",acm sigmod record,2001 ,1
efficient optimistic concurrency control using loosely synchronized clocks,"sangyong hwang , kihong kim , sang kyun cha , keunjoo kwon",sigmod record,2001 ,efficient optimistic concurrency control using loosely synchronized clocks,"serge abiteboul , richard hull",acm sigmod record,2001 ,1
a database interface for file updates,"piero fraternali , stefano paraboschi , stefano ceri",sigmod record,1995 ,data modelling versus ontology engineering,"angela bonifati , stefano ceri",acm sigmod record,1995 ,1
temporal aggregation in active database rules,"alexander aiken , daniel shawcross wilkerson , saul schleimer",sigmod record,2001 ,an algebraic approach to static analysis of active database rules,"michael j. carey , nelson m. mattos , anil k. nori",acm sigmod record,2001 ,1
database systems - breaking out of the box,sandeepan banerjee,sigmod record,1996 ,database systems-breaking out of the box,richard snodgrass,acm sigmod record,1995 ,1
aggregate-query processing in data warehousing environments,"letizia tanca , stefano ceri , piero fraternali , stefano paraboschi",acm trans . database syst .,1995 ,dyda : data warehouse maintenance in fully concurrent environments,"stefano ceri , piero fraternali , stefano paraboschi",acm transactions on database systems ( tods ),1995 ,1
iterative spatial join,"kyuseok shim , rajeev rastogi , minos n. garofalakis , sridhar ramaswamy",sigmod record,1995 ,iterative spatial join,"leonidas fegaras , david maier",acm sigmod record,1995 ,1
the xxl search engine : ranked retrieval of xml data using indexes and ontologies,"ouri wolfson , yixiu huang , sushil jajodia",sigmod record,1996 ,parallel database systems 101,"ouri wolfson , sushil jajodia , yixiu huang",acm sigmod record,1996 ,1
"fastmap : a fast algorithm for indexing , data-mining and visualization of traditional and multimedia datasets","elizabeth j. o'neil , denis rinfret , patrick e. o'neil",sigmod conference,2002 ,"fastmap : a fast algorithm for indexing , data-mining and visualization of traditional and multimedia datasets","peter baumann , paula furtado , roland ritsch , norbert widmann",international conference on management of data,2002 ,1
emergent semantics and the multimedia semantic web,"sheung-lun hung , shan-hoi ng",sigmod record,2001 ,emergent semantics and the multimedia semantic web,"e. forte , f. haenni , k. warkentyne , e. duval , k. cardinaels , e. vervaet , k. hendrikx , m. wentland forte , f. simillion",acm sigmod record,2001 ,1
extended ehemeral logging : log storage management for applications with long lived transactions,"barbara liskov , atul adya , robert gruber , umesh maheshwari",sigmod record,2001 ,extended ephemeral logging : log storage management for applications with long lived transactions,"jim melton , jan eike michels , vanja josifovski , krishna kulkarni , peter schwarz",acm sigmod record,2001 ,1
staggered striping in multimedia information systems,"mario piattini , francisco ruiz , coral calero",acm trans . database syst .,1995 ,staggered striping in multimedia information systems,"georges gardarin , fernando machuca , philippe pucheral",acm transactions on database systems ( tods ),1995 ,1
fast incremental indexing for full-text information retrieval,"boon thau loo , jennifer widom , chris olston",sigmod record,2001 ,research and practice in federated information systems,"nicolas bruno , nick koudas , divesh srivastava",acm sigmod record,2001 ,1
accessing relational databases from the world wide web,"claus hagen , hans-jörg schek , gustavo alonso , markus tresch",sigmod record,1995 ,database techniques for the world-wide web : a survey,"s. amer-yahia , s. cho , l. v. s. lakshmanan , d. srivastava",acm sigmod record,1995 ,1
instance-based attribute identification in database integration,"denis lee , wayne niblack , james l. hafner , dragutin petkovic , myron flickner , jonathan ashley",sigmod record,1995 ,an adaptive query execution system for data integration,"stella gatziu , arne koschel , g &#252; nter von b &#252; ltzingsloewen , hans fritschi",acm sigmod record,1995 ,1
informix-online xps : a dynamically scalable rdbms for open parallel platforms,"rudolf legat , arne koschel , andree keitel , ralf kramer , claudia rolker , ralf nikolai , peter c. lockemann , konrad zirm",sigmod record,1995 ,informix-online xps : a dynamically scalable rdbms for open parallel platforms,"eugene agichtein , luis gravano , jeff pavel , viktoriya sokolova , aleksandr voskoboynik",acm sigmod record,1995 ,1
principles of optimally placing data in tertiary storage libraries,dan suciu,sigmod conference,2002 ,checking the temporal integrity of interactive multimedia documents,dan suciu,international conference on management of data,2002 ,1
partial results for online query processing,"k. bernhard schiefer , arun n. swami",acm trans . database syst .,1995 ,partial results for online query processing,"donald kossmann , michael j. franklin , gerhard drasch , wig ag",acm transactions on database systems ( tods ),1995 ,1
is gui programming a database research problem ?,"tova milo , mariano p. consens",sigmod conference,2002 ,is gui programming a database research problem ?,"junghwan oh , kien a. hua",international conference on management of data,2002 ,1
fundamentals of data warehouses : 2nd revised and extended edition,david b. lomet,sigmod record,2001 ,what is the data warehousing problem ? ( are materialized views the answer ? ),donald r. deutsch,acm sigmod record,2001 ,1
an experimental system for object-based sharing in federated databases,"holger märtens , erhard rahm , thomas stöhr",sigmod record,2001 ,evaluating functional joins along nested reference sets in object-relational and object-oriented databases,"kenneth a. ross , theodore johnson , richard thomas snodgrass",acm sigmod record,2001 ,1
an ontological analysis of the relationship construct in conceptual modeling,chen li,sigmod record,2001 ,an ontological analysis of the relationship construct in conceptual modeling,"william j. mckenna , louis burger , chi hoang , melissa truong",acm sigmod record,2001 ,1
book review column,xiaolei qian,sigmod record,2002 ,book review column,"carole goble , david de roure",acm sigmod record,2002 ,1
towards automated performance tuning for complex workloads,"s. sudarshan , h. v. jagadish , rajeev rastogi , abraham silberschatz , daniel f. lieuwen",sigmod record,2001 ,towards automated performance tuning for complex workloads,"isabel cruz , ashfaq khokhar , bing liu , prasad sistla , ouri wolfson , clement yu",acm sigmod record,2001 ,1
index-driven similarity search in metric spaces,"jennifer widom , yingwei cui",acm trans . database syst .,2003 ,index-driven similarity search in metric spaces,"gisli r. hjaltason , hanan samet",acm transactions on database systems ( tods ),2003 ,1
searching in metric spaces with user-defined and approximate distances,"vasilis vassalos , janet l. wiener , michael rys , serge abiteboul , jason mchugh",sigmod record,2001 ,optimization of queries with user-defined predicates,"fabrizio ferrandina , thorsten meyer , roberto zicari",acm sigmod record,2001 ,1
filtering algorithms and implementation for very fast publish/subscribe,"fereidoon sadri , laks v. s. lakshmanan , iyer n. subramanian",sigmod record,2001 ,transaction chopping : algorithms and performance studies,"craig silverstein , sergey brin , rajeev motwani , jeffrey d. ullman",acm sigmod record,2001 ,1
a data warehousing architecture for enabling service provisioning process,david b. lomet,sigmod record,2001 ,multigranularity locking in multiple job classes transaction processing system,david lomet,acm sigmod record,2001 ,1
improving timeliness in real-time secure database systems,"beng chin ooi , kian-lee tan , hongjun lu",sigmod record,2001 ,deeds towards a distributed and active real-time database system,"martin bichler , arie segev , j. leon zhao",acm sigmod record,2001 ,1
bulk-loading techniques for object databases and an application to relational data,"christos a. polyzois , hector garcia-molina",acm trans . database syst .,1995 ,hypertext databases and data mining,"chris clifton , hector garcia-molina , david bloom",acm transactions on database systems ( tods ),1995 ,1
rainbow : distributed database system for classroom education and experimental research,"jun rao , kenneth a. ross",sigmod record,1995 ,mocha : a self-extensible database middleware system for distributed data sources,"jim melton , nelson mendoca mattos",acm sigmod record,1995 ,1
iterative spatial join,"k. selçuk candan , wen-syan li , kyoji hirata , yoshinori hara",acm trans . database syst .,1995 ,iterative spatial join,"daniela florescu , alon levy , ioana manolescu , dan suciu",acm transactions on database systems ( tods ),1995 ,1
fast computation of sparse datacubes,li yang,sigmod conference,1995 ,database design for incomplete relations,li yang,acm sigmod record,1995 ,1
cache investment : integrating query optimization and distributed data placement,christian böhm,acm trans . database syst .,1995 ,evolvable view environment ( eve ) : non-equivalent view maintenance under schema changes,christian b &#246; hm,acm transactions on database systems ( tods ),1995 ,1
the design of a retrieval technique for high-dimensional data on tertiary storage,"kyuseok shim , sridhar ramaswamy , rajeev rastogi",sigmod record,1995 ,technology and the future of commerce and finance ( abstract ),"gurmeet singh manku , sridhar rajagopalan , bruce g. lindsay",acm sigmod record,1995 ,1
a consensus glossary of temporal database concepts,"paul cereghini , carlos ordonez",acm trans . database syst .,1995 ,a consensus glossary of temporal database concepts,"clement yu , weiyi meng , wensheng wu , king-lup liu",acm transactions on database systems ( tods ),1995 ,1
the ecobase project : database and web technologies for environmental information systems,"timothy w. finin , anupam joshi",sigmod record,2001 ,adaptive precision setting for cached approximate values,"tim finin , anupam joshi",acm sigmod record,2001 ,1
editorial,"qiang wang , brian d. davison",acm trans . database syst .,1995 ,editorial,won kim,acm transactions on database systems ( tods ),1995 ,1
data mining on an oltp system ( nearly ) for free,"dennis shasha , eric simon , patrick valduriez , françois llirbat",acm trans . database syst .,1995 ,query by humming : in action with its technology revealed,"dennis shasha , francois llirbat , eric simon , patrick valduriez",acm transactions on database systems ( tods ),1995 ,1
incremental distance join algorithms for spatial databases,edward sciore,sigmod conference,2001 ,versant replication : supporting fault-tolerant object databases,edward sciore,international conference on management of data,2001 ,1
the design of a retrieval technique for high-dimensional data on tertiary storage,vijay kumar,sigmod record,1995 ,the design of a retrieval technique for high-dimensional data on tertiary storage,xiaolei qian,acm sigmod record,1996 ,1
"the hbp-tree : a modified hb-tree supporting concurrency , recovery and node consolidation","kotagiri ramamohanarao , evan p. harris",acm trans . database syst .,1995 ,"the hbp-tree : a modified hb-tree supporting concurrency , recovery and node consolidation","damianos chatziantoniou , kenneth a. ross",acm transactions on database systems ( tods ),1995 ,1
tail recursion elimination in deductive databases,"junmin gu , arie shoshani , torben bach pedersen",acm trans . database syst .,1995 ,space optimization in deductive databases,"swarup acharya , viswanath poosala , sridhar ramaswamy",acm transactions on database systems ( tods ),1995 ,1
report on second international workshop on advanced issues of e-commerce and web-based information systems,"s. seshadri , rajeev rastogi , abraham silberschatz , philip bohannon , dennis w. leinbaugh , s. sudarshan",sigmod conference,2001 ,report on second international workshop on advanced issues of e-commerce and web-based information systems,"takeshi fukuda , yasuhiko morimoto , shimichi morishita , takeshi tokuyama",international conference on management of data,2001 ,1
vxmlr : a visual xml-relational database system,"alin dobra , johannes gehrke , rajeev rastogi , minos n. garofalakis",sigmod record,2001 ,sampling large databases for association rules,"kaushik chakrabarti , minos garofalakis , rajeev rastogi , kyuseok shim",acm sigmod record,2001 ,1
partial results for online query processing,"leo mark , lars bækgaard",sigmod conference,2002 ,partial results for online query processing,"john c. shafer , rakesh agrawal",international conference on management of data,2002 ,1
process automation as the foundation for e-business,"yannis e. ioannidis , raghu ramakrishnan , philip a. bernstein",acm trans . database syst .,1995 ,xbase : making your gigabyte disk queriable,"yannis e. ioannidis , raghu ramakrishnan",acm transactions on database systems ( tods ),1995 ,1
spatial joins using r-trees : breadth-first traversal with global optimizations,"laks v. s. lakshmanan , alex pang , raymond t. ng , jiawei han",sigmod record,2001 ,dbsim : a simulation tool for predicting database performance,,acm sigmod record,2001 ,1
storage and querying of e-commerce data,"rachel pottinger , alon y. halevy",sigmod record,1995 ,the mentor workbench for enterprise-wide workflow management,"rada chirkova , alon y. halevy , dan suciu",acm sigmod record,1995 ,1
beyond document similarity : understanding value-based search and browsing technologies,"barbara liskov , atul adya , robert gruber , umesh maheshwari",sigmod record,1996 ,beyond document similarity : understanding value-based search and browsing technologies,asuman dogac,acm sigmod record,1997 ,1
an ultra highly available dbms,"stefano ceri , elena baralis , stefano paraboschi",sigmod record,2001 ,estimating the selectivity of xml path expressions for internet scale applications,"stefano ceri , piero fraternali , stefano paraboschi , letizia tanca",acm sigmod record,2001 ,1
a data model and data structures for moving objects databases,"richard hull , mohammed rupawalla , michael doherty",sigmod record,1995 ,a non-uniform data fragmentation strategy for parallel main-menory database systems,"mark lefler , mark stokrp , craig wong",acm sigmod record,1995 ,1
aurora : a new model and architecture for data stream management,"jeanne vanbriesen , paul s. fischbeck , christos faloutsos , anastassia ailamaki , mitchell j. small",sigmod record,2001 ,aurora : a new model and architecture for data stream management,"marcia a. derr , shinichi morishita , geoffrey phipps",acm sigmod record,2001 ,1
formal query languages for secure relational databases,"kyuseok shim , rajeev rastogi , minos n. garofalakis , sridhar ramaswamy",sigmod record,2001 ,a sequential pattern query language for supporting instant data mining for e-services,"philip a. bernstein , yannis ioannidis , raghu ramakrishnan",acm sigmod record,2001 ,1
editorial,"carol small , alexandra poulovassilis",sigmod record,2001 ,guest editorial,"timothy griffin , leonid libkin",acm sigmod record,2001 ,1
intelligent rollups in multidimensional olap data,william w. cohen,sigmod record,1995 ,w3qs : a query system for the world-wide web,william w. cohen,acm sigmod record,1996 ,1
aqua : a fast decision support systems using approximate query answers,"arnon rosenthal , edward sciore",sigmod record,2001 ,simultaneous optimization and evaluation of multiple dimensional queries,arnon rosenthal,acm sigmod record,2001 ,1
implementation of magic-sets in a relational database system,xiaolei qian,sigmod record,2001 ,a fast index for semistructured data,xiolai qian,acm sigmod record,2001 ,1
gigascope : high performance network monitoring with an sql interface,"weiyi meng , clement t. yu , king-lup liu , wensheng wu",sigmod record,2002 ,a simple algorithm for finding frequent elements in streams and bags,"ling feng , jeffrey xu yu , hongjun lu , jiawei han",acm sigmod record,2002 ,1
active views for electronic commerce,"terry gaasterland , jorge lobo",sigmod record,2001 ,a cost model for clustered object-oriented databases,,acm sigmod record,2001 ,1
