ltable_title,ltable_authors,ltable_venue,ltable_year,rtable_title,rtable_authors,rtable_venue,rtable_year,Truth
book review column,richard t. snodgrass,sigmod record,2002 ,bess object storage manager : architecture overview,richard snodgrass,acm sigmod record,2002 ,1
seeking the truth about ad hoc join costs,"sirirut vanichayobon , leonard brown , ravi a. dirckze , sylvain guinepain , carlos sánchez , le gruenwald , brian summers",sigmod record,2001 ,sing the truth about ad hoc join costs,"georgios evangelidis , david lomet , betty salzberg",acm sigmod record,2001 ,1
book review column,xiaolei qian,sigmod record,2003 ,book review column,karl aberer,acm sigmod record,2003 ,1
bringing object-relational technology to mainstream,"anastassia ailamaki , joseph m. hellerstein",sigmod conference,2002 ,accessing relational databases from the world wide web,"anastassia ailamaki , joseph m. hellerstein",international conference on management of data,2002 ,1
minicon : a scalable algorithm for answering queries using views,david vaskevitch,sigmod record,1994 ,on completeness of historical relational query languages,david vaskevitch,acm sigmod record,1995 ,1
description logics for semantic query optimization in object-oriented database systems,"ouri wolfson , kailash narayanan , son dao , ramya raj , a. prasad sistla",sigmod record,2001 ,evaluating functional joins along nested reference sets in object-relational and object-oriented databases,"sihem amer-yahia , sophie cluet , claude delobel",acm sigmod record,2001 ,1
"the hb-pi-tree : a multi-attribute index supporting concurrency , recovery and node consolidation","jen-wen ding , yueh-min huang , shiao-li tsao",acm trans . database syst .,1995 ,"the hb $ ^ \ \ pi $ - tree : a multi-attribute index supporting concurrency , recovery and node consolidation","rada chirkova , alon y. halevy , dan suciu",acm transactions on database systems ( tods ),1995 ,1
adapting materialized views after redefinitions,"boon thau loo , jennifer widom , chris olston",sigmod record,1995 ,online feedback for nested aggregate queries with multi-threading,"jason mchugh , jennifer widom",acm sigmod record,1995 ,1
methodology for development and employment of ontology based knowledge management applications,"viswanath poosala , sridhar ramaswamy , swarup acharya",sigmod record,2001 ,i/o reference behavior of production database workloads and the tpc benchmarks-an analysis at the logical level,"swarup acharya , phillip b. gibbons , viswanath poosala , sridhar ramaswamy",acm sigmod record,2001 ,1
indexing large metric spaces for similarity search queries,"yanlei diao , hongjun lu , zengping tian , songting chen",sigmod record,2001 ,using extended feature objects for partial similarity retrieval,"donald kossmann , michael j. franklin , gerhard drasch , wig ag",acm sigmod record,2001 ,1
contorting high dimensional data for efficient main memory processing,"mike p. papazoglou , bernd j. krämer",sigmod record,2001 ,report on the 18th british national conference on databases ( bncod ),"m. p. papazoglou , b. j. kr &#228; mer",acm sigmod record,2001 ,1
odefs : a file system interface to an object-oriented database,ramesh c. agarwal,sigmod record,1995 ,efficient support for interactive service in multi-resolution vod systems,ramesh c. agarwal,acm sigmod record,1995 ,1
a study on data point search for hg-trees,"lynn o. wilson , peter g. selfridge , divesh srivastava",sigmod record,1995 ,integration approaches for cim,"sihem amer-yahia , mary fern &#225; ndez , divesh srivastava , yu xu",acm sigmod record,1995 ,1
a scalable architecture for autonomous heterogeneous database interactions,"anthony tomasic , eric simon",sigmod record,1995 ,an extendible hash for multi-precision similarity querying of image databases,,acm sigmod record,1995 ,1
digital library services in mobile computing,"nenad jukic , svetlozar nestorov , susan v. vrbsky",acm trans . database syst .,1995 ,digital library services in mobile computing,"walid aref , daniel barbar &#225; , padmavathi vallabhaneni",acm transactions on database systems ( tods ),1995 ,1
selective information dissemination in p2p networks : problems and solutions,"chee yong chan , minos n. garofalakis , rajeev rastogi",sigmod record,1996 ,schema and database evolution in the o2 object database system,"kaushik chakrabarti , minos garofalakis , rajeev rastogi , kyuseok shim",acm sigmod record,1996 ,1
beyond market baskets : generalizing association rules to correlations,"alexandros nanopoulos , yannis manolopoulos",acm trans . database syst .,1995 ,beyond market baskets : generalizing association rules to correlations,william l. gettys,acm transactions on database systems ( tods ),1995 ,1
krdb ' 98 : the 5th international workshop on knowledge representation meets databases,"dieter fensel , alexander maedche , christoph bussler",sigmod record,1994 ,report on the 5th international workshop on knowledge representation meets databases ( krdb ' 98 ),"elvira schaefer , jan-dirk becker , andreas boehmer , matthias jarke",acm sigmod record,1994 ,1
on computing correlated aggregates over continual data streams,"mark levene , george loizou",acm trans . database syst .,1995 ,context-based prefetch - an optimization for implementing objects on relations,"mark levene , george loizou",acm transactions on database systems ( tods ),1995 ,1
fast algorithms for universal quantification in large databases,"william i. grosky , farshad fotouhi , ishwar k. sethi",sigmod record,2002 ,two techniques for on-line index modification in shared nothing parallel databases,"m. p. papazoglou , j. hoppenbrouwers",acm sigmod record,2002 ,1
the long-term preservation of authentic electronic records,"gísli r. hjaltason , hanan samet",acm trans . database syst .,2003 ,a simple algorithm for finding frequent elements in streams and bags,"edwin h. jacox , hanan samet",acm transactions on database systems ( tods ),2003 ,1
database research at the university of oklahoma,"johannes gehrke , rakesh agrawal , dimitrios gunopulos , prabhakar raghavan",sigmod record,1995 ,the database group at university of hagen,"jayavel shanmugasundaram , arvind nithrakashyap , rajendran sivasankaran , krithi ramamritham",acm sigmod record,1995 ,1
incremental computation of nested relational query expressions,"dennis shasha , eric simon , patrick valduriez , françois llirbat",acm trans . database syst .,1995 ,incremental computation of nested relational query expressions,jan jannink,acm transactions on database systems ( tods ),1995 ,1
from ternary relationship to relational tables : a case against common beliefs,"narayanan shivakumar , junghoo cho , hector garcia-molina",sigmod record,2003 ,reminiscences on influential papers,"sergey melnik , hector garcia-molina",acm sigmod record,2003 ,1
heuristic and randomized optimization for the join ordering problem,"abraham silberschatz , stanley b. zdonik",sigmod record,2001 ,query processing and optimization in oracle rdb,"jiawei han , jian pei , yiwen yin",acm sigmod record,2001 ,1
predator : a resource for database research,"kevin chen-chuan chang , seung-won hwang",acm trans . database syst .,1995 ,spatial indexing of high-dimensional data based on relative approximation,"kevin chen-chuan chang , seung-won hwang",acm transactions on database systems ( tods ),1995 ,1
active storage for large-scale data mining and multimedia,"kyu-young whang , gunter schlageter , amr el abbadi",sigmod conference,2001 ,active storage for large-scale data mining and multimedia,"fabrizio ferrandina , thorsten meyer , roberto zicari , guy ferran , jo &#235; lle madec",acm sigmod record,2001 ,1
database research at columbia university,"daniel barbará , tomasz imielinski",sigmod record,1995 ,database research at ut arlington,sudarshan s. chawathe,acm sigmod record,1995 ,1
statix : making xml count,"andré eickler , carsten andreas gerlhof , donald kossmann",sigmod record,2001 ,iterative spatial join,"martin bichler , arie segev , j. leon zhao",acm sigmod record,2001 ,1
mpeg-7 standard for multimedia databases,"kimberly keeton , joseph m. hellerstein , david a. patterson",sigmod record,1995 ,an extensible notation for spatiotemporal index queries,"joseph m. hellerstein , jeffrey f. naughton",acm sigmod record,1995 ,1
picodmbs : scaling down database techniques for the smartcard,"ling liu , robert meersman",sigmod record,2001 ,the tv-tree : an index structure for high-dimensional data,"ling liu , robert meersman",acm sigmod record,2001 ,1
self-tuning histograms : building histograms without looking at data,"edward chan , tei-wei kuo , s. w. ng , dick hung , kam-yiu lam",acm trans . database syst .,1995 ,self-tuning histograms : building histograms without looking at data,"yun-wu huang , ning jing , elke a. rundensteiner",acm transactions on database systems ( tods ),1995 ,1
maintenance of implication integrity constraints under updates to constraints,weidong chen,acm trans . database syst .,1995 ,the aggregate data problem : a system for their definition and management,weidong chen,acm transactions on database systems ( tods ),1995 ,1
using metadata for the intelligent browsing of structured media objects,michael h. böhlen,acm trans . database syst .,1995 ,integrating sql databases with content-specific search engines,michael l. brodie,acm transactions on database systems ( tods ),1995 ,1
"report on the first international conference on ontologies , databases and applications of semantics","james j. lu , guido moerkotte , joachim schü , v. s. subrahmanian",acm trans . database syst .,1995 ,"report on the first international conference on ontologies , databases and applications of semantics ( odbase ) : part of the federated conference on the move to meaningful internet systems 2002","roger bamford , d. butler , boris klots , n. macnaughton",acm transactions on database systems ( tods ),1995 ,1
proxy-server architectures for olap,h. v. jagadish,acm trans . database syst .,1995 ,semcog : an object-based image retrieval system and its visual query interface,h. v. jagadish,acm transactions on database systems ( tods ),1995 ,1
image mining in iris : integrated retinal information system,"daniel barbará , hector garcia-molina",acm trans . database syst .,1995 ,the persistent cache : improving oid indexing in temporal object-oriented database systems,"junghoo cho , hector garcia-molina",acm transactions on database systems ( tods ),1995 ,1
using metadata for the intelligent browsing of structured media objects,"viswanath poosala , sridhar ramaswamy , swarup acharya",acm trans . database syst .,1995 ,using metadata for the intelligent browsing of structured media objects,"soumen chakrabarti , shourya roy , mahesh v. soundalgekar",acm transactions on database systems ( tods ),1995 ,1
spatial queries in dynamic environments,"latha s. colby , kenneth a. ross , akira kawaguchi , daniel f. lieuwen , inderpal singh mumick",sigmod record,2001 ,experiences in mining aviation safety data,"jonathan ashley , myron flickner , james hafner , denis lee , wayne niblack , dragutin petkovic",acm sigmod record,2001 ,1
editorial,"philippe bonnet , allan beaufour , mads bondo dydensborg , martin leopold",acm trans . database syst .,1995 ,editorial,"phil fernandez , donovan schneider",acm transactions on database systems ( tods ),1995 ,1
interaction of query evaluation and buffer management for information retrieval,"peter m. chen , wee teck ng",sigmod record,2001 ,the onion technique : indexing for linear optimization queries,"janet l. wiener , jeffrey f. naughton",acm sigmod record,2001 ,1
"tpc-ds , taking decision support benchmarking to the next level","jian pei , guozhu dong , ke wang , jiawei han , jianyong wang",sigmod conference,2002 ,"tpc-ds , taking decision support benchmarking to the next level","wai fu fung , david sun , johannes gehrke",international conference on management of data,2002 ,1
contorting high dimensional data for efficient main memory processing,"kien a. hua , jung-hwan oh",sigmod record,1995 ,describing semistructured data,,acm sigmod record,1995 ,1
applying database visualization to the world wide web,"manfred a. jeusfeld , hans-joachim lenz , panos vassiliadis , martin staudt",sigmod conference,2002 ,applying database visualization to the world wide web,"george a. mihaila , louiqa raschid , anthony tomasic",international conference on management of data,2002 ,1
"review of the data warehouse toolkit : the complete guide to dimensional modeling ( 2nd edition ) by ralph kimball , margy ross . john wiley & sons , inc. 2002","mike p. papazoglou , bernd j. krämer",acm trans . database syst .,2001 ,"review of the data warehouse toolkit : the complete guide to dimensional modeling ( 2nd edition ) by ralph kimball , margy ross . john wiley & sons , inc. 2002 .",bob gerber,acm transactions on database systems ( tods ),2001 ,1
first-class views : a key to user-centered computing,"asterio k. tanaka , patrick valduriez",acm trans . database syst .,1995 ,first-class views : a key to user-centered computing,christian b &#246; hm,acm transactions on database systems ( tods ),1995 ,1
a top-down approach for two level serializability,frank g. goethals,sigmod record,1995 ,sampling-based estimation of the number of distinct values of an attribute,frank g. goethals,acm sigmod record,1997 ,1
approximate query processing using wavelets,"kevin strehlo , ralph kimball",acm trans . database syst .,1995 ,approximate query processing using wavelets,"jerry baulier , philip bohannon , s. gogate , s. joshi , c. gupta , a. khivesera , henry f. korth , peter mcilroy , j. miller , p. p. s. narayan , m. nemeth , rajeev rastogi , abraham silberschatz , s. sudarshan",acm transactions on database systems ( tods ),1995 ,1
griddb : a database interface to the grid,"barbara liskov , atul adya , robert gruber , umesh maheshwari",sigmod record,2001 ,database research at ut arlington,"reza sadri , carlo zaniolo , amir m. zarkesh , jafar adibi",acm sigmod record,2001 ,1
a multi-similarity algebra,"douglas banks , marcel kornacker",acm trans . database syst .,1999 ,a multi-similarity algebra,"jayavel shanmugasundaram , arvind nithrakashyap , rajendran sivasankaran , krithi ramamritham",acm transactions on database systems ( tods ),1995 ,1
"the sensor spectrum : technology , trends , and requirements","king-ip lin , h. v. jagadish , christos faloutsos",acm trans . database syst .,1995 ,"the sensor spectrum : technology , trends , and requirements","per - &#197; ke larson , goetz graefe",acm transactions on database systems ( tods ),1995 ,1
atomicity and isolation for transactional processes,"gísli r. hjaltason , hanan samet",acm trans . database syst .,2003 ,efficient optimistic concurrency control using loosely synchronized clocks,"gisli r. hjaltason , hanan samet",acm transactions on database systems ( tods ),2003 ,1
devise : integrated querying and visual exploration of large datasets ( demo abstract ),"damianos chatziantoniou , kenneth a. ross",acm trans . database syst .,1995 ,a transaction replication scheme for a replicated database with node autonomy,"jingren zhou , kenneth a. ross",acm transactions on database systems ( tods ),1995 ,1
the aditi deductive database system,"b. sreenath , s. seshadri",sigmod record,1995 ,secure buffering in firm real-time database systems,"kimberly keeton , david a. patterson , joseph m. hellerstein",acm sigmod record,1995 ,1
sqlem : fast clustering in sql using the em algorithm,"shahram ghandeharizadeh , doug fang",acm trans . database syst .,1995 ,sqlem : fast clustering in sql using the em algorithm,"azer bestavros , spyridon braoudakis",acm transactions on database systems ( tods ),1995 ,1
object database evolution using separation of concerns,"vipul kashyap , amit p. sheth",sigmod record,1995 ,information systems research at rwth aachen,amit p. sheth,acm sigmod record,1995 ,1
the myriad federated database prototype,"michèle cart , claire morpain , jean-françois pons , jean ferrié",acm trans . database syst .,1995 ,the myriad federated database prototype,"peter spyns , robert meersman , mustafa jarrar",acm transactions on database systems ( tods ),1995 ,1
re-designing distance functions and distance-based applications for high dimensional data,"barbara liskov , atul adya , robert gruber , umesh maheshwari",sigmod record,2001 ,distance-based indexing for high-dimensional metric spaces,"alexander s. szalay , peter z. kunszt , ani thakar , jim gray , don slutz , robert j. brunner",acm sigmod record,2001 ,1
the xps approach to loading and unloading terabyte databases,"jeannie shands , kenneth salem , hector garcia-molina",sigmod record,1995 ,solving satisfiability and implication problems in database systems,,acm sigmod record,1995 ,1
book review column,"m. tamer özsu , randal j. peters",sigmod record,2002 ,book review column,"shan-hoi ng , sheung-lun hung",acm sigmod record,2002 ,1
multi-step processing of spatial joins,"yanlei diao , hongjun lu , zengping tian , songting chen",acm trans . database syst .,1995 ,multi-step processing of spatial joins,"giuseppe santucci , laura tarantino",acm transactions on database systems ( tods ),1995 ,1
the cougar project : a work-in-progress report,"david b. lomet , mark r. tuttle",sigmod conference,2001 ,sonar : system for optimized numeric association rules,"david lomet , mark tuttle",acm sigmod record,2001 ,1
dbcache : middle-tier database caching for highly scalable e-business architectures,leonid libkin,sigmod conference,2001 ,on completeness of historical relational query languages,leonid libkin,acm sigmod record,2001 ,1
psoup : a system for streaming queries over streaming data,"patrick e. o'neil , dallan quass",sigmod record,2001 ,association rules over interval data,"tong zhou , ling liu , calton pu",acm sigmod record,2001 ,1
versant replication : supporting fault-tolerant object databases,"alex dekhtyar , robert ross , v. s. subrahmanian",sigmod conference,2001 ,multimediaminer : a system prototype for multimedia data mining,"alex dekhtyar , robert ross , v. s. subrahmanian",acm sigmod record,2001 ,1
containment of conjunctive queries : beyond relations as sets,"leonard brown , le gruenwald",sigmod record,1998 ,containment of conjunctive queries : beyond relations as sets,"oscar d &#237; az , arturo jaime , norman w. paton , ghassan al-qaimari",acm sigmod record,1998 ,1
exploiting statistics on query expressions for optimization,"takeshi tokuyama , takeshi fukuda , yasuhiko morimoto , shinichi morishita",sigmod conference,1995 ,exploiting statistics on query expressions for optimization,"wilburt labio , jun yang , yingwei cui , hector garcia-molina , jennifer widom",international conference on management of data,1995 ,1
indexing medium-dimensionality data in oracle,bill rosneblatt,sigmod conference,1995 ,indexing medium-dimensionality data in oracle,"nick roussopoulos , yannis kotidis , mema roussopoulos",acm sigmod record,1995 ,1
discovery of multiple-level association rules from large databases,"taosong he , stephen g. eick , kenneth c. cox",sigmod record,1995 ,a cost model for clustered object-oriented databases,"debabrata dey , veda c. storey , terence m. barron",acm sigmod record,1995 ,1
tutorial : designing an ultra highly available dbms,"beng chin ooi , bin cui , kian-lee tan , jianwen su",sigmod record,2001 ,a case for fractured mirrors,"beng chin ooi , cheng hian goh , kian-lee tan",acm sigmod record,2001 ,1
beyond market baskets : generalizing association rules to correlations,"kian-lee tan , tat-seng chua , beng chin ooi , wynne hsu",sigmod record,1995 ,object database evolution using separation of concerns,"calton pu , karsten schwan , jonathan walpole",acm sigmod record,1995 ,1
security of random data perturbation methods,"jun gao , jian pei , tengjiao wang , shiwei tang , yuqing wu , dongqing yang",sigmod record,2001 ,a study on data point search for hg-trees,"beng chin ooi , kian-lee tan , tat seng chua , wynne hsu",acm sigmod record,2001 ,1
views in a large scale xml repository,"p. bruce berra , bhavani m. thuraisingham , kingsley c. nwosu",sigmod conference,1995 ,views in a large scale xml repository,daniel j. dietterich,acm sigmod record,1995 ,1
issues in network management in the next millennium,"martin wechsler , ulrike glavitsch , peter schäuble",acm trans . database syst .,1995 ,silkroute : a framework for publishing relational data in xml,,acm transactions on database systems ( tods ),1995 ,1
efficient and cost-effective techniques for browsing and indexing large video databases,"sirirut vanichayobon , leonard brown , ravi a. dirckze , sylvain guinepain , carlos sánchez , le gruenwald , brian summers",sigmod record,2001 ,efficient and cost-effective techniques for browsing and indexing large video databases,"s. adali , p. bonatti , m. l. sapino , v. s. subrahmanian",acm sigmod record,2001 ,1
wrapping web data into xml,"david b. lomet , roger s. barga",sigmod record,2001 ,dyda : data warehouse maintenance in fully concurrent environments,"david b. lomet , mark r. tuttle",acm sigmod record,2001 ,1
efficient dynamic mining of constrained frequent sets,"gísli r. hjaltason , hanan samet",acm trans . database syst .,2003 ,"transactional information systems : theory , algorithms , and the practice of concurrency control and recovery","gisli r. hjaltason , hanan samet",acm transactions on database systems ( tods ),2003 ,1
implementing data cubes efficiently,"gautam das , dimitrios gunopulos",acm trans . database syst .,1995 ,implementing data cubes efficiently,"nick roussopoulos , yannis kotidis , mema roussopoulos",acm transactions on database systems ( tods ),1995 ,1
building a laboratory information system around a c++ - based object-oriented dbms,"sha guo , mark allen weiss , wei sun",sigmod record,1997 ,versioning and configuration management in an object-oriented data model,"brian babcock , shivnath babu , rajeev motwani , mayur datar",acm sigmod record,1997 ,1
erratum : a database model for object dynamics,"amit p. sheth , kshitij shah , clemens bertram",sigmod record,1997 ,are we working on the right problems ? ( panel ),,acm sigmod record,1997 ,1
book review column,"jenny chiang , ze-nian li , osmar r. zaïane , sonny h. chee , jiawei han",sigmod record,1997 ,book review column,"jayen vaghani , kotagiri ramamohanarao , david b. kemp , zoltan somogyi , peter j. stuckey , tim s. leask , james harland",acm sigmod record,1997 ,1
online aggregation,"boon thau loo , jennifer widom , chris olston",sigmod record,1995 ,online association rule mining,"georges gardarin , jean-robert gruser , zhao-hui tang",acm sigmod record,1995 ,1
the database and information system research group at the university of ulm,karl aberer,sigmod record,2002 ,to table or not to table : a hypertabular answer,karl aberer,acm sigmod record,2002 ,1
book review column,"alberto o. mendelzon , paolo atzeni",sigmod record,2001 ,book review column,arvola chan,acm sigmod record,2001 ,1
finding replicated web collections,"surajit chaudhuri , kyuseok shim",sigmod record,2001 ,chorochronos : a research network for spatiotemporal database systems,"surajit chaudhuri , vivek narasayya",acm sigmod record,2001 ,1
research issues in active database systems : report from the closing panel at ride-ads '94,"daniel j. rosenkrantz , nick koudas , dan suciu , peter scheuermann , rajeev rastogi , jiawei han , kenneth a. ross",acm trans . database syst .,1995 ,research issues in active database systems : report from the closing panel at ride-ads '94,"h. v. jagadish , j. madar , raymond t. ng",acm transactions on database systems ( tods ),1995 ,1
a normal form for precisely characterizing redundancy in nested relations,"rajeev motwani , aristides gionis , piotr indyk",sigmod record,1995 ,scalablity and availability in oracle7 7.3,,acm sigmod record,1995 ,1
"sqlj part 0 , now known as sql/olb ( object-language bindings )",peter z. revesz,acm trans . database syst .,1995 ,design principles for data-intensive web sites,peter z. revesz,acm transactions on database systems ( tods ),1995 ,1
providing better support for a class of decision support queries,"takeshi tokuyama , takeshi fukuda , yasuhiko morimoto , shinichi morishita",sigmod record,1997 ,flexible relations - operational support of variant relational structures,"wen-syan li , k. sel &#231; uk candan , kyoji hirata , yoshinori hara",acm sigmod record,1997 ,1
a toolkit for negotiation support interfaces to multi-dimensional data,"shimin chen , todd c. mowry , phillip b. gibbons",acm trans . database syst .,1995 ,declarative updates of relational databases,,acm transactions on database systems ( tods ),1995 ,1
probabilistic object bases,"viswanath poosala , swarup acharya , phillip b. gibbons",sigmod conference,2001 ,probabilistic object bases,"kaushik chakrabarti , eamonn keogh , sharad mehrotra , michael pazzani",acm sigmod record,2001 ,1
on completeness of historical relational query languages,michael j. carey,acm trans . database syst .,1995 ,flexible relations - operational support of variant relational structures,michael m. david,acm transactions on database systems ( tods ),1995 ,1
flexible support for multiple access control policies,"ron avnur , joseph m. hellerstein",sigmod record,2001 ,"database tuning : principles , experiments , and troubleshooting techniques ( part i )","alexander aiken , joseph m. hellerstein , jennifer widom",acm sigmod record,2001 ,1
optimization of queries with user-defined predicates,"alexander borgida , martin staudt , vinay k. chaudhri",sigmod record,2001 ,semantic integration of semistructured and structured data sources,"sang h. son , rasikan david , bhavani thuraisingham",acm sigmod record,2001 ,1
database research at arizona state university,"nevzat hurkan balkir , gultekin özsoyoglu",sigmod record,1995 ,the database group at university of hagen,"thomas vetterli , anca vaduva , martin staudt",acm sigmod record,1995 ,1
