ltable_title,ltable_authors,ltable_venue,ltable_year,rtable_title,rtable_authors,rtable_venue,rtable_year,Truth
the building blocks for specifying communication behavior of complex objects : an activity-driven approach,"hanan samet , edwin h. jacox",acm trans . database syst .,1995 ,the building blocks for specifying communication behavior of complex objects : an activity-driven approach,"michael j. carey , david j. dewitt , jeffrey f. naughton , mohammad asgarian , paul brown , johannes e. gehrke , dhaval n. shah",acm transactions on database systems ( tods ),1995 ,1
the grid : an application of the semantic web,"david j. dewitt , navin kabra",sigmod conference,2002 ,the grid : an application of the semantic web,"diane l. davison , goetz graefe",international conference on management of data,2002 ,1
secure bufering in firm real-time database systems,reed m. meseck,sigmod record,2001 ,tail recursion elimination in deductive databases,david b. lomet,acm sigmod record,2001 ,1
microsoft english query 7.5 : automatic extraction of semantics from relational databases and olap cubes,"yunyue zhu , xiaojian zhao , dennis shasha",acm trans . database syst .,1995 ,microsoft english query 7.5 : automatic extraction of semantics from relational databases and olap cubes,"theo h &#228; rder , g &#252; nter sauter , joachim thomas",acm transactions on database systems ( tods ),1995 ,1
infering structure in semistructured data,"luis gravano , surajit chaudhuri",sigmod record,1995 ,strudel : a web site management system,"sanjay agrawal , surajit chaudhuri , vivek narasayya",acm sigmod record,1995 ,1
a characterization of the sensitivity of query optimization to storage access cost parameters,"jochen van den bercken , bernhard seeger",sigmod record,2001 ,a characterization of the sensitivity of query optimization to storage access cost parameters,"b. sreenath , s. seshadri",acm sigmod record,2001 ,1
proximity search in databases,"jayant r. haritsa , binto george",sigmod conference,2002 ,proximity search in databases,"chaitanya baru , gilles fecteau",international conference on management of data,2002 ,1
maintenance of data cubes and summary tables in a warehouse,david b. lomet,sigmod record,1997 ,the database group at national technical university of athens ( ntua ),david b. lomet,acm sigmod record,1996 ,1
ontologies : a silver bullet for knowledge management and electronic commerce - book review,"alex dekhtyar , robert ross , v. s. subrahmanian",sigmod record,2001 ,silkroute : a framework for publishing relational data in xml,"alex dekhtyar , robert ross , v. s. subrahmanian",acm sigmod record,2001 ,1
will database researchers have any role in data security ? ( panel abstract ),karl aberer,sigmod record,2003 ,irisnet : internet-scale resource-intensive sensor services,karl aberer,acm sigmod record,2003 ,1
"information translation , mediation , and mosaic-based browsing in the tsimmis system","yannis kotidis , nick roussopoulos",sigmod conference,2002 ,databases and transaction processing : an application-oriented approach,"yannis kotidis , nick roussopoulos",international conference on management of data,2002 ,1
infering structure in semistructured data,"c. j. date , hugh darwen",sigmod record,2001 ,querying structured text in an xml database,ramesh c. agarwal,acm sigmod record,2001 ,1
massive stochastic testing of sql,"elaheh pourabbas , maurizio rafanelli",acm trans . database syst .,1995 ,massive stochastic testing of sql,"craig silverstein , sergey brin , rajeev motwani , jeffrey d. ullman",very large data bases,1995 ,1
book review column,karl aberer,sigmod record,2002 ,book review column,kenneth a. ross,acm sigmod record,2002 ,1
research issues for data communication in mobile ad-hoc network database systems,"inderpal singh mumick , dallan quass , barinderpal singh mumick",acm trans . database syst .,1995 ,research issues for data communication in mobile ad-hoc network database systems,"kwei-jay lin , ching-shan peng",acm transactions on database systems ( tods ),1995 ,1
an internet-based negotiation server for e-commerce,"alfons kemper , donald kossmann",sigmod record,1995 ,an internet-based negotiation server for e-commerce,"qun chen , andrew lim , kian win ong",acm sigmod record,1995 ,1
space optimization in deductive databases,hugh darwen,sigmod conference,2001 ,query processing in tertiary memory databases,hugh darwen,international conference on management of data,2001 ,1
cost-based selection of path expression processing algorithms in object-oriented databases,"raymond t. ng , edwin m. knorr",sigmod record,2001 ,cost estimation of user-defined methods in object-relational database systems,"kimberly keeton , david a. patterson , joseph m. hellerstein",acm sigmod record,2001 ,1
efficient mid-query re-optimization of sub-optimal query execution plans,"yanlei diao , hao zhang , peter m. fischer , michael j. franklin , mehmet altinel",acm trans . database syst .,1995 ,efficient mid-query re-optimization of sub-optimal query execution plans,"yasushi sakurai , masatoshi yoshikawa , shunsuke uemura , haruhiko kojima",very large data bases,1995 ,1
xquery formal semantics : state and challenges,"kaippallimalil j. jacob , dennis shasha",sigmod record,2001 ,xquery formal semantics state and challenges,"pinar koksal , sena nural arpinar , asuman dogac",acm sigmod record,2001 ,1
simultaneous optimization and evaluation of multiple dimensional queries,dan suciu,sigmod conference,2001 ,models and languages for describing and discovering e-services,dan suciu,acm sigmod record,2001 ,1
materialized view maintenance and integrity constraint checking : trading space for time,"anthony tomasic , eric simon",sigmod record,1995 ,using unknowns to prevent discovery of association rules,,acm sigmod record,1995 ,1
3d geographic network displays,"ching-tien ho , rakesh agrawal , nimrod megiddo , ramakrishnan srikant",acm trans . database syst .,1995 ,report on the second ieee metadata conference ( metadata ' 97 ),"ching-tien ho , rakesh agrawal , nimrod megiddo , ramakrishnan srikant",acm transactions on database systems ( tods ),1995 ,1
user-optimizer communication using abstract plans in sybase ase,"tova milo , serge abiteboul , sophie cluet",acm trans . database syst .,1995 ,schema and database evolution in the o2 object database system,"serge abiteboul , sophie cluet , tova milo",acm transactions on database systems ( tods ),1995 ,1
data warehousing and business intelligence for e-commerce - book review,"peter j. h. king , jonathan k. lawder",sigmod record,2001 ,online dynamic reordering for interactive data processing,,acm sigmod record,2001 ,1
dbxplorer : enabling keyword search over relational databases,"bryan smith , meikel pöss , lubor kollár , per-åke larson",sigmod conference,1995 ,dbxplorer : enabling keyword search over relational databases,"junmin gu , torben bach pedersen , arie shoshani",international conference on management of data,1995 ,1
reminiscences on influential papers,xiaolei qian,sigmod record,2002 ,reminiscences on influential papers,"andrew eisenberg , jim melton",acm sigmod record,2002 ,1
chain : operator scheduling for memory minimization in data stream systems,"jiawei han , teresa mah , laks v. s. lakshmanan , raymond t. ng",sigmod record,2001 ,an experimental object-based sharing system for networked databases,"marc gyssens , laks v. s. lakshmanan",acm sigmod record,2001 ,1
declarative updates of relational databases,"raghu ramakrishnan , yannis e. ioannidis",sigmod record,1995 ,a general technique for querying xml documents using a relational database system,"achim kraiss , gerhard weikum",acm sigmod record,1995 ,1
experiences in federated databases : from iro-db to miro-web,"leonidas fegaras , david maier",sigmod record,1995 ,experiences in federated databases : from iro-db to miro-web,daniel barbar &#225;,acm sigmod record,1995 ,1
experiences in federated databases : from iro-db to miro-web,ronald fagin,acm trans . database syst .,1995 ,comprehension syntax,ronald fagin,acm transactions on database systems ( tods ),1995 ,1
capturing both types and constraints in data integration,"chengyu sun , divyakant agrawal , amr el abbadi",acm trans . database syst .,1995 ,composing web services on the semantic web,"chengyu sun , divyakant agrawal , amr el abbadi",acm transactions on database systems ( tods ),1995 ,1
cluster validity methods : part i,"kenneth a. ross , zhe li",sigmod record,2001 ,are we working on the right problems ? ( panel ),,acm sigmod record,2001 ,1
silkroute : a framework for publishing relational data in xml,"giuseppe santucci , tiziana catarci",sigmod conference,2001 ,outlier detection for high dimensional data,,acm sigmod record,2001 ,1
comparative analysis of five xml query languages,"nenad jukic , svetlozar nestorov , susan v. vrbsky",acm trans . database syst .,1995 ,approximating aggregate queries about web pages via random walks,"nenad jukic , svetlozar nestorov , susan vrbsky",acm transactions on database systems ( tods ),1995 ,1
silkroute : a framework for publishing relational data in xml,"prasanna ganesan , sunita sarawagi , surajit chaudhuri",sigmod record,2001 ,efficiently publishing relational data as xml documents,"fernando berzal , nicol &#225; s mar &#237; n",acm sigmod record,2001 ,1
semint : a system prototype for semantic integration in heterogeneous databases,"james geller , ashish mehta , erich j. neuhold , yehoshua perl",sigmod record,2001 ,managing uncertainty in sensor database,"klemens b &#246; hm , karl aberer , erich j. neuhold , xiaoya yang",acm sigmod record,2001 ,1
a scalable and highly available networked database architecture,c. mohan,sigmod conference,2002 ,description logics for semantic query optimization in object-oriented database systems,c. mohan,international conference on management of data,2002 ,1
a data warehousing architecture for enabling service provisioning process,"hector garcia-molina , ramana yerneni , wilburt labio",sigmod record,1996 ,data warehousing and olap for decision support,"james clifford , albert croker , alexander tuzhilin",acm sigmod record,1996 ,1
hodfa : an architectural framework for homogenizing heterogeneous legacy database,"tova milo , sagit zohar",sigmod conference,1995 ,join queries with external text sources : execution and optimization techniques,"tova milo , sagit zohar",international conference on management of data,1995 ,1
re-tree : an efficient index structure for regular expressions,"sushil jajodia , xiaoyang sean wang , elisa bertino , claudio bettini",sigmod record,1995 ,are the terms version and variant orthogonal to one another ?,,acm sigmod record,1995 ,1
incremental distance join algorithms for spatial databases,"guido moerkotte , jens claußen , klaus peithner , alfons kemper",sigmod record,1995 ,cure : an efficient clustering algorithm for large databases,"weiyi meng , king-lup liu , clement t. yu , xiaodong wang , yuhsi chang , naphtali rishe",acm sigmod record,1995 ,1
a top-down approach for two level serializability,"sungran cho , laks v. s. lakshmanan , divesh srivastava , sihem amer-yahia",acm trans . database syst .,1995 ,sting : a statistical information grid approach to spatial data mining,"h. v. jagadish , laks v. s. lakshmanan , divesh srivastava",acm transactions on database systems ( tods ),1995 ,1
information management for genome level bioinformatics,"donovan a. schneider , phillip m. fernandez",sigmod conference,2001 ,information management for genome level bioinformatics,"can t &#252; rker , michael gertz",international conference on management of data,2001 ,1
lifestreams : a storage model for personal data,won kim,acm trans . database syst .,1995 ,model-based information integration in a neuroscience mediator system,won kim,acm transactions on database systems ( tods ),1995 ,1
security of random data perturbation methods,"raymond t. ng , edwin m. knorr",sigmod conference,2001 ,security of random data perturbation methods,"klemens b &#246; hm , karl aberer , erich j. neuhold , xiaoya yang",acm sigmod record,2001 ,1
timber : a native xml database,"hanuma kodavalla , nagavamsi ponnekanti",sigmod record,1996 ,a language based multidatabase system,"nagavamsi ponnekanti , hanuma kodavalla",acm sigmod record,1996 ,1
"probabilistic temporal databases , i : algebra","chih-he li , irene s. y. kwan , shi-ming huang",sigmod record,1995 ,"probabilistic temporal databases , i : algebra","roy goldman , narayanan shivakumar , suresh venkatasubramanian , hector garcia-molina",acm sigmod record,1995 ,1
xtract : a system for extracting document type descriptors from xml documents,"surojit chatterjee , gholamhosein sheikholeslami , aidong zhang",sigmod conference,2002 ,xtract : a system for extracting document type descriptors from xml documents,"wei han , david buttler , calton pu",international conference on management of data,2002 ,1
index-driven similarity search in metric spaces,"kinji ono , jihad boulos",sigmod record,1995 ,index-driven similarity search in metric spaces,richard snodgrass,acm sigmod record,1995 ,1
snowball : a prototype system for extracting relations from large text collections,avigdor gal,acm trans . database syst .,1995 ,snowball : a prototype system for extracting relations from large text collections,"leonid libkin , rona machlin , limsoon wong",acm transactions on database systems ( tods ),1995 ,1
the drill down benchmark,ronald fagin,sigmod record,2001 ,the drill down benchmark,"peter buneman , leonid libkin , dan suciu , val tannen , limsoon wong",acm sigmod record,2001 ,1
using metadata for the intelligent browsing of structured media objects,"letizia tanca , stefano ceri , piero fraternali , stefano paraboschi",sigmod record,1995 ,"50,000 users on an oracle8 universal server database","angela bonifati , stefano ceri , stefano paraboschi",acm sigmod record,1995 ,1
optimizing queries on compressed bitmaps,"kimberly m. james , isabel f. cruz",sigmod record,2001 ,optimizing queries on compressed bitmaps,"luis gravano , hector garcia-molina",acm sigmod record,2001 ,1
evaluating probabilistic queries over imprecise data,"ashok josji , tirthankar lahiri , amit jasuja , sumanta chatterjee",acm trans . database syst .,1995 ,theory of answering queries using views,"tirthankar lahiri , ashok joshi , amit jasuja , sumanta chatterjee",acm transactions on database systems ( tods ),1995 ,1
indexing multiple sets,"marvin h. solomon , yannis e. ioannidis , odysseas g. tsatalos",sigmod record,2001 ,an introduction to spatial database systems,"nick roussopoulos , yannis kotidis , yannis sismanis",acm sigmod record,2001 ,1
wireless client/server computing for personal information services and applications,"kian-lee tan , tat-seng chua , beng chin ooi , wynne hsu",sigmod record,2001 ,conceptual schema analysis : techniques and applications,"kevin chen-chuan chang , seung-won hwang",acm sigmod record,2001 ,1
text databases : a survey of text models and systems,peter z. revesz,acm trans . database syst .,1995 ,near neighbor search in large metric spaces,peter z. revesz,acm transactions on database systems ( tods ),1995 ,1
atomicity and isolation for transactional processes,richard t. snodgrass,sigmod record,2002 ,record-boundary discovery in web documents,richard snodgrass,acm sigmod record,2002 ,1
report from the nsf workshop on workflow and process automation in information systems,"giuseppe santucci , laura tarantino",sigmod record,2001 ,phoenix : making applications robust,"giuseppe santucci , laura tarantino",acm sigmod record,2001 ,1
online association rule mining,"jayant r. haritsa , juliana freire , maya ramanath , prasan roy , jérôme siméon",acm trans . database syst .,1998 ,online association rule mining,egbert-jan sol,acm transactions on database systems ( tods ),1998 ,1
microsoft site server ( commerce edition ),sherri kennamer,sigmod record,1995 ,implementing deletion in b + - trees,sherri kennamer,acm sigmod record,1995 ,1
database management systems and the internet,mario gentili,sigmod conference,1995 ,new tpc benchmarks for decision support and web commerce,mario gentili,international conference on management of data,1995 ,1
book review column,karl aberer,sigmod record,2002 ,book review column,nancy wiegand,acm sigmod record,2002 ,1
"probabilistic temporal databases , i : algebra","hongjun lu , huan liu , rudy setiono",acm trans . database syst .,1995 ,the role of integrity constraints in database interoperation,"hongjun lu , rudy setiono , huan liu",acm transactions on database systems ( tods ),1995 ,1
book review column,"richard t. snodgrass , vassilis j. tsotras , christian s. jensen",sigmod record,2002 ,book review column,"andrew eisenberg , jim melton",acm sigmod record,2002 ,1
on wrapping query languages and efficient xml integration,jan jannink,sigmod record,2001 ,shrinking the warehouse update window,jan jannink,acm sigmod record,2001 ,1
towards self-tuning data placement in parallel database systems,"banu özden , minos n. garofalakis , abraham silberschatz",acm trans . database syst .,1995 ,principles of optimally placing data in tertiary storage libraries,"minos n. garofalakis , banu &#214; zden , abraham silberschatz",acm transactions on database systems ( tods ),1995 ,1
parallel query scheduling and optimization with time - and space-shared resources,avigdor gal,acm trans . database syst .,1995 ,design and analysis of parametric query optimization algorithms,,acm transactions on database systems ( tods ),1995 ,1
partial results for online query processing,"laks v. s. lakshmanan , jian pei , yan zhao",acm trans . database syst .,2001 ,from nested-loop to join queries in oodb,"laks v. s. lakshmanan , jian pei , yan zhao",acm transactions on database systems ( tods ),2003 ,1
online dynamic reordering for interactive data processing,"raghu ramakrishnan , miron livny , praveen seshadri",sigmod record,2001 ,qxtract : a building block for efficient information extraction from text databases,"rakesh agrawal , king-ip lin , harpreet s. sawhney , kyuseok shim",acm sigmod record,2001 ,1
optimization of constrained frequent set queries with 2-variable constraints,"surajit chaudhuri , kyuseok shim",sigmod conference,2002 ,optimization of constrained frequent set queries with 2-variable constraints,"ashraf aboulnaga , surajit chaudhuri",international conference on management of data,2002 ,1
ogdi : toward interoperability among geospatial databases,arnaud sahuguet,sigmod record,2001 ,ogdi : toward interoperability among geospatial databases,"peter g. selfridge , divesh srivastava , lynn o. wilson",acm sigmod record,2001 ,1
a cost model for clustered object-oriented databases,"jennifer widom , sudarshan s. chawathe , hector garcia-molina , anand rajaraman",acm trans . database syst .,1995 ,a cost model for clustered object-oriented databases,"mary fernandez , atsuyuki morishima , dan suciu",acm transactions on database systems ( tods ),1995 ,1
qcluster : relevance feedback using adaptive clustering for content-based image retrieval,"michael gertz , can türker",sigmod conference,1995 ,qcluster : relevance feedback using adaptive clustering for content-based image retrieval,"charu c. aggarwal , joel l. wolf , philip s. yu , cecilia procopiuc , jong soo park",acm sigmod record,1995 ,1
xmill : an efficient compressor for xml data,"alfons kemper , florian matthes , donald kossmann",sigmod record,1995 ,xmill : an efficient compressor for xml data,"georges gardarin , jean-robert gruser , zhao-hui tang",acm sigmod record,1997 ,1
incremental computation of nested relational query expressions,"david b. lomet , gerhard weikum",acm trans . database syst .,1995 ,an overview and classification of mediated query systems,"david b. lomet , mark r. tuttle",acm transactions on database systems ( tods ),1995 ,1
book review column,rafael camps,sigmod record,2002 ,book review column,"jingren zhou , kenneth a. ross",acm sigmod record,2002 ,1
lopix : a system for xml data integration and manipulation,"sophie cluet , fanny wattez , véronique benzaken , guy ferran , christian fiegel",sigmod record,2001 ,an adaptive query execution system for data integration,"sang h. son , rasikan david , bhavani thuraisingham",acm sigmod record,2001 ,1
polymorphism and type inference in database programming,h. v. jagadish,sigmod conference,2002 ,optimal multi-step k-nearest neighbor search,h. v. jagadish,international conference on management of data,2002 ,1
optimizing queries on compressed bitmaps,"rakesh agrawal , john c. shafer",sigmod record,2001 ,optimization of queries with user-defined predicates,"angela bonifati , stefano ceri",acm sigmod record,2001 ,1
a low-cost storage server for movie on demand databases,jef wijsen,acm trans . database syst .,1995 ,a low-cost storage server for movie on demand databases,"simonas &#352; altenis , christian s. jensen , scott t. leutenegger , mario a. lopez",acm transactions on database systems ( tods ),1995 ,1
new sampling-based summary statistics for improving approximate query answers,v. s. subrahmanian,sigmod conference,2001 ,concurrency in the data warehouse,v. s. subrahmanian,acm sigmod record,2001 ,1
the p operator : discovering and ranking associations on the semantic web,alexander a. anisimov,sigmod conference,2002 ,sting : a statistical information grid approach to spatial data mining,alexander a. anisimov,international conference on management of data,2002 ,1
oodb indexing by class-division,"anand deshpande , josé a. blakeley",acm trans . database syst .,1995 ,oodb indexing by class-division,"pinar koksal , sena nural arpinar , asuman dogac",acm transactions on database systems ( tods ),1995 ,1
rainbow : mapping-driven xquery processing system,"hans-jörg schek , gustavo alonso , heiko schuldt , catriel beeri",sigmod conference,2002 ,rainbow : mapping-driven xquery processing system,"ling tony chen , doron rotem , sidhar seshadri",international conference on management of data,2002 ,1
microsoft english query 7.5 : automatic extraction of semantics from relational databases and olap cubes,"angela bonifati , stefano ceri",sigmod conference,2001 ,dynamic content acceleration : a caching solution to enable scalable dynamic web page generation,"angela bonifati , stefano ceri",acm sigmod record,2001 ,1
distance-based outliers : algorithms and applications,"anil nerode , colin bell , raymond t. ng , v. s. subrahmanian",sigmod record,2001 ,xmas : an extensible main-memory storage system for high-performance applications,"hasan davulcu , juliana freire , michael kifer , i. v. ramakrishnan",acm sigmod record,2001 ,1
tip : a temporal extension to informix,"rune hjelsvold , roger midtstraum",acm trans . database syst .,1995 ,t2 : a customizable parallel database for multi-dimensional data,,acm transactions on database systems ( tods ),1995 ,1
reminiscences on influential papers,xiaolei qian,sigmod record,2002 ,what will be,xiaolei qian,acm sigmod record,2002 ,1
research activities in database management and information retrieval at the university of illinois at chicago,christoph bussler,sigmod conference,2002 ,information integration on the web : a view from ai and databases ( report on iiweb-03 ),christoph bussler,international conference on management of data,2002 ,1
"opportunities at arpa , nsf , and elsewhere","shivnath babu , rajeev rastogi , minos n. garofalakis",sigmod record,1995 ,opportunities in information management and assurance,"jim melton , nelson mendoca mattos",acm sigmod record,1995 ,1
datablitz : a high performance main-memory storage manager,"jim melton , andrew eisenberg",sigmod conference,2001 ,datablitz : a high performance main-memory storage manager,"massimo mecella , barbara pernici",international conference on management of data,2001 ,1
answering xml queries on heterogeneous data sources,"david maier , peter buneman",sigmod record,2001 ,answering queries using views : a survey,sriram padmanabhan,acm sigmod record,2001 ,1
an experimental system for object-based sharing in federated databases,"phillip b. gibbons , yossi matias",sigmod record,1995 ,static analysis techniques for predicting the behavior of active database rules,"phillip b. gibbons , yossi matias",acm sigmod record,1995 ,1
query optimization for xml,carrie ballinger,acm trans . database syst .,1995 ,query optimization for xml,"felipe cari &#241; o , william o'connell , john burgess , joel h. saltz",acm transactions on database systems ( tods ),1995 ,1
building knowledge base management systems,chebel mina,sigmod record,1995 ,solving satisfiability and implication problems in database systems,michael m. david,acm sigmod record,1995 ,1
"semi-automatic , self-adaptive control of garbage collection rates in object databases","kyu-young whang , gunter schlageter , amr el abbadi",sigmod record,1995 ,"self-adaptive , on-line reclustering of complex object data","dac khoa doan , norman w. paton , alistair kilgour",acm sigmod record,1995 ,1
database research at columbia university,"ramaraju kalidindi , vijay kumar , rajgopal kannan , s. sitharama iyengar",sigmod record,2001 ,databases for networks,"dimitris papadias , yufei tao , greg fu , bernhard seeger",acm sigmod record,2001 ,1
progressive evaluation of nested aggregate queries,"venky harinarayan , ashish gupta , anand rajaraman",sigmod record,2001 ,processing complex aggregate queries over data streams,"jayavel shanmugasundaram , arvind nithrakashyap , rajendran sivasankaran , krithi ramamritham",acm sigmod record,2001 ,1
partition selection policies in object database garbage collection,"amihai motro , troels andreasen",acm trans . database syst .,1995 ,relational databases for querying xml documents : limitations and opportunities,"amihai motro , troels andreasen",acm transactions on database systems ( tods ),1995 ,1
