ltable_title,ltable_authors,ltable_venue,ltable_year,rtable_title,rtable_authors,rtable_venue,rtable_year,Truth
static analysis techniques for predicting the behavior of active database rules,"duri schmidt , angelika kotz dittrich , werner dreyer",,1995.0 ,"static analysis techniques for predicting the behavior of active database rules alexander aiken , joseph m. hellerstein , jennifer widom 1995",,international conference on management of data,1995.0 ,1
"domains , relations and religious wars rafael camps sigmod record",,,1995.0 ,normalization in oodb design byung s. lee acm sigmod record,,,1995.0 ,1
architecture of oracle parallel server,,acm trans . database syst .,1995.0 ,cache coherency in oracle parallel server boris klots,"guy pardon , gustavo alonso",,1995.0 ,1
"probabilistic object bases thomas eiter , v. s. subrahmanian , thomas lukasiewicz , james j. lu",,sigmod record,2002.0 ,"probabilistic object bases thomas eiter , james j. lu , thomas lukasiewicz , v. s. subrahmanian acm transactions on database systems ( tods )","raymond ng , laks v. s. lakshmanan , jiawei han , teresa mah",acm sigmod record,2002.0 ,1
online feedback for nested aggregate queries with multi-threading 1999,"barbara liskov , atul adya , robert gruber , umesh maheshwari",vldb j.,2000.0 ,"online feedback for nested aggregate queries with multi-threading kian-lee tan , cheng hian goh , beng chin ooi 1999",,,2000.0 ,1
information finding in a digital library : the stanford perspective,,acm trans . database syst .,1995.0 ,"information finding in a digital library : the stanford perspective tak w. yan , h &#233; ctor garc &#237; a-molina acm sigmod record","zhan cui , dean jones , paul o'brien",,1995.0 ,1
cost estimation of user-defined methods in object-relational database systems 1999,,,1996.0 ,cost estimation of user-defined methods in object-relational database systems 1999,arnaud sahuguet,acm sigmod record,1995.0 ,1
review of web caching and replication by michael rabinovich and oliver spatscheck . addison wesley 2002 sigmod record 2003,"david b. lomet , betty salzberg",, ,review of web caching and replication by michael rabinovich and oliver spatscheck . addison wesley 2002 . 2003,,very large data bases, ,1
safe query languages for constraint databases acm trans . database syst .,,sigmod conference, ,safe query languages for constraint databases peter z. revesz acm transactions on database systems ( tods ),daniel barbar &#225;,, ,1
a formal perspective on the view selection problem vldb,,sigmod conference,1995.0 ,a formal perspective on the view selection problem the vldb journal -- the international journal on very large data bases 2002,,,1995.0 ,1
advances in databases and information systems ( adbis ) 2002,,sigmod conference, ,advances in databases and information systems : report of 5th east european conference adbis ' 2001,"hasanat m. dewan , salvatore j. stolfo , mauricio hern &#225; ndez , jae-jun hwang",, ,1
semint : a system prototype for semantic integration in heterogeneous databases,robert g. atkinson,sigmod conference,1995.0 ,designing wrapper components for e-services in integrating heterogeneous systems,,,1995.0 ,1
iterative spatial join acm trans . database syst .,,sigmod record, ,"iterative spatial join edwin h. jacox , hanan samet acm transactions on database systems ( tods ) 2003","atul adya , robert gruber , barbara liskov , umesh maheshwari",, ,1
databases and transaction processing : an application-oriented approach - book review sigmod record 2002,,, ,"databases and transaction processing : an application-oriented approach philip m. lewis , arthur bernstein , michael kifer",,very large data bases, ,1
research directions in biodiversity informatics vldb,,,1995.0 ,research directions in biodiversity informatics very large data bases,,,1995.0 ,1
"domains , relations and religious wars rafael camps sigmod record",,, ,"in reply to domains , relations and religious wars hugh darwen",,very large data bases, ,1
a scalable algorithm for answering queries using views,,,1995.0 ,a scalable algorithm for answering queries using views,,,1995.0 ,1
safe query languages for constraint databases acm trans . database syst .,,sigmod record, ,on the semantics of now in databases acm transactions on database systems ( tods ),bassel ojjeh,acm sigmod record, ,1
information integration on the web : a view from ai and databases ( report on iiweb-03 ) sigmod record,,,2000.0 ,information integration on the web : a view from ai and databases ( report on iiweb-03 ) acm sigmod record,,very large data bases,2003.0 ,1
the database group at national technical university of athens ( ntua ),"chris clifton , svetlozar nestorov , rajeev motwani , shalom tsur , jeffrey d. ullman , arnon rosenthal , serge abiteboul",,1995.0 ,the database group at national technical university of athens ( ntua ) corporate national technical univ. of athens,,,1995.0 ,1
the database research group at eth zurich,"s. sudarshan , divesh srivastava , raghu ramakrishnan , jeffrey f. naughton",,1998.0 ,the database and information system research group at the university of ulm,,,1995.0 ,1
time-parameterized queries in spatio-temporal databases,"yanlei diao , hongjun lu , zengping tian , songting chen",sigmod record, ,closest pair queries in spatial databases 2000,,acm sigmod record, ,1
the database research group at eth zurich,"gísli r. hjaltason , hanan samet",sigmod record, ,the database and information system research group at the university of ulm,,acm sigmod record, ,1
"similarity-based queries for time series data alberto o. mendelzon , davood rafiei sigmod conference","dennis shasha , philippe bonnet",,1995.0 ,similarity-based queries for time series data international conference on management of data,,,1995.0 ,1
searching in metric spaces with user-defined and approximate distances,,sigmod record, ,"searching in metric spaces with user-defined and approximate distances paolo ciaccia , marco patella",,acm sigmod record, ,1
"a characterization of the sensitivity of query optimization to storage access cost parameters tapas kanungo , frederick reiss 2003","ouri wolfson , yixiu huang , sushil jajodia",vldb,1995.0 ,a characterization of the sensitivity of query optimization to storage access cost parameters international conference on management of data 2003,,,1995.0 ,1
database techniques for the world-wide web : a survey 1998,,sigmod record, ,applying database visualization to the world wide web 1996,"wei wang , jiong yang , richard r. muntz",, ,1
constraints for semi-structured data and xml,"joachim w. schmidt , florian matthes",sigmod record,1995.0 ,a fast index for semistructured data,,,1995.0 ,1
java and relational databases : sqlj ( tutorial ) sigmod conference 1998,,,1998.0 ,java and relational databases ( tutorial ) : sqlj international conference on management of data,christoph bussler,,1995.0 ,1
containment of conjunctive queries : beyond relations as sets,"tova milo , serge abiteboul , sophie cluet",acm trans . database syst .,1995.0 ,containment of conjunctive queries : beyond relations as sets,,,1995.0 ,1
"report on the first international conference on ontologies , databases and applications of semantics karl aberer sigmod record 2003",,, ,report on the 18th british national conference on databases ( bncod ) acm sigmod record,"mary fern &#225; ndez , yana kadiyska , dan suciu , atsuyuki morishima , wang-chiew tan",very large data bases, ,1
disima : a distributed and interoperable image database system sigmod conference,"alin dobra , johannes gehrke , rajeev rastogi , minos n. garofalakis",,2003.0 ,deeds towards a distributed and active real-time database system 1996,,international conference on management of data,2003.0 ,1
query processing in tertiary memory databases sunita sarawagi vldb,,sigmod record, ,query processing in tertiary memory databases,"kemafor anyanwu , amit sheth",, ,1
integrating and customizing heterogeneous e-commerce applications vldb j.,,sigmod conference, ,integrating and customizing heterogeneous e-commerce applications the vldb journal -- the international journal on very large data bases 2001,christoph bussler,, ,1
"optimization of constrained frequent set queries with 2-variable constraints laks v. s. lakshmanan , alex pang , raymond t. ng , jiawei han 1999",,, ,"optimization of constrained frequent set queries with 2-variable constraints laks v. s. lakshmanan , raymond ng , jiawei han , alex pang",,international conference on management of data, ,1
active views for electronic commerce,,sigmod record,2001.0 ,active views for electronic commerce very large data bases,,acm sigmod record,2002.0 ,1
tail recursion elimination in deductive databases kenneth a. ross acm trans . database syst . 1996,,,1995.0 ,tail recursion elimination in deductive databases acm transactions on database systems ( tods ),,the vldb journal -- the international journal on very large data bases,1995.0 ,1
generating spatiotemporal datasets on the www sigmod record 2000,"wolfgang wonner , gerhard weikum , michael gillmann",, ,generating spatiotemporal datasets on the www,,very large data bases, ,1
"efficient retrieval of similar shapes davood rafiei , alberto o. mendelzon vldb j.",,sigmod record, ,efficient retrieval of similar shapes 2002,re &#233; e j. miller,acm sigmod record, ,1
chorochronos : a research network for spatiotemporal database systems sigmod record,yannis kotidis,sigmod record, ,an extensible notation for spatiotemporal index queries acm sigmod record,,acm sigmod record, ,1
the database group at national technical university of athens ( ntua ),"david shutt , jason zander , brian harry , paul sanders , philip a. bernstein",acm trans . database syst .,1995.0 ,the database group at national technical university of athens ( ntua ) corporate national technical univ. of athens,,,1995.0 ,1
a normal form for precisely characterizing redundancy in nested relations acm trans . database syst . 1996,,,1995.0 ,a normal form for precisely characterizing redundancy in nested relations 1996,,,1995.0 ,1
a database platform for bioinformatics,,, ,a database platform for bioinformatics very large data bases,"tom barclay , jim gray , don slutz",the vldb journal -- the international journal on very large data bases, ,1
formal query languages for secure relational databases,"jason tsong-li wang , george jyh-shian chang , dennis shasha , girish patel , kaizhong zhang , liam relihan",sigmod record, ,a system for watermarking relational databases,,, ,1
the database group at national technical university of athens ( ntua ),,acm trans . database syst .,1995.0 ,the database group at national technical university of athens ( ntua ) corporate national technical univ. of athens,,,1995.0 ,1
an active functionality service for e-business applications sigmod record 2002,"michael l. brodie , surajit chaudhuri",sigmod conference,1995.0 ,an active functionality service for e-business applications acm sigmod record,,,1995.0 ,1
the database group at national technical university of athens ( ntua ),gerhard weikum,vldb,1995.0 ,the database group at national technical university of athens ( ntua ) corporate national technical univ. of athens,,,1995.0 ,1
the zero latency enterprise 2000,,sigmod record, ,the zero latency enterprise,,acm sigmod record, ,1
efficiently publishing relational data as xml documents 2000,,sigmod record, ,efficiently publishing relational data as xml documents,"e. a. rundensteiner , k. claypool , m. li , l. chen , z. zhang , c. natarajan , j. jin , s. de lima , s. weiner",acm sigmod record, ,1
irisnet : internet-scale resource-intensive sensor services sigmod conference 2003,,,1995.0 ,"irisnet : internet-scale resource-intensive sensor services amol deshpande , suman nath , phillip b. gibbons , srinivasan seshan 2003",,very large data bases,1995.0 ,1
book review column karl aberer 2002,,sigmod conference,1995.0 ,book review column acm sigmod record 2001,,,1994.0 ,1
"domains , relations and religious wars rafael camps sigmod record",,acm trans . database syst .,1995.0 ,normalization in oodb design byung s. lee acm sigmod record,,,1995.0 ,1
fast algorithms for universal quantification in large databases,"karl aberer , xiaoya yang , klemens böhm , erich j. neuhold",,1995.0 ,"fast algorithms for universal quantification in large databases goetz graefe , richard l. cole",,,1994.0 ,1
use of a component architecture in integrating relational and non-relational storage systems sigmod conference 1995,"laks v. s. lakshmanan , raymond t. ng , theodore johnson",vldb,2000.0 ,use of a component architecture in integrating relational and non-relational robert atkinson 1995,,,2000.0 ,1
answering queries using views : a survey vldb j. 2001,,,1995.0 ,theory of answering queries using views alon y. halevy acm sigmod record 2000,bassel ojjeh,the vldb journal -- the international journal on very large data bases,1995.0 ,1
integrating and customizing heterogeneous e-commerce applications vldb j.,,sigmod conference,1997.0 ,integrating and customizing heterogeneous e-commerce applications the vldb journal -- the international journal on very large data bases 2001,h. v. jagadish,,1995.0 ,1
minicon : a scalable algorithm for answering queries using views vldb j.,michael m. david,, ,a scalable algorithm for answering queries using views,,, ,1
balancing histogram optimality and practicality for query result size estimation sigmod conference 1995,,, ,balancing histogram optimality and practicality for query result size estimation 1995,,, ,1
"update propagation strategies to improve freshness in lazy master replicated databases eric simon , esther pacitti vldb j.","barbara liskov , atul adya , robert gruber , umesh maheshwari",, ,update propagation strategies to improve freshness in lazy master replicated databases,,very large data bases, ,1
an efficient method for checking object-oriented database schema correctness,,, ,naos - efficient and modular reactive capabilities in an object-oriented database system 1994,,very large data bases, ,1
query unnesting in object-oriented databases leonidas fegaras 1998,,sigmod record, ,unisql/x unified relational and object-oriented database system won kim 1994,,, ,1
"broadcast protocols to support efficient retrieval from databases by mobile users anindya datta , vijay kumar , aslihan celik , debra e. vandermeer","jeffrey f. naughton , qiong luo",,1995.0 ,broadcast protocols to support efficient retrieval from databases by mobile users acm transactions on database systems ( tods ) 1999,,acm sigmod record,1995.0 ,1
"heuristic and randomized optimization for the join ordering problem guido moerkotte , michael steinbrunn , alfons kemper 1997",,acm trans . database syst .,1995.0 ,"heuristic and randomized optimization for the join ordering problem michael steinbrunn , guido moerkotte , alfons kemper","bruce k. hillyer , avi silberschatz",,1995.0 ,1
workflow history management 1998,"sridhar ramaswamy , swarup acharya , phillip b. gibbons , viswanath poosala",sigmod record, ,workflow history management,,acm sigmod record, ,1
"disjunctive datalog heikki mannila , thomas eiter , georg gottlob","jochen van den bercken , bernhard seeger",sigmod conference,2002.0 ,"disjunctive datalog thomas eiter , georg gottlob , heikki mannila",,,2002.0 ,1
"disjunctive datalog heikki mannila , thomas eiter , georg gottlob",david vaskevitch,sigmod record, ,"disjunctive datalog thomas eiter , georg gottlob , heikki mannila",,acm sigmod record, ,1
ibm 's db2 universal database demonstrations at vldb '98 vldb,"randall g. bello , william d. norcott , mohamed ziauddin , harry sun , karl dias , alan downing , james j. feenan jr. , andrew witkowski , james l. finnerty",sigmod conference,1995.0 ,ibm 's db2 universal database demonstrations at vldb '98 1998,,,1995.0 ,1
a study on the management of semantic transaction for efficient data retrieval 2002,renée j. miller,sigmod conference,1995.0 ,"a study on the management of semantic transaction for efficient data retrieval shi ming huang , irene kwan , chih he li acm sigmod record",,,1995.0 ,1
form-based proxy caching for database-backed web sites,,vldb, ,form-based proxy caching for database-backed web sites very large data bases,"andrew frank , stephane grumbach , ralf hartmut g &#252; ting , christian s. jensen , manolis koubarakis , nikos lorentzos , yannis manolopoulos , enrico nardelli , barbara pernici , hans-j &#246; rg schek , michel scholl , timos sellis , babis theodoulidis , peter widmayer",, ,1
web caching for database applications with oracle web cache,moira c. norrie,vldb j.,1995.0 ,web caching for database applications with oracle web cache,,,1995.0 ,1
actiview : adaptive data presentation using supersql vldb,"hamid pirahesh , t. y. cliff leung , s. sudarshan , praveen seshadri , divesh srivastava , raghu ramakrishnan , joseph m. hellerstein , peter j. stuckey",,1997.0 ,"actiview : adaptive data presentation using supersql yoko maeda , motomichi toyama 2001",,,1995.0 ,1
delaunay : a database visualization system sigmod conference 1997,frédéric cuppens,sigmod conference,1995.0 ,applying database visualization to the world wide web 1996,,,1995.0 ,1
online query processing 2001,,sigmod record, ,toward learning based web query processing 2000,,, ,1
on the cost of monitoring and reorganization of object bases for clustering 1996,,, ,on the cost of monitoring and reorganization of object bases for clustering,,very large data bases, ,1
"iterative dynamic programming : a new class of query optimization algorithms donald kossmann , konrad stocker 2000",,vldb, ,iterative dynamic programming : a new class of query optimization algorithms acm transactions on database systems ( tods ) 2000,"christophe bobineau , luc bouganim , philippe pucheral , patrick valduriez",, ,1
report on fqas 2002 : fifth international conference on flexible query answering systems 2003,"v. s. subrahmanian , elisa bertino , pierangela samarati , sushil jajodia",sigmod record, ,report on the fourth international conference on flexible query answering systems ( fqas 2000 ) acm sigmod record,,acm sigmod record, ,1
conceptual modeling and specification generation for b2b business process based on ebxml 2002,"miron livny , michael j. carey , hweehwa pang",sigmod record, ,conceptual modeling and specification generation for b2b business processes based on ebxml,,, ,1
"is gui programming a database research problem ? ravi krishnamurthy , charles hoch , nita goyal , michael suckow , brian meckler sigmod conference",,vldb j.,1995.0 ,"is gui programming a database research problem ? nita goyal , charles hoch , ravi krishnamurthy , brian meckler , michael suckow 1996",,,1995.0 ,1
semantic and pedagogic interoperability mechanisms in the ariadne educational repository sigmod record 1999,"patrick valduriez , philippe pucheral , christophe bobineau , luc bouganim",sigmod record, ,semantic interoperability in global information systems acm sigmod record 1999,,acm sigmod record, ,1
"panel : future directions of database research - the vldb broadening strategy , part 2","ravishankar subramanya , christos faloutsos , yoshiharu ishikawa",vldb,2000.0 ,"panel : future directions of database research - the vldb broadening strategy , part 2 michael l. brodie 2000",,,2000.0 ,1
fast algorithms for universal quantification in large databases,"yunyue zhu , xiaojian zhao , dennis shasha",sigmod conference,1995.0 ,"fast algorithms for universal quantification in large databases goetz graefe , richard l. cole",,,1995.0 ,1
distance-based indexing for high-dimensional metric spaces sigmod conference,,,1995.0 ,distance-based indexing for high-dimensional metric spaces 1997,"chung-min chen , munir cochinwala , claudio petrone , marc pucci , sunil samtani , patrizia santa",,1995.0 ,1
report on the acm fourth international workshop on data warehousing and olap ( dolap 2001 ) joachim hammer sigmod record 2002,"takeshi tokuyama , yasuhiko morimoto , shinichi morishita , takeshi fukuda",sigmod record, ,report on the acm fourth international workshop on data warehousing and olap ( dolap 2001 ) acm sigmod record 2002,,acm sigmod record, ,1
i/o reference behavior of production database workloads and the tpc benchmarks - an analysis at the logical level,,, ,i/o reference behavior of production database workloads and the tpc benchmarks-an analysis at the logical level acm transactions on database systems ( tods ),"minos n. garofalakis , yannis e. ioannidis",very large data bases, ,1
database research at ut arlington sigmod record 2003,"rajendran m. sivasankaran , bhaskar purimetla , john a. stankovic , krithi ramamritham , donald f. towsley",,1996.0 ,bluetooth-based sensor networks acm sigmod record 2003,,international conference on management of data,1995.0 ,1
on efficiently implementing schemasql on an sql database system,"thomas seidl , marco pötke , hans-peter kriegel",sigmod conference, ,efficiently mining long patterns from databases 1998,,, ,1
spatial queries in dynamic environments,,,2000.0 ,"spatial queries in dynamic environments yufei tao , dimitris papadias",,,2000.0 ,1
transaction timestamping in ( temporal ) databases,,, ,transaction timestamping in ( temporal ) databases very large data bases 2001,,very large data bases, ,1
reminiscences on influential papers sigmod record,"wei wang , richard r. muntz , jiong yang",, ,reminiscences on influential papers 2002,,, ,1
the mariposa distributed database management system sigmod record 1996,,, ,the mariposa distributed database management system acm sigmod record,,very large data bases, ,1
"the design of a retrieval technique for high-dimensional data on tertiary storage ratko orlandic , craig swietlik , jack lukaszuk","taosong he , stephen g. eick , kenneth c. cox",sigmod record,2001.0 ,the design of a retrieval technique for high-dimensional data on tertiary storage acm sigmod record 2002,,acm sigmod record,2001.0 ,1
the database group at national technical university of athens ( ntua ),,sigmod conference,1995.0 ,the database group at national technical university of athens ( ntua ) corporate national technical univ. of athens,,,1999.0 ,1
a formal perspective on the view selection problem vldb,,, ,a formal perspective on the view selection problem the vldb journal -- the international journal on very large data bases 2002,"s. choo , w. o'connell , g. linerman , h. chen , k. ganapathy , a. biliris , e. panagos , d. schrader",acm sigmod record, ,1
"indexing large metric spaces for similarity search queries z. meral özsoyoglu , tolga bozkaya 1999",,, ,"indexing large metric spaces for similarity search queries tolga bozkaya , meral ozsoyoglu acm transactions on database systems ( tods )",,, ,1
an efficient method for checking object-oriented database schema correctness,,vldb,1995.0 ,"an efficient method for checking object-oriented database schema correctness a. formica , h. d. groger , m. missikoff 1998",,,1995.0 ,1
a region splitting strategy for physical database design of multidimensional file organizations vldb 1997,,, ,a region splitting strategy for physical database design of multidimensional file organizations 1997,,, ,1
rainbow : distributed database system for classroom education and experimental research vldb,"sirish chandrasekaran , michael j. franklin",,2000.0 ,rainbow : distributed database system for classroom education and experimental research 2000,,the vldb journal -- the international journal on very large data bases,2000.0 ,1
devise : integrated querying and visualization of large datasets sigmod conference,,,1995.0 ,devise : integrated querying and visual exploration of large datasets international conference on management of data 1997,"j. thomas , s. de &#223; loch , n. mattos",,1995.0 ,1
provision of market services for eco compliant electronic market places sigmod record 2000,"miron livny , raghu ramakrishnan , donko donjerkovic , shilpa lawande , jussi myllymaki , guangshun chen , r. kent wenger , kevin s. beyer",, ,provision of market services for eco compliant electronic marketplaces 2000,,, ,1
"a logical view of structured files tova milo , serge abiteboul , sophie cluet","a. r. hurson , simin h. pakzad , m. w. bright",sigmod record, ,a logical view of structured files 1998,,acm sigmod record, ,1
aggregate-query processing in data warehousing environments vldb,"åsa hagström , duminda wijesekera , francesco parisi-presicce , sushil jajodia",sigmod conference, ,incremental clustering for mining in a data warehousing environment,,, ,1
declarative updates of relational databases,,,2003.0 ,formal query languages for secure relational databases 1994,christoph bussler,international conference on management of data,2003.0 ,1
interviso : dealing with the complexity of federated database access 1995,,,1995.0 ,interviso : dealing with the complexity of federated database access 1995,,very large data bases,1995.0 ,1
"winmagic : subquery elimination using window aggregation qi cheng , hamid pirahesh , linqi liu , kwai wong , wenbin ma , calisto zuzarte","guido moerkotte , sven helmer",acm trans . database syst .,1995.0 ,winmagic : subquery elimination using window aggregation international conference on management of data,,,1995.0 ,1
advances in databases and information systems ( adbis ) 2002,,sigmod record, ,advances in databases and information systems : report of 5th east european conference adbis ' 2001,"zachary g. ives , daniela florescu , marc friedman , alon levy , daniel s. weld",acm sigmod record, ,1
a unified framework for enforcing multiple access control policies,,, ,flexible support for multiple access control policies 2001,,, ,1
multi-dimensional selectivity estimation using compressed histogram information 1999,"m. tamer özsu , david toman , mariano p. consens , david dehaan",,2000.0 ,multi-dimensional selectivity estimation using compressed histogram information,,very large data bases,2000.0 ,1
