ltable_title,ltable_authors,ltable_venue,ltable_year,rtable_title,rtable_authors,rtable_venue,rtable_year,Truth
"datablitz : a high performance main-memory storage manager p. p. s. narayan , s. joshi , m. nemeth , abraham silberschatz , henry f. korth , a. khivesera , jerry baulier , s. sudarshan , philip bohannon , peter mcilroy , j. miller , s. gogate , rajeev rastogi , c. gupta vldb",,, ,"datablitz : a high performance main-memory storage manager jerry baulier , philip bohannon , s. gogate , s. joshi , c. gupta , a. khivesera , henry f. korth , peter mcilroy , j. miller , p. p. s. narayan , m. nemeth , rajeev rastogi , abraham silberschatz , s. sudarshan",,, ,1
advances in databases and information systems ( adbis ) 2002,,sigmod record, ,the database and information system research group at the university of ulm,"carsten a. gerlhof , alfons kemper , guido moerkotte",acm sigmod record, ,1
quality-driven integration of heterogenous information systems vldb 1999,"rajeev rastogi , minos n. garofalakis , kyuseok shim , kaushik chakrabarti",acm trans . database syst .,1995.0 ,quality-driven integration of heterogenous information systems,,,1995.0 ,1
rolex : relational on-line exchange with xml 2003,"barbara liskov , atul adya , robert gruber , umesh maheshwari",sigmod conference, ,rolex : relational on-line exchange with xml,,, ,1
picodbms : scaling down database techniques for the smartcard 2001,"jun rao , kenneth a. ross",sigmod record, ,picodmbs : scaling down database techniques for the smartcard,,acm sigmod record, ,1
advances in databases and information systems ( adbis ) 2002,,sigmod record, ,advances in databases and information systems : report of 5th east european conference adbis ' 2001,"andrew eisenberg , jim melton",acm sigmod record, ,1
materialized views and data warehouses nick roussopoulos sigmod record,,, ,materialized views and data warehouses,,very large data bases, ,1
"active storage for large-scale data mining and multimedia garth a. gibson , erik riedel , christos faloutsos",,, ,"active storage for large-scale data mining and multimedia erik riedel , garth a. gibson , christos faloutsos","matthias jarke , christoph quix , guido blees , dirk lehmann , gunter michalk , stefan stierl",the vldb journal -- the international journal on very large data bases, ,1
a hypertext query language for images li yang,,sigmod record, ,a hypertext query language for images,"georgios evangelidis , david lomet , betty salzberg",acm sigmod record, ,1
form-based proxy caching for database-backed web sites,,sigmod record, ,form-based proxy caching for database-backed web sites very large data bases,"laura m. haas , donald kossmann , ioana ursu",acm sigmod record, ,1
partition selection policies in object database garbage collection sigmod conference,,, ,partition selection policies in object database garbage collection international conference on management of data,,very large data bases, ,1
algebraic query optimisation for database programming languages vldb j.,,sigmod record, ,algebraic query optimisation for database programming languages,,acm sigmod record, ,1
estimating compilation time of a query optimizer 2003,,, ,estimating compilation time of a query optimizer,ramesh c. agarwal,international conference on management of data, ,1
time-parameterized queries in spatio-temporal databases,"giuseppe santucci , tiziana catarci",vldb j.,1995.0 ,closest pair queries in spatial databases 2000,,,1995.0 ,1
query processing techniques for arrays 2002,,sigmod record, ,"query processing techniques for arrays arunprasad p. marathe , kenneth salem",,acm sigmod record, ,1
parallel database systems 101 jim gray 1995,,sigmod conference,1995.0 ,parallel database systems 101 1995,"jiawei han , jian pei , yiwen yin",,1995.0 ,1
the grid : an application of the semantic web 2002,"mike p. papazoglou , bernd j. krämer",sigmod record, ,"agents , trust , and information access on the semantic web 2002",,, ,1
safe stratified datalog with integer order does not have syntax,karl aberer,sigmod record, ,"safe stratified datalog with integer order does not have syntax alexei p. stolboushkin , michael a. taitslin",,acm sigmod record, ,1
semantic assumptions and query evaluation in temporal databases,"daniela florescu , alberto o. mendelzon , alon y. levy",, ,semantic assumptions and query evaluation in temporal databases international conference on management of data,,acm sigmod record, ,1
"evaluation of remote backup algorithms for transaction-processing systems christos a. polyzois , hector garcia-molina acm trans . database syst .",,, ,evaluation of remote backup algorithms for transaction-processing systems,,the vldb journal -- the international journal on very large data bases, ,1
spatial joins using r-trees : breadth-first traversal with global optimizations 1997,"wei wang , richard r. muntz , jiong yang",sigmod conference,1997.0 ,spatial joins using r-trees : breadth-first traversal with global optimizations,,,1995.0 ,1
efficiently publishing relational data as xml documents 2000,,acm trans . database syst .,1995.0 ,efficiently publishing relational data as xml documents,,,1995.0 ,1
spatial queries in dynamic environments,"enrico nardelli , timos k. sellis , andrew u. frank , stéphane grumbach , hans-jörg schek , manolis koubarakis , michel scholl , ralf hartmut güting , barbara pernici , christian s. jensen , nikos a. lorentzos , babis theodoulidis , yannis manolopoulos , peter widmayer",sigmod record,1995.0 ,"spatial queries in dynamic environments yufei tao , dimitris papadias",,,1995.0 ,1
"database systems - breaking out of the box abraham silberschatz , stanley b. zdonik sigmod record 1997","barbara liskov , atul adya , robert gruber , umesh maheshwari",, ,database systems-breaking out of the box 1997,,very large data bases, ,1
a research status report on adaptation for mobile data access 1995,"stefan deßloch , nelson mendonça mattos",,1995.0 ,"a research status report on adaptation for mobile data access brian d. noble , m. satyanarayanan 1995",,,1995.0 ,1
ontologies : a silver bullet for knowledge management and electronic commerce - book review sigmod record 2002,"carole a. goble , omar boucelma , silvana castano , vanja josifovski , zoé lacroix , bertram ludäscher",,1998.0 ,"review of ontologies : a silver bullet for knowledge management and electronic commerce by dieter fensel . springer-verlag , 2002 . antonio badia",,international conference on management of data,1995.0 ,1
report on the second ieee metadata conference ( metadata ' 97 ) 1998,"taosong he , stephen g. eick , kenneth c. cox",sigmod record, ,"report on the second ieee metadata conference ( metadata ' 97 ) ron musick , chris miller acm sigmod record 1998",,acm sigmod record, ,1
supporting valid-time indeterminacy,,sigmod conference,1995.0 ,supporting valid-time indeterminacy 1998,,,1995.0 ,1
persistent threads vldb,,,1995.0 ,persistent threads very large data bases 1994,,,1995.0 ,1
supporting efficient multimedia database exploration vldb j. 2001,"guido moerkotte , alfons kemper , carsten andreas gerlhof",sigmod record, ,supporting efficient multimedia database exploration 2001,,acm sigmod record, ,1
advances in databases and information systems ( adbis ) 2002,,sigmod record,2003.0 ,advances in databases and information systems : report of 5th east european conference adbis ' 2001,joseph m. hellerstein,acm sigmod record,2002.0 ,1
devise : integrated querying and visual exploration of large datasets ( demo abstract ) sigmod conference,,vldb, ,devise : integrated querying and visual exploration of large datasets international conference on management of data 1997,"wai fu fung , david sun , johannes gehrke",, ,1
"database tuning : principles , experiments , and troubleshooting techniques ( part i ) 2002",,sigmod conference,1995.0 ,"database tuning : principles , experiments , and troubleshooting techniques ( part i ) international conference on management of data","antonio corral , yannis manolopoulos , yannis theodoridis , michael vassilakopoulos",,1995.0 ,1
an adaptive data replication algorithm acm trans . database syst .,,, ,are quorums an alternative for data replication ? acm transactions on database systems ( tods ),,, ,1
"a query language for multidimensional arrays : design , implementation , and optimization techniques sigmod conference","iakovos motakis , carlo zaniolo",, ,"a query language for multidimensional arrays : design , implementation , and optimization techniques 1996",,very large data bases, ,1
engineering federated information systems : report of efis '99 workshop sigmod record 1999,,sigmod record, ,advances in databases and information systems : report of 5th east european conference adbis ' 2001,"felipe cari &#241; o , mark jahnke",acm sigmod record, ,1
"on-line warehouse view maintenance jennifer widom , dallan quass 1997",,sigmod record, ,"on-line warehouse view maintenance dallan quass , jennifer widom international conference on management of data 1997",,, ,1
devise : integrated querying and visual exploration of large datasets ( demo abstract ) sigmod conference,"jeanine weißenfels , dirk wodtke , angelika kotz dittrich , gerhard weikum , peter muth",, ,devise : integrated querying and visual exploration of large datasets international conference on management of data 1997,,the vldb journal -- the international journal on very large data bases, ,1
book review column karl aberer sigmod record,,sigmod record, ,book review column karl aberer acm sigmod record,"philip bohannon , xin ( luna ) dong , sumit ganguly , henry f. korth , chengkai li , p. p. s. narayan , pradeep shenoy",acm sigmod record, ,1
devise : integrated querying and visual exploration of large datasets ( demo abstract ) sigmod conference,"helen j. wang , peter j. haas , joseph m. hellerstein",, ,devise : integrated querying and visual exploration of large datasets international conference on management of data 1997,,the vldb journal -- the international journal on very large data bases, ,1
multigranularity locking in multiple job classes transaction processing system,,sigmod record, ,multigranularity locking in multiple job classes transaction processing system acm sigmod record,,acm sigmod record, ,1
fast algorithms for universal quantification in large databases,"paul cereghini , carlos ordonez",vldb,1995.0 ,"fast algorithms for universal quantification in large databases goetz graefe , richard l. cole",,,1995.0 ,1
high-concurrency locking in r-trees 1995,,sigmod conference,1995.0 ,high-concurrency locking in r-trees very large data bases,,,1995.0 ,1
static analysis techniques for predicting the behavior of active database rules,,sigmod record, ,"static analysis techniques for predicting the behavior of active database rules alexander aiken , joseph m. hellerstein , jennifer widom 1995",,acm sigmod record, ,1
"optimization of queries with user-defined predicates surajit chaudhuri , kyuseok shim 1996",,acm trans . database syst .,1995.0 ,optimization of queries with user-defined predicates,"jong-hak lee , young-koo lee , kyu-young whang , il-yeol song",,1995.0 ,1
data warehousing and olap for decision support ( tutorial ) sigmod conference 1997,"nick roussopoulos , alexandros labrinidis",sigmod conference,1995.0 ,"data warehousing and olap for decision support surajit chaudhuri , umeshwar dayal 1997",,,1995.0 ,1
"tcp-d - the challenges , issues and results",?,sigmod record, ,"tpc-d-the challenges , issues and results acm sigmod record 1996",,acm sigmod record, ,1
data mining with optimized two-dimensional association rules,"guido moerkotte , sophie cluet , vassilis christophides",,1995.0 ,data mining with optimized two-dimensional association rules 2001,,,1995.0 ,1
"a multi-paradigm querying approach for a generic multimedia database management system ji-rong wen , qing li , wei-ying ma , hongjiang zhang",,,1995.0 ,"a multi-paradigm querying approach for a generic multimedia database management system ji-rong wen , qing li , wei-ying ma , hong-jiang zhang",,very large data bases,1995.0 ,1
using schema matching to simplify heterogeneous data translation,,, ,using schema matching to simplify heterogeneous data translation 1998,"vijayshankar raman , bhaskaran raman , joseph m. hellerstein",very large data bases, ,1
controlling data warehouses with knowledge networks,"sihem amer-yahia , divesh srivastava , laks v. s. lakshmanan , sungran cho",,1995.0 ,controlling data warehouses with knowledge networks very large data bases 2000,,very large data bases,1995.0 ,1
estimating compilation time of a query optimizer 2003,,acm trans . database syst .,1995.0 ,estimating compilation time of a query optimizer,,acm transactions on database systems ( tods ),1995.0 ,1
information finding in a digital library : the stanford perspective,"christian s. jensen , david b. lomet",sigmod conference,1995.0 ,"information finding in a digital library : the stanford perspective tak w. yan , h &#233; ctor garc &#237; a-molina acm sigmod record",,,1995.0 ,1
"integrating reliable memory in databases peter m. chen , wee teck ng",,,1995.0 ,"integrating reliable memory in databases wee teck ng , peter m. chen 1998",,,1995.0 ,1
an efficient method for checking object-oriented database schema correctness,,,1995.0 ,"an efficient method for checking object-oriented database schema correctness a. formica , h. d. groger , m. missikoff 1998",,,1995.0 ,1
lore : a lightweight object repository for semistructured data 1996,,sigmod conference, ,lore : a lightweight object repository for semistructured data international conference on management of data,,, ,1
chorochronos : a research network for spatiotemporal database systems sigmod record,"peter m. g. apers , mark w. w. vermeer",sigmod record,1996.0 ,chorochronos : a research network for spatiotemporal database systems acm sigmod record,,,1995.0 ,1
"the aditi deductive database system kotagiri ramamohanarao , david b. kemp , jayen vaghani , tim s. leask , james harland , peter j. stuckey , zoltan somogyi 1994",,, ,"the aditi deductive database system jayen vaghani , kotagiri ramamohanarao , david b. kemp , zoltan somogyi , peter j. stuckey , tim s. leask , james harland","james j. lu , guido moerkotte , joachim schue , v. s. subrahmanian",, ,1
hilbert r-tree : an improved r-tree using fractals vldb,,sigmod record, ,hilbert r-tree : an improved r-tree using fractals very large data bases 1994,"jonathan e. cook , alexander l. wolf , benjamin g. zorn",acm sigmod record, ,1
"wrapper generation for semi-structured internet sources craig a. knoblock , naveen ashish sigmod record 1997",,vldb j.,1995.0 ,"wrapper generation for semi-structured internet sources naveen ashish , craig a. knoblock","soumen chakrabarti , martin van den berg , byron dom",,1995.0 ,1
on completeness of historical relational query languages acm trans . database syst .,,sigmod conference, ,incremental computation of nested relational query expressions acm transactions on database systems ( tods ),,, ,1
semantic interoperability in information services : experiencing with coopware 1999,daniel a. keim,sigmod record, ,semantic interoperability in information services : experiencing with coopware,,acm sigmod record, ,1
lore : a lightweight object repository for semistructured data 1996,"tova milo , serge abiteboul , sophie cluet",, ,lore : a lightweight object repository for semistructured data international conference on management of data,,very large data bases, ,1
conceptual schema analysis : techniques and applications acm trans . database syst .,"m. tamer özsu , david toman , mariano p. consens , david dehaan",,1995.0 ,"conceptual schema analysis : techniques and applications s. castano , v. de antonellis , m. g. fugini , b. pernici",,,1995.0 ,1
research directions in biodiversity informatics vldb,,vldb j.,1995.0 ,research directions in biodiversity informatics very large data bases,,,1995.0 ,1
"report on the 18th british national conference on databases ( bncod ) carole a. goble , brian j. read sigmod record",,,1995.0 ,report on the fourth international conference on flexible query answering systems ( fqas 2000 ) acm sigmod record,,,1995.0 ,1
advances in databases and information systems ( adbis ) 2002,"jordan parker , jesse anton , zheng zeng , lawrence jacobs , tie zhong , xiang liu",sigmod record, ,advances in databases and information systems : report of 5th east european conference adbis ' 2001,,acm sigmod record, ,1
fast high-dimensional data search in incomplete databases,,, ,fast high-dimensional data search in incomplete databases very large data bases 1998,"brian cooper , neal sample , michael j. franklin , gisli r. hjaltason , moshe shadmon",, ,1
book review column karl aberer 2002,"barbara liskov , atul adya , robert gruber , umesh maheshwari",, ,book review column,,very large data bases, ,1
hypertext databases and data mining soumen chakrabarti 1999,,sigmod conference,1995.0 ,hypertext databases and data mining soumen chakrabarti international conference on management of data,,,1995.0 ,1
"a toolkit for negotiation support interfaces to multi-dimensional data matthias jarke , stephan jacobs , michael gebhardt sigmod conference","abraham silberschatz , sumit ganguly , yossi matias , phillip b. gibbons",,1995.0 ,"a toolkit for negotiation support interfaces to multi-dimensional data michael gebhardt , matthias jarke , stephan jacobs international conference on management of data 1997",,,1995.0 ,1
"the intrinsic problems of structural heterogeneity and an approach to their solution theo härder , joachim thomas , günter sauter",,sigmod record, ,the intrinsic problems of structural heterogeneity and an approach to their solution the vldb journal -- the international journal on very large data bases 1999,"elisa bertino , ahmed k. elmagarmid , mohand-sa &#239; d hacid",acm sigmod record, ,1
devise : integrated querying and visual exploration of large datasets ( demo abstract ) sigmod conference,,, ,devise : integrated querying and visual exploration of large datasets international conference on management of data 1997,ilsoo ahn,very large data bases, ,1
"efficient and transparent application recovery in client-server information systems david b. lomet , gerhard weikum",,,1995.0 ,"efficient transparent application recovery in client-server information systems david lomet , gerhard weikum international conference on management of data",,,1995.0 ,1
efficient dynamic mining of constrained frequent sets acm trans . database syst . 2003,,, ,"efficient dynamic mining of constrained frequent sets laks v. s. lakshmanan , carson kai-sang leung , raymond t. ng acm transactions on database systems ( tods )",m. moni,, ,1
containment of conjunctive queries : beyond relations as sets,,,1995.0 ,containment of conjunctive queries : beyond relations as sets,,,1995.0 ,1
silkroute : a framework for publishing relational data in xml acm trans . database syst .,,,1995.0 ,silkroute : a framework for publishing relational data in xml acm transactions on database systems ( tods ),"i. mirbel , b. pernici , t. sellis , s. tserkezoglou , m. vazirgiannis",very large data bases,1995.0 ,1
query by diagram : a graphical environment for querying databases,,, ,query by diagram : a graphical environment for querying databases international conference on management of data,"m. livny , r. ramakrishnan , k. beyer , g. chen , d. donjerkovic , s. lawande , j. myllymaki , k. wenger",very large data bases, ,1
"checkpointing in oracle juan loaiza , ashok joshi , tirthankar lahiri , william bridge vldb 1998",,, ,"checkpointing in oracle ashok joshi , william bridge , juan loaiza , tirthankar lahiri very large data bases 1998","alan demers , johannes gehrke , rajmohan rajaraman , niki trigoni , yong yao",very large data bases, ,1
"are quorums an alternative for data replication ? bettina kemme , ricardo jiménez-peris , marta patiño-martínez , gustavo alonso acm trans . database syst .",,, ,are quorums an alternative for data replication ? acm transactions on database systems ( tods ),,very large data bases, ,1
fast algorithms for universal quantification in large databases,,sigmod conference,1995.0 ,"fast algorithms for universal quantification in large databases goetz graefe , richard l. cole",,,1999.0 ,1
"are quorums an alternative for data replication ? bettina kemme , ricardo jiménez-peris , marta patiño-martínez , gustavo alonso acm trans . database syst .",,, ,are quorums an alternative for data replication ? acm transactions on database systems ( tods ),,very large data bases, ,1
"the treescape system : reuse of pre-computed aggregates over irregular olap hierarchies curtis e. dyreson , torben bach pedersen , christian s. jensen 2000","mark d. hill , anastassia ailamaki , david j. dewitt , marios skounakis",sigmod conference,1995.0 ,"the treescape system : reuse of pre-computed aggregates over irregular olap hierarchies torben bach pedersen , christian s. jensen , curtis e. dyreson",,,1995.0 ,1
containment of conjunctive queries : beyond relations as sets,"taosong he , stephen g. eick , kenneth c. cox",,1995.0 ,containment of conjunctive queries : beyond relations as sets,,,1995.0 ,1
space optimization in deductive databases acm trans . database syst . 1995,"amr el abbadi , mirek riedewald , divyakant agrawal",,1995.0 ,tail recursion elimination in deductive databases acm transactions on database systems ( tods ),,,1995.0 ,1
distributed hypertext resource discovery through examples 1999,alon y. halevy,, ,distributed hypertext resource discovery through examples,,international conference on management of data, ,1
the mariposa distributed database management system sigmod record 1996,,, ,research perspectives for time series management systems acm sigmod record,"alexandra poulovassilis , carol small",the vldb journal -- the international journal on very large data bases, ,1
exploratory mining via constrained frequent set queries sigmod conference 1999,,,1995.0 ,exploratory mining via constrained frequent set queries 1999,"mary fernandez , atsuyuki morishima , dan suciu",,1995.0 ,1
copy detection mechanisms for digital documents sigmod conference,,sigmod conference,1995.0 ,copy detection mechanisms for digital documents,,,1995.0 ,1
algebraic query optimisation for database programming languages vldb j.,,,1995.0 ,algebraic query optimisation for database programming languages,dave liles,very large data bases,1995.0 ,1
on the cost of monitoring and reorganization of object bases for clustering 1996,,, ,on the cost of monitoring and reorganization of object bases for clustering,"ernest teniente , antoni oliv &#233;",, ,1
buffering and read-ahead strategies for external mergesort 1998,,,2001.0 ,buffering and read-ahead strategies for external mergesort,"yihong zhao , prasad m. deshpande , jeffrey f. naughton , amit shukla",very large data bases,2001.0 ,1
"selectivity estimation in extensible databases - a neural network approach shaoyu zhou , m. seetha lakshmi","giuseppe de giacomo , moshe y. vardi , maurizio lenzerini , diego calvanese",,1995.0 ,selectivity estimation in extensible databases - a neural network approach,,,1995.0 ,1
"broadcast protocols to support efficient retrieval from databases by mobile users anindya datta , vijay kumar , aslihan celik , debra e. vandermeer",,sigmod conference,1995.0 ,broadcast protocols to support efficient retrieval from databases by mobile users acm transactions on database systems ( tods ) 1999,,,1995.0 ,1
"fast and accurate text classification via multiple linear discriminant projections pp shourya roy , mahesh v. soundalgekar , soumen chakrabarti vldb j.","kotagiri ramamohanarao , justin zobel , alistair moffat",sigmod conference,1995.0 ,fast and accurate text classification via multiple linear discriminant projections,,,1998.0 ,1
computing complete answers to queries in the presence of limited access patterns chen li 2003,,,1995.0 ,computing complete answers to queries in the presence of limited access patterns chen li the vldb journal -- the international journal on very large data bases,,,1995.0 ,1
"exposing undergraduate students to database system internals anastassia ailamaki , joseph m. hellerstein 2003",,sigmod record, ,"exposing undergraduate students to database system internals anastassia ailamaki , joseph m. hellerstein acm sigmod record",,acm sigmod record, ,1
answering queries using views : a survey vldb j. 2001,,vldb,1995.0 ,answering queries using views : a survey,"john s. keen , william j. dally",,1995.0 ,1
searching in metric spaces with user-defined and approximate distances,,sigmod record, ,"searching in metric spaces with user-defined and approximate distances paolo ciaccia , marco patella","rachel pottinger , alon y. levy",acm sigmod record, ,1
"challenges for global information systems alon y. levy , divesh srivastava , abraham silberschatz , maria zemankova vldb",,,1995.0 ,"challenges for global information systems alon y. levy , abraham silberschatz , divesh srivastava , maria zemankova 1994","simonas &#352; altenis , christian s. jensen",,1995.0 ,1
reminiscences on influential papers,"richard t. snodgrass , curtis e. dyreson",, ,reminiscences on influential papers,,very large data bases, ,1
towards on-line analytical mining in large databases jiawei han 1998,,, ,towards on-line analytical mining in large databases 1998,"surajit chaudhuri , ashish kumar gupta , vivek narasayya",very large data bases, ,1
concurrency in the data warehouse vldb,,, ,concurrency in the data warehouse 2000,"rakesh agrawal , ramakrishnan srikant",very large data bases, ,1
searching in metric spaces with user-defined and approximate distances,karl aberer,sigmod record, ,"searching in metric spaces with user-defined and approximate distances paolo ciaccia , marco patella",,acm sigmod record, ,1
