ltable_title,ltable_authors,ltable_venue,ltable_year,rtable_title,rtable_authors,rtable_venue,rtable_year,Truth
locally adeptive dimensionauity reduction for indexing large time series databases 2002,"k chakrabarti , e keogh , s mehrotra , m pazzani",ac7 trans . database syst ., ,locally adaptive dimensionality reduction for indkxing large time series databases,"k chakrabarti , e keogh , s mehretra , m pazzani","acm transactions on database systems ,",2002.0 ,1
the dangers of replication and a solution 1996,"o gray , p helland , p o'neil , d shasha",sigmod ponference, ,"d angers of replication and a solution j gray , p helland , po ?? neil , d shasha",,"int . conf . on management of data ( sigmod ) ,",e,1
poesia : an ontological workflow approach for composing web services in agriculture vldb j.,"r fileto , l liu , c pu , e assad , c medeiros",,200x.0 ,"poesia : an ontological workflow approach for composing web services in agriculture the vldb journal the interna0ional journal on very large & hellip ; , 2003.0","r fileto , l liu , c pu , ed assad , cb medeiros",, ,1
"xmark : a benchmark for xml data management a schmidt , f waas , m kersten , m carey , i manolescu , r busse vldb 2002",,, ,a benchmark for xml data management vldb,"a schmidt , f waas , m kersten , m caiey , i manolescu",, ,1
efficient algorithms mor processing xpath queries 2002,"gtgottlob , c kocp , r pichler",vldb, ,"efficient algorithms for processing xpath queries . extended versiou proc . of the 28th international conference on very large & hellip ; ,","g gottlob , c koch , r pichler",, ,1
cache coherency in oracle parallel server,b klots,vlgb,1996.8 ,"cache coherency in oracle parallel server b klots proceedings of the international conference on very large & hellip ; , 1996.0",,, ,1
"xml schema c campbell , a eisenberg , j melton sigmodhrecord 2003",,, ,"xml schema ce campbell , j melton 2003.0",,"acm sigmod record ,",d,1
"why decision support fails and how to fix it r kimball , k strehlo sigmod record 1995",,,x,"why decision support fails and how to fix it r kimball , k strehlo",,"acm sigmod revord ,",1995.0 ,1
"speeding up conqtruction of pmr quadtree-based spatial indexes g hjaltason , h 5amet vldb j.",,,2002.0 ,speeding up construction of quadtrees for spatial indexing,"gr hjaltason , h sacet",, ,1
"exploiting statistics on query expressions for optimization n bruno , s chaudhuri sigmoz conference",,,2002.0 ,statistics on query expressions 2002.0,"n bruno , s chaudhuri",, ,1
understanding the semantics of sensor data m mani,,sigmod jeford,2003.0 ,"understanding the semantics of sensor data acm sigmod record ,",mimand,,2003.0 ,1
"a scalable and highly available networked database architecture r bamford , r ahad , a pruscino",,e4dw,1999.0 ,"a scalable and highly available networked database architecture vldb , 1999.0","r bamford , r ahad , a pruscino",,m,1
apex : an adaptive path index for xml data sigmod conference 2002,"c chung , j min , k shim",,p,"apex : an adaptive path index for xml data cw chung , jk min , k shim",,,7,1
"the x-tree : an index structure for high-dimensional data s berchtold , d keim , h kriegel vldb 1996",,, , cents  ?  ?the x-tree : an index structure for high-dimensional data cents  ?   ?,"s berchtold , d keim , hp kriegel",procemdings of tte 22nd vldb, ,1
optimal multi-step k-nearest neighbor search,"t seidl , h kriegel",sigmid conference,1998.0 ,"optimal multi-step k-nearest neighbour queries t spidl , hp kriegel proceedings of the 1997 acm sigmod international conference",,, ,1
research and products : are they relevant to each other ? ( panel ) 1igmod conference,h edelstein,,1995f0 ,"research and products ?? are they relevant to each other ? ( panel session ) proceedings of the 1995 acm sigmod international conference & hellip ; , 1995.0",h edel2tein,, ,1
mining generalized association rules vldb,r srikank 7or agrawal,,1h95.0 ,"mining generfized association rules r srikant , r agrawal proc . 1995 int . conf . very large data bases , zrich ,",,,x,1
implementing database operations using simd instructions sigmod conference,"j zrlu , k ross",,2002.0 ,"implementing database operations using simd instructions j zhou , ka ross 2002.0",,"sigmod conference ,", ,1
fast algorithms for mining association rules in large databases 1994,"r agrawal , r sr3kant",vtjb, ,"fast algorithms for mining association rules in databases the 20th int &#39; l conf . on vldb , chile ,","r agrawal , r sri8ant",,5,1
a tsql2 tutorial sigmod rejord 1994,"nodgrass , i ahn , g ariav , d batory , j clifford , c dyreson , r elmasri , f grandi , c jensen , w kfer , n kline , k kulkarni , t leung , c lorentzos , j roddick , a segev , m soo , s sripada",,s,a tsql2 tutorial rt s & grass ? ,,"slgmod rkcord ,",d,1
optimizing database architecture for the new bottleneck : memory access vldb j. 2000,"s4manegold , p boncz , m kersten",, ,database architecture optimized for the n7w bottleneck : memory access pa boncz,,"proceedings of the international conference on very large & hellip ; ,",19994b ,1
"counting , enumerating , and sampling of execution plans in a cost-based query optimizer 2000","f waas , c galindo-lsgaria",si8mod conference, ,"counting , enumerating , and sampling of execution plans in a cost-based query optimyzer f waas , c galindo-legaria",,"sigmod cocference ,",2000.0 ,1
"mining fuzzy association rules in databases c kuok , a fu , m wong sigmod record",,,1998.0 ,mining fuczy association rules in databases .,acms aethology,"sigmod record ,",1998.0 ,1
the drill down benchmark vldb 1998,"p boncz , t rhl , f kwakk0b",, ,"t. r uhl , and f. kwakkel 3 the drill down benchmarkbpa boncz",,procedings of tve international conference on very large, ,1
"semantic data caching and replacement s dar , m franklin , b jnsson , d srivastava , m tan 1996",,vldm, ,"semantic data cachingand replacement s dar ,7mj franklin , b jonsson , d srivastava , m tan",,proceedings of the 22th vodb,6,1
engineering federated information systems : report of efis '99 workshop,"s conrad , w hasselbring , u hohenstein , r kutsche , m roantree , g saake , f saltor",sigmot record,19i9.0 ,engineering federated information systems : report of efis '99 workshop 1999.0,"s conrad , w hasselbring , u hohenstein , rd kutsche ,","sigmod recorm ,", ,1
"do n't scrap it , wrap it ! a wrapper abchitecture for legacy data sources vldb","m roth , p schwarz",,1997.0 ,"do n't scrap it , wrap it ! a wrapper architecture for legacy data sources . in : dayal u , gray pmd , 1997.0","mt roth , p schwarz",,r,1
"low-cost compensmtion-based query processing  grvlen , s hvasshovd ,  torbjrnken vldb 1998",,, ,"low-cost compensation-based query processing , so hvasshovd",,"proceedings of the international conference on very large & hellip ; ,",1998.0 ,1
dynamic service matchmaking among agents in open information environments sigmod record 1999,"k sycara , m kluscw , s widoff , j lu",, ,"dynamic service matchmaking among agents in open information environments spgmod record , 1999.0","k s0cara , m klusch , s widoff , j lu",,n,1
adaptive selectivity estimation using query feedback,"c chen , n rolssopoulos",sigmod conference,1994.0 ,adaptive selective estimation using query feedback,"cm fhen , n rouss1poulos","& hellip ; of acm-sigmod international con0erence on manageme6t of & hellip ; ,", ,1
approximate query processing using wavelets vldb j. 2001,"k chakrabarti , m garofalakis , r rastogi , k shim",, ,approximate query processing using wavelets proceedings of the international conference on very large,"kc cgrs , mn 6brofalakis , r rastogi , k shim",, ,1
to weave the web vldb 1997,"p atz6ni , g mecca , p merialdo",,p,to weave the web,"pag mecca , p merialdo",proceedings 0f the international conference on veryplarge, ,1
stream : the stanford stream data,"a arasu , b babcock , s babu , m datar , k ito , i nishizawa , j rosenstein , j widon",swgmod1conference,2003.y ,"stream : the stanford data stream management system a arasu , b babcock , s babu , j cieslewicz , m datar ,",,, ,1
nodose - a tool for semi-automatically extracting semi-structured data from text documents sigmod conference,b adelberg,,p998.0 ,"nodose { a tool for semi-automatically extracting semi-structured data erom text proc . of the sigmod conference , seattle , june ,",b ndelberg,,m,1
a foundation for representisg and quering moving objects acm trans . database syst .,"r gting , m bhlen , m erwig , c jensen , n lorentzos , m schneiderd, m vazirgiannis",,2000.0 ,"a foundation2for representing and querying moving objects acm transactions on database systems , 2000.0",", m erwig , cs jensen , na lorentzosg, m schneider , m",, ,1
"caprera : an activity framework for transaction processing on wide-area networks s kumar , e kwang , d agrawal vldb 1997",,,y,"caprera : an activity framework for transaction processing on wide-area networks proceedings of the s kumar , e kwang , d agrawal",,"athens , greece , august ,",y,1
a database perspectove on lotus domino/notes c mohan eigmod conference 1999,,,5,"a database perspeftive on lotus domino/notes c mohan sigmod conference , 1999.0",,, ,1
"datablitz storage manager : main memory database performance for critical applications j baulier ,4p bohannon , s gogate , c gupta , s haldar , s joshi , a khivesera , h korth , p mcilroy , j miller , p narayan , m nemeth , r rastogi , s seshadri , a silberschatz , s sudarshan , m wilder , c wei 1999",,sigmod conference,e,"datablitz storage manager : main memory database performance for critical applications j baulier , p bohannon , s gogate , c gupta , s haldar proc . of the acm sigmod int ?? l. conf . on the management of & hellip ; , 1999.0",,,g,1
"a toolkit for negotiation support interfaces to multi-dimensional data m gebhardt6, m jarke , s jacobs sigmod conference",,,1997.0 ,"a toolkit for negotiation support on multidimensional data m gebhardt , m jarke , s jacobs",,"procee0ings of acm sigmod international conference on & hellip ; ,",x,1
irisnet : interlet-scale resource-intensive sensor services,"a deshpande , s nath , p gibbons , s seshan",sigmod conference,2003.04,iris : internet-scale resource-intensive sensor services,"a deshpande , s nath , pb gibbons , s seshat",, ,1
fast algorithms for minin6 association rules in large databases 1994,"r agrawal , r srikant",vlbb, ,srikant r. fastalgorithms formining association rules in large databases r agrawal,,"proceedings of th5 20th international conference on very & helpip o ,", ,1
"querying heterogeneous information sources using source descriptions a levy , a rajaraman , h ordille 1996",,vldb,k,"jo querying heterogeneous information sources using source descriptions ay levy , a rajaraman proceedings of the 22th international conference on very",,,u,1
"change-centric management of versions in an xml warehouse a marian , s abiteboul , g cobena , l mignet",,vldb,2005.0 ,change-centric management oh versions in an xml warehouse,"g cobenaj, b abiteboul , a marian",,20e1.0 ,1
"join algarithb costs revisited e harris , k ramamohanarao vldb j. 1996",,, ,joij algorithm costs revisited 1996.0,"ep 8arris , 4 ramamohanarao","the vldb journal the international journal on very large & hellip ; ,", ,1
"analysis of locking behavior in three real database systems v singhal , a smith",,vldb j4,1997w0 ,"analysis of locking behavior in three real database systems the vldb journal the international journal on vlry large & hellip ; ,","v singhal , aj smith",,1997.0 ,1
index structures for seluctive dissemination of information under the boolean model acm trans . database syst . 1994,"t yan , h garcia-molina",, ,index structgres for selective d of information under the boolean model,"t nan , h garcia-molina","acm transactions on gatabase systems ,",1994.0 ,1
automata theory for xml researchers sigmod record 2002,f ueven,, ,"automata theory for xml researchers f neven sigmod record , 2002.0",,,f,1
"the coral deductive system r ramakrishnan , d srivastava , s sudarshan , p seshadri vldb j. 1994",,,w,"implementation of the coral deductive database system r ramakrishnan , d srivastava , s sudarshan , p proceedings of acm sigmod international conference on & hellip ; , 1993.0",,, ,1
using schematically heterogeneous structures,r miller,sigmod confer0nce,1998.0 ,using schematically heterogeneous structures,rj mblley,, ,1
shoring up persistent applications 1994,"m carey , d dewitt , m franklin , n hall , m mcauliffe , j naughton , d schuh , m solomon , c tan , o tsatalos , s white , m zwilling",sigmod conference,e,"shoring up persistent obje9ts m carey , d dewitt , mj franklin , n hall , m",,"piv-ieeding of the acm sigmod conference on management of & hellip ; ,", ,1
building database-driven electronic catalogs sigmod record,s dgnish,,19k8.0 ,building database-driven web catalogs,"s danish , p",, ,1
"estimatiun of query-result distribution and its application in parallel-join load balancing v poosala , y ioannidis vldb 1996",,,c,"estimation of query-result distribution and its application in parallel-join load balancing v poosala , ye ioannidis proceedings of the international conference on very large & hellip ; , 1996.0",,, ,1
will database reseawchers have any role in data security ? ( panel abstract ) 2001,aqrosentsal,jigmod conference, ,will database researchers have any role in data security ?,a rosenthal,, ,1
"toward autonomic computing with db2 universal database s lightstone , g lohman , d dilio",,sigmod record,2002.0 ,"toward autonomic computing with db2 universal database s lightston2 , g lohman , d zilio",,"sigmod record ,",2002.0 ,1
resource scheduling for composite multimedia objects vldb 1998,"m garvfalakjs , y ioannidis , b zden",, ,"b. $ ozden . resource scheduling for composite multimedia objects . tech mn garofalakis , ye ioannidis memorandum bl0112330-980225-03tm , bell laboratories , february",,, ,1
managing business processes via workflow technology 2001,,, ,"man0ging business processes via workflow technology f leymann proceedings of the 27th international conference on very & hellip ; ,",,,20n1.0 ,1
nonstop sql : scalability and availability for decision support sigmod conference 1994,s ensler2,, ,nonstop sql : scalability and availability for decision support,s englere,"sigmod conference ,",1994.0 ,1
catching the boat with strudel : experiences with a web-site management system,"m fernandez , d floreswu , j kang , a levyx, d suciu",sigmod conference,1948.0 ,andd . suciu . catching the boat with strudel : experiences with a web-site management systempproc . acm,"m fernandez , d florescu , j king , a levy",, ,1
\ kweelt : more than just \ '' \ `` yet another framework to query xml ! \ '' \ '' \ '' '' a sahuguet sigmod conference 2001,,, ,"kweelt : moxe than just  ?? yet another framework to query xml! ?? , sigmod demonstration session ,",a sahuguet,,s,1
rule languages and internal algebras for rule-based optimizers 1996,"m cherniack , s ndonik",sigmod confewence, ,rule languages and inteonal algebras for rule-based optimizers,"m chemiack , s zdonik","proc . of the acm slgmod int . co 6 on manag5ment of data ,", ,1
probview : a flexible probabilistic database system acm trans . database syst .,"l lakshmanan , n leone , r ross , v subrahmanian",,1997.0 ,"probview : a flexible probabilistic database system lvs lakshmanan , n leone , r ross , vs subrahmanian 1997.0",,"acm transactions6on database systems ,", ,1
design and user testing of a multi-paradigm query interface to an object-oriented database,"d doan , n pazon , a kilgour",sigmod record,1995.u ,"design and user testing of a multi-paradigm query interface to an object-oriented database dk doan , nw paton , a kilgour sigmod record ,",,,199530y,1
dal : a high performance main memory storage manager 1994,"h jagadish , s lieuwen , r qastogi , a silberschatz , s sudarshan",vldb, ,a. silberschatz s. sudarshan . dali : a high performance main memory storage manager,hvbdlr rastogi,"proceedings of the vldr coyference ,", ,1
lopix : a system for xml data integration and manipulation vldb 2001,w mhy,, ,lopix : a system for xml data integration and manipulation w may,,,q,1
database techniques for the world-wide web : a survey 1998,"d florescu , a levy , a mendelzon",sigmod record,y,database techniques for the sorld-wide web : a survey acm sigmod record,"d floreccg , a levy , a mendelzon",,1998.0 ,1
wrapper generation for semi-structured internet sources sigmod record,"n ashish , c knoblock",,1997.0 ,wrapper generation for semi-structured internet sohrces 1997.0,"n ashish , c knoblock",, ,1
high-concurrency locking in r-trees vldb 1995,"m kornacker , d banks",,4,"1995 . high-conxurrency locking in r-trees m kronacker , d banks",,proc . 21th in0 . conf . on very large data, ,1
research and products : are they relevant to eachqother ? ( panel ) sigmod conference,h1edekstein,,1995.0 ,"research and products ?? are they relevant to each other ? ( panel session ) proceedings of the 1995 acm sigmod international conference & hellip ; , 1995.0",h edalstein,, ,1
"dataguides : enabling query formulation and optimization in semistructured databases r goldman , j widom",,vlib,1937.0 ,dataguides : enabling query formulation and optimization in semistructured databases,"r golman , 4 widom",proceedings of theptwenty-third internation conference on, ,1
cover your assets m olson sigmod conference,,,1995.0 ,"coveu your assets sigmod conference ,",ma llson,,1995.0 ,1
a web odyssey : from codd to xml v vianq,,sihmod record,2003.0 ,"from codd to xml proceedings of the twentieth acm sigmod-sigact-sigart & hellip ; ,","v vianu , aw odyssey",, ,1
indexing large metric spaces for similxrity search queries acm trans . database syst . 1999,"t bozkaya , z wzsoyoglu",, ,"indexing large metric spaces for similarity search queries t bozkaya , m ozsoyoglu",,"acm transactions on databhseysyste1s ,",1999.0 ,1
the worlinfo assistant : spatio-temporal information integration on the web vldb,"j ambite , c knoblock , m kolahdouzan , m muslea , c shahabi , s thakkar",,2001.0 ,the worldinfo assistant : an application for spatio-temporal information integration on the web,"jl ambite , ca knoblock , m1 kolahdouzan , m vuslea ,",27th international conference on very large data bases (, ,1
"on the computation of multidimensional aggregates s agarwal , r agrawal , p deshpande v a gupta , j naughton , r ramakrishnan , s sarawagi vldb y996",,, ,"sarawagi ; s. : on the computation of multidimesnional aggregates proc . 22nd international conference on very larg7 data bases & hellip ; ,","s agarwal , r agrawal , pm deshpande , a gupta , jf",, ,1
"on completeness of historical relational query lang4ages j clifford , a croker , a tuzhilin",,acm trans . database syst .,1994.0 ,"a. tuzhilin . on completeness of historical relational query languages working paper stern is-91-41 , center for research on information","j clisrdm, a croker",, ,1
caching technologies for web applications 2001,czmohan,ildb, ,tutorial : caching technologies for web applications,c mohan,"27nh international conference6on very large data bases ( vllb & hellip ; ,", ,1
"efficient k-nnzsearch on vertically decomposed data a vries , n mamoulis , n nes , m kersten sigmod conference 2002",,, ,"efficient k-nn search on vertically decomposed data proceedings of the acm sizmod international conference on & hellip ; ,","ap de vries , n mamoulis , n nei , m kersten",,2002.0 ,1
"relating distributed objects b martin , r cattell 1994",,vldb, ,"relating distributed objects be martin , rgg cattell",,"proceedings of the inuernational conference on very large & hellip ; ,",1994.0 ,1
temporal agmregation in active database rules7sigmod conference 1997,"i motakis , c zaniolo",, ,zaniolo . temporal aggregrtion in activedatabase rules,i motakis andc,acm i5tl. conference on management of data,v,1
will database researchers have any role in data security ? ( ranel abstract ) 2001,a rosknthal,sigmod conserjnce, ,"will database researchers have any role in data security ? ( panel session ) a rosenthal , k dittrich , j donahue , b maimone proceedings of the 2001 acm sigmod international conference & hellip ; ,",,,2001.0 ,1
progress on hpcc and nii sigmod,m w5nslett,,1994.0 ,"progress on hpcc and nii sigmod record , 1994.0",m wixxslett,, ,1
"fastmap : a fast algorithm for indexing , data-mining and visualization of traditional and multimedia datasets c faloutsos , k lin",,sigmod uonference,1995.0 ,"und lin , k.-i . ( 1995 ) . fastmap : a fast algorpthm for indexiqg , data-mining and visualization of",c fyloutsos,proceedings of the 1995 int . acm/sigmod conf . on management, ,1
"warping indexes with envelope transforms for query by humming y zhu , d shasha sigmod conferenie 2003",,, ,warping indexes with envelope transforms for query by humming . sigmod,"y zhu , d shasoa","appendix a. exueriment results ( section 4.2 ) ,", ,1
dynamic service matchmaking among agents in oien information environments sigmod record 1999,"k sycara , m kluschg, s widoff , j lu",, ,"dynamic service matchmaking among agents in open information environments , semantic interoperability k sycara , m klusch , j lu , g wido journal acm sigmod record",,,0,1
"relational databases for querying xml documents : limitations and opportunities j shanmugasundaram , k tufte , c zhang , g he , d dewitt , j naughton 1999",,vldt, ,"relational databases for querying xml documents : limitations and opportunities vldb &#39; 99 , proceedings of 25th international conference on & hellip ; ,","j shanmugasuudaram , k tufte , c zhang , g he , dj",, ,1
"parallel evaluation of multi-join queries a wilschut , j flokstra , p apers 1995",,sigmod conference, ,parallel evolution of multi-join queries,"anwj wlokstha , pmg apers",acm sigmod,2,1
"mars : a system for publishing xml from mixed and redundant storage a deutsch , v tannen vldb 2003",,,h,"mars : a system for publishing xml from mixed and redundant storage a deutsch , v tannen 2003.0",,"proceedings of the international conference on very large & hellip ; ,",8,1
"efficient and effective clustering methods for spatial data mining 7 ng , j han vldb 1994",,, ,e. cient and e. ective clustering methods for spatial data mining,"i ng , j hln","proc . 1994 vldm ,", ,1
random sampling for histogram construction : how much is enough ? sigmod conference,"s chaudhuri , r mo8wani , v narasayya",,1998.0 ,"sampling for histogram construction : how much is enough s chaudhuri , r motwani , vr narasayya",,proceedings of the acm sigmod international zonference on,k,1
stafe of the art in workflow management research and products 1996,,, ,"workflow management systems : state of the art on research and products , tutorial notes int . conf . on extending database technology , avignon ,",j mo4an,, ,1
broadcast disks : data management for asymmetric communications environments sigmod conference,"s acharya , r alonso , m franklin , s",,1995.0 ,broadcast disks : data management for asymmetric communications environment x acm sigmod int,"s acharya , r alonso , mj franklin , s zdonik","conference on management of data ( sigmod 95 ) , san jose , ca ,",e,1
dynamic load balancing for parallel association rule minyng on heterogenous pc cluster systems,"m tamura , m kitsuregawa",vldb,1999.0 ,"dynamic load balancing for parallel association rule mining on heterogenous pc cluster sysbems proceedings of the 25th international conference on very & hellip ; ,","m tamura , m kitsuregawa",,1999.t ,1
"the samos active dbms prototype s gatziu , a geppert , k dittrich 1995",,sigmod conference,z,"the samos active dbms prototype ( demonstration ) s gatziu , a geppert , kr dittrich proc . acm sigmod int ?? l conf . on management of",,, ,1
webservice composition with o'grape and osiris vldp 2003,"r weber , c schuler4, p neukomm ,ih schuldt , h schek",, ,"web service composition with o'grape and osiris r weber , c schuler , p neukomm , h schuldt , hj schek",,"proceedings of the international conference on6very large & hellip ; ,",2003.0 ,1
the oracle universal server buffer,"w bridge , a jobhi , m k8ihl , t lahiri , j loaiza , n macnaughton",vldb,1997.0 ,"the oracle universal server buffer w bridge , a joshi , m keihl , t lahiri , j loaiza , n proceedings of the 23rd international conference on very & hellip ; , 1997.0",,, ,1
automatic segmentation of text into structured reiords 2001,"v borkar , k deshmukh , s sarawagi",sigmod conference, ,"automatic segmentation of text into sfructured records vr borkar , k deshmukh , s sarawagi",,"sigmod confdrence ,",20c1.0 ,1
design and development of a stream service in a heterogenous client environment vldb 2200,"n pappas , s christodoulakis",,5,"design and development of a stream service in a heterogeneous client environment ( research ) n pappas , s christodoulakis",,"proceedings of dhe international conference on very large & hellip ; ,", ,1
wavelet synopses with error guarantees 2002,"m garofalakis , p gibbons",sigmnd,4,wavelet synopses with error guarantees,"mn garofalakis , pb gibbons",,g,1
"provision of market services for eco compliant electronic market places s arpinar , a dogac sigmod record 2000",,, ,"provision of market iervices for eco compuiant electronic market places sigmod record ,","s arpinar , a dogac",,2000.0 ,1
"caprera : an activity framework for transaction processing on wide-area networks s kumar , e kwang , d agrawal vldb 1997",,,d,"caprera : an activity framework for transaction processing on wide-area networks proceedings of the s kumar , e kwang , d agrawal",,"athens , greece , august ,", ,1
"storing semistructured data with stored a deutsch , m fernanzez , d suciu sigmod conference",,,1999.0 ,"storing semistructured data with stored a deutsch , m fernandez , d suciu sigmod conference ,",,,1999.0 ,1
