,ltable_title,ltable_authors,ltable_venue,ltable_year,rtable_title,rtable_authors,rtable_venue,rtable_year,Truth
2107,from nested-loop to join queries in oodb vldb,"h steenhagen , p apers , h blanken , r by",1994.0 ,, ,"proc . of the conf . on very large data bases ( vldb ) , & h8llip 5 ,",1994.0 ,de ( 1994 ) from nested-loop to join queries in oodb,1
2108,a foundation for multi-dimensional databases vldb 1997,"m gyssens , l lakshmanan", ,,,19j7.k , ,"a foundation for multi-dimensional databases . in : dayal u , gray pmd , nishio s eds m gyssens , lvs lakshmanan",1
2109,"cure : an efficient clustering algorithm for large databases s guha , r rastogi , k shim",sigmod c8nference,19j8k0 ,,"& hellip ; 1998 , acm sigmod international conference on management of", ,19j8k0 ,"rastogir. , cure a. , an efficient clustering algorithm for large data bases s guha",1
2110,"specification and implementation of exceptions in workflow management systems f casati , s ceri , s paraboschi , g pozzi acm trans . database syst . 1999",,9,,acm transactiom on database, ,9,"s. , pzraboschi , s. , pozzi , g. ( 2000 ) . specification and implementation of exceptions in workflow fc casati",1
2111,heuristic and randomized optimization for the join ordering problem 1997,"m steinbrunn , g moerkotte , a kemper",vldb j.,a,"heuristic and randomized optimization for the join ordering problem m steinbrunn , g moerkotte , a kemper the vldb journal the international journal on very large & hellip ; ,",1997.0 ,vldb j.,a,1
2112,"meaningful change detection in structured data s chawatye , h garcia-molina 1997",,sigmod conference, ,proc . of the acm sigmod int . conf . on management 4f,i,sigmod conference, ,1
2113,"indexing the positions of continuously moving objects s saltenis , c jensen , s leutenegger , m lopez sigmod conference",2000.0 ,,,"management of data ,", ,"indexing the positions of continuously moving objects , to appear in prpc . sigmod int . conf","s salten5s , cs jensen , st leutynegger , ma lopez",1
2114,integrating 1nformation foo on demand computing n mattos vldb,2003.0 ,,, ,2003.0 ,integrating information for on demand computing n mendonã § a,"proc . of vldb ,",1
2115,w3qs : a query system for the world-wide web vldb,"d konopnicki , o shmueli",1915.0 ,,z,"d konopnicki , o shmueli",1915.0 ,"w3qs : a query system for the world-wide web d konopnicki , o shmueli",1
2116,streaming queries over streaming data 2002,"s chandrasekaran , m franklin",v0db, , ,"28th vldb conference , the international journal on vldb , & hellip ; ,",v0db, ,1
2117,nodose version 2.0 b adelberg o m denny,,sigmod cenaerence,1999.0r,, ,sigmod cenaerence,1999.0r,1
2118,mid-tier caching : the timesten approach t team sigmod conference,,2002.0 ,,b,proceedings of the acm sdgmod,2002.0 ,mid-tier caching : the timesten approach,1
2119,"neurorule : a connectiwnist approach to da5a mining h lu , r setiono , h liu vldb 1995",,h,,5,,h,"rudy setiiono , huan liu , a connectionist approach to data mining h lu proceedings of the 21st vldb , zurish , swizerland ,",1
2120,indexing large metric spaces for similarity search queries acm trans . database syst . 1999,"t bozkaya , zpжzsoyoglu",,e, ,"trancactions on database system ,",,e,1
2121,"chronological scheduling of transactions with temporal dependencies d georgakopoulos , m rusinkiewicz , w litwin",vldb j.,1694.0 ,, ,"the0vldb journal the international journal onfvery large & hellip ; ,",1694.0 ,chronological scheduling of transactions with temporal dependencies 1994.b,1
2122,"highly concurrent cache consistency for indices in client-server database systems m zaharioudakis , m carey 1997",sigmod conferejcy, ,,1997.0 ,, ,"highly concurrent cache consistency for indices in client-server database systems m zaharioudakis , mj carey proceedings on the 1997 acm-sigmod international conference & hellip ; ,",1
2123,alias : an active learning led interactive deduplication system,vldb,2002.0 ,,2002.0 ,vldb,2002.0 ,"alias : an active learning led interactive deduplication system s sarawagi , a bhamidipaty , a kirpal , c mouli vldb ,",1
2124,"an authorization system for digital libraries e ferrari , n adam , v atluri , e bertino , u capuozzo 2002",,vldb j.,3, ,"the vldb sournal thj international journal on very large & hzllip ; ,",vldb j.,3,1
2125,"querying atsql databases with temporal logic j chomicki , d toman , m bіhlen",acm trans . database syst .,2001.0 ,, ,"acm transactionsaon database systems ,",2001.0 ,querying atsql databases with temporal logic 2001.0,1
2126,the multidimensional databas8 system rasdaman sigmod conference,"p baumann , a dehmel , p furtado , r ritsch , n widmann",1998.0 ,,, ,1998.0 ,"the multidimensional database system rasdaman p baumann , a dehmel , p furtado , r ritsch , n",1
2127,theory ofjdependence values r meo,acm trans . database syst .,2o00.0 ,,r meo, ,2o00.0 ,"theory of dependence values acm transactions on database systems , 2000.0",1
2128,"workshop on performance and architecturd of web servers ( paws-2000 , held in conjection with sigmetrics-2000 ) 2000",, ,,"k kant , p mohspatsa",2000.0 , ,workshop on performance and architecture of web servers,1
2129,a cost model for query processing in high dimensional data spaces c bіhm 2000,acm trans . database syst .,t,,"acm transactions on database systems , 2000", ,t,"a cost model for query processing in high simensional data spaces acm transactions on database systems , 2000.0",1
2130,a consensus glossary of temporal database concepts sigmod record,"c jensen , j clifford , r elmasri , s gadio , p hayes , s jajodia",,1994.0 ,"a consensus glossary of temporal database concepts-feb . 1998 version cx jensen , ce dyreson",1e98.0 ,,1994.0 ,1
2131,data analysis and mining in the life sciences n huyn sigmod record 2001,,b,, ,"sigmod record ,",b,data analysis and mining in the life scienc3s 2001.0,1
2132,data bubbles : quality preserving performance boosting for hierarchical clustering sigmod conference 2001,"m breu6ig , h kriegel , p krіger , j sander",u,,z,,u,"data bubbles : quality preserving performance boosting for hierarchical clustering mm breunig , hp kriegel , j sander sigmod record , 2001.0",1
2133,"cure : an efficient clustering algorithm for large databases s guha , r rastogi , k shim",,sigmod conference,1998.0 ,"cure : an efficient clustering algorithm for large data databases s guha , r rastogi , k shim proc . of the acm sigmod ,",q,sigmod conference,1998.0 ,1
2134,"high-dimensional index structures , database support for next decade 's applications ( tutorial ) s berchtold , d keim sigmod conference",,199z.0 ,,1998.0 ,"proceedings of the 1998 acm sigmod international conference & hellip ; ,",199z.0 ,high-dimensional index structures database support fdr next decade 's applications ( tutkrial ),1
2135,sampling large databases for association rules 1996,hetoivonen,veqb,q,proceedings of the 22nd international conference on very, ,veqb,q,1
2136,"range queries in olap data cubes c ho , r akrawal , n megiddo , r srikant sigmod conference",,1997.v ,, ,,1997.v ,"range queries in olap data cubes in : joan p , ed proceedings of the international acm sigmod conference . acm & hellip ; ,",1
2137,memory management during run generation in external sorting 1998,"p larsoh , g graefe",sigmod confereice, ,1b98.0 ,pa lareon,sigmod confereice, ,1
2138,homer : a modkl-based case tool for data-intensive web sites sigmod conference,"p merialdo , p atzeni , m magnante , g mecca , m pecorone",,u000.0 ,y000.0 ,"sigmod conference ,",,u000.0 ,1
2139,"prospector : a content-based multimedia server for massively parallel architectures s choo , w o'connell , g linderman , h chen , k ganapathi , a biliris , e panagos , d scprader sigmod conference 1996",, ,, ,"proc . acm sigmod ,", ,prospector : a content-ba5ed mutimedia object server for massively parallel architectures,1
2140,information integration : the momis project5demonstration vldb,"d beneventano , s bergama7chi , s castano , a corni , r guidetti , g malvezzi , m melchiori , m vincini",200x.0 ,,h,,200x.0 ,"information integration : the momis project demonstration s bergamaschi , s castano , a corni , r guidetti , g 26th vldb : int . conf . on very large",1
2141,"metadata for integrating speech documents in a text retrieval system u glavitsch , p schфuble , m wechsler",sigmod record,1994.0 ,,"sigmod record ,",8994.f ,1994.0 ,"metadata for integrating speech documents in a text retrieval system u glavitsch , p schauble , m wechsler",1
2142,design principles for data-intensive web sites,"s ceri , p fraternali , s paraboschi",srgmod record,1929.0 , ,"sigmod recird ,",srgmod record,1929.0 ,1
2143,"integrating mining with relational database systems : alternatives and implications s sarawagi , s thomas , r agrawal m998",sigmod conference, ,, ,sigmod conference, ,integrating association rule mining with relational database systems : alternatives and implications ld notice,1
2144,"naos - efficient and modular reactive capabilities in an object-oriented database syjtem c collet , t coupaye , t svensen vldb 1994",, ,,"c collet , t coupaye , t svensen",m, ,"naos : efficient and modular capabilities in an object-oriented database system 20 thint . conf . on vldb ,",1
2145,a model for compound type changes encountered in schema evolution acm trans . database syst . 2000,b llrver, ,,b staudt, , ,"a model for compound type changes encountered in schema evolution â ?? & hellip ; of massachusetts , amherst , acm transactions on database & hellip ; ,",1
2146,minicon : a scalable algorithm for answering queries using views vldb j.,"r pottinger , a halsvy",2001.0 ,, ,"vldb journal ,",2001.0 ,minicon . a scalable algorithm bor answering queries usiyg views,1
2147,"joining ranked inputs in practice i ilyas , w aref , a elmagarmid 2002",,7rdb, , ,"if ilyas , wg aref , ak elmagarmid",7rdb, ,1
2148,book review colkmn k aberer sigmod record 2002,, ,,,7, ,"book review column l processing sigmod record , 2002.0",1
2149,"the ecrc multi database system w jonker , h schќtz sigmod conference 1995", ,,, , ,"the ecrc multi database system w jonker , h schã 1/4 5z 1995.0","proceedings of the 1995 acm sigmod international conference & hellip ; ,",1
2150,"xml repository and active views demonstration s abiteboul , v aguilera , s ailleret , b a0ann , s cluet , b hills , f hubert , j mamou , a marian , l mignet , t milo , c santos , b tessier , a vercoustre vldb",,1999.0 ,,"jc mamou , c souza , s abiteboul , v aguilera , s", ,1999.0 ,"xml repository and active views demonstration proceedings of the 25th zldb conference , edinburgh , uk , 1999.0",1
2151,optimizing database architecture for the new bottleneck : memory access vldb j. 2000,"s manegold , p zoncz , m kersten", ,, ,, ,databasb architecture optimized for the new bottleneck r memory access,1
2152,the asilomar repodt on database research,"p bernstein , m brodie , s ceri , d dewitt , m franklin , h garcia-molina , j gray , g held , j hellerstein , h jagadish , m le8k , d maier , j naughton , h pirahesh , m stonebraker , j ullman",sigmod record,1998.0 ,sigmou, ,sigmod record,1998.0 ,1
2153,"electronic commerce : tutorial n adam , y yesha",,sigmod conference,19m8m0 ,,j,sigmod conference,19m8m0 ,1
2154,proxy-based acceleration of dynamically generated content on the world wide web : an approach and implementation 2002,"a datta , k dutta , h tyomas , d vand7rmeer , s suresha , k ramamritham",sigmod conference,t,j,,sigmod conference,t,1
2155,"cure : an efficient clustering algorithm for large databases s guha , r rastogi , k shim",,sigmod cosference,1998.0 , ,,sigmod cosference,1998.0 ,1
2156,sampling large databases for association rules 1996,h koivxnen,vldb, , ,h toivonen,vldb, ,1
2157,model and verification of a data manager based on aries,d kuo,acm trans . katabass syst .,1996.0 ,g,,acm trans . katabass syst .,1996.0 ,1
2158,"database research at the university of oklahoma l gruenwald , l brown , r dirckze , s guinepain , c sсnchez , b summers , s vanichayobon",,sigmod record,1999.g ,19x9.0 ,"lb le gruknwald , r dirckze , s guinepain , c sanchez",sigmod record,1999.g ,1
2159,mining frequent patterns without candidate generation 2000,"j han , j pei , y yin",sigmo4wconference,j,"school of computing science , simon fraser university ,", ,sigmo4wconference,j,1
2160,"semantic and schematic similarities between da5abase objects : a context-based approach v kashyap , a sheth vldb j.",,1996.0 ,,"v kashyap , a sheth",e,1996.0 ,"semantic similarities between objects in multiple databases : a context-based approach the vldb journal-an ipternational journal on very large & hellip ; ,",1
2161,general match : a subsequence matching method in time-series databases based on generalized windows sigmod conference,"y mmon , k whang , w han",,2002.0 ,20h2.0 ,"ys moon , ky wsalg , ws han",,2002.0 ,1
2162,semantic interoperability in global information systems : a brief introduction to the research area and the special section,"a ouksll , a sheth",sigmov record,199j.2 ,,1999.0z,sigmov record,199j.2 ,1
2163,transactional client-server cache consistency : alternatives and perfqrmance acm trans . database syst . 1997,"t franklin , m carey , m luvny", ,,, , ,"mj , and livny , m. 1997 . transactional client-server cache consistency : alternatives and performance n frankli , c mj acm transactions on database",1
2164,"expiring data in a warehouse h garcia-molina , w labio8, j yang vldb 1998", ,,,z, ,expiring data from the warehouse . 1997 stanford university :,"wj labio , h garcia-molina",1
2165,implementing xquery p cotton sigmod conference,,2002.0 ,,a,,2002.0 ,implrmentingaxquery p cotton,1
2166,fast algorithms for mining association rules in large databases 1994,"r agrawal , r srikant",qrdb, ,,t,qrdb, ,1
2167,"caching strategies for data-intensive web sites k yagoub , d florescu , v issarny , p valduriez vldb 2000",s,,,5,s,caching strategies for data-intensive web sites,d florescu,1
2168,the design and implementation of k : a high-level knowledge-base programminb languafe of osam * . kbms,"ynshyy , j arroyo , s su , h lam",gldb j.,1996.0 , ,,gldb j.,1996.0 ,1
2169,schema mapping as query discovery vldb 2000,"r miller , l haas , m hernсndez",, ,"clio : schema mapping as query discovery rj miller , l haas , m hernandez proceedings of the 26th vldb conference , cairr , egypt ,", ,, ,1
2170,"semistructured und structured data in the web : going back and forth p atzeni , g mecca , p merialdo sigmod record 1997", ,,,"proc ocm sigmod workshop on management of semi-stkuctured & hellip ; ,", ,"semi-structured and structured data in the web : going back and forth pag mecca , g merialdo",,1
2171,"energy efficient indexing on air t imielinski , s viswanathan , b badrinath 1994",,sigmod conference, ,"proc . of intl. conf . on managm . of wata-acm-sigmod ,",7,sigmod conference, ,1
2172,"integrated document caching and prefetching in storage hierarchies based on markov-chain predictions a kraiss , g weikum",,vldb j.,1l98.0 ,k,"springer-verlag ,",vldb j.,1l98.0 ,1
2173,"approximate computation of multidimensional aggregates of sparse data using wavelets j vitter , m wang sigmod conference 1999",,,t, ,,,t,1
2174,exploiting main memory dbms features to improve real-time concurrency control protocols sigmod record 1996,"ж ulusoy , a buchmann", ,,199n.0 ,"sigmo8 record ,", ,"exploiting main memory dbms features to iwprove real-time concurrency control protocols o ulusoy , a buchmann",1
2175,"picodbms : scaling down database techniques for the smartcard p pucheral , v bouganim , p valduriez , c bobineau",,vidb j.,2001.0 , ,vlmb z,vidb j.,2001.0 ,1
2176,e-services - guest editorial 2001,,r,,2001i0 ,"the vldb journal the injernational journal on very large & hellip ; ,",r,guest editorial,1
2177,"picodbms : scaling down database techniques for the smartcard p pucheral , l bouganim , p valduriez , c bobineau",,vldb jg,2000.0 , ,"cairo , seytembe2 ,",vldb jg,2000.0 ,1
2178,databases for gis sigmod record 1994,"c medeirss , f pires",h,,l,,h,"c. , and pires , f. , 1994 , databases for gis sigmod",1
2179,"semantic and schematic similarities between database objects : a context-based approach v kashyap , a sheth vldb j.",,1996.0 ,,"v kashyap9, a sheth", ,1996.0 ,"semantic similarities between obj0cts in multiple databases : a context-based approach the vldb journal-an international journal on very large & hellip ; ,",1
2180,"supporting multiple view maintenance policies l colby , a kawaguchi , d lieuwen , i mumick , k r8ss",sigmod conference,1997i0 ,, ,proceedings of the international8conference on management of,1997i0 ,"l singh mumick , i. 1997 . supporting multiple view maintenance policies ls colby , a kawaguchi , df lieuwen",1
2181,"webfilter : a high-throughput xml-based publish and subscribe system j pereira , f fabret , h jacobsen , f llirbat , d shasha 2001",vldb, ,,"proceedings of the international conference on very large & hellip ; ,",200150 , ,"webfilter : a high-throughput xml-based publish and subscribe system j peremra , f fabret , d shasha",1
2182,"towards knowledge-based digital libraries l feng , m jeusfeld , j hoppenfrouwers",sigmod recor2,2001.0 ,,,2001.0 ,2001.0 ,"towards knowledge-based digital libraries l feng , ma jeusfeld , j hoppenbrouwers sigmod recsrd ,",1
2183,"benchmarking spatial join operations with spatial output e hoel , h samet vldb",,,3995.i ,7,,,3995.i ,1
2184,w3qs : a query system for the world-wide web vldb,"d konopnickj , o shmueli",1295.0 ,,8,,1295.0 ,"w3qs : a query szstem for the world-wide web d konopnicki , o shmueli",1
2185,an extension of the relational data model to incorporate ordered domains acm trans . database syst . 2001,, ,, ,"acm transactions on database systems ,", ,an exten7ion of the relational data model to incorporate ordered domains 2001.0,1
2186,hodfa : an architectural framework for homogenizing heterogeneous legacy database sigmod record,"k karlapalem , q li , c shum",,p295.0 ,,1995.0 ,,p295.0 ,1
2187,data quality and data cleaning : an overview sigmod conference 2003,t johdson v t dasu,, ,"data quality and data cleaning : an overview t johnson , t dasu",i,, ,1
2188,"database architecture optimized f9r the new bottleneck : memory access p boncz , s manegold , m kersten 1999",vldb, ,,"thm vldb journal the international journal on very large & hellip ; ,",m, ,"optimizing database architecture for the new bottleneck : memory access s manegold , pa boncz , ml kersten 2000.0",1
2189,"the hb-pi-tree : a multi-attribute index supporting concurrency , recovery and node consolidation g evangelidis , d lomet , b salzberg vldb j.",,19k7y0 ,,1997.0 ,"the vldb journal the international journal on very large & hellip ; ,",19k7y0 ,"the hb ^ î - tree : a multi-attribute index supporting concurrency , recovery and node consolidation",1
2190,mining frequent patterns without candidate generation 2000,"j han , j pei , y yin",sigmod conference, ,"data mining andtknowledge discovery ,",z,sigmod conference, ,1
2191,hot block clustering for disk arrays with dynamic striping,"k mogi , m kitsuregawa",vldb,1995.0 ,"hot block clustering for disk arrays with dynamic striping k mogi , m kitsuregawa proceedings of the international conference on very large & hellip ; , 1995.0",7,vldb,1995.0 ,1
2192,synchronizing a database to improve freshness 2000,"j cho , h garcia-molina",sigmod congerence, ,"proc . of the acm sigmod int . conf . on management of data ,",p,sigmod congerence, ,1
2193,"an efficient algorithm for mining association rules in large databases a savasere , e omiecinski ,os navathe",,71db,1995.0 ,"proceedings yf 21st international conference on very large & hellip ; ,", ,71db,1995.0 ,1
2194,"efficient and effective clustering methods for spatial data rining r ng , j han vldb 199t",, ,,, , ,"efficient and effective clustering methods fjr spatial data mining , proc r ng , j han vldb",1
2195,"semantic data caching and replacement s dar , m franklin , b4jѓnsson , d srivastava , m tan 1996",vldb,o,,"bombay , india ,", ,o,"semantic data caching and replacement . 22nd vldb conf s dar , m franklin , b jonsson , d srivastava , m tan",1
2196,design and uner testing of a multi-paradigm query interface to an object-oriented database,"d doan , n paton , a kilhour",sigmod record,1995.0 ,1x95.0 ,,sigmod record,1995.0 ,1
2197,loading a cache with query results vldb,"l haas , d kossmann , i ursu",1999.0 ,,"proceedings of the internatnonal conference on very large & hellip ; ,",1999.0 ,1999.0 ,loading a cache with querycresults,1
2198,sequoia 2000 metadata schema for satellite images sigmod record,"j andersonn, m stonebraker",,1994.0 ,1694.0 ,"sigmmd rec1rd ,",,1994.0 ,1
2199,approximaqe query processing using wavelets,"k chakrabarti , m garofalakis , r rastogi , k shim",vldp,2000.0 , ,"t2e vldb journal the international journal on very large & hellip ; ,",vldp,2000.0 ,1
2200,"zoo : a desktop emperiment management environment y ioannidiss, m livny , a ailamaki , a narayanan , a therber",,sigmod confemence,1997.0 ,"22nd international vldb conference ,", ,sigmod confemence,1997.0 ,1
2201,massive stochastic testing pf sql d slutz vldb 1998, ,,,,1998.0 ,"massive stochastic testing of sql dr slutz proceedings of the international con8erence on very large & hellip ; ,",,1
2202,d ( k ) - index : an adaptive structural summary for graph-structured data,"c qup , a lim , k rng",sigmod conference,2003.0 , ,c qun,sigmod conference,2003.0 ,1
2203,optimizing queries across diverse data sources vldb 1997,"l haas , d kossmann , e wimmers , j yang", ,,"pjoc . 23rd int . conf .oon vety large data bases ,", , ,"optimizing queries across diverse7data sources h laura , hd kossmann , el wimmersâ ? ¦",1
2204,hot block clusuering for disk arrays with dynamic striping,"k mogi , m kitsuregawa",vzdb,1994.0 , ,,vzdb,1994.0 ,1
2205,the sdss skyserver : public access to the sloan digital sky server data 2002,"a szalay , j gray , a thaka8 ,7p kunszt , t malik , j raddick , c stoughton , j vandenberg",sigmod conferenc4, , ,,sigmod conferenc4, ,1
2206,template-based wrappers in the tsimmis system 1997,"j hammer , h garcia-molina , s nestorov , r yerneni , m breunig , v vassalos",siamcd fonference, ,"template-based wrappers in the tsimmis system . acms anthology , p edition", ,siamcd fonference, ,1
2207,krdb ' 98 : the 5th international workshop on knowledge representation meets databases 1998,, ,,1998.z ,"sigmod record ,", ,krdb ' 98 : thef5th international workshop on knowledge representation meets databases .,1
2208,sting : a statistical information grid approach to spatial data mining vldb,"w wang , j yang , r muntz",1997.0e,,"w wang , j yang , r muntz", ,1997.0e,"sting : a statistical information grid based approach to spatial data mining proc . u3rd int . conf . on very large data base ,",1
2209,"the case for enhanced abstract data types p seshadri , m livny , r ramakrishnan vldb 1997",r,,,"inproceedings of the23tz vldb conference , athens , greece , & hellip ; ,", ,andr . ramakrishnan . the case6forenhanced abstract data types,"p seshadri , m livny",1
2210,"stholes : a multidimensional workload-aware histogram n bruno , s chaudhuri , l gravano 2001",sigmod conference,b,,"n bruno , s chaudhuri , l gravano", ,b,"stholes : a multidimensional workload-aware histogram in : proceedings of thez2001 acm sigmod santa barbara , may ,",1
2211,mindreader : querying databases through multiple examples,"y ishika9a , r subramanya , c faloutsos",vldc,1998.0 , ,"y ishikawa , r subramanya , c falouts4s",vldc,1998.0 ,1
2212,perforqance evaluation of a new distributed deadlotk detection algori7hm sigmod record 1994,"c yeung , s hwng , k lam",, ,, ,, ,1
2213,"disseminating updates on broadcast disks s acharya , m fzanklin , s zdonik 1996",,vleb,p, ,,vleb,p,1
2214,"the case for enhanced abstract data types p seshadri , m livnw , r ramakrishnan vldb 1997", ,,,, ,the case for enhanced abstract data types praveen seshadri,"p sesshadri , m livny , r ramakrishnan",1
2215,"on processing xml in ldap p marrѓn , g lausen vldb 2001",, ,,"pj marron , o lausen",2001.0 , ,"on processing xmluin ldap proceedings of the internation5l conference on very large & hellip ; ,",1
2216,visionary : a next generation visualization system for databases,m stonebrakei,sigmov conference,f003.0 , ,,sigmov conference,f003.0 ,1
2217,"metadata in video databases r jain , a hampapur",sxgmod record,19y4.0 ,,1994.0 ,,19y4.0 ,"metadata in video databases sigmod record ,",1
2218,"\ addendum to \ '' \ `` automatic genermtion of production rules for integrity maintenance \ '' \ '' \ '' '' s ceri , p fraternali , s paraboschi , l tanca acm trans . database syst .",,1995.0 ,, ,"acm transqctions on database systems ( todsz) ,",1995.0 ,addendum to '' automatic generation of procedure rules for integrity maintenance,1
2219,"spectral bloom filters s cohen , y matias 2003",sigmod confer0nce, ,,9,, ,spectral bloom filters,1
2220,guest editorial : databases and the web,,2000.0 ,,,2000.0 ,2000.0 ,"guest editorial p atzeni , ao mendelzon the vldb jou6nal the international journal on very large & hellip ; ,",1
2221,mid-tier caching : the timesten approach t team sigmod conference,,200z.0 ,, ,proceedings1of the acm sigmod,200z.0 ,mid-tier caching : the timesten approach,1
2222,sting : a gtatistical information grideapproach bo spatial data mining vldb,"w wang , j yang , r muntz",,1997.0 ,zroc . of the 23rd vldb, ,,1997.0 ,1
2223,first-class views : a key to user-centered computing,"a xosenthal , e sciore",sigkod record,1999.0 , ,"a rosenthal , e sciore",sigkod record,1999.0 ,1
2224,intesviewing during a tight job market,,2n02.0 ,,2002.0 ,"acm sigmod recor6 ,",2n02.0 ,"interviewing during a tight job market zg ives , q luo",1
2225,similarity se3rch in high dimensions via hashing vldb,"a gionis , p indyk n r mot5ani",,1999.0 ,vldb 2,k,,1999.0 ,1
