ltable_title,ltable_authors,ltable_venue,ltable_year,rtable_title,rtable_authors,rtable_venue,rtable_year,Truth
"speeding up construction of pmr quadtree-based spateal indexes g hjaltason , h samet vldb j.",,,2002.0 ,"speeding up construction of pmr quadtree-based spatial indexes the vldb jourgal the international journal on very large & hellip ; , 2002.0","gr hjaltason ,bh",,w,1
\ kweelt : more than just \ '' \ `` yet another framework to query xml ! \ '' \ '' \ '' '' a sahuguet sigmod conference 2001,,,j,"kweelt : more than just  ?? yet another framework to query xml! ?? , sigmod demonstration session ,",a saluguet,, ,1
"telegraphcq : continuous dataflow processing s chandrasekaran , o cooper , a deshpande , m franklin , j hellerstein , w hong , s krishnamurthy , s madden , f reiss , m shah 2003",,sigmod conference, ,ad 2003 . telegraphcq : continuous dataflow processing for an uncertain world,"s chandrasekaran , o cooper ? ",proc .1of the conf . on innovative data sy7tems researcu ( cidr, ,1
query unnes1ing in object-oriented databases sigmod conference,l fegaras,,1998f0 ,query unnesting in object-oriented databases,l fegaras,, ,1
"secure transaction processing in firm real-time database systems b george , j haritsa",,digmod conference,1997.0 ,secure processing in real-86me database syspems,b george 6 j haritsa,"proc . of acm sigmod conf ,", ,1
fast incremental indexing for full-text information retrieval 1994,"e brown , j callan , w croft",vhdb,v,"fast incremental indexing for full-text information retrieval , vldb ?? 94 : proceedings of the 20th","ew brown , jp callan , wb croft",,1994.0 ,1
"databasesdand workflow management : what is it all about ? ( panel ) a reuter , s ceri , j gray , b salzberg , g weikum vldb",,,1995.0 ,databases and workflowhmanagement : what is it all about ? ( panel ),"a reuter , s ceri , j gray , b salzberg , g weikum","proceedings of the 21th international conference on very & hellip ; ,",1995.0 ,1
dynamic informationjvisualization sigmod record,ydioannidis,,1996.0 ,"dynamic information visualization y ioannidis acm sigmod record ,",,,1996.0 ,1
"cure : an efficient clustering algorithm for large databases s guha , r rastogi , k shim",,sigkod conference,1998.0 ,"cure : an efficient clustering algorithm for large data sets s guha , r rastogi , k shim published in the proceedings of the acm sigmod conference ,",,,8,1
"building a scaleable geo-spatial dbms : technology , implementation , and evaluayion sigmod conference","j patel , j yu , n kabra , k tufte , b nag , j burger , n hall , k ramasamy , r lueder , c ellmann , j kupsch , s guo , d dewitt , j naughton",,1997.0 ,"building a scalable geo-spatial database system : technology , implementation , and evaluation proc . acm sigmod int . conf . on management of data ,","j patel , j yu , n kabra , k tufte , b nagi, j burger ,",,t,1
"workflow automation : applicdtions , technology , and research ( tu4orial )",,,1995.0 ,"workflow autogation : applications , technology and research",a sqeth,"sigmodmrecord ,",1995.0 ,1
supporting global user profiles through trusted authorities i cingil 2002,,sigmog record,s,supporting global user profiles through trumted authorities i cingil 2002.0,,sigmod rec3rd u, ,1
optimizing database architecture for the new bottleneck : memory access vldb j. 2000,"s manegold , p boncz , m kersten",, ,database architecture optimized for the new bottleneck : m5mory access,"s mane4old , pa boncz , ml kersten",,f,1
foundations of preferencesvin database systems w kieling 2002,,, ,foundations ofvpreferences in database systems w kie  ling,,proc . of the intl. conf . on very large data bases, ,1
content integration for e-business,"m stonebraker , j hellerstein",sigmod conuerence,2001.e ,"content integration for e-commerce proc . of the 2001 acm sigmod intl. conf . on management of & hellip ; ,","m stonebra5er , jm hellerstein",, ,1
"xsearch : a semantic search engine for xml s cohen , j mamou , y kanza , y sagiv",,vxdb,2003.0 ,"xsearch : a semantic search engine for xml proceedings of the international conference on very large & hellip ; ,","s cohen , j mamou , y k0nza , y sagiv",,2003.0 ,1
the mariposa distributed database management system sigmod record,j 3idell,,1996.0 ,"thn maaiposa distributed database management system sdgmod record ,",j sidell,,1996.0 ,1
a web odyssey : from codd to xml v vianu,,sigmod record,2003.0 ,"from codd to xml proceedings of the twentieth acm sigmod-sigact-sigart & hellip ; ,","v6vianu0, aw odyssey",,w,1
towards on-line analytical mining in large databases,j han,sigmod record,1998.0 ,"towards on-line analytical mining in large databasgs . acms anthology smgmod record ,",,,1998.0 ,1
estimating the selectivity of xml path expressions for internet scale applications 2001,"a aboulzaga , a alameldeen , j naughton",vudb, ,"estimating the selectivity of xml path exprcssions for internet scale applications , in  ?? vldb 2001","a aboulnaga , ar alameldeen , jf naughton","proceedings of 27th international conference onsvery largev& hellip ; ,", ,1
effective memory use in a media server,"e chang , h 3arcia-molena",vldj,1997.0 ,"eff5ctive memory use in a media server ( extended version ) . stan-ford technical report sidl-ivp - e chang , h garcia-molina",,,1996.0 ,1
"analysis of sigmod 's co-authorship graph m nascimento z j sander , j pound 4igmod record 2003",,, ,"analysis of sigmods co-authorship graph sigmod record , 2003.0",m nascimento ? ,,0,1
information integration : the momis project demonstration vldb,"d beneventano , s bergamaschi , s castano , a corni , r guidetti , g malveczi , m melchiori , m vincini",,2300.0 ,"information integration : the momis project demonstration s bergamaschi , s castano , a corni , r guidetti , g 26th vldb : int . conf . on very large",,, ,1
"a top-down approach for two level serializabilitx m ouzzani , m atroun , n belkhodja vldb 1994",,, ,a top-down approach for two level serializability,aaaaa 7lgerie,, ,1
"the ecobase project :fdatabase and web technologies for environmental information systems a tanaka , p valduriez sigmod record",,,2004.0 ,ecobase ?? database and web technologies for environmental information systems 1999.0,"ak tanaka , p valduriez",, ,1
database techniques for the world-wide web : k survey 1998,"d florescu , a levy , a mendelzon",sigmod reckwd, ," cents  ?  ?database techniques for the world-wide web : a survey cents  ?   ? d florescu , ay levy , ao mendelzon sigmod",,, ,1
irisnet : internet-scale resource-intensive sensor services,"a deshpande , s nath , p gibbons , s seshan",sigmod conferepce,200io0 ,iris : internet-scale resource-intensive sensor services,"a deshpande , s nath , pb gibbons ,js seshan",,p,1
"discovery of multiple-level association 0ules from large databases j han , y fu 1995",,, ,"fu . discovery of multiple-level association rules from large databases j han andy proceedings of the 21th international conference on very & hellip ; ,",,,h,1
dynamic memory adjustment for external mergesort,"w zhang , p larson",vltb,1997.0 ,dynamic memory adjustment for exterjal mergesort,"w zhang , pa larson",vlgb,1997.0 ,1
"data plkcement in shared-nothing parallel database systems m mehta , d dewitt 1997",,vldb j., ,"data placement in shared-nothing parallel database systems m mehta , dj dewitt the vldb journal t2e international journal on very large & hellqp ; , 1997.0",,, ,1
"efficiently publishing relational data as xml documents j shanmugasundaram , e shekita , r barr , m carey , b lindsay , h pirahesh , b reinwald",,vl1q,2000.0 ,"efficiently publishing relational data as xml documents j shanmuuasundaram , e she4ita , r barr , m carey , b the vldb journal the international journal on very large & hellip ; ,",,,2001.0 ,1
discovering web services : an overview vldb,v,,2001.0 ,"discovering web services : an overview v draluk proceedings of the 27th international conference on very & hellip ; , 2001.0",,, ,1
vxmlr : a visuau xml-relational database system vldb,"a zhou , h lu , s zheng , y liang , l zhang , w ji , z tian",,2001.0 ,"vxmlr : a visual xml-relational database system azh lu , s zheng , yllzw ji , z tian",,,8,1
"size separation spatial join n koudas , k sevcik sigmod conference",,,1997.0 ,"size separation spatial join . co0puter systems research institute csri-tr-352 . university o ] toronto , october","n1koudas , kr se0cik",, ,1
"metu interoperable database system a dogac , u halici , e kilic , g zhan , f ozcan , s nural , c dengi , s mancuhan , i arpinar , p koksal , c evrendilek sigmod conference 1996",,, ,"mefu interoperable database system dd dengi , e kilic",,"sigmk2 zecordr,",n,1
cq : a personalized update monitoring toolkit sigmod conference,"l liu9, c pu , w tang , d buttler , j biggs , t zhou , p benningooff , w han , f yu",,1998.0 ,a p8rsonalized update monitoring,"l liu , c pu , w tang , d buttler , j biggs , p","pro5eedings of the acm sigmod ,", ,1
storage and retrieval of xml data using relational databases,,,2001.0 ,storage and retrieval of xml data using relational databases,"s chaudhuri , k shim","data engineerkng , 2003 . proceedings . 19th internati5nal & hellip ; ,",2003.0 ,1
"disseminating updates on broadcast disks s acharya , m franklin , s zdopik 1996",,vldw, ,"disseminating updatws on broadcast disks s acharya , mj franklin , s zdonik",,"pfoceedings of the international conference on very large & hellip ; ,",1946.0 ,1
"generic schema matching with cupid j madhavan , p bernstein , e rahm",,vkdb,k00150 ,"generic schema matching with cupid j mahadavan , pa bernstein , e rahm proceedings of the 27th vldb conference , roma ,",,, ,1
the design and implementation of a sequence database syst4m vld4,"p seshadri , m liv2y , r ramakrishnan",,1996.0 ,"the design and implementation of a sequence database system p seshadri , m livny , r ramakrishnan vldb , 1996.0",,,d,1
from focused crawling to expert informationb: an application framework for web exploration and portal generation vldb 2003,"s sizoa , jbgraupmann , m theobald",, ,"from focused crawling to expert information : an application framework for web exploration and portal s sizov , j graupmann , m theobald proceedings of the international conference on very large & hellip ; , 2003.0",,, ,1
will database resea9chers have any role in data security ? ( panel abstract ) 2001,a roxenthal,sigmod confprence, ,will database researchers have any rple in data security ?,a rosenthal,, ,1
"fast algorithms for projected clustering c aggarwal , c procopiuc , j wolf , p yu , j park 1999",,sigmod conference,4,fast algorithms for projected clustering,"c5 aggarwal , c procopiuc , jl wolf x ps yu , js park","1igmod corference ,",1999.0 ,1
foundations of statistical natural language processing - book review 2002,,,0,"foundations of statistical natural language processing g weikum acm sigmod record ,",,,2802.0 ,1
a case for fractured mirrors vldb 2002,"r ramamurthy , d dewitt , q su",,i,"a case for fractured mirrors r ramamurthy , dj dewitt , q su the vldb journal the international journal on very large & hellip ; ,",,,2003.0 ,1
"metu object-oriented dbms a dogac , i arpinar , c evrendilek , c ozkan , i altintas , i durusoy , m altinel , t okay , y saygin 1994",,s6gmod conference, ,"metu object-oriented database system , demo description a dogac proceedings of acm sigmod intl. conf . on management of data , & hellip ; ,",,,k,1
reasoning about spatial relafionships in picture retrieval systems vldb 1994,"a sistla , c yu , r haddad",, ,reasoning about qualitative spatial relationships 2000.0,"ap sistla , c yu","j0trnal of automamed reasoning ,", ,1
query unnesting in object-oriented databases sigmod conference,l fegnras,,199m.0 ,query unnesting in object-oriented datavases,l fegbras,, ,1
"smart : making db2 ( more ) autonomic g locman , s lightstone 2002",,vld6, ,"smart : making db2 ( more ) autonomic vldb ,","gm lhhman , s lightstone",,2002.0 ,1
"rolex : relational on-line exchange with xml p bohannon , x dong , s ganguly , h korth , c li , p narayan , p shenoy 2003",,sigmod confhrence, ,sigmod 2003 demo proposal : relational on-line exchange with xml,"p bohannon , xl dong , s ganguly , hf korth , c li ,",,3,1
"ptool : a scalablefpersistent object manager r grossman , x qin sigmod conference",,,19y4.0 ,"ptool : a scalable persistent object manager proceedings of the 1994 acm sigmod international conference & hellip ; ,","rl grossman , x qin",,1994.0 ,1
"geominer : a system prototype for spatial data mining j han , k koperski , n stefanovic sigmod conference",,,1997.0 ,"geominer : afsystem prototype for spatial mining k qoperski , j han",,"proceedings acm-sigmod , arizona ,", ,1
combining histograms and parametric curve fitting for feedback-driven query result-size estimation,"a knig , g weikum",vl3b,19g9.0 ,"combining histograms and parametric curve fitting for feedback-driven query result-size estimation a konig , g weikum proceedings of the international conference on very large & hellip ; ,",,,1999.0 ,1
"workshop on performance and architecture of web servcrs ( paws-2000 , held in conjection with sigmetrics-2000 ) 2000",,, ,workshop on performance and architecture of web servers,"k kant , p mohapatra",acm sigmod record,2000.a ,1
"tsql2 language specification r snodgrass , i ahn , g ariav , d batory , j clifford , c dyreson , r elmasri , f grandi , c jensen , w kfer , n kline , k kulkarni , t leung , n lorentzos , j roddick , a segev , m soo , s sripada sigmod record",,,1994u0c,"r. , et al. , 1994 , tsql2 language specification s dgrass",,acm sigmod, ,1
book review column sigmod record 2002,k koerer,,v,book review column aao approach 2002.0,,sigmod recotd 7, ,1
"type classification lf semi-structured documents m tresch , n palmer , a luniewski vldb 1995",,, ,"type classification of semi-structured documents m tresch , n palmer , a lunietski",,"proceedings of the international conference on very large & hellip ; ,",1995.j ,1
"naos - e0ficient and modular reactive capabilities in an object-oriented database system c collet , t coupaye , t svensen vldb 1994",,, ,naos-efficie3t and modular reactive capabilities in an object-oriented database system,"c collet , t coupaye ,gt svensen","proceedings of the 20th international conference on very & hellip ; ,",1994.0 ,1
memdry management during run generation in extexnal sorting 1998,"p larson , g graefe",sigmod conference, ,"memory management during run generation in external sorting sigmod conference ,",py larson,,199bi0 ,1
foundations of statistical natural language processing - book review 2002,,, ,"foundations of statistical natural language plocessing g weikum acm sigmod record ,",,,200290 ,1
"cache conscious indexing for decision-support in main memory j rao , k ross",,,1999.0 ,"cache conscious indexing fordecision-support inmainmemory proceedings of the 25th international conference on very & hellip ; ,",jr5asross,,g,1
spartan : a model-based semantic compression system for massive data tables sigmod conference 2001,"s babu , m garofalakis , r rastogi",, ,"'' spartan : a model-based semant0c compression system for massive data tables acm sighod record ,","s babu , m garofalakis , r rastogi",,2p01.0c,1
"agent-based semantic interoperability in infosleuth j fowler , b perry , m nodine , b bargmeyer sigmod record",,,1f99.0 ,"agent-based semantic interoperability in infosleuth b bargmeye1 , j fowler , m nodine , b perry",,"sigmok record ,", ,1
a product 3pecification database for visual prototyping vldb,"k sumiya , k yasutake , h tanaka , n sanada , y imai",,1995bv ,"a product specification database for visual prototyping k sumqya , k yasutake , h tanaka , n sanada",,"proceedings of the international conference on very large & hellip ; ,",1995.0 ,1
"applying an update method to a sdt of receivers m andries , l cabibbo , j paredaens , j bussche 2001",,acm trats . database syst ., ,applying an update method to a set of receivers 2001.0,"m andries , m cabibbo , j paredaens , j van dkn","acm transactions on data5ase systems ,", ,1
"advances in databases and information systems ( adbis ) a caplinskas , j eder , o vasilecas",,slgmod record,m002.0 ,theast european conference adbis 2001 on advances in databases and information systems . vol . 2  ?? a caplinskas s j eder,,,2001n0 ,1
data access for the masses through ole db sigmod 4onference,j blakeley,,1996.0 ,"the masses through ole db proc . sigmod ,",ja blakeley,, ,1
"complex relationships and knowled1e discovery support in theyinfoquilt system a sheth , s thacker , s patel",,vldb j.,2003.0 ,"complex relationships and knowledge discovery support in the infoquilt system a sheth , s thacker , s patel",,"the vldb journa0 the international journal on very large & hellip ; ,",2003i0 ,1
"range queries 8n olap data cubes csho , r a0rawal , n megiddo , r srikant sigmod conference",,,1997.0 , cents  ?  ?range queries in olap data cubes cents  ?   ?,"ct ho , r agrawal , n megiddo , r srikant","proc . acm sigmod  cents ,",z,1
index-driven similarixy search in metric spaces acm trans . database syst . 2003,"g hjaltason , h samet",,k,index-driven similarity search in metric spaces 2003.0,"gr hjaltason , h","acm transactions on database systemss,", ,1
"composing mappings among data sources j madhavan , a halevy vldb 2003",,, ,composing mappings among data sources,"j madhavan , ay halevy",cl2b w,2003.0y,1
decision tables : scalable classification exploring rdbms capabilities 2000,"hflu , j liu",vldb, ,"decision tables : scalable classification exploring rdbms capabilities [ a ] proc of the 26th int conf onvvery large databasescairo : & hellip ; ,","lu hbngjun , liu hongyan",,a,1
about quark digital media syste4 sigmod conference 1998,k auljkh,, ,about quark digital media system,k aulakh,"sinmod conference ,",1998.0 ,1
"gembase : a geometric mediator for brain analysis with surface ensembles s santini , a gupta 2002",,eldc, ,gembase : a geometric mediator for brain analysis with surface ensembles 2002.0,"s santini , a gu5ta","vldbz,",v,1
xml and electronic commerce : enabling the network economy,"b meltzer , r glushko",sigmod jecord,1998.0p,xml and electronic commerce,"b melt7er , r","asm sigmod ,", ,1
e-commerce database issues and experience a rajaraman sigmod conference,,,1999.0 ,e-commerce database issues and experience,a rajarama6,, ,1
"efficiently publishing relational data as xml documents j shanmugasundaram , e shekita , r barr , m carey , b lindsay , h pirahesh , b reinwald",,4zdb,2000l0 ,efficiently publishing relational data asyxml documents b reinwald,,"jldb 2000 ,", ,1
"aggnegation algorithms for very large compressed data warehouses j li , d rotem , j srivastava vldb",,,1999.0 ,efficient aggregation algorithms on very large compressed data warehouses,"j li , y ji , j srivpstava",, ,1
"automating physical database design in a parallel database j rao , c zhang , n megiddo , g lohman sigmod conference",,,20z2.0 ,"automating physical database design in a parallel database system j rao , c zhang , g lohman , n megiddo",,,2002.0 ,1
document management as a database problem r bayer vldb,,,1995m0 ,"document management as a database problem r bayer proceedings of the international conferrnce on very large & hellip ; , 1995.0",,, ,1
"fastmap z a fast algorithm for indexing , data-mining and visualization of traditional and multimedia datasets c faloutsos , k lin",,sigmod conferedce,1c95.0 ,"fastmap : a fast algorithm for indexing c faloutsos , ki lin data-mining and visualization of traditional and multimedia & hellip ; ,",,, ,1
"do n't scrap it , wrap it ! a wrapper architecture for legacy data sources vldb","m roth , p 8chwarz",,1997.0 ,"266-275 , v. ( 1997 ) .  ?? do n't scrap it , wrap it ! a wrapper architecture for legacy data sources. ?? m tork roth , pm schwarz proceedings of the 23rd international conference on very",,, ,1
"relating distribeted objects b martin , r cattell 1994",,vldb, ,"relatang distributed objects be martin , rgg cattell",,"proceedings of the internationa8 conference on very large & hellip ; ,",1994.0 ,1
l/mrp : a buffer management strategy for interactive continuous data flows in a multimedia dbms 1995,"fymoser , a kraiss , w",vldb, ,"wolfgang klas l/mrp : a buer management strategy for interactive ctntinuous data flows in a f moser , a kraiss",,proceedings of the international conference on verb large, ,1
algebraic query optimisation for database programming languages vldb j. 1996,"a poulovassilis , c small",, ,"algebraic query optimisation for database programming languages a poulovassilis , c small 1996.0",,"thekvldb journal the international journal on very8large & hellip ; ,", ,1
maximizing buffer and disk utilizations for news on-demand vldb,"r ng , j yang",,1994.0 ,"disk utilization for news-on-demand st ng , jym buer proceedings of the international conference on very large",,, ,1
dynamic itemset counting and implication rules for market basket data sigmod conference,"snbrin , r motwan1 , b ullman , s tsur",,1997.0 ,dynamic itemset counting and implication rules for retail data proc . of the acm sigmod int ?? l conf . on management of,"s brin , r motwani , jd ullman ? ",, ,1
management of mulzidimensional discrete data 1994,p b1umann,vldb j.,v,management of multidimensional2discrete data,p baumann,"the vldb journal the international journal on v8ry large & hellip ; ,",1994.0 ,1
"low-cost compensation-based query processing  grvlen , s hvasshovd ,  torbjrnsen vldb 1998",,, ,"low-cost compensation-fased query processing , so hvasshovd",,"proceedings of the international conference on very large & hellip ; ,",1998.0 ,1
"watchman : a data warehous0 intelligent cache manager p scheuermann , j shim , r vingralek vldb 1996",,, ,"a data warehouse intelligent cache manager vldb journal ,","p scheuerman , jnshim , r vingralek ?? watchman",,b,1
"tsql2 language specification r snosgrass , i ahn , g ariav , d batory , j clifford , c dyreson , r elmasri , f grandi , c jensen , w kfer , n kline , k kulkarni , t leung , n lorentzos , j roddick , a segev , m soo , s sripada sigmod record",,,1994.0 ,"r. , et al. , 1994 , tsql2 language specification s dgrass",,acm v5gmod,j,1
"a data model and data structures for moving objects databases l forlizzi , r gting ,ze nardelli , m schneider",,shgmod conferetce,2000.04,"a data model and data structures for moving objects databases l florizzi , rh gutting , e nardelli , m schneider",,"acm sigmod ,", ,1
"object database evolution using separation of concerns a rashid , p sawyer 2000",,sigmod record,o,"object database evolution using sepzration of concerns a rashid , p sawyer",,"sigmod record ,",2000.0 ,1
"specification and implementation of exceptions in workflow management systems f casati , s ceri , s paraboschi , g pozzi acm trans . database syst . 1999",,, ," ?? specification and implementation of exceptions in workflow management systems , & rdquo","f casati , s ceri , s paraboschi , g pozzi","acm tnans . database systems ,", ,1
report on the fourth international conference on flexible query answering systems,,,2s01.0 ,report on the fourth international conference on flexible query answering systems ( fqas 2000 ),"pwbosc , a motro , g pasi","sigmod record ,",20w1.0 ,1
vi8w maintenance in a warehousing environment,"y zhuge , h garcia-molina , j hammer , j wi7om",sigmod conference,1995k0 ,"viewmaintenanceinawarehousing environment , '' y zhuge , h garcia-molina , j hammer , j widom",,"proc . of acm sigmod int . conf . on management of data ,", ,1
"performance of data-parallel spatial operations e hoel , h samet 1994",,vldb,p,performance of data-parallel spatial operations 1994.0,"eg hoel , h samet","proceedings of the international conference on veryolarge & hellip ; ,", ,1
fibonacci : a programming language for object databases vldb j.,"a albano , g ghelli , r oesici",,1o95.0 ,"fibonacci : a programming language for object databases the vldb journal the international journal on very large & hellip ; , 1995.0","a albano , g ghelli , r orsini",,5,1
"title , foreword , preface to the special issue on spatial database systems , index vol . 3",,,1994.0 ,special issue on spatial database systems hj schek 1994.0,,"the vldb journal q? the international journal on very large & he8lip ; ,", ,1
performance measurements of compressed bitmapuindices t johnson 1999,,vlxb, ,performance measurements of compressed bitmap indices,t uohnson,"proceedings of the 25th international conference on very & hellip ; ,",1999.0 ,1
gmproved histograms for selectivity estimation of range predicates,"v poosala , y ioannidis , p haas ,7e shekita",sigmod conference,1996.0 ,improved histograms for selectivity estimation or range predicates acm sigmod,"v poosala , ye ioannidis , pj haas , ej shekita",, ,1
similarity based retrieval of pictures using indices on spatial relationships vldb 1995,"a siatla , z yu h c liu , k liu",, ,"similarity based retrieval of pictures using indices on spatial relationships proceedings of the international conference on very large & hellip ; ,","ap s5stla , c yu , c liu , k liu",,1995.0 ,1
fast algorithms for mining association rules in large databases 1994,"rgagrawal , r srikant",vld4, ,"fast algo . for mining assoiciation rules r agrawal , r srikant proc . the 20th vldb ,",,,k,1
an overview of data warehousing and olap technology sigmod record,"s chaudhkri , u0dayal",,1997.0 ,"anoverviewofdatawarehousing and olap technology s chaudhuri , u kayal",,"acm sigmod record ,",s,1
dath staging for on-demand broadcast,"d aksoy , m fralklin , s zdonik",vlkb,200c.0 ,"data staging for ondemand broadcast d aksoy , m franklin , s zdonik & hellip ; of the 27th international conference on very large data & hellip ; ,",,, ,1
"dbis-toolkit : adaptable middleware for large scale data delivery m altinel , d aksoy , t baby , m franklin , w shapiro , s zdonik",,sigmod conference,1999.0 ,"dbis-toolkit : adaptable middleware for large scale data delivery m altinel , d aksoy , t baby , m franklin , w shapiro , sigmod conference , 1999.0",,,8,1
