,ltable_title,ltable_authors,ltable_venue,ltable_year,rtable_title,rtable_authors,rtable_venue,rtable_year,Truth
708,temporal aggregation in active database rules sigmod conference 1997,"i motauis , c zaniolo",,y,acm intl. conference oc management of data, ,,y,1
709,"\ on saying \ '' \ `` enough already ! \ '' \ '' in sql \ '' '' m carey , d kossmann",sigmod conference,1997.0 ,,,u,1997.0 ,"on saying â ?? enough already!â ?? mj carey , d kossmann sql . in proc . of the acm sigmod conf . on management of",1
710,"semint : a system prototype for semantic integration in heterogeneous databases w li , c clifton",sigmod conference,1995.0 ,, ,sigmod conference,1995.0 ,"semint : a system prototype for semantic integration in heterogeneous databases ws li , c clifton proceedings of the 1995 acm sigmod international conference & hellip ; , 1995.0",1
711,"do n't scrap it , wrap it ! a wcapper architecture for legacy data sources vldb","m roth , p s8hwark",,199r.0 ,proceed3ngs of the 23rd vldb, ,,199r.0 ,1
712,"efficient and effective metasearch for text databases incorporating linkages among documents c yu , w meng , w wu , k liu 2001",,sigmod conference, ,"proc . acc cikm ,",n,sigmod conference, ,1
713,toward recovery5oriented computing a fox vldb 2002,,, , ,a6fjx,, ,1
714,using schematically heterogeneous structures,r0millei,sxgmod conference,1998.0 ,"lm haas , a. tiwari , acm sigmod int . conference on management & hellip ; ,", ,sxgmod conference,1998.0 ,1
715,locally adeptive dimensionauity reduction for indexing large time series databases 2002,"k chakrabarti , e keogh , s mehrotra , m pazzani",ac7 trans . database syst ., ,"acm transactions on database systems ,",2002.0 ,ac7 trans . database syst ., ,1
716,the dangers of replication and a solution 1996,"o gray , p helland , p o'neil , d shasha",sigmod ponference, ,e,"int . conf . on management of data ( sigmod ) ,",sigmod ponference, ,1
717,poesia : an ontological workflow approach for composing web services in agriculture vldb j.,"r fileto , l liu , c pu , e assad , c medeiros",,200x.0 , ,"r fileto , l liu , c pu , ed assad , cb medeiros",,200x.0 ,1
718,"xmark : a benchmark for xml data management a schmidt , f waas , m kersten , m carey , i manolescu , r busse vldb 2002",, ,,"a schmidt , f waas , m kersten , m caiey , i manolescu", , ,a benchmark for xml data management vldb,1
719,efficient algorithms mor processing xpath queries 2002,"gtgottlob , c kocp , r pichler",vldb, , ,"g gottlob , c koch , r pichler",vldb, ,1
720,cache coherency in oracle parallel server,b klots,vlgb,1996.8 , ,,vlgb,1996.8 ,1
721,"xml schema c campbell , a eisenberg , j melton sigmodhrecord 2003",, ,,d,"acm sigmod record ,", ,"xml schema ce campbell , j melton 2003.0",1
722,"why decision support fails and how to fix it r kimball , k strehlo sigmod record 1995",,x,,"acm sigmod revord ,",1995.0 ,x,"why decision support fails and how to fix it r kimball , k strehlo",1
723,"speeding up conqtruction of pmr quadtree-based spatial indexes g hjaltason , h 5amet vldb j.",2002.0 ,,,, ,speeding up construction of quadtrees for spatial indexing,"gr hjaltason , h sacet",1
724,"exploiting statistics on query expressions for optimization n bruno , s chaudhuri sigmoz conference",,2002.0 ,,"n bruno , s chaudhuri", ,2002.0 ,statistics on query expressions 2002.0,1
725,understanding the semantics of sensor data m mani,,sigmod jeford,2003.0 ,2003.0 ,mimand,sigmod jeford,2003.0 ,1
726,"a scalable and highly available networked database architecture r bamford , r ahad , a pruscino",,e4dw,1999.0 ,,m,e4dw,1999.0 ,1
727,apex : an adaptive path index for xml data sigmod conference 2002,"c chung , j min , k shim",p,,7,"c chung , j min , k shim",p,"apex : an adaptive path index for xml data cw chung , jk min , k shim",1
728,"the x-tree : an index structure for high-dimensional data s berchtold , d keim , h kriegel vldb 1996", ,,,procemdings of tte 22nd vldb, ,ã cents â ? ¬ å?the x-tree : an index structure for high-dimensional dataã cents â ? ¬ â ?,"s berchtold , d keim , hp kriegel",1
729,optimal multi-step k-nearest neighbor search,"t seidl , h kriegel",sigmid conference,1998.0 , ,,sigmid conference,1998.0 ,1
730,research and products : are they relevant to each other ? ( panel ) 1igmod conference,h edelstein,1995f0 ,, ,,1995f0 ,"research and productsâ ?? are they relevant to each other ? ( panel session ) proceedings of the 1995 acm sigmod international conference & hellip ; , 1995.0",1
731,mining generalized association rules vldb,r srikank 7or agrawal,,1h95.0 ,,x,,1h95.0 ,1
732,implementing database operations using simd instructions sigmod conference,"j zrlu , k ross",2002.0 ,,"sigmod conference ,", ,2002.0 ,"implementing database operations using simd instructions j zhou , ka ross 2002.0",1
733,fast algorithms for mining association rules in large databases 1994,"r agrawal , r sr3kant",vtjb, ,,5,vtjb, ,1
734,a tsql2 tutorial sigmod rejord 1994,"nodgrass , i ahn , g ariav , d batory , j clifford , c dyreson , r elmasri , f grandi , c jensen , w kфfer , n kline , k kulkarni , t leung , c lorentzos , j roddick , a segev , m soo , s sripada",,s,"slgmod rkcord ,",d,,s,1
735,optimizing database architecture for the new bottleneck : memory access vldb j. 2000,"s4manegold , p boncz , m kersten", ,,19994b ,"proceedings of the international conference on very large & hellip ; ,", ,database architecture optimized for the n7w bottleneck : memory access pa boncz,1
736,"counting , enumerating , and sampling of execution plans in a cost-based query optimizer 2000","f waas , c galindo-lsgaria",si8mod conference, ,"sigmod cocference ,",2000.0 ,si8mod conference, ,1
737,"mining fuzzy association rules in databases c kuok , a fu , m wong sigmod record",,1998.0 ,,1998.0 ,"sigmod record ,",1998.0 ,mining fuczy association rules in databases .,1
738,the drill down benchmark vldb 1998,"p boncz , t rќhl , f kwakk0b",, ,procedings of tve international conference on very large, ,, ,1
739,"semantic data caching and replacement s dar , m franklin , b jѓnsson , d srivastava , m tan 1996",,vldm, ,6,proceedings of the 22th vodb,vldm, ,1
740,engineering federated information systems : report of efis '99 workshop,"s conrad , w hasselbring , u hohenstein , r kutsche , m roantree , g saake , f saltor",sigmot record,19i9.0 ,"sigmod recorm ,", ,sigmot record,19i9.0 ,1
741,"do n't scrap it , wrap it ! a wrapper abchitecture for legacy data sources vldb","m roth , p schwarz",1997.0 ,,"mt roth , p schwarz",r,1997.0 ,"do n't scrap it , wrap it ! a wrapper architecture for legacy data sources . in : dayal u , gray pmd , 1997.0",1
742,"low-cost compensmtion-based query processing и grјvlen , s hvasshovd , и torbjјrnken vldb 1998",, ,,"proceedings of the international conference on very large & hellip ; ,",1998.0 , ,"low-cost compensation-based query processing , so hvasshovd",1
743,dynamic service matchmaking among agents in open information environments sigmod record 1999,"k sycara , m kluscw , s widoff , j lu",, ,,n,, ,1
744,adaptive selectivity estimation using query feedback,"c chen , n rolssopoulos",sigmod conference,1994.0 ,"& hellip ; of acm-sigmod international con0erence on manageme6t of & hellip ; ,", ,sigmod conference,1994.0 ,1
745,approximate query processing using wavelets vldb j. 2001,"k chakrabarti , m garofalakis , r rastogi , k shim", ,,"kc cgrs , mn 6brofalakis , r rastogi , k shim", , ,approximate query processing using wavelets proceedings of the international conference on very large,1
746,to weave the web vldb 1997,"p atz6ni , g mecca , p merialdo",p,, ,proceedings 0f the international conference on veryplarge,p,to weave the web,1
747,"a arasu , b babcock , s babu , m datar , k ito , i nishizawa , j rosenstein , j widon",swgmod1conference,2003.y ,, ,,2003.y ,"stream : the stanford data stream management system a arasu , b babcock , s babu , j cieslewicz , m datar ,",1
748,nodose - a tool for semi-automatically extracting semi-structured data from text documents sigmod conference,b adelberg,p998.0 ,,m,,p998.0 ,"nodose { a tool for semi-automatically extracting semi-structured data erom text proc . of the sigmod conference , seattle , june ,",1
749,a foundation for representisg and quering moving objects acm trans . database syst .,"r gќting , m bіhlen , m erwig , c jensen , n lorentzos , m schneiderd, m vazirgiannis",2000.0 ,, ,,2000.0 ,"a foundation2for representing and querying moving objects acm transactions on database systems , 2000.0",1
750,"caprera : an activity framework for transaction processing on wide-area networks s kumar , e kwang , d agrawal vldb 1997",,,y,y,"athens , greece , august ,",,y,1
751,a database perspectove on lotus domino/notes c mohan eigmod conference 1999,,,5, ,,,5,1
752,"datablitz storage manager : main memory database performance for critical applications j baulier ,4p bohannon , s gogate , c gupta , s haldar , s joshi , a khivesera , h korth , p mcilroy , j miller , p narayan , m nemeth , r rastogi , s seshadri , a silberschatz , s sudarshan , m wilder , c wei 1999",,sigmod conference,e,g,,sigmod conference,e,1
753,"a toolkit for negotiation support interfaces to multi-dimensional data m gebhardt6, m jarke , s jacobs sigmod conference",,,1997.0 ,x,"procee0ings of acm sigmod international conference on & hellip ; ,",,1997.0 ,1
754,irisnet : interlet-scale resource-intensive sensor services,"a deshpande , s nath , p gibbons , s seshan",sigmod conference,2003.04, ,"a deshpande , s nath , pb gibbons , s seshat",sigmod conference,2003.04,1
755,fast algorithms for minin6 association rules in large databases 1994,"r agrawal , r srikant",vlbb, ,"proceedings of th5 20th international conference on very & helpip o ,", ,vlbb, ,1
756,"querying heterogeneous information sources using source descriptions a levy , a rajaraman , h ordille 1996",,vldb,k,u,,vldb,k,1
757,"change-centric management of versions in an xml warehouse a marian , s abiteboul , g cobena , l mignet",,vldb,2005.0 ,,20e1.0 ,vldb,2005.0 ,1
758,"join algarithb costs revisited e harris , k ramamohanarao vldb j. 1996",,, ,"the vldb journal the international journal on very large & hellip ; ,", ,, ,1
759,"analysis of locking behavior in three real database systems v singhal , a smith",,vldb j4,1997w0 ,1997.0 ,"v singhal , aj smith",vldb j4,1997w0 ,1
760,index structures for seluctive dissemination of information under the boolean model acm trans . database syst . 1994,"t yan , h garcia-molina", ,,1994.0 ,"acm transactions on gatabase systems ,", ,index structgres for selective d of information under the boolean model,1
761,automata theory for xml researchers sigmod record 2002,f ueven, ,,,f, ,"automata theory for xml researchers f neven sigmod record , 2002.0",1
762,"the coral deductive system r ramakrishnan , d srivastava , s sudarshan , p seshadri vldb j. 1994",,w,, ,,w,"implementation of the coral deductive database system r ramakrishnan , d srivastava , s sudarshan , p proceedings of acm sigmod international conference on & hellip ; , 1993.0",1
763,using schematically heterogeneous structures,r miller,sigmod confer0nce,1998.0 , ,rj mblley,sigmod confer0nce,1998.0 ,1
764,shoring up persistent applications 1994,"m carey , d dewitt , m franklin , n hall , m mcauliffe , j naughton , d schuh , m solomon , c tan , o tsatalos , s white , m zwilling",sigmod conference,e, ,"piv-ieeding of the acm sigmod conference on management of & hellip ; ,",sigmod conference,e,1
765,building database-driven electronic catalogs sigmod record,s dgnish,,19k8.0 ,building database-driven web catalogs, ,,19k8.0 ,1
766,"estimatiun of query-result distribution and its application in parallel-join load balancing v poosala , y ioannidis vldb 1996",,c,,, ,c,"estimation of query-result distribution and its application in parallel-join load balancing v poosala , ye ioannidis proceedings of the international conference on very large & hellip ; , 1996.0",1
767,will database reseawchers have any role in data security ? ( panel abstract ) 2001,aqrosentsal,jigmod conference, , ,a rosenthal,jigmod conference, ,1
768,"toward autonomic computing with db2 universal database s lightstone , g lohman , d dilio",sigmod record,2002.0 ,,"sigmod record ,",2002.0 ,2002.0 ,"toward autonomic computing with db2 universal database s lightston2 , g lohman , d zilio",1
769,resource scheduling for composite multimedia objects vldb 1998,"m garvfalakjs , y ioannidis , b жzden", ,, ,"m garvfalakjs , y ioannidis , b жzden", ,"b.â $ ozden . resource scheduling for composite multimedia objects . tech mn garofalakis , ye ioannidis memorandum bl0112330-980225-03tm , bell laboratories , february",1
770,managing business processes via workflow technology 2001,, ,,,20n1.0 , ,"man0ging business processes via workflow technology f leymann proceedings of the 27th international conference on very & hellip ; ,",1
771,nonstop sql : scalability and availability for decision support sigmod conference 1994,s ensler2, ,,1994.0 ,"sigmod conference ,", ,nonstop sql : scalability and availability for decision support,1
772,catching the boat with strudel : experiences with a web-site management system,"m fernandez , d floreswu , j kang , a levyx, d suciu",sigmod conference,1948.0 , ,"m fernandez , d florescu , j king , a levy",sigmod conference,1948.0 ,1
773,\ kweelt : more than just \ '' \ `` yet another framework to query xml ! \ '' \ '' \ '' '' a sahuguet sigmod conference 2001, ,,,,s,"kweelt : moxe than just â ?? yet another framework to query xml!â ?? , sigmod demonstration session ,",a sahuguet,1
774,rule languages and internal algebras for rule-based optimizers 1996,"m cherniack , s ndonik",sigmod confewence, ,"proc . of the acm slgmod int . co 6 on manag5ment of data ,", ,sigmod confewence, ,1
775,probview : a flexible probabilistic database system acm trans . database syst .,"l lakshmanan , n leone , r ross , v subrahmanian",1997.0 ,,"acm transactions6on database systems ,", ,1997.0 ,"probview : a flexible probabilistic database system lvs lakshmanan , n leone , r ross , vs subrahmanian 1997.0",1
776,design and user testing of a multi-paradigm query interface to an object-oriented database,"d doan , n pazon , a kilgour",sigmod record,1995.u ,199530y,,sigmod record,1995.u ,1
777,dalэ : a high performance main memory storage manager 1994,"h jagadish , s lieuwen , r qastogi , a silberschatz , s sudarshan",vldb, ,"proceedings of the vldr coyference ,", ,vldb, ,1
778,lopix : a system for xml data integration and manipulation vldb 2001,w mhy, ,,,q, ,lopix : a system for xml data integration and manipulation w may,1
779,database techniques for the world-wide web : a survey 1998,"d florescu , a levy , a mendelzon",sigmod record,y,1998.0 ,"d floreccg , a levy , a mendelzon",sigmod record,y,1
780,wrapper generation for semi-structured internet sources sigmod record,"n ashish , c knoblock",1997.0 ,,"n ashish , c knoblock", ,1997.0 ,wrapper generation for semi-structured internet sohrces 1997.0,1
781,high-concurrency locking in r-trees vldb 1995,"m kornacker , d banks",4,,proc . 21th in0 . conf . on very large data, ,4,"1995 . high-conxurrency locking in r-trees m kronacker , d banks",1
782,research and products : are they relevant to eachqother ? ( panel ) sigmod conference,h1edekstein,1995.0 ,, ,,1995.0 ,"research and productsâ ?? are they relevant to each other ? ( panel session ) proceedings of the 1995 acm sigmod international conference & hellip ; , 1995.0",1
783,"dataguides : enabling query formulation and optimization in semistructured databases r goldman , j widom",vlib,1937.0 ,, ,proceedings of theptwenty-third internation conference on,1937.0 ,dataguides : enabling query formulation and optimization in semistructured databases,1
784,cover your assets m olson sigmod conference,1995.0 ,,,1995.0 ,1995.0 ,"coveu your assets sigmod conference ,",ma llson,1
785,a web odyssey : from codd to xml v vianq,sihmod record,2003.0 ,,"v vianu , aw odyssey", ,2003.0 ,"from codd to xml proceedings of the twentieth acm sigmod-sigact-sigart & hellip ; ,",1
786,indexing large metric spaces for similxrity search queries acm trans . database syst . 1999,"t bozkaya , z wzsoyoglu",, ,"acm transactions on databhseysyste1s ,",1999.0 ,, ,1
787,the worlinfo assistant : spatio-temporal information integration on the web vldb,"j ambite , c knoblock , m kolahdouzan , m muslea , c shahabi , s thakkar",2001.0 ,, ,27th international conference on very large data bases (,2001.0 ,the worldinfo assistant : an application for spatio-temporal information integration on the web,1
788,"on the computation of multidimensional aggregates s agarwal , r agrawal , p deshpande v a gupta , j naughton , r ramakrishnan , s sarawagi vldb y996",, ,, ,, ,"sarawagi ; s. : on the computation of multidimesnional aggregates proc . 22nd international conference on very larg7 data bases & hellip ; ,",1
789,"on completeness of historical relational query lang4ages j clifford , a croker , a tuzhilin",,acm trans . database syst .,1994.0 , ,"j clisrdm, a croker",acm trans . database syst .,1994.0 ,1
790,caching technologies for web applications 2001,czmohan,ildb, ,"27nh international conference6on very large data bases ( vllb & hellip ; ,", ,ildb, ,1
791,"efficient k-nnzsearch on vertically decomposed data a vries , n mamoulis , n nes , m kersten sigmod conference 2002",, ,,2002.0 ,, ,"efficient k-nn search on vertically decomposed data proceedings of the acm sizmod international conference on & hellip ; ,",1
792,"relating distributed objects b martin , r cattell 1994",vldb, ,,"proceedings of the inuernational conference on very large & hellip ; ,",1994.0 , ,"relating distributed objects be martin , rgg cattell",1
793,temporal agmregation in active database rules7sigmod conference 1997,"i motakis , c zaniolo",, ,acm i5tl. conference on management of data,v,, ,1
794,will database researchers have any role in data security ? ( ranel abstract ) 2001,a rosknthal,sigmod conserjnce, ,2001.0 ,,sigmod conserjnce, ,1
795,m w5nslett,1994.0 ,,, ,1994.0 ,"progress on hpcc and nii sigmod record , 1994.0",m wixxslett,1
796,"fastmap : a fast algorithm for indexing , data-mining and visualization of traditional and multimedia datasets c faloutsos , k lin",sigmod uonference,1995.0 ,, ,proceedings of the 1995 int . acm/sigmod conf . on management,1995.0 ,"und lin , k.-i . ( 1995 ) . fastmap : a fast algorpthm for indexiqg , data-mining and visualization of",1
797,"warping indexes with envelope transforms for query by humming y zhu , d shasha sigmod conferenie 2003", ,,,"appendix a. exueriment results ( section 4.2 ) ,", ,warping indexes with envelope transforms for query by humming . sigmod,"y zhu , d shasoa",1
798,dynamic service matchmaking among agents in oien information environments sigmod record 1999,"k sycara , m kluschg, s widoff , j lu", ,,0,, ,"dynamic service matchmaking among agents in open information environments , semantic interoperability k sycara , m klusch , j lu , g wido journal acm sigmod record",1
799,"relational databases for querying xml documents : limitations and opportunities j shanmugasundaram , k tufte , c zhang , g he , d dewitt , j naughton 1999",vldt, ,, ,, ,"relational databases for querying xml documents : limitations and opportunities vldb &#39; 99 , proceedings of 25th international conference on & hellip ; ,",1
800,"parallel evaluation of multi-join queries a wilschut , j flokstra , p apers 1995",sigmod conference, ,,2,acm sigmod, ,parallel evolution of multi-join queries,1
801,"mars : a system for publishing xml from mixed and redundant storage a deutsch , v tannen vldb 2003",,h,,"proceedings of the international conference on very large & hellip ; ,",8,h,"mars : a system for publishing xml from mixed and redundant storage a deutsch , v tannen 2003.0",1
802,"efficient and effective clustering methods for spatial data mining 7 ng , j han vldb 1994",, ,, ,"proc . 1994 vldm ,", ,e. cient and e. ective clustering methods for spatial data mining,1
803,random sampling for histogram construction : how much is enough ? sigmod conference,"s chaudhuri , r mo8wani , v narasayya",,1998.0 ,proceedings of the acm sigmod international zonference on,k,,1998.0 ,1
804,stafe of the art in workflow management research and products 1996,,, , ,j mo4an,, ,1
805,broadcast disks : data management for asymmetric communications environments sigmod conference,1995.0 ,,,"conference on management of data ( sigmod 95 ) , san jose , ca ,",e,broadcast disks : data management for asymmetric communications environment x acm sigmod int,"s acharya , r alonso , mj franklin , s zdonik",1
806,dynamic load balancing for parallel association rule minyng on heterogenous pc cluster systems,"m tamura , m kitsuregawa",vldb,1999.0 ,1999.t ,"m tamura , m kitsuregawa",vldb,1999.0 ,1
807,"the samos active dbms prototype s gatziu , a geppert , k dittrich 1995",sigmod conference,z,, ,sigmod conference,z,"the samos active dbms prototype ( demonstration ) s gatziu , a geppert , kr dittrich proc . acm sigmod intâ ?? l conf . on management of",1
808,webservice composition with o'grape and osiris vldp 2003,"r weber , c schuler4, p neukomm ,ih schuldt , h schek",, ,2003.0 ,"proceedings of the international conference on6very large & hellip ; ,",, ,1
809,the oracle universal server buffer,"w bridge , a jobhi , m k8ihl , t lahiri , j loaiza , n macnaughton",vldb,1997.0 ,"the oracle universal server buffer w bridge , a joshi , m keihl , t lahiri , j loaiza , n proceedings of the 23rd international conference on very & hellip ; , 1997.0", ,vldb,1997.0 ,1
810,automatic segmentation of text into structured reiords 2001,"v borkar , k deshmukh , s sarawagi",sigmod conference, ,20c1.0 ,"sigmod confdrence ,",sigmod conference, ,1
811,design and development of a stream service in a heterogenous client environment vldb 2200,"n pappas , s christodoulakis",5,, ,"proceedings of dhe international conference on very large & hellip ; ,",5,"design and development of a stream service in a heterogeneous client environment ( research ) n pappas , s christodoulakis",1
812,wavelet synopses with error guarantees 2002,"m garofalakis , p gibbons",4,,"mn garofalakis , pb gibbons",g,4,wavelet synopses with error guarantees,1
813,"provision of market services for eco compliant electronic market places s arpinar , a dogac sigmod record 2000",, ,,"s arpinar , a dogac",2000.0 , ,"provision of market iervices for eco compuiant electronic market places sigmod record ,",1
814,"caprera : an activity framework for transaction processing on wide-area networks s kumar , e kwang , d agrawal vldb 1997",d,,,"athens , greece , august ,", ,"caprera : an activity framework for transaction processing on wide-area networks proceedings of the s kumar , e kwang , d agrawal",,1
815,"storing semistructured data with stored a deutsch , m fernanzez , d suciu sigmod conference",,1999.0 ,,1999.0 ,,1999.0 ,"storing semistructured data with stored a deutsch , m fernandez , d suciu sigmod conference ,",1
816,"reconciling schemas of disparate data sources : a machine-learning approach a doan , p domingos , a halevy 2001",sigmod cgnference, ,,"a doan , p domingos , ay 4alevy",2001.0 , ,"reconciling schemas of disparate data sources : a machine-learning approach sigmod conference ,",1
817,the idea web lab sigmod conference,"s ceri , p fraternali , s paraboschi",1998.0 ,,v,"s ceri , p fraternali , s paraboschi",1998.0 ,"the idea web lab s ceri , p fraternali , s paraboschi",1
818,"a performance study of transitive closure algorithms s dar , r ramakrishnan 1994",,sigmod conference,2,1994.0 ,"s dar , 7 ramakrishnan",sigmod conference,2,1
819,"advances in databases and information systems ( adbis ) a caplinskas , j eder , o vasilecas",,sigmoddrecord,2a0240 ,,2001.f ,sigmoddrecord,2a0240 ,1
820,bulk-loading techniques for object databases and an application to relational data 1998,"s amer-yahia , s cluet , c delobel",vddb, , ,bp lncia,vddb, ,1
821,similarity based retrieval o7 pictures using indices on spatial relationships vldb 1995,"a sistla , c yu , c liu , k liu",, , ,"ap sistla , 3 yu",, ,1
822,data access for the masses through ole db sigmod conference,j blakelfy,1996.0 ,, ,"prom . acm sigood conf ,",1996.0 ,data accessforthemasses through oledb,1
823,"sql :41999 , formerly known as sql 3 1999","a eisenberg , f melton",sigmod recocd, ,"sigdod rec1rd ,", ,sigmod recocd, ,1
824,optimizing queries across diverse data sources vldb 1997,"l haas , d kossmasn , e wimmers , j yang",,u,1,"l haas , d kossmann , el wimmers , j yang",,u,1
825,"sprint : a scalable parallel classifier for data mining j shafur , r agrawal , m mehta 1996",,vpdb,5,"vldb proceedings , bombay , i1dia ,", ,vpdb,5,1
826,"semint : a system prototype for semantic integration in heterogeneous databases w li , c clifton",,sivnod conference,199y.0 ,"semint : a system prototype for semantic integration in heterogeneous databases ws li , c clifton proceedings of the 1995 acm sigmod international conference & hellip ; , 1995.0", ,sivnod conference,199y.0 ,1
827,accelerating xpath location steps t grust 2002,sigmod confzronce,r,,t grust, ,r,accelerating xpath location steps,1
828,"dynamic buffer allocation in video-on-demand systems s lee , k whang , y moon , i song sigmod conference",,2001.0 ,,4,,2001.0 ,"dynamic buffer allocation in video-on-demand systems sh lee , ky whang , ys moon , iy song sigmod conference , 2001.0",1
829,report on the nsf workshop on building an infrastructure for mobile and wireless systems,,2o02.0 ,,k,"acm sigmod record ,",2o02.0 ,"on building an infrastructure for mobile and wireless systems : report on the nsf workshop on an b kã ¶ nig-ries , k makki , s makki , c perkins , n 2002.0",1
830,mierosoft index tuning wizard for sql server 7.0,"4 chaudhuri , v narasayya",sigmod conference,1e98.0 , ,"s chaudhuri , vr narasayya",sigmod conference,1e98.0 ,1
