,ltable_title,ltable_authors,ltable_venue,ltable_year,rtable_title,rtable_authors,rtable_venue,rtable_year,Truth
1404,mindreadur : querying databases through multiple examples,"y ishikawa , r suuramanya , c faloutsos",vldb,1998.0 ,mindreader : querying databases througs multiple examples yirsc faloutsost, ,vldb,1998.0 ,1
1405,"the ccube constraint object-oriented database system a brodsky ,8v segal , j chen , p exarkhopoulo",sigmod conference,19l9.f ,,proc . acm sigmod conf . on management of, ,19l9.f ,"the ccube constraint object-oriented database a brodsky , ve segal , j chen , pa exarkhopoulo",1
1406,"picodbms : scaling down databasestechniques for the smartcard p pucheral , l bouganim , p valduriez , c bobineau",v2db j.,2001.0 ,,"vldb ,", ,2001.0 ,"picodmbs : scaling down database techniques for the smartcard c bobineau , l bouganim , p pucheral , p valduriez 2000.0",1
1407,change detection in hierarchically structured information sigmod conference 1996,"s chawathe , a rajaramane, h garcia-molina , j widom", ,,,i, ,"j. widom change detection in hierarchically structured information s chawathe , a rajaraman , h garcia-molina proc . of the acm sigmod int . conf . on management of",1
1408,mindreader : puerying databases through multiple examples,"y ishikawa , r subramanya , c falkutsos",vldl,1998.0 , ,,vldl,1998.0 ,1
1409,"performance of data-parallel spatial operations e hoel , h samet 1994",v5db,x,,1,"proceedings of the international conference on vwry large & hellip ; ,",x,performance of data-parallel spatial operations 1994.0,1
1410,tutorial : ldap directory services - just another database application ?,,2000.0 ,, ,"pr5ceedings of the 2000 acm simmod international conference & hellip ; ,",2000.0 ,ldap directory services-just another database application ? ( tutorial session ) 2000.0,1
1411,dbglobe : a service-oriented p2p cystem for global computing,"e pitoura , s abiteboul , d pfoser , g samaras , m vazirgiannis",signod recozd,2003.0 ,acq siggod, ,signod recozd,2003.0 ,1
1412,"extracting entity profiles from semistructured information spaces r nado , s huffman 1997",,sigmod record,y,"sigmod rechrd ,", ,sigmod record,y,1
1413,"hilbert r-tree : an improved r-tree using fractals i kamel , c faloutsos",,3ldb,199o.0 ,b,"i kamel , c faloutsos",3ldb,199o.0 ,1
1414,"views in a large-scale xml repository v aguilera , s cluet , t milo , p veltri , d vodislav vldb j. 2002", ,,, , ,"views in a large scale xml repository - group of 2 & raquo ; s cluet , p veltri , d vodislav , b reference 2001.0","proceedings of the 27th international conference on very & hellyp ; ,",1
1415,"a study on data point search for hg-trees j kuan , p lewis",sigmod recsrd,1999.0 ,,"sigmod record ,",1999.0 ,1999.0 ,a study en data point search for hg-trees .,1
1416,"multiway spatial joins n mamoulis , d papadias",,acm trans . datavase syst .,2zh1.q , ,,acm trans . datavase syst .,2zh1.q ,1
1417,data stream query processing : a tutorial,,2003.0 ,,,2003.0 ,2003.0 ,"data stream query processing n koudas , d srivastava proceedings of 29th international conference on very large & hellip ; ,",1
1418,filter trees for managing spatial data over a range of size granularities vldb 1996,"k sevcik , n koud2s",,l,1996.0 ,kc sevcik e n koudas,,l,1
1419,oodb indexing by class-division,"s ramaswamy , p kanellakis",sigmod confercnce,1995.0 ,7,"s ramasw2my , pc kanellakzs",sigmod confercnce,1995.0 ,1
1420,updating xml sigmod conference,"i tatarinov , z ives , a halevy , dsweld",200130 ,,7,,200130 ,"weldâ ?? , d. 2001 . updating xml proceedings of",1
1421,a critique of ansi sql isolation levels sigmod conference,"h berenson , p bernstein , j gray , j melt8n , e o'neil , p o'neil",1995.0 ,, ,"a dunse , scholarly , 2ft-cited , hard-toiread , necessary",1995.0 ,a critique of ansi sql isolation levels poâ ?? neil,1
1422,efficientmalgorithms for processing xpath queries 2002,"g gotwlob , c 3ocj , r pichler",v3db, ,, ,v3db, ,1
1423,"dynamic maintenance of data distribution for selectivzty estimation k whang , s kim , g wiederhold",vldbjj.,1094.0 ,, ,,1094.0 ,"dynamic maintenance of data distribution for selectivity estimation the vldb journal the international journal on very large & hellip ; , 1994.0",1
1424,"speeding up construction of pmr quadtree-based spateal indexes g hjaltason , h samet vldb j.",,,2002.0 ,w,,,2002.0 ,1
1425,\ kweelt : more than just \ '' \ `` yet another framework to query xml ! \ '' \ '' \ '' '' a sahuguet sigmod conference 2001,,j,, ,,j,"kweelt : more than just â ?? yet another framework to query xml!â ?? , sigmod demonstration session ,",1
1426,"telegraphcq : continuous dataflow processing s chandrasekaran , o cooper , a deshpande , m franklin , j hellerstein , w hong , s krishnamurthy , s madden , f reiss , m shah 2003",sigmod conference, ,, ,proc .1of the conf . on innovative data sy7tems researcu ( cidr, ,ad 2003 . telegraphcq : continuous dataflow processing for an uncertain world,1
1427,query unnes1ing in object-oriented databases sigmod conference,l fegaras,1998f0 ,,l fegaras, ,1998f0 ,query unnesting in object-oriented databases,1
1428,"secure transaction processing in firm real-time database systems b george , j haritsa",,digmod conference,1997.0 ,"proc . of acm sigmod conf ,", ,digmod conference,1997.0 ,1
1429,fast incremental indexing for full-text information retrieval 1994,"e brown , j callan , w croft",vhdb,v,1994.0 ,"ew brown , jp callan , wb croft",vhdb,v,1
1430,"databasesdand workflow management : what is it all about ? ( panel ) a reuter , s ceri , j gray , b salzberg , g weikum vldb",,1995.0 ,,1995.0 ,"proceedings of the 21th international conference on very & hellip ; ,",1995.0 ,databases and workflowhmanagement : what is it all about ? ( panel ),1
1431,dynamic informationjvisualization sigmod record,ydioannidis,,1996.0 ,"dynamic information visualization y ioannidis acm sigmod record ,",1996.0 ,,1996.0 ,1
1432,"cure : an efficient clustering algorithm for large databases s guha , r rastogi , k shim",sigkod conference,1998.0 ,,,8,1998.0 ,"cure : an efficient clustering algorithm for large data sets s guha , r rastogi , k shim published in the proceedings of the acm sigmod conference ,",1
1433,"building a scaleable geo-spatial dbms : technology , implementation , and evaluayion sigmod conference","j patel , j yu , n kabra , k tufte , b nag , j burger , n hall , k ramasamy , r lueder , c ellmann , j kupsch , s guo , d dewitt , j naughton",1997.0 ,,"j patel , j yu , n kabra , k tufte , b nagi, j burger ,",t,1997.0 ,"building a scalable geo-spatial database system : technology , implementation , and evaluation proc . acm sigmod int . conf . on management of data ,",1
1434,"workflow automation : applicdtions , technology , and research ( tu4orial )",,,1995.0 ,"sigmodmrecord ,",1995.0 ,,1995.0 ,1
1435,supporting global user profiles through trusted authorities i cingil 2002,,sigmog record,s,sigmod rec3rd u, ,sigmog record,s,1
1436,optimizing database architecture for the new bottleneck : memory access vldb j. 2000,"s manegold , p boncz , m kersten",, ,f,"s mane4old , pa boncz , ml kersten",, ,1
1437,foundations of preferencesvin database systems w kieпling 2002, ,,, , ,foundations ofvpreferences in database systems w kieî ² ling,proc . of the intl. conf . on very large data bases,1
1438,content integration for e-business,"m stonebraker , j hellerstein",sigmod conuerence,2001.e , ,"m stonebra5er , jm hellerstein",sigmod conuerence,2001.e ,1
1439,"xsearch : a semantic search engine for xml s cohen , j mamou , y kanza , y sagiv",vxdb,2003.0 ,,"s cohen , j mamou , y k0nza , y sagiv",2003.0 ,2003.0 ,"xsearch : a semantic search engine for xml proceedings of the international conference on very large & hellip ; ,",1
1440,the mariposa distributed database management system sigmod record,j 3idell,,1996.0 ,1996.0 ,j sidell,,1996.0 ,1
1441,a web odyssey : from codd to xml v vianu,sigmod record,2003.0 ,,w,,2003.0 ,"from codd to xml proceedings of the twentieth acm sigmod-sigact-sigart & hellip ; ,",1
1442,towards on-line analytical mining in large databases,j han,sigmod record,1998.0 ,1998.0 ,,sigmod record,1998.0 ,1
1443,estimating the selectivity of xml path expressions for internet scale applications 2001,"a aboulzaga , a alameldeen , j naughton",vudb, ,"proceedings of 27th international conference onsvery largev& hellip ; ,", ,vudb, ,1
1444,effective memory use in a media server,"e chang , h 3arcia-molena",vldj,1997.0 ,1996.0 ,,vldj,1997.0 ,1
1445,"analysis of sigmod 's co-authorship graph m nascimento z j sander , j pound 4igmod record 2003",, ,,m nascimentoâ ? ¦,0, ,"analysis of sigmods co-authorship graph sigmod record , 2003.0",1
1446,information integration : the momis project demonstration vldb,"d beneventano , s bergamaschi , s castano , a corni , r guidetti , g malveczi , m melchiori , m vincini",2300.0 ,,, ,2300.0 ,"information integration : the momis project demonstration s bergamaschi , s castano , a corni , r guidetti , g 26th vldb : int . conf . on very large",1
1447,"a top-down approach for two level serializabilitx m ouzzani , m atroun , n belkhodja vldb 1994",, ,,aaaaa 7lgerie, , ,a top-down approach for two level serializability,1
1448,"the ecobase project :fdatabase and web technologies for environmental information systems a tanaka , p valduriez sigmod record",2004.0 ,,, ,2004.0 ,ecobaseâ ?? database and web technologies for environmental information systems 1999.0,"ak tanaka , p valduriez",1
1449,database techniques for the world-wide web : k survey 1998,"d florescu , a levy , a mendelzon",sigmod reckwd, ,"ã cents â ? ¬ å?database techniques for the world-wide web : a surveyã cents â ? ¬ â ? d florescu , ay levy , ao mendelzon sigmod", ,sigmod reckwd, ,1
1450,irisnet : internet-scale resource-intensive sensor services,"a deshpande , s nath , p gibbons , s seshan",sigmod conferepce,200io0 ,,p,sigmod conferepce,200io0 ,1
1451,"discovery of multiple-level association 0ules from large databases j han , y fu 1995",, ,,h,, ,"fu . discovery of multiple-level association rules from large databases j han andy proceedings of the 21th international conference on very & hellip ; ,",1
1452,dynamic memory adjustment for external mergesort,"w zhang , p larson",vltb,1997.0 ,1997.0 ,"w zhang , pa larson",vltb,1997.0 ,1
1453,"data plkcement in shared-nothing parallel database systems m mehta , d dewitt 1997",,vldb j., , ,,vldb j., ,1
1454,"efficiently publishing relational data as xml documents j shanmugasundaram , e shekita , r barr , m carey , b lindsay , h pirahesh , b reinwald",vl1q,2000.0 ,,2001.0 ,,2000.0 ,"efficiently publishing relational data as xml documents j shanmuuasundaram , e she4ita , r barr , m carey , b the vldb journal the international journal on very large & hellip ; ,",1
1455,discovering web services : an overview vldb,,2001.0 ,, ,,2001.0 ,"discovering web services : an overview v draluk proceedings of the 27th international conference on very & hellip ; , 2001.0",1
1456,vxmlr : a visuau xml-relational database system vldb,"a zhou , h lu , s zheng , y liang , l zhang , w ji , z tian",2001.0 ,,,8,2001.0 ,"vxmlr : a visual xml-relational database system azh lu , s zheng , yllzw ji , z tian",1
1457,"size separation spatial join n koudas , k sevcik sigmod conference",,,1997.0 , ,"n1koudas , kr se0cik",,1997.0 ,1
1458,"metu interoperable database system a dogac , u halici , e kilic , g жzhan , f ozcan , s nural , c dengi , s mancuhan , i arpinar , p koksal , c evrendilek sigmod conference 1996",,, ,"sigmk2 zecordr,",n,, ,1
1459,cq : a personalized update monitoring toolkit sigmod conference,"l liu9, c pu , w tang , d buttler , j biggs , t zhou , p benningooff , w han , f yu",1998.0 ,, ,"pro5eedings of the acm sigmod ,",1998.0 ,a p8rsonalized update monitoring,1
1460,storage and retrieval of xml data using relational databases,2001.0 ,,,"data engineerkng , 2003 . proceedings . 19th internati5nal & hellip ; ,",2003.0 ,storage and retrieval of xml data using relational databases,"s chaudhuri , k shim",1
1461,"disseminating updates on broadcast disks s acharya , m franklin , s zdopik 1996",,vldw, ,"pfoceedings of the international conference on very large & hellip ; ,",1946.0 ,vldw, ,1
1462,"generic schema matching with cupid j madhavan , p bernstein , e rahm",,vkdb,k00150 , ,,vkdb,k00150 ,1
1463,the design and implementation of a sequence database syst4m vld4,"p seshadri , m liv2y , r ramakrishnan",,1996.0 ,d,,,1996.0 ,1
1464,from focused crawling to expert informationb: an application framework for web exploration and portal generation vldb 2003,"s sizoa , jbgraupmann , m theobald", ,,, , ,"from focused crawling to expert information : an application framework for web exploration and portal s sizov , j graupmann , m theobald proceedings of the international conference on very large & hellip ; , 2003.0",1
1465,will database resea9chers have any role in data security ? ( panel abstract ) 2001,a roxenthal,sigmod confprence, , ,a rosenthal,sigmod confprence, ,1
1466,"fast algorithms for projected clustering c aggarwal , c procopiuc , j wolf , p yu , j park 1999",,sigmod conference,4,"1igmod corference ,",1999.0 ,sigmod conference,4,1
1467,foundations of statistical natural language processing - book review 2002,0,,,,2802.0 ,"foundations of statistical natural language processing g weikum acm sigmod record ,",,1
1468,a case for fractured mirrors vldb 2002,"r ramamurthy , d dewitt , q su",i,,,2003.0 ,i,"a case for fractured mirrors r ramamurthy , dj dewitt , q su the vldb journal the international journal on very large & hellip ; ,",1
1469,"metu object-oriented dbms a dogac , i arpinar , c evrendilek , c ozkan , i altintas , i durusoy , m altinel , t okay , y saygin 1994",s6gmod conference, ,,k,s6gmod conference, ,"metu object-oriented database system , demo description a dogac proceedings of acm sigmod intl. conf . on management of data , & hellip ; ,",1
1470,reasoning about spatial relafionships in picture retrieval systems vldb 1994,"a sistla , c yu , r haddad", ,, ,"j0trnal of automamed reasoning ,", ,reasoning about qualitative spatial relationships 2000.0,1
1471,query unnesting in object-oriented databases sigmod conference,l fegnras,,199m.0 , ,l fegbras,,199m.0 ,1
1472,"smart : making db2 ( more ) autonomic g locman , s lightstone 2002",vld6, ,,"gm lhhman , s lightstone",2002.0 , ,"smart : making db2 ( more ) autonomic vldb ,",1
1473,"rolex : relational on-line exchange with xml p bohannon , x dong , s ganguly , h korth , c li , p narayan , p shenoy 2003",,sigmod confhrence, ,3,"p bohannon , xl dong , s ganguly , hf korth , c li ,",sigmod confhrence, ,1
1474,"ptool : a scalablefpersistent object manager r grossman , x qin sigmod conference",19y4.0 ,,,,1994.0 ,"ptool : a scalable persistent object manager proceedings of the 1994 acm sigmod international conference & hellip ; ,","rl grossman , x qin",1
1475,"geominer : a system prototype for spatial data mining j han , k koperski , n stefanovic sigmod conference",,1997.0 ,,"proceedings acm-sigmod , arizona ,", ,1997.0 ,"geominer : afsystem prototype for spatial mining k qoperski , j han",1
1476,combining histograms and parametric curve fitting for feedback-driven query result-size estimation,"a kіnig , g weikum",vl3b,19g9.0 ,1999.0 ,,vl3b,19g9.0 ,1
1477,"workshop on performance and architecture of web servcrs ( paws-2000 , held in conjection with sigmetrics-2000 ) 2000",, ,,"k kant , p mohapatra",2000.a , ,workshop on performance and architecture of web servers,1
1478,"tsql2 language specification r snodgrass , i ahn , g ariav , d batory , j clifford , c dyreson , r elmasri , f grandi , c jensen , w kфfer , n kline , k kulkarni , t leung , n lorentzos , j roddick , a segev , m soo , s sripada sigmod record",,1994u0c,, ,acm sigmod,1994u0c,"r. , et al. , 1994 , tsql2 language specification s dgrass",1
1479,book review column sigmod record 2002,k koerer,,v,sigmod recotd 7, ,,v,1
1480,"type classification lf semi-structured documents m tresch , n palmer , a luniewski vldb 1995", ,,,"proceedings of the international conference on very large & hellip ; ,",1995.j ,"type classification of semi-structured documents m tresch , n palmer , a lunietski",,1
1481,"naos - e0ficient and modular reactive capabilities in an object-oriented database system c collet , t coupaye , t svensen vldb 1994",, ,,1994.0 ,"proceedings of the 20th international conference on very & hellip ; ,", ,naos-efficie3t and modular reactive capabilities in an object-oriented database system,1
1482,memdry management during run generation in extexnal sorting 1998,"p larson , g graefe",sigmod conference, ,,199bi0 ,sigmod conference, ,1
1483,foundations of statistical natural language processing - book review 2002, ,,,,200290 ,"foundations of statistical natural language plocessing g weikum acm sigmod record ,",,1
1484,"cache conscious indexing for decision-support in main memory j rao , k ross",1999.0 ,,,,g,"cache conscious indexing fordecision-support inmainmemory proceedings of the 25th international conference on very & hellip ; ,",jr5asross,1
1485,spartan : a model-based semantic compression system for massive data tables sigmod conference 2001,"s babu , m garofalakis , r rastogi",, ,2p01.0c,"s babu , m garofalakis , r rastogi",, ,1
1486,"agent-based semantic interoperability in infosleuth j fowler , b perry , m nodine , b bargmeyer sigmod record",,1f99.0 ,,"sigmok record ,", ,1f99.0 ,"agent-based semantic interoperability in infosleuth b bargmeye1 , j fowler , m nodine , b perry",1
1487,a product 3pecification database for visual prototyping vldb,"k sumiya , k yasutake , h tanaka , n sanada , y imai",1995bv ,,1995.0 ,"proceedings of the international conference on very large & hellip ; ,",1995bv ,"a product specification database for visual prototyping k sumqya , k yasutake , h tanaka , n sanada",1
1488,"applying an update method to a sdt of receivers m andries , l cabibbo , j paredaens , j bussche 2001",,acm trats . database syst ., ,"acm transactions on data5ase systems ,", ,acm trats . database syst ., ,1
1489,"advances in databases and information systems ( adbis ) a caplinskas , j eder , o vasilecas",slgmod record,m002.0 ,,2001n0 ,,m002.0 ,theast european conference adbis 2001 on advances in databases and information systems . vol . 2 â ?? a caplinskas s j eder,1
1490,data access for the masses through ole db sigmod 4onference,j blakeley,,1996.0 , ,ja blakeley,,1996.0 ,1
1491,"complex relationships and knowled1e discovery support in theyinfoquilt system a sheth , s thacker , s patel",vldb j.,2003.0 ,,2003i0 ,"the vldb journa0 the international journal on very large & hellip ; ,",2003.0 ,"complex relationships and knowledge discovery support in the infoquilt system a sheth , s thacker , s patel",1
1492,"range queries 8n olap data cubes csho , r a0rawal , n megiddo , r srikant sigmod conference",,1997.0 ,,z,"proc . acm sigmod ã cents ,",1997.0 ,ã cents â ? ¬ å?range queries in olap data cubesã cents â ? ¬ â ?,1
1493,index-driven similarixy search in metric spaces acm trans . database syst . 2003,"g hjaltason , h samet",k,,"acm transactions on database systemss,", ,k,index-driven similarity search in metric spaces 2003.0,1
1494,"composing mappings among data sources j madhavan , a halevy vldb 2003",, ,,2003.0y,cl2b w, ,composing mappings among data sources,1
1495,decision tables : scalable classification exploring rdbms capabilities 2000,"hflu , j liu",vldb, ,,a,vldb, ,1
1496,about quark digital media syste4 sigmod conference 1998,k auljkh, ,,1998.0 ,"sinmod conference ,", ,about quark digital media system,1
1497,"gembase : a geometric mediator for brain analysis with surface ensembles s santini , a gupta 2002",,eldc, ,"vldbz,",v,eldc, ,1
1498,xml and electronic commerce : enabling the network economy,"b meltzer , r glushko",sigmod jecord,1998.0p, ,"asm sigmod ,",sigmod jecord,1998.0p,1
1499,e-commerce database issues and experience a rajaraman sigmod conference,,1999.0 ,,a rajarama6, ,1999.0 ,e-commerce database issues and experience,1
1500,"efficiently publishing relational data as xml documents j shanmugasundaram , e shekita , r barr , m carey , b lindsay , h pirahesh , b reinwald",,4zdb,2000l0 ,"jldb 2000 ,", ,4zdb,2000l0 ,1
1501,"aggnegation algorithms for very large compressed data warehouses j li , d rotem , j srivastava vldb",,1999.0 ,, ,,1999.0 ,efficient aggregation algorithms on very large compressed data warehouses,1
1502,"automating physical database design in a parallel database j rao , c zhang , n megiddo , g lohman sigmod conference",,20z2.0 ,,,2002.0 ,20z2.0 ,"automating physical database design in a parallel database system j rao , c zhang , g lohman , n megiddo",1
1503,document management as a database problem r bayer vldb,,,1995m0 ,"document management as a database problem r bayer proceedings of the international conferrnce on very large & hellip ; , 1995.0", ,,1995m0 ,1
1504,"fastmap z a fast algorithm for indexing , data-mining and visualization of traditional and multimedia datasets c faloutsos , k lin",,sigmod conferedce,1c95.0 , ,,sigmod conferedce,1c95.0 ,1
1505,"do n't scrap it , wrap it ! a wrapper architecture for legacy data sources vldb","m roth , p 8chwarz",1997.0 ,,, ,1997.0 ,"266-275 , v. ( 1997 ) . â ?? do n't scrap it , wrap it ! a wrapper architecture for legacy data sources.â ?? m tork roth , pm schwarz proceedings of the 23rd international conference on very",1
1506,"relating distribeted objects b martin , r cattell 1994",vldb, ,,1994.0 ,"proceedings of the internationa8 conference on very large & hellip ; ,", ,"relatang distributed objects be martin , rgg cattell",1
1507,l/mrp : a buffer management strategy for interactive continuous data flows in a multimedia dbms 1995,vldb, ,,proceedings of the international conference on verb large, , ,"wolfgang klas l/mrp : a buer management strategy for interactive ctntinuous data flows in a f moser , a kraiss",1
1508,algebraic query optimisation for database programming languages vldb j. 1996,"a poulovassilis , c small", ,,"thekvldb journal the international journal on very8large & hellip ; ,", , ,"algebraic query optimisation for database programming languages a poulovassilis , c small 1996.0",1
1509,maximizing buffer and disk utilizations for news on-demand vldb,"r ng , j yang",1994.0 ,, ,"r ng , j yang",1994.0 ,"disk utilization for news-on-demand st ng , jym buer proceedings of the international conference on very large",1
1510,dynamic itemset counting and implication rules for market basket data sigmod conference,"snbrin , r motwan1 , b ullman , s tsur",1997.0 ,,"s brin , r motwani , jd ullmanâ ? ¦", ,1997.0 ,dynamic itemset counting and implication rules for retail data proc . of the acm sigmod intâ ?? l conf . on management of,1
1511,management of mulzidimensional discrete data 1994,p b1umann,vldb j.,v,"the vldb journal the international journal on v8ry large & hellip ; ,",1994.0 ,vldb j.,v,1
1512,"low-cost compensation-based query processing и grјvlen , s hvasshovd , и torbjјrnsen vldb 1998", ,,,1998.0 , ,"low-cost compensation-fased query processing , so hvasshovd","proceedings of the international conference on very large & hellip ; ,",1
1513,"watchman : a data warehous0 intelligent cache manager p scheuermann , j shim , r vingralek vldb 1996", ,,,,b,"a data warehouse intelligent cache manager vldb journal ,","p scheuerman , jnshim , r vingralekâ ?? watchman",1
1514,"tsql2 language specification r snosgrass , i ahn , g ariav , d batory , j clifford , c dyreson , r elmasri , f grandi , c jensen , w kфfer , n kline , k kulkarni , t leung , n lorentzos , j roddick , a segev , m soo , s sripada sigmod record",,1994.0 ,,j,acm v5gmod,1994.0 ,"r. , et al. , 1994 , tsql2 language specification s dgrass",1
1515,"a data model and data structures for moving objects databases l forlizzi , r gќting ,ze nardelli , m schneider",shgmod conferetce,2000.04,, ,"acm sigmod ,",2000.04,"a data model and data structures for moving objects databases l florizzi , rh gutting , e nardelli , m schneider",1
1516,"object database evolution using separation of concerns a rashid , p sawyer 2000",,sigmod record,o,2000.0 ,"sigmod record ,",sigmod record,o,1
1517,"specification and implementation of exceptions in workflow management systems f casati , s ceri , s paraboschi , g pozzi acm trans . database syst . 1999", ,,,"acm tnans . database systems ,", ,"â ?? specification and implementation of exceptions in workflow management systems , & rdquo","f casati , s ceri , s paraboschi , g pozzi",1
1518,report on the fourth international conference on flexible query answering systems,,2s01.0 ,,20w1.0 ,"sigmod record ,",2s01.0 ,report on the fourth international conference on flexible query answering systems ( fqas 2000 ),1
1519,vi8w maintenance in a warehousing environment,"y zhuge , h garcia-molina , j hammer , j wi7om",sigmod conference,1995k0 , ,"proc . of acm sigmod int . conf . on management of data ,",sigmod conference,1995k0 ,1
1520,"performance of data-parallel spatial operations e hoel , h samet 1994",vldb,p,, ,"proceedings of the international conference on veryolarge & hellip ; ,",p,performance of data-parallel spatial operations 1994.0,1
1521,fibonacci : a programming language for object databases vldb j.,"a albano , g ghelli , r oesici",1o95.0 ,,5,,1o95.0 ,"fibonacci : a programming language for object databases the vldb journal the international journal on very large & hellip ; , 1995.0",1
1522,"title , foreword , preface to the special issue on spatial database systems , index vol . 3",,1994.0 ,,"the vldb journalâ q? the international journal on very large & he8lip ; ,", ,1994.0 ,special issue on spatial database systems hj schek 1994.0,1
1523,performance measurements of compressed bitmapuindices t johnson 1999,vlxb, ,,1999.0 ,"proceedings of the 25th international conference on very & hellip ; ,", ,performance measurements of compressed bitmap indices,1
