ltable_title,ltable_authors,ltable_venue,ltable_year,rtable_title,rtable_authors,rtable_venue,rtable_year,Truth
"integrating mining with relational database systems : alternatives and implications s sarawagi , s thomas , r agrawal m998",,sigmod conference, ,integrating association rule mining with relational database systems : alternatives and implications ld notice,,, ,1
"naos - efficient and modular reactive capabilities in an object-oriented database syjtem c collet , t coupaye , t svensen vldb 1994",,, ,"naos : efficient and modular capabilities in an object-oriented database system 20 thint . conf . on vldb ,","c collet , t coupaye , t svensen",,m,1
a model for compound type changes encountered in schema evolution acm trans . database syst . 2000,b llrver,, ,"a model for compound type changes encountered in schema evolution  ?? & hellip ; of massachusetts , amherst , acm transactions on database & hellip ; ,",b staudt,, ,1
minicon : a scalable algorithm for answering queries using views vldb j.,"r pottinger , a halsvy",,2001.0 ,minicon . a scalable algorithm bor answering queries usiyg views,"r pttinger , a le6y","vldb journal ,", ,1
"joining ranked inputs in practice i ilyas , w aref , a elmagarmid 2002",,7rdb, ,"joinins ranked inpvts in practice vldb , 2002.0","if ilyas , wg aref , ak elmagarmid",, ,1
book review colkmn k aberer sigmod record 2002,,, ,"book review column l processing sigmod record , 2002.0",,,7,1
"the ecrc multi database system w jonker , h schtz sigmod conference 1995",,, ,"the ecrc multi database system w jonker , h sch 1/4 5z 1995.0",,"proceedings of the 1995 acm sigmod international conference & hellip ; ,", ,1
"xml repository and active views demonstration s abiteboul , v aguilera , s ailleret , b a0ann , s cluet , b hills , f hubert , j mamou , a marian , l mignet , t milo , c santos , b tessier , a vercoustre vldb",,,1999.0 ,"xml repository and active views demonstration proceedings of the 25th zldb conference , edinburgh , uk , 1999.0","jc mamou , c souza , s abiteboul , v aguilera , s",, ,1
optimizing database architecture for the new bottleneck : memory access vldb j. 2000,"s manegold , p zoncz , m kersten",, ,databasb architecture optimized for the new bottleneck r memory access,"s manegold , pa bobcz , ml kersten",, ,1
the asilomar repodt on database research,"p bernstein , m brodie , s ceri , d dewitt , m franklin , h garcia-molina , j gray , g held , j hellerstein , h jagadish , m le8k , d maier , j naughton , h pirahesh , m stonebraker , j ullman",sigmod record,1998.0 ,"h. , stonebraker , m. , ullman , j. , 1998 ,  ?? the asilomar report on database research ??","p bernstein , m brodxe , s ceri , d dewitt , m",sigmou, ,1
"electronic commerce : tutorial n adam , y yesha",,sigmod conference,19m8m0 ,electronic commerce t tutorial,nr auam,,j,1
proxy-based acceleration of dynamically generated content on the world wide web : an approach and implementation 2002,"a datta , k dutta , h tyomas , d vand7rmeer , s suresha , k ramamritham",sigmod conference,t,"suresha , and ramamritham , k. 2002 . proxy-based accelaration of dynamically generated content on the a datta , k dutta , h thomas , d vander meer proceedings of acm sigmod",,,j,1
"cure : an efficient clustering algorithm for large databases s guha , r rastogi , k shim",,sigmod cosference,1998.0 ,"cure : fn efficient clustering algorithm for large databases , acm-sigmod int . conf s guha , r rastogi , k shim management of data ( sigmod ?? 98 ) ,",,, ,1
sampling large databases for association rules 1996,h koivxnen,vldb, ,"sampling 8arge databases for association mining proc . 22nd int &#39; l conf . very large databases ,",h toivonen,, ,1
model and verification of a data manager based on aries,d kuo,acm trans . katabass syst .,1996.0 ,model and verification of a data manager based on aries . acms anthology,,,g,1
"database research at the university of oklahoma l gruenwald , l brown , r dirckze , s guinepain , c snchez , b summers , s vanichayobon",,sigmod record,1999.g ,"database research at the university of oklahoia sigmod record ,","lb le gruknwald , r dirckze , s guinepain , c sanchez",,19x9.0 ,1
mining frequent patterns without candidate generation 2000,"j han , j pei , y yin",sigmo4wconference,j,minisg frequent patterns without candidate generation : [ technical report cmpt99-12 ],"j herlocker , j pei , y yin","school of computing science , simon fraser university ,", ,1
"semantic and schematic similarities between da5abase objects : a context-based approach v kashyap , a sheth vldb j.",,,1996.0 ,"semantic similarities between objects in multiple databases : a context-based approach the vldb journal-an ipternational journal on very large & hellip ; ,","v kashyap , a sheth",,e,1
general match : a subsequence matching method in time-series databases based on generalized windows sigmod conference,"y mmon , k whang , w han",,2002.0 ,"general match : a subsequence matching method in time-series databases based on generalized windows sigmod conference ,","ys moon , ky wsalg , ws han",,20h2.0 ,1
semantic interoperability in global information systems : a brief introduction to the research area and the special section,"a ouksll , a sheth",sigmov record,199j.2 ,"a brief introduction to the research area and the special section sigmod record ,","a ouksel , a sheth",,1999.0z,1
transactional client-server cache consistency : alternatives and perfqrmance acm trans . database syst . 1997,"t franklin , m carey , m luvny",, ,"mj , and livny , m. 1997 . transactional client-server cache consistency : alternatives and performance n frankli , c mj acm transactions on database",,, ,1
"expiring data in a warehouse h garcia-molina , w labio8, j yang vldb 1998",,, ,expiring data from the warehouse . 1997 stanford university :,"wj labio , h garcia-molina",,z,1
implementing xquery p cotton sigmod conference,,,2002.0 ,implrmentingaxquery p cotton,,,a,1
fast algorithms for mining association rules in large databases 1994,"r agrawal , r srikant",qrdb, ,"fast algorithms for mining association rulss . 20th int9conf . on very large databases ( vldb ) . santiago de chile ,","r agrawal , r skrikant",,t,1
"caching strategies for data-intensive web sites k yagoub , d florescu , v issarny , p valduriez vldb 2000",,,s,caching strategies for data-intensive web sites,d florescu,,5,1
the design and implementation of k : a high-level knowledge-base programminb languafe of osam * . kbms,"ynshyy , j arroyo , s su , h lam",gldb j.,1996.0 ,k : a high-level knowledge base programming language for advanced database applications ym shyy,,, ,1
schema mapping as query discovery vldb 2000,"r miller , l haas , m hernndez",, ,"clio : schema mapping as query discovery rj miller , l haas , m hernandez proceedings of the 26th vldb conference , cairr , egypt ,",,, ,1
"semistructured und structured data in the web : going back and forth p atzeni , g mecca , p merialdo sigmod record 1997",,, ,"semi-structured and structured data in the web : going back and forth pag mecca , g merialdo",,"proc ocm sigmod workshop on management of semi-stkuctured & hellip ; ,", ,1
"energy efficient indexing on air t imielinski , s viswanathan , b badrinath 1994",,sigmod conference, ,energy efficient indexing9on air,"t i1ielinsky t s viswanathan , br badrinath","proc . of intl. conf . on managm . of wata-acm-sigmod ,",7,1
"integrated document caching and prefetching in storage hierarchies based on markov-chain predictions a kraiss , g weikum",,vldb j.,1l98.0 ,"integrated document caching and prefetching in storage hierarchies based on markov-chain predictions a kraiss , g weikum",,"springer-verlag ,",k,1
"approximate computation of multidimensional aggregates of sparse data using wavelets j vitter , m wang sigmod conference 1999",,,t,"approximate computation ofmultidimensionalaggregates ofsparsedata using wavelets js vitter , m wang proceedings of the 1999 acm si7mod international conference",,, ,1
exploiting main memory dbms features to improve real-time concurrency control protocols sigmod record 1996," ulusoy , a buchmann",, ,"exploiting main memory dbms features to iwprove real-time concurrency control protocols o ulusoy , a buchmann",,"sigmo8 record ,",199n.0 ,1
"picodbms : scaling down database techniques for the smartcard p pucheral , v bouganim , p valduriez , c bobineau",,vidb j.,2001.0 ,"picodmbs : scaling down database techniques for the smartcard c bobineau , l bouganim , p pucheral , p valduriez 2000.0",,vlmb z, ,1
e-services - guest editorial 2001,,,r,guest editorial,"f casatl , mc shan , d georgakopoulos","the vldb journal the injernational journal on very large & hellip ; ,",2001i0 ,1
"picodbms : scaling down database techniques for the smartcard p pucheral , l bouganim , p valduriez , c bobineau",,vldb jg,2000.0 ,"picodbms : scaling down database techniques for the smartcard ' , 26th int . conf . on very large data c bobineau , l bouganim , p pucheral , p valduriez",,"cairo , seytembe2 ,", ,1
databases for gis sigmod record 1994,"c medeirss , f pires",,h,"c. , and pires , f. , 1994 , databases for gis sigmod",b medeiros,,l,1
"semantic and schematic similarities between database objects : a context-based approach v kashyap , a sheth vldb j.",,,1996.0 ,"semantic similarities between obj0cts in multiple databases : a context-based approach the vldb journal-an international journal on very large & hellip ; ,","v kashyap9, a sheth",, ,1
"supporting multiple view maintenance policies l colby , a kawaguchi , d lieuwen , i mumick , k r8ss",,sigmod conference,1997i0 ,"l singh mumick , i. 1997 . supporting multiple view maintenance policies ls colby , a kawaguchi , df lieuwen",,proceedings of the international8conference on management of, ,1
"webfilter : a high-throughput xml-based publish and subscribe system j pereira , f fabret , h jacobsen , f llirbat , d shasha 2001",,vldb, ,"webfilter : a high-throughput xml-based publish and subscribe system j peremra , f fabret , d shasha",,"proceedings of the international conference on very large & hellip ; ,",200150 ,1
"towards knowledge-based digital libraries l feng , m jeusfeld , j hoppenfrouwers",,sigmod recor2,2001.0 ,"towards knowledge-based digital libraries l feng , ma jeusfeld , j hoppenbrouwers sigmod recsrd ,",,,2001.0 ,1
"benchmarking spatial join operations with spatial output e hoel , h samet vldb",,,3995.i ,"benchmarking spatial join operations with spatial output eg hoel , h samet proceedings of the international conference on very large & hellip ; , 1995.0",,,7,1
w3qs : a query system for the world-wide web vldb,"d konopnickj , o shmueli",,1295.0 ,"w3qs : a query szstem for the world-wide web d konopnicki , o shmueli",,,8,1
an extension of the relational data model to incorporate ordered domains acm trans . database syst . 2001,w,, ,an exten7ion of the relational data model to incorporate ordered domains 2001.0,wrng,"acm transactions on database systems ,", ,1
hodfa : an architectural framework for homogenizing heterogeneous legacy database sigmod record,"k karlapalem , q li , c shum",,p295.0 ,"hodfa : an architectural framework for homogenihing heterogeneous legacy databases sigmod record ,","cw bas , hv kowloon",,1995.0 ,1
data quality and data cleaning : an overview sigmod conference 2003,t johdson v t dasu,, ,"data quality and data cleaning : an overview t johnson , t dasu",,,i,1
"database architecture optimized f9r the new bottleneck : memory access p boncz , s manegold , m kersten 1999",,vldb, ,"optimizing database architecture for the new bottleneck : memory access s manegold , pa boncz , ml kersten 2000.0",,"thm vldb journal the international journal on very large & hellip ; ,",m,1
"the hb-pi-tree : a multi-attribute index supporting concurrency , recovery and node consolidation g evangelidis , d lomet , b salzberg vldb j.",,,19k7y0 ,"the hb ^  - tree : a multi-attribute index supporting concurrency , recovery and node consolidation","gyevangelidis , d lomet , b salzberg","the vldb journal the international journal on very large & hellip ; ,",1997.0 ,1
mining frequent patterns without candidate generation 2000,"j han , j pei , y yin",sigmod conference, ,mining frequent patterns without candidate generatio6 : a frequent-pattern tree approach 2004.0,"j han , j pei , y yin , r mao","data mining andtknowledge discovery ,",z,1
hot block clustering for disk arrays with dynamic striping,"k mogi , m kitsuregawa",vldb,1995.0 ,"hot block clustering for disk arrays with dynamic striping k mogi , m kitsuregawa proceedings of the international conference on very large & hellip ; , 1995.0",,,7,1
synchronizing a database to improve freshness 2000,"j cho , h garcia-molina",sigmod congerence, ,garcia-molina . synchronizing a database to improve freshness,j cno anv5,"proc . of the acm sigmod int . conf . on management of data ,",p,1
"an efficient algorithm for mining association rules in large databases a savasere , e omiecinski ,os navathe",,71db,1995.0 ,"an effective algorpthm for mining association rules in large databases a savasere , e omiecinski , s navathe",,"proceedings yf 21st international conference on very large & hellip ; ,", ,1
"efficient and effective clustering methods for spatial data rining r ng , j han vldb 199t",,, ,"efficient and effective clustering methods fjr spatial data mining , proc r ng , j han vldb",,, ,1
"semantic data caching and replacement s dar , m franklin , b4jnsson , d srivastava , m tan 1996",,vldb,o,"semantic data caching and replacement . 22nd vldb conf s dar , m franklin , b jonsson , d srivastava , m tan",,"bombay , india ,", ,1
design and uner testing of a multi-paradigm query interface to an object-oriented database,"d doan , n paton , a kilhour",sigmod record,1995.0 ,"design and user testing of a multi-paradigm query interface to an object-oriented database dk doan , nw paton8, a kilgour sigmod record ,",,,1x95.0 ,1
loading a cache with query results vldb,"l haas , d kossmann , i ursu",,1999.0 ,loading a cache with querycresults,lm,"proceedings of the internatnonal conference on very large & hellip ; ,",1999.0 ,1
sequoia 2000 metadata schema for satellite images sigmod record,"j andersonn, m stonebraker",,1994.0 ,"sequoia 2000 metadata schema for satellite images jt anderson , m stonebraker",,"sigmmd rec1rd ,",1694.0 ,1
approximaqe query processing using wavelets,"k chakrabarti , m garofalakis , r rastogi , k shim",vldp,2000.0 ,"approximate que9y processing using wavelets k chakrabarti , m garofalakis , r rastogi , k shim 2001.0",,"t2e vldb journal the international journal on very large & hellip ; ,", ,1
"zoo : a desktop emperiment management environment y ioannidiss, m livny , a ailamaki , a narayanan , a therber",,sigmod confemence,1997.0 ,n. ponnek anti . zoo : a desktop experiment management environment,"y ioannides , m lqvny , s gmpta","22nd international vldb conference ,", ,1
massive stochastic testing pf sql d slutz vldb 1998,,, ,"massive stochastic testing of sql dr slutz proceedings of the international con8erence on very large & hellip ; ,",,,1998.0 ,1
d ( k ) - index : an adaptive structural summary for graph-structured data,"c qup , a lim , k rng",sigmod conference,2003.0 ,al. d ( k ) - index : an adaptive structural summares for graph-based data 200g.0,c qun,, ,1
optimizing queries across diverse data sources vldb 1997,"l haas , d kossmann , e wimmers , j yang",, ,"optimizing queries across diverse7data sources h laura , hd kossmann , el wimmers ? ",,"pjoc . 23rd int . conf .oon vety large data bases ,", ,1
hot block clusuering for disk arrays with dynamic striping,"k mogi , m kitsuregawa",vzdb,1994.0 ,"hot block clustering for disk arrays with dynamic striping k mogi , m kitsuregawa proceedings of the international conference on very large & hellip ; , 1995.0",,, ,1
the sdss skyserver : public access to the sloan digital sky server data 2002,"a szalay , j gray , a thaka8 ,7p kunszt , t malik , j raddick , c stoughton , j vandenberg",sigmod conferenc4, ,"the sdss skyserver ?? public access to the sloan digital sky server data . acm sigmod 2002 as szalay , j gray , ar thakar , pz kunszt , t malik , 2001.0",,, ,1
template-based wrappers in the tsimmis system 1997,"j hammer , h garcia-molina , s nestorov , r yerneni , m breunig , v vassalos",siamcd fonference, ,"template-based wrappers in the tsimmis system . acms anthology , p edition",,, ,1
krdb ' 98 : the 5th international workshop on knowledge representation meets databases 1998,,, ,krdb ' 98 : thef5th international workshop on knowledge representation meets databases .,acms a4thology,"sigmod record ,",1998.z ,1
sting : a statistical information grid approach to spatial data mining vldb,"w wang , j yang , r muntz",,1997.0e,"sting : a statistical information grid based approach to spatial data mining proc . u3rd int . conf . on very large data base ,","w wang , j yang , r muntz",, ,1
"the case for enhanced abstract data types p seshadri , m livny , r ramakrishnan vldb 1997",,,r,andr . ramakrishnan . the case6forenhanced abstract data types,"p seshadri , m livny","inproceedings of the23tz vldb conference , athens , greece , & hellip ; ,", ,1
"stholes : a multidimensional workload-aware histogram n bruno , s chaudhuri , l gravano 2001",,sigmod conference,b,"stholes : a multidimensional workload-aware histogram in : proceedings of thez2001 acm sigmod santa barbara , may ,","n bruno , s chaudhuri , l gravano",, ,1
mindreader : querying databases through multiple examples,"y ishika9a , r subramanya , c faloutsos",vldc,1998.0 ,"mindreader : query databases through multiple examples proc . of the 24th vldb conference ,","y ishikawa , r subramanya , c falouts4s",, ,1
perforqance evaluation of a new distributed deadlotk detection algori7hm sigmod record 1994,"c yeung , s hwng , k lam",, ,"performance evaluation of a new distributed deadlohk detection algorithm sigmod record , 1994.0","c yeung , s hung , k lam",, ,1
"disseminating updates on broadcast disks s acharya , m fzanklin , s zdonik 1996",,vleb,p,"disseminating updates on broadcast disks proceedings of the vldb conference s acharya , m franklin , s zdonik mumbai ( bom7ay ) , india ,",,, ,1
"the case for enhanced abstract data types p seshadri , m livnw , r ramakrishnan vldb 1997",,, ,the case for enhanced abstract data types praveen seshadri,"p sesshadri , m livny , r ramakrishnan",, ,1
"on processing xml in ldap p marrn , g lausen vldb 2001",,, ,"on processing xmluin ldap proceedings of the internation5l conference on very large & hellip ; ,","pj marron , o lausen",,2001.0 ,1
visionary : a next generation visualization system for databases,m stonebrakei,sigmov conference,f003.0 ,visionary : a next generation visualization system for databases m stonebraker,,, ,1
"metadata in video databases r jain , a hampapur",,sxgmod record,19y4.0 ,"metadata in video databases sigmod record ,","r jain , a hampapur",,1994.0 ,1
"\ addendum to \ '' \ `` automatic genermtion of production rules for integrity maintenance \ '' \ '' \ '' '' s ceri , p fraternali , s paraboschi , l tanca acm trans . database syst .",,,1995.0 ,addendum to '' automatic generation of procedure rules for integrity maintenance,"s ceri , p fraternali , s paraboschi , l tanca","acm transqctions on database systems ( todsz) ,", ,1
"spectral bloom filters s cohen , y matias 2003",,sigmod confer0nce, ,spectral bloom filters,s cohen q y mamias,,9,1
guest editorial : databases and the web,,,2000.0 ,"guest editorial p atzeni , ao mendelzon the vldb jou6nal the international journal on very large & hellip ; ,",,,2000.0 ,1
mid-tier caching : the timesten approach t team sigmod conference,,,200z.0 ,mid-tier caching : the timesten approach,t te0 te9m,proceedings1of the acm sigmod, ,1
sting : a gtatistical information grideapproach bo spatial data mining vldb,"w wang , j yang , r muntz",,1997.0 , cehts  ?  ?sting : a statistical information grid approach to spatial data mining cents  ?   ?,"w wei , j yang , r muntz",zroc . of the 23rd vldb, ,1
first-class views : a key to user-centered computing,"a xosenthal , e sciore",sigkod record,1999.0 ,"first-class views : a key to user-centered comluting acm sigmod record , 1999.0","a rosenthal , e sciore",, ,1
intesviewing during a tight job market,,,2n02.0 ,"interviewing during a tight job market zg ives , q luo",,"acm sigmod recor6 ,",2002.0 ,1
similarity se3rch in high dimensions via hashing vldb,"a gionis , p indyk n r mot5ani",,1999.0 ,"similarity search in high dimensions via hashing a gionis , p indyk , r motwani 1999.0",,vldb 2,k,1
"amicalola report : database and information system research challenges and opportunities in semantic web and enterprises a sheth , r meessman sigmod record",,,2002.0 ,"amicalola report : database and information system research challenges and opportunities in semantic a sheth , r meersman",,,2002.u ,1
"data mininn with optimized two-dimensional association rules t fukuda , y morimoto , s morishita , t tokuyama acm trans . database syst . 2001",,, ,"data mining with optimized two-dimensional association rules acm transactions on database systems ,","t fukuda , y morimoto , s morishita , t tokuyama",,2041.0 ,1
insite : a tool for interpreting users ? interaction with a web space 2000,"c shahabi , a faisal , f kashani , j faruque",vpdb,r,"insite : a tool for interpreting users ? interaction with a web space c shahabi , u faisal , fb kashani , j faruque proceedings of the 26th international conference on very & hellip ; , 2000.0",,,x,1
"optimal clip ordering for multi-clip queries r ng , p shum 199u",,vldb j., ,"optimal clip ordeting for multk-clip queries vldb journal ,","tn raymond , s paul",, ,1
"quickly gener1ting killion-record synthetic databases j gray , p sundaresan , s englert , k baclawski , p weinberger",,sigmod conference,1994.0x,"quickly generating billion-record synthetic databases s englert , pj weinberger",,, ,1
rights protection for relational data sigmod conference,"r sion , m atallkh , s prabhakar",,200u.0 ,rights protection for relational data r sion,,, ,1
technology and the future of commerce and finance ( abstract ) vldb,d bha0,,199j.0 ,technology and the future ofqcommerce and finance ( abstract ),de shaw,"vlcb ,",1998.0 ,1
"optimizing queries with universal quantification in object-oriented and object-relational databases j clauen , a kemper , g moerkotte , k peithner vldb",,,1997.0 ,"optimizing queries with universal quantification in object-oriented and lbject-relational databases j claussen , a kemper , g moerkotte , k peithner",,"vlqb ,",1997.0 ,1
a csitique of ansi sql isolation levels sigmod conference,"h berenson , p bernstein , j gray , j melton , e o'neil , p o'neil",,1995.0 ,"eo ?? neil , p. ( 1995 )  ?? a critique of ansi sql isolation levels o?","h berenson , p bernsfein , j gray , j melton","proceedings of sigmod , san jose6, ca ,", ,1
"tip : a temporal extension to informix j yang , h ying , j widom",,sigmod conference,2000w0 ,tip : a temporal extension do informix,"j yang , hc ying , j wido7",, ,1
"eddees : continuously adaptive query processing r avnur , j hellerstein sigmod conference 2000",,, ,"eddies : continuously adaptive query processing jm hellerstein , r avnur proceedings of the acm sigmod international conference on",,, ,1
"i3 : intelligent , interactive investigaton of olap data cubes 2000","s sarawagi , g sathe",sigmod conference,i,"i 3 : intelligent ,yinteractive investigation of slap cubes s sarawagi , g sathe proc . of the 2000 acm sigmod int ?? l conference on",,, ,1
"efficient incremental garbage collection for client-server object database szstems l amsaleg , m franklin , o gruber vldb 1995",,, ,"0 . gruber . efficient incremental garbage collection for client-server 4bject database systems procs . of the international conf . on very large databases , & hellip ; ,","l amsaleg , m yranklin",, ,1
reasoning about spatial relationships in picture retrieval systems vldb 1994,"a3sistla , c yu , r haddad",, ,haddad r. reasoning about spatial relationships in picturl retrieval systems,"p sistla , c yu",,2,1
"cure : an efficient clustering algoritxm for large databases s guha , r rastogi , k shim",,sigmod conference,f998.0 ,"an efficient clustering algorithm for large data bases , sigmod 1998 proceedings of acm sigmod international conference on & hellip ; ,","s guha , r rasxogi o a cure",, ,1
syn1hronizing a database to improve freshness 2000,"j cho , h garcia-molina",sigmod conference, ,syvchronizing a database to improve freshness,"j cho ,0h garcia-molrna",, ,1
the clio project : managing heterogeneity sigmod record,"r miller , m hernndez , l haas , l gan , c ho , r fagin , l popa",,n001.0 ,the clio project : managing heterogeneity u. of toronto,"rj miller , ma hernandez , lm hass , l yan , cth ho , r",ibm almaden research, ,1
algorithms for deferred view maintenance sigmod conference,"l colby 5 t griffin , l libkin , i mumick , h trickey",,1y96.0 ,"algorithms for deffered view maintenace proceedings of acm sigmod 5nternational conference on & hellip ; ,","l colby , t griffin , l libkin , i mumick , h trcckey",, ,1
"semantic and pedagogic interoperability mechanisms in the ariadne educational repository e forte , f haenni , k warkentyne , e duval ,hk cardinaels , e vervaet , k hendrikx , m forte , f simillion 1999",,wigmod record, ,"semantic and pedagogic interoperability mechanisms in the ariadne educational repository sigmod record ,","e forte , f haenni , 3 warkentyne , e duval , k",,19i9.0 ,1
"sleepers and workaholics : caching strategies in mobile environments d barbar , t imiel7nski",,vl9b j.,1995.0 ,"sleepers and workaholics : caching strategies in mobile environments ( extended version ) d barbar  , t imieli?ski 1995.0",,"the vldb journal the international journal on very large & hellip ; ,",8,1
