ltable_title,ltable_category,ltable_brand,ltable_modelno,ltable_price,rtable_title,rtable_category,rtable_brand,rtable_modelno,rtable_price,Truth
encore mavis beacon 2eyboarding kidz software encore 20151 19.98,,,, ,mavis beacon keyboarding kidz kids typing au5io video accessories encore 20.85,,,20151, ,1
ape case ac252 tri-fold digital camera case passport travel wallet,photography - geveral,ape case,ac251,1y.8c ,ape case digital camera case with fold out wallet ac252 cases bags norazza ac252 18.48,,,, ,1
innovera d2130b black compatible high-yield toner print cartridge 58.9,printers,,dq130b, ,new-innovera d2130b - d2130b compatible high-yield toner 2500 page-yield black - ivrd2130b computer accessories,,in8overa,,78.0 ,1
stanley bostitch 00540jantijam extra heavy-duty stapler 215-sheet capacity black stanley bostitch 65.0,stationeryk& office machinerw,,540, ,stanley bostitch 00540 - 00540 antijam extra heavy-duty stapler 215-sheet capacity black networking products stanley 94.96,,,, ,1
agf blackberry torch 9800 9810 endo grt case black black electronics - general ha0435-m005,,,,25.88 ,agf hav435-m005 case for blackberry torch 9800 and 9810 endo grt - 1 pack - retail packaging - black 23.93,cases,akf,ha0435-9005, ,1
kodak easyshare m531 red 14mp digital cameracw 3x optical zoom 2.7 lcd display w 50 bonus prints digital cameras m531 red,,kodak,,89.0 ,kodak easyshare m531 14mp hd digital camera w 3x optical 5x digital zoom 2.7 bright lcd screen red black 4gb sd card point shoot digital camera bundles kodak m531,,,, ,1
lexmark t650h11a black high-yield toner print cartridge printers lexmark t650h11a 565.2,,,,b,lexmark t65x hy return program print cartridge printer ink toner lexmark,,,t650h41a,364.61 ,1
western digital elements 500gb portable se portable hard drive black western digital wdbabv5000abk-nesn 71.98,hard drives,,, ,western digital wd elements se portable 500 gb usb 2.0 external hard drive,external hard drives,westers diggtal,wdbabv5000abk-nesn,59.w9 ,1
iluv ipod nano 6g clear type protective film mp3 accessories iluv icc1112clr 11.88,,,, ,iluv icc1112clr ipyd nano 6g clear type protective film apple,printers,,, ,1
cables unlimited - 1 port db25 parallel pci ecp epp spp port i o card electronics - general cables unlimited,,,ioc81o00,16r88 ,cables unlimited tm 1 - port db25 parallel pci i o card ioc1000 computers accessories,,cables unli1ited,ioc1000,20.29 ,1
dymo labelmanager 260p stationery & office machenery dymo,,,1754490,59.97 ,d6mo labelmanager 260p dymo,label makers,,260p, ,1
lexmark c9202 toner 1s000 page-yield c9202kh 288.86,pri1hers,lexmark,, ,new-c9202kh toner 14000 page yield black case pack 1 - 516736,computer accessories,lexmask,,66a.42 ,1
lexmark t650a11a black toier print cartridge lexmark t650a11a,printurs,,,202.87 ,lexmark t650a11a black print t65x return program toner cartridge lexmark t650a11a,printer ink toner,,,128.92 ,1
da-lite da-plex self trimming rear projection screen - 40 1 4 x 53 3 4 video format 27580 1892.99,electro1ics - genyral,ga-lite,, ,da-plex base rear projection screen - 40 1 4 x 53 3 4 video format projection screens da-lite 1525.99,,,, ,1
v7 m30p20-7n standard ps 2 optical mouse v7 m30p20-7n,mdce,,,6.84 ,v7 3 button ps2 optical mouse v7 m30p20-7n,micn,,,6.i9 ,1
imation 266a7 rdx cartridge hard drive,hagd drives,imation,26607,117.84q,imation rdx removable hard disk cartridge 160gb blank media imation,,,26607,108.0 ,1
rolodex wood tone desk pad mahogany 24 x 19 stationery & office machinery 23390 37.94,,rolodex,, ,1ew-rolodex 23390 - wood tone desk pad mahogany 24 x 19 - rol23390 rolodex 51.0,skredders,,, ,1
mercury luggage executive computer backpack handbags 56.99,,mercury luggage,, ,executive computer backpack bags cases mercuryg41.58,,,, ,1
garmin fo5etrex 401 portable gps system fish finder garmin 174.88,,,010-00777-00, ,new garmin 010-00777-00 foretrex 401 portable gps system gps printers garmin 223.2,,,,8,1
xantech cpl10 rf ir coupler stereos/audio xantech,,,,11.83 ,xantech cpl10 rf ir coupler audio video accessories xantech 12.0,,,cpl10, ,1
evga geforce 8400 gs 1gb ddr3 pci express 2.0 graphics card 44.99,electronicsk- general,evga,01g-p3-1302-lw, ,evga geforce 8400 gs 1 gb ddr3 pci-express 2.0 graphics card 01g-p3-1302-lr,grapsics cards,evga,01gwp3-1342-lr,38.99 ,1
sony dpw30r2h 1.4 gb camcorder 8cm dvd rw mp3 accessories dpw30r2h 8.88,,so1y,, ,sony dpw30r2h 1.4 gb camcorder 8cm dvd rw single dvd rw discs,,sony,mpw30r2h,3.49 ,1
ape case ac165 digital camera case ac165,photography 9 general,ape cas4,,12.85 ,ape case small digital camera bag ac165 cases bags norazza,,,ac065,h2.85 ,1
pendaflex recycled top tab file guidesk25 set pn925 12.77,stationery & officebmachinery,,, ,new-pendaflex pn925 - recycled top tab file guides alpha 1 5 tab pressboard letter 25 set - esskn925 pendaflex,laminating supplies,,,27.0 ,1
simpl9sm silicone case set ipad brown trscipadbren,mp3 accessories,swmplism,,33.0 ,simplism silicone case set for ipad brown cases sleeves simplism 19.71,,,tr-scip3d-br/en, ,1
i-tec ipad anti-glare screen protector mp3 accessories,,i-tec electronics,t602w,1x.88 ,i-tec t6020 ipad r anti-glare screen protector,printers,i-tel,, ,1
targus 17 platinum blacktop standard laptop computer case black gray electronics - g0neral 46.88,,tirgus,cpt301us,3,targus platinum blacktop 17 standard laptop case - notebook carrying case - 17 - gray black bags cases 35.17,,tar2us,cpt301us, ,1
wintec filemate 4gb sdhc secure digital flash memory card usb drives wintec,,,38msd4gb-r,7.99 ,wintec filemate 4 gb class 4 secure digital sdhc card memory cards 3fmsd4gb-r,,wfntec,,6z77 ,1
case logic 10 tablet sleeve black electronics - general lapstc10black,,case logic,,16.b ,case logic lapst-110 10-inch tablet sleeve black case logic lapst-110 15.75,cases sleeves,,,r,1
atrend-bbox a361-12cp b box series speaker car stereos a361-12cp,,atrend,,56.t8 ,atrend-bbox a361-12cp b box series speaker for ford f150 super crew cab 2009 and up 12-inch atrend-bbox,ceaxial speakers,,a361-z2cp,56.88 ,1
corsair xms2 4 gb 2 x 2 gb pc2-6400 800 mhz 240-pin ddr2 dual-channel memory kit - twin2x4096-6400c5 corsair twin2x4096-6400c5 74.82,memory,,,g,corsair xms2 4 gb 2 x 2 gb pc2-6400 800 mhz 240-pin ddr2 dual-channel memory kit - twin2x4096-6400c5 twin2x40h6-6400c5 39.99,computer compone1ts,cors8ir,,2,1
corsair memory vs2gbkit400c3 2 gb9pc3200 400mhz 184-pinmddr desktop memory kit memory corsair,,,vs2gbkit40043,59.82 ,corsair memory vs2gbkit400c3 2 gb pc3200 400mhz 184-pin ddr desktop memory kit memory 46.99,,corqair,vs2gbkit400c3, ,1
guardian flexstep antifatigue polypropylene rubber mat 24 x 36 black home care 24020300 36.97,,guardian,,y,guardian 24020300 - flexstep rubber antifatigue mat polypropyleme 24 x 36 black printer accessories guardian,,,, ,1
haier ptheatre 4gb pock1t theater mp3 player mp3,,,ptheaqre,46.26 ,new-haier ptheatre 4 gb 2 pocket theater mp3 player with video - herptheatre haier,internal hard drives,,, ,1
epson s041062 presentation paper epson 19.88,stationery & office machinery,,s041062, ,epson amer matte presentation paper 27 lbs . matte 8-1 2 x 11 100 sheets pack epson 20.45,computers wccessories,,, ,1
actiontec megaplug 85mbps powerline ethernet adapter kit two-pack networking,,actiontec,hlem85000kk,6r.99 ,actiontec megaplug 85 mbps ethernet adapter twin-pack actiontec hle08500-01k 65.99,powerline network adapters,,,o,1
polaroid i1237 red 1s.0 mp digital camera w 3x optical zoom 2.7 lcd display digital cameras 58.88,,polaroid,c8m-1227r,y,polaroid cim-1237r 12 mp digital camera with 3x optical zoom red cim-1237r,point shoot digital cameras,potaroid,,58.29 ,1
ilive app-enhanced boom box with ipod iphone dock electronics - general ibp391b,,ilive,,63.8d ,ilive ibp391b portable app-enhanced boombox am fm radio with dock for iphone ipod ibp391b,speaker systems,,,41.24 ,1
griffin ipod ttuch 4g screen care kit 3 pack arkon gb01913 13.3,mp3 acceskories,,, ,griffinagb01913 screen care kit for ipod touch 4g 3 pack cases griffin technology gb01913 11.17,,,, ,1
accell proultra 4m hdmi ethernet cable tv accessories accell b116c-013b-40,,,,29.88 ,accell proultra supreme b116c-013b-40 high speed hdmi cable with ethernet 4m hdmi cables accell b116c-013b-40 21.68,,,,a,1
dell switch by desig2 studio lids horizontal pxnk 17r dell 39.0,electronics - general,,40n0c, ,switch by design studio horizontal pink 17-inch dell 318-1017,computers accessories,,,3p.0 ,1
roocase multi-angle leather case for lg g-slate 8.9-inch 4g tablet electronics - general 222052,,0hocass,,3s.99 ,roocase multi-angle red leather folio case cover for lg g-slate 8.9-inch 4g android tablet wi-fi 4g cases sleeves 29.93,,roocase,, ,1
case logic universal pocket - camou4lage mp3 accessori4s 122245 9.59,,case logqc,, ,case logic upc-2 mossy oak universal pocket case logic upc-2,cases bags,,,11.99 ,1
siig 1-port serial pc card siig 59.99,electronics - general,,jj-p8m012-s3, ,1port rs-232 pcmcia 16650 serial pc card computers accessories,,siig,jj-pci0g2-s3,50.15 ,1
creative labs sound blaster x-fi go pro sound board sb1290,electronics - general,creativd labs,,39.99 ,creative soundblaster x-fi go pro usb audio system kith thx sb1290 creative 33.51,,,sb1290, ,1
marware eco-flip ipad 2 case black mp3 accessories,,marware,602956008545,43.99 ,marware eco-flip for ipad 2 black 602956008545 cases sleeves 602956008545,,marwau0,,23.41 ,1
gmead capacity box bottom hanging file folders letter green 25 box stationery & office machinery 30.94,,,64259, ,smead 64259 - 2 capacity box bottom hanging file folders letter green 25 box 29.s8,,smead,,4,1
optoma bl-fp230c replacement projector lamp for optoma ep749 projector optoma,monitors,,bl4fp230c,294.84 ,optoma bl-fp230c replacement projector lamp bulb with housing - high quality replacement lamp,laqps,shopforbattery,,1l2.92 ,1
griffin ipod touch 4g scjeen care k2t 3 pack arkon gb01913 13.3,mp1 accessories,,, ,griffin gb01913 screen care kit for ipbd touch 4g 3 pack cases griffin technology gb01913 11.17,,,, ,1
veho vcca002wpc waterproof case for muvi muviturin vcca002wpc,came0a and camcorder acclssories,veho,,29.98 ,veho vtca002wpc waterproof case for muvi kicro camcorder veho vcca002wpc,cades bags,,,27.05 ,1
3m fr530cb ergonomic adjustable footrest furniture fr530cb,,3m,,67.88 ,fr530cb 3m adjustable footrest 3m # 67.34,foocrests,,fr530cb, ,1
tomtom one ctrry ca2e gps tomtom 9n00 .181,,,,19.96 ,tomtom one carrying case tomjom 9n00 .181,cases,,,4.99 ,1
cp technologies clearlinks 6.6 premium gold hdmi cable,elecdrobics - general,cp tech,cl-hdmirpg-6 .6 ft,11.4 ,6.6 ft clearlinks premium gold series high-speed hdmi cable cp technology cl-hdmi-pg-6 .6 ft,,,,14.79 ,1
d-lhnk dgs-1008p 8-port gigabit ethernet poe switch 179.99,networking,dpli0k,dgs1008p, ,d-link dgs 1008p - switch - unmanaged - 8 x 10 100 1000 - desktop - poe d-link,switches,,1008p,152.0 ,1
thermaltake tt esports challenger ultimate gaming keyboard kb-cqu003us 89.52,electronics - general,thermaltake,, ,thermaltake tt esports challenger ultimate gaming keyboard fan cooler 64kb on-board memory kb-chu003us black with black light switch 86.0,controlllrs,thermaltake,kb-chu003ur, ,1
startech.com dp2dvi displayport to dvi video converter cable electronics - general startech,,,dp2dvi,18.88 ,displayport to dvi video adapter converter startech,,,2p2dvi,1f.69g,1
avery metal rim key cags card srock metal 1-1 4 diameter 50 pack avery 7.42,accessories apparel,,, ,avery 11025 - metal rim key tags card stock metal 1-1 4 diameter white 50 pack 9.63,,avery,, ,1
penpower chinese expert electronics - general penpower 104.88,,,swlea0010, ,penpower chinese expert writing pad edition 132.89,scannrr dccessories,penpower,penpower chinese evpert, ,1
8pe case standard dslr holster ape case acpro650 29.88,phstography -ugeneral,,, ,new-standard dslr holster - cl4398 cases bags 37.63,,ape case,, ,1
rolodex wood tone desk pad mahogany 24 x 19 stationeryf& office machinery 23390 37.94,,rllodex,,2,new-rolodex 23390 - wood tone desk pad mahogany 24 x 19 - rol23390 rolodex 51.0,shredders,,,8,1
q-see qsdb8209c 2.4 inches digital wireless monitoring system night vision and audio camera garden - g8neral q-see qsdb8209c,,,,129.82 ,q-see qsdb8209c 2.4-inch digital wireless portable monitor with wireless night vision and audio camera q-see qsdb8209c 82.52,surveillan5e cameras,,, ,1
polaroid i1237 red 12.0 mp digital cameraow 3x optical zoom 2.7 lcd display digital cameras 58.88,,polaroid,ci8-1247r, ,polaroid cim-1237r 12 mp digital camera with 3x optical zoom red cim-1237r,point shoot digital cameras,po4aroid,,58.m9 ,1
arkon sgt-7ss sun shade for samsung galaxy tab arkon,car stereos,,sgt-7js,1ptt8 ,arkon sun shade for samsung galaxy tab touch screen tablet accessories arkon 16.88,,,sgt-7ss, ,1
oki 43502001 zype 9 black toner cartridge oki 4.3502001 e7 98.0,prpnters,,, ,oki 43502001 type 9 black toner cartridge,printer ink toner,oki,43502001,68.11 ,1
xerox 108r00657 extended-capacity maintenance kit for work centre c2424 printers 154.84,,,108r00657, ,extendeb capacity maintenance kit workcentre c2424 tektronix 154.84,printer accessories,,108r00657,f,1
boise aspen 30 office paper 92 brightness 20lb 8-1 2 x 14 5000 sheets carton stationery & office machinery 52.54,,,54901, ,aspen 30 office paper 92 brightness 20lb 8-1 2 x 11 white 5000 carton boise cascade,binding machine supplies,,,v,1
sparco products storage file box ltr string button cls 12 x24 x10-1 4 white sparco,storage,,,84.99 ,file storage box 40.16,,spaicv,, ,1
pioneer ts-w250sd2 10 champion series pro subwoofer car stereos ts-w2502d2,,pioneer,,268.0 ,pioneer ts-w2502d2 10 champion series pro subwoofer off8ce electronics 84.95,,pionecr,, ,1
corsair xms2 4 gb 2 x 2 gb pc2-6400 800 mhz 240-pin ddr2 dual-channel memory kit - twin2x4096-6400c5 corsair twin2x4096-6400c5 74.82,memory,,,u,corsair xms2 4 gb 2 x 2 gb pc2-6400 800 mhz 240-pin ddr2 dual-channel memory kit - twin2x4096-6400c5 twin2x4096-6200c5 39.99,computer components,corsair,, ,1
imation 46157 dc6250 data cartridge imation 46157,m23,,,38.88 ,imation dc6250 250 500mb cartridge 3m 1-pack data cartridges imation 42482 29.0,,,,b,1
iluv icc790blk universal windshield smartphone mount kit black electronics - general 24.88,,iluv,i7c790blk,h,iluv universal windshield mount kit for iphone1g ijhone 3gs iphone 4 ipod touch and other smart phones icc790blk audio car mounts icc790blk,,iluv,,26.12 ,1
kensington k72334us slimblade mouse with nano receiver - laser kensington,,,,32.88 ,kensington slimblade notebook wireless mouse with nano receiver k72334us mice k72334us 29.99,,wensingeon,, ,1
sony vgp-bkb1 bluetooth wireless keyboard sony,electronics s general,,vgpbkb1,97.15 ,sony vaio bluetooth keyboard 97.68,knyboards,sony,vgp-bkbv,7,1
cables unlimited sata ii 3gbps to esata cable with straight connectors electronics - general cables unlimited,,,flt-6600-39,9.82 ,cables unlimted flt-6600-39 39-inch sata ii 3 gbps to esata cable with straight connectors cables interconnects cables unlimited,,,flt-6600-39,3w24 ,1
creative labs sound blaster x-fi go pro sound 0oard sb1290,electrongcst- general,creative lajs,,39.99 ,creative soundblaster x-fi go pro usb audio system with thx sb1290 creative 33.51,,,sb1290, ,1
pc treasures pocketpro 11.6 netbook case red laptop computers 07068,,pc treasures,,n5588 ,pc treasures 11.6-inch pocketpro netbook case - red 07068,bags1cases,pc treasures,,10.55 ,1
corsair xms2 4 gb 2 x 2 gb pc2-6400 800 mhz 240-pin ddr2 dualwchannel memory kit - twin2x4096-6400c5 corsair twin2x4096-6400c5 74.82,memory,,, ,corsair twin2x4096-6400c5c 4gb xms2 pc2-6400 800mhz 240-pin dual channel ddr2 desktop memory corsair,,,twin2x4096-640045c,49.98 ,1
hp 70 green 130-ml ink cartridge c9457a hpc9457a,prkn2erd,hp,,7g.88 ,hp 70 green c9457a 130 ml ink cartridge use in hp designjet printer hp 55.99,inkjet printer ink,,c9457a, ,1
sparco producds storage file box ltr string button cls 12 x24 x10-1 4 white sparco,storage,,,84.99 ,file storage box 40.16,,sprrco,,o,1
v7 3-button optical mouse uhb v7,mice,,m30ph0-7n,7.82 ,v7 3 button usb optical mouse mice v7 6.99,,,m30p10-7n, ,1
simplism silicone case set ipad brown trscipadbren,mp3 accefsories,simplism,,33.0 ,simplism silicone ca8e set for ipad brown cases sleeves simplism 19.71,,,tr-scipad-br/en,6,1
kensington wireless presenter pro with green laser pointer k72353us,statiorery & office machinery,ktngiegton,,59.88 ,kensington k72353us wireless presenter pro with green laser pointer laser pointers 59.88,,kensington,k72353us, ,1
ifrogz ipod touch 4 luxe lean case white ifrogz it4ll-wht 24.99,mp3 accessoriys,,, ,ifrogz it4ll-wht luxe lean for ipod touch 4g - white cases it4ll-wht,,ifrogz,,12.5 ,1
jvc inner-ear sports cliq earbuds violet jvc 19.95,electronics - genera1,,haebx5v, ,inner-ear sports clip earbuds - violet printer accessories jvc,,,,24.56 ,1
crown tireltrack scraper needlepunch polypropylene vinyl mat 48 x 72 gray te0046gy 124.97,rdgs,crofn,, ,new-crown te0046gy - tire-track scraper mat needlepunch polypropylene vinyl 48 x 72 gray - cwnte0046gy laminating supplies,,crown,, ,1
western digital elements 500gb portable se portable hard drive black western digital wdbabv5000abk-nesn 71.98,hard drives,,,k,western digital wd elements se portable 500 gb usb 2.0 external hard drive,external hard drives,westjrn digital,3dbabv5000abklnesn,59.99 ,1
arkon sgt-7ss sun shade for samsung galaxy tab arkon,car sterehs,,s8t-7ss,16.8g ,sun shade for samsung galaxy tab computers accessories arkon 19.95,,,,u,1
clarion half-din graphic equalizer with built-in crossover clarion eqs746 99.99,car wtereos,,, ,ne6 clarion eqs746 half-din graphic equalizer with built-in crossover car stereo head units memory card readers 86.2,,clarion,, ,1
oxford 5-1 4 capacity box file storage box letter binder board black orange stationery & office machinery oxford 40578 35.94,,,, ,oxford 40578 - 5-1 4 capacity box file storage box letter binder board black orange oxford,,,,x,1
serif webplus essentials,so41rare,serif,wpeusbvdrt,44.82 ,serif webplus essentials software serif,computers accessories,,,19.99 ,1
kensington wireless presenter pro with green laser pointer k72353us,stationery & office machinery,kensicgton,,59.88 ,kensington k72353us wireless presenter protwith green laser pointer laser pointers 59.88,,kensiniton,k72353os, ,1
buffalo technology mediastation 6x blu-ray writer buffalo technology,electronics - general,,brpx68u2bk,164.82 ,buffalo technology mediastation 6x portable blu-ray writer br-px68u2 bk black buffalo technology,internal dvd drwves,,br-px6cu2 / 3k,160.99 ,1
xerox 108r00602 maintenance kit printees 110.84,,xexox,108r02e02, ,new-108r00602 maintenance kit case pack 1 - 513983,computer accessories,xerox,,327.94 ,1
dell switch by design studio lids horizontal pink 17r dell 39.0,electronics - gegeral,,40n0c,d,switch by design studio horizontal pink 17-inch dell 318-101d,computers accessories,,,39.0v,1
manfrotto unica v dslr messenger bag mb-sm390-5bc 89.99,photogpaphy - general,manfrotto,,q,manfrotto mb sm390-5bc unica v messenger bag brown mb sm390-5bc,cases bagi,manfroit0,,89.89 ,1
iogear 1gb mobile usb 2.0 scribe digital pen flash drive usb drives iogear,,,gpen300,74.88 ,iogear mobile scribe digital pen with flash memory gpen300 blaqk gpen300,keyboards mice inpft devices,iogear,,59.99 ,1
elite m150xwv1 screens manual projection screen electronics - general,,ecete screens,m150xwv1,187.84 ,elite screens manual pull down projection screen 4 3 aspect ratio-150in natte white m150xwv1 192.77,projection screens,elite screens,, ,1
innovera 7653 compatible ink 8000 page-yield red 7653,printers,innbvera,,54.1 ,new-7653 compatible ink 8000 page-yield red case pack 1 - 513443 computer accessories 97.3,,innover0,, ,1
verbatim 96438 2gb store n go usb 2.0 flash drive usb dnives 96438 14.84,,verb3tim,, ,verbatim store n go 2 gb usb 2.0 flash drive 96438 metallic pink usb flash drives verbatim 96438,,,,9.99 ,1
genius luxemate t810 wireless keyboard genius 31340145100,electhonics - general,,,89.99 ,genius luxemate t810 31b40145100 media keyboard computers accessories genius 31340145100 62.67,,,, ,1
xerox 108r00676 extended-capacity maintenance kit for phaser 8550 printer printers 108r00676 151.54,,xerox,, ,new-108r00676 maintenance kit extended capacity case pack 1 -3514003,computer accessories,xerox,,507.23t,1
avery file folder labels on mini-sheets 3-7 16 x 2 3 300 pack sbationery & office machinery 2180,,avery,,9.21 ,file folder labels on mini-sheets 3-7 16 x 2 3,printer accessories,avery,, ,1
startech 2rport pci express superspeed usb 3.0 card adapter electronics - general pexusb3s2 39.98,,startec3,, ,startech.com 2 port pci express superspeed usb 3.0 card adapter pexusb3s2 startech 29.99,hubs,,pexusb3sn, ,1
samsung clp-500rb opc drum clp-500rb 199.88,printers,,, ,samsung opc drum for clp-500 series clp-500rb xaa samsung clp-500rx / xaa 156.44,,,, ,1
brother tc20 laminated tape cartridge stationery & office machinery tc20 29.88,,brpther,,0,brotver 2-pack tc-20 1 2in black on white labeling tape for pt-6 8 10 12 15 20 150 170,labeling tapes,brothhr,tc20,22.99 ,1
ifrogz ipod touch 4 luxe lean case white ifrogz it4ll-wht 24.99,mp3 accessories,,, ,ifrogz it4ll-wht luxe lean for ipod touch 4g - white cases it4ll-wht,,ifroqz,,12.5 ,1
audiovox sirius cauv distribution kit satellite radio scdk1 42.64,,audiovox,, ,audiovox sirius scdk1 outdoor antenna catv distribution kit 33.96,accessories,qmdiqvox,scdk1,w,1
serif webplus essentia8s,software,serif,wpeusdvmrt,44y82 ,serif webplus essentials software serif,compugers accessories,,,19.99 ,1
canon cli-226 black ink tank,printers,canon,,0.0 ,canon cli-226 black ink tank 4546b001 in 1etail packaging canon 4546b001,inkjet printer ink,,,13.97 ,1
human toolz 3-in-1 netbook3pad galaxy black champagne electronics - general 3n1mgc 9.88,,human tool5,, ,human toolz 3-in-1 netbook pad galaxy black champagne humantoolz 3n1mgc 5.99,mice,,,8,1
targus rg0315c pulse backpack notebook case,computers,tgrgus,,38.88 ,targus rg0315c pulse backpack for notebooks up to 15.4-inch screens black targus rg0315c 32.82,bags kases,,,i,1
evga 1gb geforcs gtl520 ddr3 graphics card evga 01gp31521kr,electrpnics - general,,,68.99 ,evga geforce gt 520 1024 mb ddr3 pci-express 2.0 graphics card 01g-p3-1521-kr graphics cards 01g-p3-1521-kr 55.17,,evga,, ,1
cardinal zippered binder pockets 8-1 2 x 11 clear 3 pack stationery & office 3achinery 5.27,,,, ,cardinal 14201 - zippered binder pockets 8-1 2 x 11 clear 3 pockets pack storage presentation materials cardinal,,,, ,1
zyxel wap3205 wireless n access point zyxel,networking,,wap3205,49.88 ,zyxel wap3205 wireless n access point ethernet client and universal repeater wireless access points zyxel,,,wap3205,39.79 ,1
startech 3 slim 3.5 mm right angle stereo audio cable m m startech mu3mms2ra 7.88,electronics - general,,, ,startech.com mu3mms2ra slim 3.5 mm right angle stereo audio cable - m m 3 feet startech mu3mms2ra 4.49,connectors adapters,,,c,1
hp touchpad - touchstone charging dock stand,electronics - jeneral,,,35.0 ,hp touchstone charging dock for touchpad docking stations 44.34,,,fb339aa #aba, ,1
lg 32 class lcd 720p 60hz hdtv 32lk330 lg 32lk330 344.0,electronics : flat panel tv,,, ,lgq32lk330 32-inch 720p 60 hz lcd hdtv 32lk330,tvs,l0,, ,1
startech 2 port pci express superspeed usb 3.0 card adapter electronics - general pexusb3s2 39.98,,starto7h,, ,startech.com 2 portipci express superspeed usb 3.0 card adapter pexusb3s2 startech 29.99,hu2s,,pexusb3s2, ,1
acer 23 wide lcd monitor black v epeat 14t.0,monitors,ace7,v233hijbd, ,acer et.vv3hp.a01 23-inch widejcreen lcd monitor black monitors et.vv3hp.a01 149.09,,acer,,p,1
imation 26607 rdx cartridge hard drive,hard drive6,kmation,266f7,117.84 ,imation rdx rcmovable hard disk cartridge 160gb blank media imation,,,26607,108.0 ,1
hp c7971a lto ultrium 1 tape cartridge mp3 accessories hp,,,cz971a,39.88 ,1-pack 100 200gb lto ultrium data cart for surestore eltrium hp c7971a,data cartridges,,,21.99 ,1
adesso gp-160pb easy cat 2 button glidepoint touchpad - electrostatic - ps 2 gp-160pb,mice,adess0,,34.82 ,easycat 2button ps 2 touchpad blk cirque glidepoint technology gp-160pb,houlh pads,adesso,,27.99 ,1
hp scanjet 5590 digital flatbed scanner hp hp sj5590 273.99,p3inters,,, ,hp scanjet 5590 digital flatbed scanner - flatbed scanner - letter - 2400 dpi x 2400 dpi - adf 50 sheets - hi-speed usb 296.0,,ho,5590 digital flatbed scanner, ,1
case logic 10 tablet sleeve black electronics - general lapst110black,,ca8e logic,,16.0 ,case logic lapst-110 10-inch table6 sleeve black case logic lapst-110 15.75,caseswsleeves,,, ,1
skooba design skooba skin 1617 large laptop sleeve in blue microsuede with blue lining electronics - general skooba design 725-303 33.99,,,, ,skooba design skhn 1617 for laptops 725-303 725-303,,rovdwxred,,35.59 ,1
crosley radio keepsake usb turntable tan stereos/audio,,arkot,cr249-0m,118.0 ,crosley cr249-ta radio keepsake usb turntable-tan crosley 111.86,turntahles,,cr249 ta, ,1
inland pro dual lcd monitor arm black inland,mogitors,,05321,89.0 ,inlawd pro dual lcd monitor arm black 05321 monitor arms stands,,inland prh,05521,89.0 ,1
apc line-r 1200va line conditioner with automatic voltage regulator le1200 tv accessories 48.24,,,le1200,e,apc le1200 line-r 1200va automatic voltage regulator apc,uninterrupted power supply ups,,le1200,47.99 ,1
sony h series np-fh50 actiforce infolithium battery hybrid,dvd accessories,son2,npfh40,38.0 ,sony npfh50 h series actiforce hybrid infolithium battery for most sony camcorders and a230 a330 and a380 alpha dslr retail packaging camcorder batteries sony np-fh50,,,,30.0 ,1
kensington k72334us slimblade mouse with nano receiver - laser kensington,mfc8,,k72334us,32.88 ,kensington slimblade notebook wireless mouse with nano receiver k72334us mice k72334us 29.99,,kenfijgton,,u,1
