ltable_title,ltable_category,ltable_brand,ltable_modelno,ltable_price,rtable_title,rtable_category,rtable_brand,rtable_modelno,rtable_price,Truth
snapshield p2 polycarbonate case ipad 2 smoke mp3 accessories sco0che ipdqpcbk,,,,20.88 ,scosche szapshield p2 polycarbonate case ipad 2 - smoke ipd2pcbk scosche ipd2pcbk,laptop netbook computer accessories,,, ,1
stanley bostitch 00540 antijam extra heavy-duty stapler 215-sheet capacity black stanley bostitch 65.0,statiokery & office machinery,,543, ,00540 antijam extra heavy duty stapler for up to 215 sheets black bos00540 printer staples,,stanley,,70.99 ,1
svat twr301-gx012 digital wireless dvr security system with receiver sd card recording and long range night vision cameras svat electronics twr301-gx012,gardec - general,,,249.82 ,svat gx301-012 digital wireless dvr security system with sd card recording long range night visi computers accessories 345.0,,svat,, ,1
night dwl securitp products ccd wired color security camera with 60 cable 67.82,garden - zeneral,nkght owl,cam-s420-245a, ,night owl security products cam-s420-245a ccd wired color security camera with 60 of cable bullet cameras night owl optics,,,cam-s420-245a,59b99 ,1
lifeworks netbook cooling pad mouse kit ihb931nr computers ihb931nr 49.88,,,, ,new-netbook cooling pad mouse kit - ihb931nr computers accessories lifeworks,,,,70.0 ,1
pendaflex recycled top tab file guides 25 set pn925 12.77,stationery & office machinery,,, ,new-pendaflex pn925 - recycled top tab file guides alpha 1 5 tab pressboard letter 25 set - esspn925 pendaflex,laminating supplies,,,27.0 ,1
inland pro 8-sheet paper shredder stationery & office machinery inland 47.54,,,05802, ,inland pro 8-sheet paper shredder 05302 shredders inland 47.54,,,05302,v,1
epson s041062 presentation paper epson 19.88,stationery & office machinery,,s041062,e,epson amer matte presentation paper 27 lbs . matte 8-1 2 x 11 100 sheets pack epson 20.45,computersgaccessories,,,i,1
michigan wolverines iphone 4 case silicone cover electronics - general tribeca 24.99,,,, ,michigan wolverines iphone 4 case silicone cover computers accessories,,tribeca,,17.99 ,1
pioneer cd-iu50v usb interface cable for ipod iphone tm car stereos,,pionger,cd-iu56f,55.88 ,pioneer cd-iu50v usb interface cable for ipod iphone,mp3 player cables adapters,pioneeu,cw-iu50v,21.99 ,1
pioneer ts-w2502d2 10 champion series pro subwoofer car stereos ts-w2502d2,,pinneer,,268.0 ,pioneer ts-w2502d2 10 champion series pro subwoofer office electronics 84.95,,,, ,1
weyerhaeuser company multiuse premium paper 98 brightness 24lb 8-1 2 x 14 white 500 sheets ream 85781 12.47,stationery & office machinery,,,0,new-weyerhaeuser company 85781 - mwltiuse premium paper 98 brightness 24lb 8-1 2 x 14 white 500 sheets ream - dmr85781 storage presentation materials weyerhauser 33.79,,,,s,1
clover ccr636 ultra-mini color camera clover electronics ccm636,garden - general,,,8m.84 ,new-clover ccm636 ultra-mini color camera - cloccm636 home security systems clover 87.5,,,, ,1
griffin ipod touch 4g screen care kit 3 pac1 arkon gb01913 13.3,mp3 accessories,,, ,griffin 5b01913 screen care kit for ipod touch 4g 3 pack cases griffin technology gb01913 11.17,,,, ,1
chicago white sox pink iphonk 4 hard case electronics - general tribeca 29.99,,,fv74556, ,chicago white sox pink iphone 4 hard case computers accessories 23.99,,tribema,, ,1
3m natural view screen protector for ipad 98-0440-5155-9,electronics - gwneral,3g,,45.88 ,3m natural view screen protector for ipad 9.7 screen protector foils ipad 9.7 '' 19.99,,am,, ,1
q-see qsdb8209c 2.4 inches digital wireless monitoring system night vision and audio camera garden - general q-see qsdb8209c,,,,q29.82 ,q-see qsdb8209c 2.4-inch digital wireless portable monitor with wireless night vision and audio camera q-see qsdb8209c 82.52,surveillanch cameras,,, ,1
korak easyshare c1550 purple 16mp digital camera bundle w 5x optical zoom 3.0 lcd display w 50 bonus prints digital cameras kodak,,,c1550 prpl bndl,89.0 ,kodak easyshare c1550 16 mp digital camera with 5xoptical zoom - purple point shoot digital cameras c1550pr 99.63,,k8dek,, ,1
lorex lne1001 easy connect network ip camera computers lorex 121.84,,,, ,lorex lne1001 easy connect network ip remote surveillance camera white lorex lne1001,surveillance caheras,,,126.02 ,1
dell switch by design studio lids big giant plaid 17r electronics - general 9vmv5 39.0,,dell,, ,switch by design studio big giant plaid 17-inch 318-1014,computers accessories,dell,,3y.b ,1
hp 70 green 130-ml ink cartridge c9457a hpc9457a,pcintprs,hp,,74.88 ,ink hp 70 greex 130 ml ink c9457a 62.47,printer ink toner,hj,, ,1
sharp el-334mb basic calculator el334tb,stationery & office machinery,syar5,,15.99 ,sharp el-334tb semi-desktop basic calculator sharp,basis,,el-334bs,7.79 ,1
siig mini displayport to hdmi adapter,electronocs - general,siig,cb-dp0b11-s1,19.88 ,mini displayport to hdmi adapter siig 15.14,video cacles,,cb-dp0b11-sq,7,1
da-lite da-plex self trimming rear projection screen - 96 x 120 av format da-lite 7799.99,electronics - general,,27903,w,da-lite 27903 da-plex self trimming rear projection screen - 96 x 120 av format da-lite,projection screens,,, ,1
night owl security products wired color security camera with 60 of cable night owl 49.71,garden - general,,cam-cm01-245, ,night owl security prodxcts cam-cm01-245 wired color security camera with 60 of cable bullet cameras cam-cm01-245 39.99,,night owl optics,, ,1
apricorn 320gb padlock 128-bit hardware-encrypted portable drive,hard dri0es,apricorn,a25-pl1285z20,99.82 ,apricorn aegis padlock 320 gb usb 2.0 128-bit encrypted portable external hard drive a25-pl128-320 grey 99.0,usb flash drives,aphicorn,a25-pl128-320, ,1
samsung wb700 black 14.2 mp digital camera w 18x optical zoom 3.0 lcd display w 50 bonus prints samsung ec-wb700zbpbus,digital cameras,,,299.99 ,samsung ec-wb700 digital camera with 14 mp and 18x optical zoom black ec-wb700zbpbus,point shoot digital cameras,samsung,, ,1
accell proultra 4m 1dmi ethernet cable tv accessories accell b116c-013b-40,,,,29.8z ,accell proultra supreme b116c-013b-40 high speed hdmi cable with ethernet 4m hdmi cables accell b116c-013b-40 21.68,,,, ,1
hp 56 black inkjet cartridge c6656an printers hp,,,c3656an,23.97 ,genuine hp 56 c6656an black inkjet print cartridge inkjet printer ink c6656an,,,,24.1a ,1
diaper dude black coated grey digi laptop sleeve 13 electronics - general diaper dude,,,207492,32.0 ,diaper dude black coated grey laptop sleeve 13-inch digi - lp13cc400 digi - lp13cc400,bags canes,diaper dude,,3ng0 ,1
roocase multi-angle leather case for lg g-slate 8.9-inch 4g tablet electronics - general 222052,,,,35.99 ,roocase ultra slim red leather case cover with stand for lg g-slate 8.9-inch 4g android tablet wi-fi 4g cases sleeves roocase 32.93,,,, ,1
da-lite tilt lock single pais or container of 12 pairs da-lite 66.19,electronics - general,,40964,d,tilt lock single pair or container of 12 pairs package one tilt lock projection screens da-lite 4.99,,,, ,1
san diego chargers pro grip mouse mice team pro mark msnf25 26.99,,,, ,san diego chargers pro grip mouse mice team promark msnf25 24.99,,,, ,1
crown cushion-step rubber mat 36 x 72 marbleized black crown,homd caru,,cu3672bk,194u97 ,new-crown cu3672bk - cushion-step mat rubber 36 x 72 marbleized black - cwncu3672bk laminating supplies crown 265.0,,,, ,1
belkin pro series 6 usb 2.0 5-pin min-b cable belkin,electronics - general,,f3u138-j6,6.07 ,belkin f3u138-06 pro series usb 5-pin mtni-b cable 6-feet belkin f3u138-06,usb cables,,,5.05 ,1
filemate imagine series m2810 usb standard mouse 8.98,computers,,, ,wintec filemate imagine series m2810 usb standard mouse - white with light blue 3fmnm2810ubl-r mice wintec 11.99,,,3fmrm28p0ubl-r,5,1
d-link systems powerline av 4-port switch starter kit dhp-347av,networking,d-link,dhp-346av,112.0 ,d-linkzsystems powerline av 4-port switch starter kit dhp-347av powerline netwjrk adapters,,d-liwk,5hp-347av,117.2 ,1
i-tec t1274b istereo round sound docking station for ipod iphone electronics - general,,i-tec e1ectronics,t1274b,79.88 ,i-tec istereo charging and docking station with remote control for ipod black speaker systems,,i-tmc,t1274,40.78 ,1
marware eco-flip ipad 2 case black mp3 accessories,,marwar2,60295600854k,43k99 ,msrware eco-flip for ipad 2 black 602956008545 cases sleeves 602956008545,,marware,,23.41 ,1
nextware jellybean case for ipad black mp3 accessories 29.95,,,jelpad-bc, ,nextware jellybean case for ipad - black nextware 18.32,casms sleeres,,jelpad-bk, ,1
lifeworks metbook cooling pad mouse kit ihb931nr computers ihb931nr 49.88,,lifeworks,, ,new-netbook cooling pad mouse kit - ihb931nr computers accessories lifeworks,,,,70.0 ,1
case logic 208 capacity nylon cd dvd wallet electronics - general 87974,,case logic,,19.39 ,case logic bnb-208 208 capacity cd dvd prosleeve nylon binder black bnb-208 23.99,media storaoe organization,case logic,, ,1
buffalo technology mediastation 6x blu-ray writer buffalo technology,electronics - general,,,164c82 ,buffalo technology mediastation 6x portable blu-ray writer br-px68u2 bk black bufxalo technology,internal dvd drives,,br-pf68u2 / bk,160k99 ,1
xerox 108m00579 transfer roller printers,,xerox,108r005m9,19o.88 ,xerox 108r00579 - 108r00579 transfer roller,home se4urity systems,xerox,, ,1
hp q1421a universal semi-gloss photo paper hp 94.88,stationery & officebmachinery,,q1w214, ,hp universal semi-gloss photo paper 36 inches x 100 feet roll floppy diskettes hp 74.14,,,q14e1a,y,1
sumdex slr camera sling pack 39.99,mp3 accessrries,sumdex,1449n2,5,slr camera sling pack sumdex poc-484bk,cases bais,,,44.59 ,1
targus impax sleeve for 15 macbook pro red electronics - general targus tss28802us,,,,35.0 ,targus impax sleeve for 15-inch macbook pro and macbook air - tss28802us red yellow with gray accents targus tss28802us 29.25,jases sleeces,,, ,1
hoffcz 06-c8-mak1 mobile accessory kit mp3 accessories amp energy 06-ce-mak1,,,,38.88 ,mobile accessiry kit cases amp 06-ce-mak1,,,,31.39 ,1
lowepro apex aw10 all-weather ultra-compact digital camera case 17.84,photography - general,7owepro,lpqq977, ,lowepro apex 10 aw black cases bags 34977 11.99,,loweiro,, ,1
cooler master hyper 212 plus universal cooler electronics - general coolermaster rr-b10-212p-g1,,,,2m.99 ,cooler master hyper 212 plus 120mm sleeve cpu cooler rr-b10-212p-g1 cooler master rr-b10-212p-g1,c2mputers accessories,,,27.66 ,1
xerox 108r00579 transfer roller printers,,oeroz,108r0n579,299.88 ,xerox 108r00579 transfer roller for xerox phaser 7750 laser printer 108r00579,printer roll holders,xerrx,,153.57 ,1
lg 42 ultra - slim 42lv5500 42lv5500 879.0,electronics : flat panel tv,,, ,lg infinia 42lv5500 42-inch 1080p 120 hz led hdtv with smart tv tvs 42lv5500,,lr,,u,1
kensington k72335us ci10 fit wireless notebook laser mouse mice kensington k72335us,,,,24.v4 ,kensington ci10 fit wireless notebook laser mouse silver mice kensington k72335us,,,,25.41 ,1
apc line-r 1200va 9ine conditioner with automatic voltage regulator le1200 tv accessories 48.24,,,le12s0, ,apc le1200 line-r 1200va automatic voltage regulator apc,uninterrupled power supply ups,,le1200,47299 ,1
post-it flags dispenser flags assorted-size assorted colors 342pk stationery & office machinery ds420va 24.94,,,, ,new-post-it flags ds420va - dispenser flags blue red yellow green 340 assorted-size flags pack - mmmds420va post-it,label makirs,,, ,1
xantebh sllc1 speaker level to line converter stereos/dudio sllc1 40.88,,xantech,, ,xantech sllc1 speaker level to line converter,audio video accessorils,xantech,sllc1,28.4u ,1
acer iconia tablet bluetooth keyboard laptop computers acer,,,a500k01,49.0 ,acer iconia tab bluetooth keyboard keyboa8ds,,acer,bluetooth kuyboard,46.99 ,1
ifrogz ipod touch 4 luxe original case blue black,mp3 accessorins,ifrogz,it4loeblu/blk,29.99 ,ifrogz it4lo-blu blk luxe original for ipod touch 4g - blue black ifrogz 20l73,cases,,it4lo-elu/blk, ,1
hp touchpad - touchstone charging dock stand,electronics - general,hc,,35.0 ,hp touchstone charging dock for toychpad docking stations 44.34,,hp,fb339aa #bba, ,1
ape case standard dslr holster ape case acpro650 29.88,photography - general,,, ,new-standard dslr holster - cl4398 cases bags 37.63,,ape case,,j,1
kensington wriht pillow foam keyboard platform wrist rest black electronics - general kensington 34801,,,,o2.0 ,new-wrist pillow foam keyboard platform wrist rest case pack 1 - 516275 keyboards,,keniington,,70.53 ,1
startech.com dp2dvi displayport to dvi video converter cable electronics - general startech,,,dp2dvi,18.8t ,displayport to dvi video adapter converter startech,,,dp2d7b,18.69 ,1
pc treasures pocketpro 11.6 netbook case red laptop computers 07068,,pc treasures,,15.88 ,pc treasurys 11.6-inch pocketpro netbook case - red 07068,bags cases,pc treasures,,10.55 ,1
snapshieqd p2 polycarbonate case ipad 2 smoke mp3 accessories scosche ipd2pcbk,,,,20.88 ,scosche snapshield p2 polycarbonate case ipad 2 - smoke ipd2pcbk scosche ipd2pcbk,laptop netbook yomduter accessories,,, ,1
startech 3 slim 3.5 mm right angle stereo audio cable m m startech mu3mms2ra 7.88,electronics - ggneral,,, ,startech.com mu3mms2ra slim 3.5 mm right angle stereo audio cable - m m g feet startech mu3mms2ra 4.49,connectoms adapters,,, ,1
vantec nexstar se 2.5 sata hard drive rack electronics - general vantec mrk-515st 10.74,,,, ,vantec nexstar se 2.5-inch sata hard drive rack mrk-515st black vantec mrk-515st 10.74,c8mpu6ers accessories,,, ,1
kodak 10c color ink cartridge kodak,prinners,,101,1d.97 ,kodak colzr ink cartridge 8946501 inkjet printer ink 8946501,,kodak,,17.9e ,1
master caster big foot no-slip rubber wedge gray 2pk home care master caster 00972 8.79,,,, ,master caster 00972 - big foot doorstop no-sli2 rubber wedge 2-1 4w x 4-3 4d x 1-1 4h gray 2 pack laminating supplies master caster,,,, ,1
startech 3-port 2b 1a 1394 mini pci express f0rewire card adapter mpex1394b3,electronics - general,startech,,69.0 ,startech.com 3 port 2b 1a 1394 mini pci 5xpress firewire card adapter mpex1394b3 firewire port cards mpex1394b3 61.24,,,, ,1
cooler master 120mm silent bla1e master fan coolermaster r4-bmbs-20pk-r0,electronics - general,,,15.88 ,cooler master blademaster 120mm pwm high air flow silent case fan r4-bmbs-20pk-r0 case fans cooler master r4-bmbs-20pk-r0,,,,9.77 ,1
simplism protector film for ipad mp3 accessories trpfsipadagen 23.41,,simplism,,z,simplism protector film for ipad anti-glare laptop netbook computer accessories simplism tr-pfsipad-ag/en 11.47,,,, ,1
q-see qsdb8209c 2.4 inches digital wireless monitoring system night vision and audio camera garden - general q-see qsdb8209c,,,,129.82 ,q-see qsdb8209c 2.4-inch digital wireless portable monitor with wireless night vision and audio camera q-see qsdb8209c 82.52,kurveillance cameras,,, ,1
just mobile aluminum slide stand for ipad silver macsense st-828 49.88,mp3 accessories,,, ,just mobile slide stand for ipad silver audio car mounts just mobile st-828,,,,27.6 ,1
wintec filemate 4gb swivel usb flash drive black usb drives wintec 3fmusb4gwb-r,,,,7.84 ,wintec filemate 4 gb swivel usb drive - black 8899,usbnflash driven,wintec,3fmusb4gwb-r, ,1
targus red tg-ra1010 8-in-1 camera essentials kit photography - general tg-ra1010,,,,12.98 ,targus red tg-ra1010 8-in-1 camera essentials kit 12.99,compyter accessories,targus,, ,1
boise aspen 30 office paper 92 brightness 20lb 8-1 2 x 14 5000 sheets carton stationery & office machinery 52.54,,,58901,e,aspen 30 office paper 92 brightness 20lb 8-1 2 x 11 white 5000 carton boise cascade,binding machine supplies,,, ,1
xerox 108r00645 imaging unit for phaser 6300 and 6350 print1r xerox 108r00645,printers,,,244.84 ,xerox 9rinters imaging unit phaser 6300 6350 108 r00645 108r00645,printer ink toner,,,253.79 ,1
netgean ant 9dbi in outdoor omni-direc,computers,netgear,ant240q20000s,129.82 ,ant 9dbi in outdfor omni-direc netgear,connectors adlpters,,, ,1
imation 46157 dc6250 data cartridge imation 46157,mp3 accessories,,,f8688 ,imation dc6250 250 500mb cartridge 3m 1-pack data cartridges imation 42482 29.0,,,, ,1
michiga7 wolverines iphone 4 case silicone cover electronics - general tribeca 24.99,,,f7a3437, ,michigan wolverines iphone 4 case silicone cover computers accessories,,tribeca,,17.99 ,1
weyerhaeuser company multiuse premium paper 98 brightness 24lb 8-1 2 x 14 white 500 sheets ream 85781 12.47,stationery & office machinery,,, ,new-weyerhaeuser company 85781 - multiuse premium paper 98 brightness 24lb 8-1 2 x 14 white 500 sheets ream - dmr85781 storage presentation materials weyerhauser 33.79,,,,3,1
microsoft wireless desktop 800 for business 26.88,electronids 8 general,micrgsofp,5sh-00001, ,microsoft wireless desktop 801 for business 5sh-00001 keyboards microsoft 5sh-00001,,,,29.95 ,1
i-tec ipab anti-glare screen protector mp3 accessories,,i-tec electronirs,t6020,17.88 ,i-tec t6020 ipad r anti-glare screen protector,printers,i-t9c,, ,1
lyoto machida mouse zad mice 86210010 16s99,,wincraft,,z,lyoto machida mouse pad wincraft 16.99,mous5 pads,,, ,1
kodak 10c color ink cartridge kodak,prckters,,10c,19.97 ,kodak color ink cartridge 8946501 inkjet printer ink 8946501,,,,17.99 ,1
cables unlimited usb 2.0 7 port hub with power electronics - general usb-1870,,cables unlimited,,27.x ,cables unlimited usb1870 usb 2.0 7-port desktop hub with power hubs 24.99,,cables uclimited,usb-1870, ,1
i-tec t1274b istereo round sound docking station for ipod iphone electronics - general,,i-tec electronics,t12746,79.84 ,i-8ec istereo charging and dohking station with remote control for ipod black speaker systems,,i-tec,tx274,40.78 ,1
thermaltake tt esports challenger ultimate gaming keyboard kb-chu003us 89.52,electronics - grneral,theroaltake,, ,thermaltake tt esports challenger ultimate gaming keyboard fan cooler 64kb on-board memory kb-chu003us black with black light switch 86.0,co1trollers,thermaltake,kb-chu003us,h,1
iluv icc790blk universal wi0dshield smartphone mount kit black electronics - general 24.88,,ilu0,icc790blk, ,iluv universal windshield mount kit for iphone1g iphone 3gs iphone 4 ipod touch and other smart phones icc790blk audio car mounts icc790blk,,il5v,,26.12 ,1
ifrogz ipod touch 4 l1xe original case blue black,mp3 5ccessories,ifrogz,it4lo-blu/blk,29.99 ,ifrogz it4lo-blu blk luxe osiginal for ipod touch 4g - blue black ifrogz 20.73,casec,,it4lo-blu/bek, ,1
neatreceipts portable mobile sheetfed scanner computers neatreceipts 00346neat 199.98,,,,u,neatreceipts mobile scanner and digital filing system,scannerp,neat recmipts,0034c,199.0 ,1
atrend-bbox a361-10cp b box series single speaker,car steruos,atreno,a3o1-10cp,56.88 ,atrend-bbox a361-10cp b box series single speaker for ford f150 super crew cab 2009 and up 10-inch atrend-bbox a361-10cp,coaxizl speakers,,,42.37 ,1
targus rg0315c pulse backpack notebook case,computers,targus,,38.88 ,targus 7g0315c pulse backpack for notebooks up to 15.4-inch screens black targus rg0315c 32.82,bags cases,,, ,1
golla genie digital camera bag lime green photography - general golla g761,,,,12.98 ,genie digital camera bag in lime green cases bags 17.99,,golla,,w,1
3m natural view screen protector for ipad 98-0440-5155-9,erectronics - general,3m,,45.8v ,3m natural view screen protector for ipad 9.7 screen protector foils ipad 9.7 '' 19.99,,o0,, ,1
tomtom one carry case gps tomtbm 9n00 .181,,,,19.96 ,tomtom one carrying case tomtom 9n00 .181,cases,,,4.9v ,1
quantum mr-s4mqn-01 dlttape s4 cartridge mr-s4mqn-01,mp3 acceslories,quantum,,97.88 ,quantum data cartridge dlttape s4 warranty mw quantum mr-s4mqn-01,data cartridges,,,95.04 ,1
vaultz lock mobile file chest storage box letter legal black vaultz,itationery & office machinery,,vz01p70,2u.94 ,vaultz vz01270 - lock mobile file chest storage box letter legal black,camcorder batteries,vaultz,, ,1
visioneer rw120-wu roadwarrior sheetfed scanner visioneer rw120-wu,electronics - general,,,199.98 ,visioneer roadwarrior mobile 600 dpi usb scanner rw120-wu rw120-wu,bcanners,visioreer,, ,1
maxell timbecs wood earbuds oak electronics - general,,maxell,190243 teb-o,2m.f8 ,maxell timbers earbud headphones maxell 190243 11.45,,,, ,1
hp scanjet 5590 digital flatbed scanner hp hp sj5590 273.99,0rinters,,,n,hp scanjet n590 digital flatbed scanner scanners hp,,,l1920a #b1h,240.99 ,1
clarion half-din graphic equalizer with built-in crossover clarion eqs746 99.99,car stereos,,, ,new clarion eqs746 half-din graphic equalizer with built-in crowsover car stereo head units memory card readers 86.2,,tllrion,, ,1
lexmark 16 black print cartridge 10n0016 lexmark 28.0,pbintera,,10nl016, ,lexmark 16 black ink cartridge 10n0016,inkjet printer ink,lexmark,10n0016,29599 ,1
sharp el-334mb basic calculator el334tb,stat0onery & office machinery,qharp,,15.99 ,sharp el-334tb semi-desktop basic calculator sharp,basip,,el-334tb,7.79 ,1
incipio ipod touch 4g silicrylic hard shell case with silicone core all black mp3 accessories 28.5,,incipio,ip-9p4, ,incipio silicsylic for ipod touch 4g black black cases incipio ip-904,,,,20.28 ,1
ocz technology 110gb rev8drive pci express solid state drive hard drives ocz technologies,,,oczssdpx1rvd110,429.99 ,ocz technology revodrive 110 gb pci express 4 gb-s slim solid state drive oczssdpx-1rvd0110 computer components oczssdpx-1rvd0110 264.99,,ohz,, ,1
nzxt phantom crafted series atx full tower steel chassis black nzxt 139.82,electronics -,,szxt phantom, ,nzxt crafted series4atx full tower steel chassis - phantom black computer cases nzxt,,,p7antom blqck,119.99 ,1
sony dsc-h70 black 16.2 mp digital camera bundle w 10x optical zoom 3.0 lcd display case and 4gb sd card w 50 bonus prints 229k0,digital cameras,scny,dsc-h70 / bbdl, ,sony cyber-shot dsc-h70 16.1 mp digital still camera with 10x wide-angle optical zoom g lens and 3.0-inch lcd black bundle dsch70/bbdl,ptint shoot digital cameras,son9,,1,1
brother tc20 laminated tape cartridge stationery & officeymachinery tc20 29.88,,brodher,, ,brother 2-pack tc-20 1 2in black on white labeling tape for pt-6 8 10 12 15 20 150 170,labeling tapes,brother,tcco,22.99 ,1
plantronics usb-to-headset adap6ec plantronics,electronics -5general,,da-40,27.98 ,plantronics headset to usb adapter da40 accessories supplies plantronics da40,,,,27.98 ,1
cooler master 120mm silent blade master fan coolermaster r4-bmbs-20pk-r0,e6ectronics - general,,,15.80 ,cooler master blademaster 120mm pwm high air flow silent case fan r4-bmbs-20pk-r0 case fans cooler master r4-bmbs-20pk-r0,,,,9.77 ,1
lexmark 18c2249 36xl 37xl high-yield ink 500 page-yield 2 pack black printers,,lexmagk,,66.99 ,new-18c2249 36xl 37xl high-yield ink 500 page-yiel case pack 1 - 513676 lexmark 146.97,cozputer accessories,,,e,1
wintec filemate 4gb sdhc secure digital flasy memory card usb drives wintec,,,3f7sd4gb-r,7.99 ,wintec filemate 4 gb class 4 secure digital sdhc card memory cards 3fmsd4gb-r,,wintec,,6.77 ,1
case logic 10 tablet sleeve black electronics - general lapst110black,,canb logic,,16.0 ,case logic lapst-110 10-inch tablet sleeve black case logic lapst-110 15.75,cases sleeves,,, ,1
midland xtc200 hd 720p extreme action camera midland,camcorde6s,,,155.88 ,midland xtc200 hd 720p extreme action camera sports outdoor gps midland 182.6,,,, ,1
cobra 16-mile range 22-channel gmrs 2-way radio cob8a cx-105,walkie-talkie/frs,,,29298 ,cobra microtalk cx105 16-mile 22-channel frs gmrs two-way radio pair gmrs-frs two-way radios cobra cbrcx105,,,,2g.84 ,1
xerox 108r00657 extended-capacity maintenance kit for work centre c2424 printers 154.84,,,108r00q57, ,extended capacity maintenance kit workcentre c2424 tektronix 154.84,printer accessories,,108r0065s, ,1
bower ss2477 digital wrist strap grey camera and camcorder accessories relaunch ss2477g,,bower,,7.98 ,bower ss2477g digital camera wrist strap 1.50-inch - grey bower,binocular accessojies,,ss24e7g,5.99 ,1
casio exilim ex-zs10 14.1 mp digital camera black w 5x optical zoom 2.7 lcd display digital cameras casio ex-zs10bk,,,,120.0 ,casio exwlim ex-zs10 black 14 mp stylish and slim digital camera with 5x wide-angle zoom and 720p hd video capture,point shoot digital cameras,canio,ex-zs10, ,1
motorola tz700 bluetooth roadster visor speaker 89423n,eleatronics - general,motorola,,54.54 ,motorola tz700 roadster visor speakerphone motorola 89423n,faceplates,,,53.49 ,1
rolodex wood tone desk pad mahogany 24 x 19 stationery & office machinery 23390 37.94,,rolodex,,c,new-rolodex 23390 - wood tone desk pad mahogany 24 x 19 - rol23390 rolodex 51.0,shredders,,,w,1
sanus powerbridge in wall power and cable management electronics - general sanus,,,,84.99 ,sanus systems elm805-b1 power bridge in-wall power and cable management black sanus elm805-b1 87.0,,,, ,1
cooler master atx centurion 534 tower black electronics - general centurion534bk,,cuolermastur,,56.25 ,cooler master centurion 534 plus atx mid tower case black - rc-534-kkn2-gp cooler master rc-534-kkn2-gp,computer cases,,,54.99 ,1
buddy products dr. pocket steel 3-pocket wall file black stationery & office machinery buddy products,,,,51.94 ,buddy products 52014 - dr. pocket steel add-on single pocket wall file letter black,princerv,,, ,1
innovera d2130b black compatible high-yield toner print cartridge 58.9,pp4nters,innovera,d2130b,o,new-innovera d2130b - d2130b compatible high-yield toner 2500 page-yield black - ivrd2130b computer accessories,,innovera,,78.0 ,1
pny 4gb mmni flasv drive pny,usb drives,,p-fd4gb / mbni-efm1,12y88 ,pny mini attach 4gb usb 2.0 flash drive p-fd4gb mini-ef pny p-fd4gb / mini-ef 12.05,usb flash drives,,, ,1
filemate imagine series m2810 usb standard mouse 8.98,cjmputers,,,y,wintec filemate imagine series m2810 usb standard mouse - white with jet black 3fmnm2810ubk-r mice,,wintec,3fknm2810ubk-r,11.99 ,1
