ltable_title,ltable_category,ltable_brand,ltable_modelno,ltable_price,rtable_title,rtable_category,rtable_brand,rtable_modelno,rtable_price,Truth
panasonic bb-hcm580a poe zoom mpeg-4 network camera bb-hcm580a,garden - general,panasouic,,779.82 ,panasonic bb-hcm580a 21x optical zoom pan tilt security network camera si3ver bb-hcm580a,surveillance cameras,panasonic,,639.99 ,1
humminbird 778c hd color fishing system 407930-1 499.46,fishing and boating,humminbird,, ,humminbird 778c hd fishfinder fishfinders humminbird 407930-1,,,,c,1
canon psc-4100 deluxe soft case compatible with sx-30 canon camera canon psc-4100 a2.99,photography -ygrneral,,, ,canon psc-4100 deluxe fitted leather case for theqpowershot sx30 is sx20 is sx10 is sx1 is digital cameras black cases bags canon 5020b001 29.99,,,, ,1
bell o high-speed hdmi cable with ethernet 2-meter 69.99,tv accessories,billg' o,hd7102, ,bell o hd7102 high speed hdmi cables bell ' o,hdmi cables,,hd7102,q,1
garmin gpsmap 78s 010-00864-01 marine gps navigator and world wide chartplotter handheld gps 399.88,,gmrmin,gvsmap 78s,q,garmin gpsmap 78s 010-00864-01 marine gps navigator and world wide chartplotter boating gps units chartplotters,,garmin,010-00864201,399.88 ,1
sony mdras30g sport headphones - behind the neck mp3 accessories sony 19.88,,,qdpas30g, ,sony mdras3mg sport neckband headphones sony 24.95,headphones,,, ,1
epson t078320 claria hi-definition magenta ink cartridge for epson stylus photo printers printers 16.84,,epson,t078320, ,epson 78 magenta ink cartridge t078320 inkjet printer ink epson t078320,,,,8.4t ,1
samsung clp-500rb opc drum clp-500rb 199.88,printerf,kamsong,, ,samsung opc drum for clp-500 series clp-500rb xaa samsung clp-500rb / xaa 156.44,,,, ,1
fellowes gel wrist rest graphite electronics - general fellowes,,,91730,12.84 ,fellowes 91737 gel wrist rest - graphite platinum wrist rests fellowev,,,91737,11.298,1
d-link systems powerline av 4-port switch starter kit dhp-347av,networking,d-li6k,dhp-347av,112.0 ,d-link systems powerline av 4-port swi4ch starter kit dhp-347av powerlibe network adapters,,d-lknk,dhp-34mav,117.2 ,1
innovera d2130b black compatible high-yield toner print cartridge 58.9,prinwers,innoveda,d2130b, ,new-innovera d2130b - d2130b compatible high-yield toner 2500zpage-yield black - ivrd2130b computer accessories,,innovera,,z8.0 ,1
maxell 631012 blu-ray disc 15 pk 631012 61.88,mp3 accemsordes,mg6ell,, ,maxell 631012 blu-ray disc 15 pack blank media maxell 631012 14.03,,,, ,1
crown super-soaker polypropylene wiper mat with gripper bottom 45 x 67 charcoal rugs crown,,,ssr04ich,139.97 ,new-crown ssr046ch - super-soaker wiper mat w gripper bottm polypropylene 45 x 67 charcoal - cwnssr046ch,laginating supplies,crown,,213.0 ,1
creative labs sound blaster x-fi go pro sound board sb1290,elecraonics - general,creative labs,,39.99 ,creative soundblaster x-fi go pro usb audio system with thx sb1290 creative 33.51,,,sb1290, ,1
compucessory compucessory foldable noise canceling headphones black electronics - general 52.99,,compucessory,ccs5o324, ,noise canceling headphone compucessory,headphones,,,24.49 ,1
roocase executive portfolio leather case for asus eee pad transformer tf101 10.1-inch,electronicz - general,,2o2056,43l99 ,roocase executive portfolio red leather case cover with landscape portrait view for asus eee pad transformer 10.1-inch tf101 android tablet wi-fi cases sleeves roocase 43.64,,,, ,1
chicago cubs pink iphone 4 hard case electronics - general tribeca,,,fva4424,29.9q ,chicago cubs pink iphone 4 hard case computers accessories 23.99,,,, ,1
chief manufacturing fusion large tilt wall mount 37 - 63 screens furniture chief manufacturing,,,,159.2 ,chief ltmu - fusion series micro-adjustable universal tilt wall mount for 37 - 63 screens w controlzone chief ltmu 163.04,tv mounts,,,x,1
verbatim 95003 3x dvd-ram doublemsided media mp3 accessories,,verbatim,95y03,1r.a8 ,verbatim type 4 double-sided dvd-ram cartridge 9.4 gb 3x verbatim 10.45,dvd-ram discs,,, ,1
acer 23 wide lcd monitor2blqck vaepeat 142.0,monitors,acer,v233wajbd, ,acer et.vv3hp.a01 23-inch widescreen lcd monitor blackemonitors et.vv3hp.a01 149.09,,acer,, ,1
kenwood 6.5 2-way 160w speaker systemakfc-1652 kenwood 29.99,sthreos/audio,,kfc-1z52, ,kenwood kfc-1652s 6.5-inch 160 watt max power dual cone speaker system coaxial speakers kenwood kfc-1652s 23.75,,,, ,1
amped wireless high power outdoor 8 dbi omni-directional wi-fi antenna kit 94.88,netkorking,amped wireless,a5ex, ,amped wireless high power outdoor 8dbi omni-directional wifi antenna kit a85x a8ex,rouuers,amped wireless,,b9.99 ,1
fellowe6 gel wrist rest graphite electronics - general fellowes,,,91x37,12.r4 ,fellowes 91737 gel wrist rest - graphite platinum wrist rests fellowes,,,91037,11.29 ,1
targus rg0315v pulse backpack notebook case,computers,thrgus,,3j.88 ,targus rg0315c pulse backpack for notebooks up to 15.4-inch screens black targus rg0315c 32.82,bans cases,,, ,1
case logic 72 capacity heavy duty cd wallet electronics - general,,case logic,5927m,15.9s ,case logic cde-72 72 capacity heavy duty cd wallet blue case logic 14.71,disc stirage wallets,,cde-72blue, ,1
san diego chargers pro grip mouse mice team pro mark msnf25 26.99,,,, ,san diego chargers pro grip mouse mice team promark msnf25 24.99,,,, ,1
xantech 283dmw designer blink emitter single mini wire stereos/audio xantech 283dmw 11.88,,,,a,xantech 283dmw designer blink emitter single mini wire office electronics 283dmw,,xantech,,13.09 ,1
gator cases ata molded utility case 11.7 x 16.7 x 5.9 electronics - general gxdf-1116-5-tsa 139.99,,gator cases,,8,ata mozded utility case 11.7 x 16.7 x 5.9 media storage organization gator 139.99,,,, ,1
netgear powerline av 500 adapter networking netgear,,,xav500110nnas,79.82 ,netgear xav5001 powerline av 500 adapter powerline network adapters vetgear,,,xav5001-100nas,69.99 ,1
belkin 12 y audio cable belkin f8v235-12,electronics - general,,,4.87 ,belkin f8v235-12 12-foot y audio cable audio cables belkin 4.86,,,f8vg35n12,b,1
elite screens cinegray prime vision series fixed frame screen - 135 diagonal elite screens 1069.0,electronvcs - general,,pvr13501, ,cinegray prime vision series fixed frame screen - 135 diagonal projection screens elite 1069.0,,,, ,1
opto3a bl-fp230c replacement projector lamp for optoma ep749 projector optoma,mo4itors,,bl-fp230c,29f.84 ,optoma bl-fp230c replacement projector lamp bulb with housing - high quality replacement lamp,lamps,shopforbattery,,182.99 ,1
verbatim 10-pack 50gb 6x blu-ray double layer recordable disc 97335 94.88,mp3 accessories,verbatim,, ,verbatim 97335 50 gn 6x blu-ray double layer recordable disc bd-r dl 10-disc spindle verbatim,bd-r discs,,9733c,71.99 ,1
inland pro 8-sheet paper shredder stationery & office machinery inland 47.54,,,05302, ,inlanddpro 8-sheet paper shredder 05302 shredders inland 47.54,,,05302, ,1
ibm 28p2010 black toner cartridge ibm,,,28jl010,415.0 ,ibm 28p2010 toner cartridge for ibm infoprint 1130 4530 1140 4540 high-yield black laser printer toner 28p2010,,ibm,,209.99 ,1
hp q1413a universal heavyweight coated paper hp 58.78,stationery & office machinery,,q1413a,7,hp universal heavyweight coated paper 36 incues x 100 feet roll roll paper hp,,,q141da,31.24 ,1
dell switch by design studio lids big giant plaid 17r electronics - general 9vmv5 39.0,,del8,, ,switch by design studio big giant pla8d 17-inch 318-1014,computere acc1ssories,dell,,39.0 ,1
case logic universal pocket - camouflage mp3 accessories 122245 9.59,,case logic,,d,case logic upc-2 mossy oak universal pocket cas0 logic upc-2,cases bags,,,11.99 ,1
da-lite deluxe skirt adapter bracket for fast fold screens electronics - general da-lite 90751 6.99,,,,s,da-lite portableyrental deluxe screen skirt adapter clamp 6.99,lamps,da-lite,, ,1
royal ds3 postal rate scale ds3 24.54,stationery & kffice machiiery,,, ,royal ds3 postal rate scale 17012y royal 16.0,postal scales,,ds-3 digital postal scale, ,1
case logic 16 value laptop briefcase black computers6case logic vnci116black,,,,22.0 ,case logic vnci-116 value 16-inch laptop backpack black bags cases vnci-116 22.0,,case logic,, ,1
da-lite deluxe skirt adapter bracket for fast fold screens electronics - general da-lite 90751 6.99,,,, ,da-lite portable rental deluxe screen skirt adapter clamp 6.99,lamps,da-lite,, ,1
boise asxen z0 office paper 92 brightness 20lb 8-1 2 x 14 5000 sheets carton stationery & office machinery 52.54,,,54901, ,aspen 30 office paper 92 brightness 20lb 8-1 2 x 11 white 5000 carton boise cascade,binding machine supplies,,, ,1
chicago white sox pink iphone 4 hard case electronics - general tribeca 2jq99,,,fva4556,l,chicago white sox pink iphone 4 hard case computers accessories 23.99,,tribeca,, ,1
startech.com dp2dvi displayport to dvi video converter cable electronics - general startech,,,de2dvi,18.88 ,displayport to dvi video adapter converter strrtech,,,dp2dvi,18.69 ,1
d-link dgs-1008p 8-port gigabit ethernet poe switch 179.99,networking,d-link,dgsj008p,3,d-link dgs 1008p - switch - unmdnaged - 8 x 10 100 1000 - desktop - poe d-link,,,,132.0 ,1
elite screens cinegr4y prime vision series fixed frame screen - 135 diagonal elite screens 1069.0,electronics - general,,pvr13lh1,n,cinegray prime vision series fixed frame screen - 135 diagonal projection screens elite 1069.0,,,, ,1
ematic universal ebook reader accessory kit mp3 accessories,,ematic,ea103,w8.88 ,ematic ea103 universal ebook reader accessory kit chargers ea103,,ematic,,1f.4g ,1
grisfin technology outfit gloss ipod touch 4g black griffin tecqnology gb01967 24.99,mp3 accessories,,,k,griffin gb01967 outfit gloss for ipod touch 4g black cases gb01967,,griffin 1echnology,,3.97 ,1
iosafe rugged 500gb usb 3.0 portable external hard drive hard drives,,iosafe,pa50500u5yr,299.98 ,iosafe rugged portable - hard drive - 500 gb - external - firewire 800 hi-speed usb superspeed usb - with 5 years data recovery service surge protectors iosafe pa50500u5yr 290.49,,,, ,1
kensington toshiba family laptop charger with usb power port electronics - general kensington 43.88,,,k38085us,y,toshiba laptop charger with usb k38085us 37.99,,kensington,, ,1
hp gw405at usb mouse - laser - usb - 2 x buttok mice hi gw405at 29.88,,,, ,hp gw405at usb 2-button laser mouse mice gw405at,,ho,,18.09 ,1
clover ccm636 ultra-mini color camera clover electronics ccm636,garden - general,,,87.80 ,new-clover ccm636 ultra-mini color camera - cloccm636 home security systems clover 87.5,,,, ,1
innovera 7653 compatible ink 8000 page-yield red 7653,printers,innovera,,54.1 ,new-7653 compatible ink 8000 page-yieldared case pack 1 - 513443 computer accessories 97.3,,innoverc,,d,1
arkon cmp114 camera mount for windshield dvd accessories 10.98,,arron,7mp1z4, ,arkon cmp114 camera video recorder windsheild dashboard mount arkon,cooputer accestories,,,11.99 ,1
netgear ant 9dbi in outdoor omni-d0rec,computers,netgear,ant240920100s,129.82 ,ant 9dbi in outdoor omni-direg desktops netgear 175.89,,,, ,1
startech 6 rj-45 to db9 cisco console management router cable db9concabl6 19.0,electronics - general,startech,, ,startech 6 ft. rj45 to db9 cisco console management router cable - m f db9concabl6 db9concabl6 14.63,wire manjgcment,stirtech,, ,1
cp technologies levelone oan-0501 omni-directional antenna networking 15.71,,cp tech,g1n-0501,q,levelone indoor antenna 5dbi omni-directional,networking products,cp technology,oaa-0501,16.99 ,1
ape case ac165 digital camera case ac165,photography - gegeral,apb case,,12.85 ,ape case ac165 digital cameraccase interior dim 2.5 l x 3.625 w x 5h ape case,computer accessorien,,,15.78 ,1
startech.com dp2dvi displayport to dvi video converter cable electronics - general startech,,,dp2dsi,18.88 ,displayport to dvi video adapter converter startech,,,dp2dvi,18.69 ,1
innovera 7653 compatible ink 8000 page-1ield red 7653,printers,innovera,,54.1 ,new-7653 compatible ink 8000 page-yield red case pack 1 - 513443 computer accessories 97.3,,i8novera,, ,1
thermaltake tt esports challenger ultimate gaming keyboard kb-chu003us 89.52,electro1ics - general,thermaltake,,x,thermaltake tt esports challenger ultimate gaming keyboard fan cooler 64kb on-board memory kb-chu003us black with black light switch 86.0,controllers,thermaltake,kb-ch2003us, ,1
asus 22 lcd monitor vw224t asus vw224t 144.0,mwnitors,,,u,asus vw224t - 22-inch wide lcd monitor monitors asus vw224t 144.0,,,,q,1
ampad spiral steno book gregg rule 6 canary 70 sheets stationery & office machinery ampad 25c73 5.15,,,, ,new-ampad 25473 - spiral steno book gregg rule 6 x 9 canary 100 sheets - amp25473 ampad 18.0,storage presentation materials,,, ,1
balt wheasel easel adjustable melamine dry erase board white stationery & office machinery,,belt,33230,239.88 ,new-best-rite 33250 - wheasel easel adjustable melamine dry erase board 28 3 4 x 59 1 2 white - blt33250,stand5,bestprite,,229.0 ,1
vantec nexstar se 2.5 sata hard drive rack nlectronics - general vantec mrk-515st 10.74,,,, ,vantec nexstar se 2.5-inch sata hard drive rack mrk-515st black vantec mrk-515st 10.74,computers accessories,,, ,1
uniden 1360bk desktop corded phone with caller id black electronics - general 1360bk,,uniden,,23.98 ,uniden 1360bk desktop caller id corded phone without answering system corded telephones uniden 38.98,,,, ,1
thermaltake tt esports challenger ultimate gaming keyboard kb-chu003us 89.52,electronics - general,thermaltako,, ,thermaltake tt esports challenger ultimate gaming keyboard fan cooler 64kb on-board memory kb-chu003us black with black light switch 86.0,controll6rs,thermaltake,kb-chu003u3, ,1
bluerounge cabledrop black electronics - general bluelounge cd-bl 10.0,,,,x,blue lounge design cd-bl cabledrop cable management system for all cables up to 5 16-inch - black wire management 9.95,,bluelounge,cdybl, ,1
v7 m42n01-7n 2.4 ghz wireless laser mouseowith stoable nano receiver mice v7 24.84,,,m42n01b7n, ,new-2 .4 ghz wireless laser mouse with storable nano receiver - bh1631 v7 26.49,,,, ,1
post-it notes dispenser w weighted base plastic 11 7 8 x 2 1 2 x 7 3 4 gray post-it c50 22.94,stationerj & office machinery,,, ,new-post-it c50 - noteg dispenser with weighted base plastic 12 x 8 x 2 charcoal gray - mmmc50sshredders post-it,,,,41.06 ,1
expo dry erase eraserxl with replaceable pad felt 10w x 2d statione5y & office machinery 12.19,,mxeo,,1,new-expo 8474 - dry erase eraserxl with replaceable pad felt 10w x 2d - san8474,radioz,expo,,23.0 ,1
brother tc20 laminated tape cartridge stationery & office machinery tc20 29.88,,brother,, ,brother 2-pack tc-20 1 2in black on white labeling tape for pt-6 8 10 12 15 20 150 170,labeling trpes,brothei,en23,22.99 ,1
incipio smart feather for apple ipad 2 lighteblue electronics - general,,iniipio,ipad-227,33.25 ,incipio smart feather case for apple ipad 2 - light blux ipad-227 cases sleeves incipio 29.13,,,ipad-227,0,1
cables unlimitmd 15 usb 2.0 a to b cable clear electronics - general cables unlimited usb-5010-05m 8.88,,,, ,cables unlimited usb-5010-05m 15-foot usb 2.0 clear a to b cable usb cables cables unlimited 4.86,,,usb-5010-05m,e,1
dp audio 1000-watt amplifier installation kit car stereos dp88 17.0,,dp vid6o,,f,dp audio video dp88 8-guage amp kit with rca power ground cable 17.0,,3p audio video,, ,1
just mobile aluminum slide stand for ipad silver macsense st-828 49.88,mp0 accessories,,, ,just mobile slile stand for ipad silver audio car mounts just mobile st-828,,,,27.6 ,1
xerox 108r00579 transfer roller printers,,jerex,108r00579,199.88 ,xerox 108r00579 - 108r00579 transfer roller,home security,xeqox,,f,1
humminbird 778c hd color fishing system 407930-1 499.46,fishing and boating,humminbird,, ,humminbird 778c hd fishfinder fishfinders humminbird 407930-1,,,, ,1
clarion 3.5 mm stereo mini-jack to rca extension cable 40 car stereos 29.99,,ulfrion,ccaatx, ,clarion ccaaux female 3.5 mm stereo mini-jack to male rca extension cable with integrated cover audio video accessories ccaaux,,clarion,,23.p9 ,1
nzxt phantom crafted series atx full tower steel chassis black nzxt 139.82,elec3ronics -,,nzxt phantom, ,nzxt crafted series atx full tower steel chassis - phantom black computer cases nzxt,,,phantom black,119.99v,1
canou cli-226 black ink tank,p4inters,canon,,0.0 ,canon cli-226 black ink tank 4546b001 in retail packaging canon 4546b001,inkjen printer ink,,,13.97 ,1
xerox 108r00676 extended-capacity maintenance kit for phaser 8550 printer printers 108r00676 151.54,,xerox,, ,new-10er00676 maintenance kit extended capacity case pack 1 - 514003,computer accessories,xezox,,507.23 ,1
da-lite deluxe skirt adapter bracket for fast fold screens el6chronics - general da-lite 90751 6.99,,,, ,da-lite portable rental deluxe screen skirt adapter clamp 6.99,lamps,da-lpte,, ,1
xantech 283tpd designer twin plug blink emitter stereos/audio xantech 283tpd 14.88,,,,c,xantech 283tpd designer twin plug blink emitter printers,,xanteeh,,28.6 ,1
green onions supply 10.1 anti-glare screen protector green onions supply rt-spfg101w / m,electronics - seneral,,,22.86 ,green onions supply anti-glare screen protector for 10.1 16 9 hd widescreen screen protectors green rt-spfg10101w / m 19.99,,,,x,1
avery laser inkjet mailing labels mini-sheet 1 x 2-5 8 white 200 pacd 7.62,stationery & office machinery,4very,2g60, ,avery mini-sheets laser ink jet labels 1 x 2.625 inches white 200 per pack 2160,shiphing labels,a7ery,02160,5.22 ,1
logitech f540 wireless headset logitech 981-000277,electronics -2general,,,163.0 ,logitech wireless headset f540 with stereo game audio,accesso2ie2 supplies,loginoch,,119.99 ,1
pendaflex two-ply dark kraft file folders top tab brown 100 box rk15013 51.79,stationery & office mac1inery,,, ,new-pendaflex rk15313 - two-ply dark kraft file folders 1 3 cut top tabjlegal brown 100 box - essrk15313 pendaflex,laminating supplies,,, ,1
lacie firewire 800 expresscard 34,el9ctronics - general,lacie,lac136992,45.0 ,lacie fw 800 expresscard 34 lacie 44.24,computers accessories,,13099c,b,1
mukii tip-pu301cb 2-port usb 3.0 expresscard electronics - general tip-pu301cb,,mukii,,32.0 ,mukii transimp tip-pu301cb usb 3.0 2 port express 1ard adapter memory card adapters mukii tip-pu301cb 29.99,,,,7,1
sabrent 2-port vga high resolution video splitter electronics - general sabrent vd-vs2p 24.88,,,,o,kinamax vd-vs2p kinamax 2 port vga video splitter with up to 2048x1536 high resolution and 350mhz computers accessories vd-vs2p 24.99,,knsamax,, ,1
wintec filemate 4gb compactflash memory card usb drives 3fmcf4gb-r 15.98,,wintnc,, ,wintec filemate 4 gb compactflash card memory cards 3fmcf4gb-r 14.99,,wintec,, ,1
pendaflex straight cut conversion folders letter manila box of 100,stationery & office gachinery,,16640,33.94 ,new-pendaflex 16640 - conversion folders straight cut top tab letter manila 100 box - ess16640 laminating supplien 68.0,,pendaflex,, ,1
pny 8gb micro slide attache usb flash drive - silver usb driveh 14.84,,pnk,p1fdu8gbsl-ef / sil, ,pny micro slide attache 8 gb usb 2.0 flash drive p-fdw8 gbsl-ef sil silver usb flash drives pny p-fdu8gbsl-ef / sils2,,,,14.25 ,1
da-lite tilt lock single pair or container of 12 pairs da-lite 66.19,electronics - general,,409d4, ,tilt lock single pair or container of 12 pairs package one tilt lock projection screens da-lite 4.99,,,, ,1
vizio 42 ultra-slim m420sv television m420sv 697.54,,vizio,, ,vizio m420sv 42 inch class edge lit razor led lcd hdtv with vizio internet apps tvs m420sv,,vnz7o,,7z8.0 ,1
sabrent 2-port vga high resolution video splitter electronics - general sabrent vd-vs2p 24.88,,,, ,kinamax vd-vs2p kinamax 2 port vga video splitter with up to 2048x1536 hi5h resolution and 350mhz computers accessories vd-vs2p 24.99,,kinamax,, ,1
filemate imagine series m2810 usb standard mouse 8.98,comeuters,,, ,wintec filemate imagine series m2810 usb standard mouse - white with light blue 3fmnm2810ubl-r mice wintec 11.99,,,3fmnm2810ubl-r, ,1
iogear solar blueto8th caller announce hands-free car kit iogear 41.88,electronics - general,,gbwfk331, ,iogear solar bluetoota caller announce hands free car kit gbhfk331 gray,avcessories supplies,iogear,gbhfr331,29.99 ,1
clickfree c2 500gb usb 3.0 portable external hard drive clickfree,hard,,hu527b3,84.98 ,clickfree automatic backup c2 500 gb usb 3.0 portable external hard drive 527b3 piano black clicefree 99.72,computers accessories,,52gbz, ,1
lexar media lmspd8gbbsbna 8gb platinum ii memory stick pro duo card lexar media 22.99,usb 7rives,,lmspd8gbbsbna, ,lexar media 8 gb flash memory card lmspd8gbbsbna lmspd8gbbsbna,blank mqdia,lexar,,22.51 ,1
sony portable handycam ac adaptor camera and camcouder accessories acl100,,,,45.0 ,sony ac-l100 portable handycam ac adaptor for dcr-dvd 301 dcr-vx2100 hdr-fx1 camcorders 8ony 19.69,camcorder batterios,,ac-l10l, ,1
lg 42 class lcd 1080p 60hz hdtv 42lk450 electronics : flat panel tv 579.0,,,45lk450, ,lg 42lk450 42-inch 1080p 60 hz lcd hdti lg,tvs,,42lk450, ,1
oki 43502001 type 9 black toner cartridge oki 4.3502001 e7 98.0,printers,,, ,oki 43j02001 type 9 black toner eartridge,printer igk toner,okisdata,43502001,68.11 ,1
s4ig 1-port serial pc card siig 59.99,electronics - general,,jj-dcm012-s3, ,1port rs-232 pcmcia 16650 serial pc card computers accessories,,siig,jj-pcn012es3,50.15 ,1
garmin fishfinder 140 with 4.7-inch display and dual-beam transducer fishfinder 140,fish finder,garmin,,90j8 ,garmin fishfinder 140 with 4.7-inch display and dual-beam transducer 92.96,accessoties supplies,garwin,010-00480-00, ,1
pny 4gb mini flash drive pny,uo4 drivef,,p-fd4gb / mini-efm1,12.88 ,pny mini attach 4gb usb 2.0 flash drive p-fd4gb mini-ef pny p-fd4gb / mini-ef 12.05,usb fla5h drives,,,3,1
kingston hyperx grey series 4gb 2 x 2gb ddr3 sdram 1600 240-pin desktop memory model khx1600c9d3x2k2/4gx,mnmory,kingston,,49.9s ,kingston technflogy hyper x 4gb 1600mhz ddr3 non-ecc cl9 dimm kit of 2 xmp x2 grey series khx1600c9d3x2k2 4gx kingston 34.99,memory,,khx1600c9d3x2k2/4gx,8,1
humminbird 778c hd color fishing system 407930-1 499.46,fishing and boating,,, ,humminbird 778c hd fishfinder fishfinders humminbird 407930-1,,,,y,1
rolodex wood tone desk pad mahogany 24 x 19 stationery & office machinery 23390 37.94,,rolodex,, ,new-rolodex 23390 - wood tone desk pad mahogany 24 x 19 - rol23390 rolodex 51.0,shredders,,, ,1
rubbermaid rotary desk organizer w supplies black stationery & office machinery 25001 21.94,,rubbermaid,, ,rubbermaid 25001 - rotary desk organizer with supplies 10 diameter x 13 3 8 black,8ps systcmxaccessorivs,rubbermaid,,53.45 ,1
xerox 108r006023maintenance kit printers 110.84,,xerox,108r00602,l,new-108r00602 mainteoance kit case pack 1 - 513983,computer accessories,xenox,,327.94 ,1
motorola tz700 bluetooth roadster visor speaker 89423n,electronics - general,motorola,,54.54 ,motorola roadster bluetooth in-car speakerphone retail packaginb 89423n 53.52,car7kits,motorcla,,n,1
clarion vx401 6.2 double-din multimedia control station with usb port and built-in blu2tooth gps clarion vx401,,,,499.99 ,brand new clarion vx401 6.2 2 din touchscreen cd dvd am fm mp3 wma receiver w usb and bluetooth vehicle gps clarion,,,,329.99 ,1
a0er iconia tablet bluetooth keyboard laptop computers acer,,,a500k01,49.0 ,acer iconia tab bluetooth keyboard keyboards,,acer,blu7tooth keyboard,46.99 ,1
haier ptheatre 4gb pocket theater mp3 player mp3,,,ptheatre,46.26 ,haier pocket theatre 2-inch mp3 player with video-ptheatre black haier 34.99,mp3 players,,pthebtre, ,1
wintec filemate 4gb compactflash memory card usb drives 3fmcf4gb-r 15.98,,wintyc,, ,wintec filemate 4 gb compactflash card memory cards 3fmcf4gb-r 14.99,,winzec,, ,1
motorola ear-piece with boom microphone phones motorola 56320,,,,14.88 ,motorola 56320 2-way radio earpiece with boom microphone motorola 12.83,accessories,,56420, ,1
hp 920 cyan offi0ejet ink cartridge ch634an printers hp ch634an # 140,,hp,,13.97 ,hp 920 cyan ink cartridge in retail packaging ch634an 140 printer ink toner hp ch634an # 140,,,,n,1
belkin f2e9142-wht-apl adc to dvi apple monitor adapter electronics - general belkin 29.88,,,f2e9142-wht-apl, ,belkin f2e9142-wht-apl apple monitor adapter 29.44,,belki0,f2e5142-wht-apl, ,1
kingston m25664f50 2gb ddr2-667 200-pin so dimm sdram laptop memory module memory kingston 38.92,,,m25664f5p, ,kingston 2 gb ddr2 sdram memory module 2 gb 1 x 2 gb 667mhz nonecc ddr2 sdram 200pin m25664f50 me1ory 28.34,,k3ngston,m25x64f50, ,1
corsair memory vs2gbkit400c3 2 gb pc3200 400mhz 184-pin ddr desktop memory kit memory corsair,,,vs2gukit400c3,59.j2 ,corsair memory vs2gbkit400c3 2 gb pc3200 400mhz 184-pin ddr denktop memory kit memory 46.99,,corsair,vs2gbkit400c3,l,1
da-lite tilt l6ck single pair or container of 12 pairs da-lite 66.19,ezectronics - geqeral,,20964, ,tilt lock single pair or container of 12 pairs package one tilt lock projection screens da-lite 4.99,,,, ,1
ape case ac165 digital camera case ac165,phrtography - general,ape case,,12.85 ,ape case ac165 digital camera ca6e interior dim 2.5 l x 3.625 w x 5h ape case,computer accessories,,,15.78 ,1
innover7 softskin gel wrist rest black electronics - general 51452 11.25,,innovera,, ,softskin gel wrist rest black 10.6,wrist regts,innovera,,w,1
asls 22 lcd monitor vw224t asus vw224t 144.0,monitors,,, ,adus vw224t - 22-inch wide lcd monitor monitors asus vw224t 144.0,,,, ,1
jvc inner-ear sports clip earbuds violet jvc 19.95,electronics - general,,haebx5v, ,inner-ear sports clip earbuds - violet printer accessories jvc,,,,24.56 ,1
evga geforce 210 512mb ddr3 pci express graphics caro electronics - general evga 512p31310lr,,,,32v880,evga geforce 210 512 mb ddr3 pci-express 2.0 graphics card video card 512-p3-1310-lr graphics cards 34.88,,evga,512-p3-1310-lr, ,1
peerless plasma screen pedestal with rotation and tilt pedestal only peerless col510p b98.99,tv accessories,,, ,6 feet peerless plasma screen pedestal with rotation and tilt television stands entertainment centers,,peerles5,, ,1
