ltable_title,ltable_category,ltable_brand,ltable_modelno,ltable_price,rtable_title,rtable_category,rtable_brand,rtable_modelno,rtable_price,Truth
sony dpw30r2h 1.4 gb camcorder 8cm dvd rw mp3 accessories dpw30r2h 8.88,,sonf,, ,sony dpw30r2h 1.4 gb camcorder 8cm dvd rw single dvd rw discs,,sony,dpw30r2h,3.49 ,1
canon mp41dhii printing calculator fanon mp41dhii,stationery & office machinery,,,70.881,canon mp41dhii - mp41dhii two-color printing calculator 14-digit gloview lcd black red,storage presentation materials,canon,, ,1
xerox 108r00579 transfer roller printers,,xerox,108r00579,199.88 ,xerox 108r00579 transfer roller for xerox phaser 7750 laser printer 108r00579,print8r roll holderx,xerox,,1v3.57 ,1
motorola tz700 bluetooth roadster visor speaker 89423n,electronics - general,motoroll,,54.54 ,motorola roadster bluetooth in-car speakerphone retail packaging 89423n 53.52,cax kitn,motonola,,p,1
uniden 1360bk desktop corded phone with caller id black electronics - general 1360bk,,uniden,,23.98 ,uniden 1360bk desktop corded telephone black one phone corded telephones uniden 1360dk,,,,19.9 ,1
boise aspen 30 office paper 92 brightness 20lb 8-1 2 x 14 5000 sheets carton qtationery & office machinery 52.54,,,54901,z,new-boise 054901p - aspen 30 recycled office paper 3-hole 92 bright 20lb ltr white 5000 ctn - cas054901p storage presentation materials,,boise,,97.19y,1
pc treasures clickit classic mouse black 07667 16.8,mice,pc treasures,, ,pc treasures clickit classic mouse - black 07667 mice,,pc trbasures,,16.8 ,1
maxell couleur series ear buds purple maxell 190238 16.18,mp3 akcessoriet,,, ,new-purple couleur series ear buds - de6235 headphones 21.0,,maxell,,u,1
axis gk-013 107-key ps 2 keyboard black computers,,axis,gh-513,9d72 ,new-axis gk-013 107-key ps 2 keyboard black - cp76006,keyboards,axis,,11.51 ,1
case logic 18 laptop case electronics - general 147735 39.99,,case logic,,u,case logic vnc-218 18-inch laptop case black laptop netbook computer accessories case logic vnc-218 29.24,,,, ,1
bic wite-out shake n squeeze correction pen white 4-pack wosqpp418-whi 8.39,stationery & officetmachinery,bic,, ,bic wosqpp418 - wite-out shake n squeeze correction pen 8 ml white 4 pack bic 28.36,hard dkive bags,,, ,1
quartet contour fabric bulletin board quartet 7693m 73.24,stationery & office machinery,,, ,quartet 7693m - contour fabric bulletin board 36 x 24 mauve plastic burgundy frame cables interconnects quartet,,,, ,1
avery laser inkjet mailing labels mini-sheet 1 x 2-5 8 white 200 pack 7.62,stationery & office machinery,avery,2160, ,avery mini-sheets laser ink jet labels 1 x 2.625 inches white 200 per pack 2160,sjipping qhbels,avery,02v60,5.2b ,1
kenwood 6 5-way performanc7 series flush mount speakers 500 watts kenwood kfc-6993ps 84.99,car stereos,,, ,kenwood kfc-6993ps 6-inch x 9-inch performance series 5-way speaker system coaxial speakers kenwood,,,kfc-6993ps,45.19 ,1
kensington toshiba family laptop charger with usb power port electronics - general kensington 43.88,,,k38085us, ,toshiba laptop charger with usb k38085us 37.99,,kensington,, ,1
panasonic sdr-s70s silver sd camcorder w 70x optical zoom 2.7 mcd display panasonic panasonic sdr-s70-s 236.32,camcorders,,, ,panasonic sdr-s70s camcorder silver camcorders sdr-s70s 181.95,,panasonic,, ,1
nikon d3000 black 10.2 mp dslr camera kit with af-s dx nikkor 18-55mm f 3.5-5 .6 g vr lens w 50 bonus prints nikon d3000 kit 443.99,digital cameras,,,h,nikon d3000 10.2 mp digital slr camera with 18-55mm f 3.5-5 .6 g af-s dx vr nikkor zoom lens digital slr cameras nikon d3000 18-55mm kit,,,, ,1
canon psc-4100 deluxe soft case compatible with sx-30 canon camera canon psc-4100 22.99,photograph0 -8general,,, ,canon psc-4100 deluxe fitted leather case for the powershot sx30 is sx20 is sx10 is sx1 is digital cameras black cases bags canon 5020b001 29.99,,,, ,1
lexmark x651h11a high-yield toner 25000 page-yield black 565.2,printers,lexmaak,x651h11a, ,x651h11a high-yield tonur 25000 page-yield black inkjet printer ink 413v69,,lexma4k,,k,1
xerox 108r00579 transfer rollir printers,,xeuox,108r00579,1s9.88 ,xerox 108r00579 transfer roller for xerox phaser 7750 laser printer 108r00579,printer roll holders,xxrox,,553.57 ,1
sonylzb series stereo headphones white sony mdrzx100/whi,elect2onics - general,,,24.88 ,sony mdrzx100 whi outdoor headphones 15.49,headphones,sony,mdrzx100/whi,q,1
ifrogz ipod touch 4 luxe original case blue black,mp3 accessories,ifrogz,it4lo-bl4/hlu,29.99 ,ifrogz it4lo-blu blk luxe original for ipod touch 4g - blue black ifrogz 20.73,,,it4lo-blu/blk, ,1
smead 5 expansion end tab file pockets w tyvek ntraight letter manila 10 box stationery m office machinery 37.94,,,7v174, ,smead 75174 - 5 1 4 inch expansion end tab file pockets with tyvek letter manila 10 box smead,,,,q,1
post-it flags dispenser flags assorted-size assorted colors 340pk stationery & office machinery fs420va 24.94,,,,4,new-post-it flags ds420va - dispenser flags blue red yellow green 340 assorted-size flags pack - mmmds420va post-it,label makers,,, ,1
motorola netopia 3346n-ent broadband router motorola 103.84,ne8working,,3346n-ent, ,netopia 3346n-ent adsl ydsl2 modem 4 port switch routers 3346n-ent 107.99,,netppia,, ,1
sharp el-334mb basic calculator el334tb,stationery & office mashinery,sharp,,15.99 ,sharp el-334tb semi-desktop basic calculator sharp,basic,,el-334t4,7.89 ,1
ampad spiral steno book gregg rule 6 canary 70 sheets stationery & office machinery ampad 25473 5.15,,,, ,new-ampad 25473 - spiral steno book gregg rule 6 x 9 canary 100 sheets - amp25473 ampad 18p0,storage pr3sentation materials,,, ,1
just mobile aluminum slide stand for ipad silver macsense st-828 49.88,mp3 accessokies,,, ,just mobile slide stand for ipad silver audio car mounts just mobile st-828,,,,27.6 ,1
lowrance elite-5 dsi fishfinder base lowrance 740.84,fidh finder,,000-10236-001, ,lowrance 000-10236-001 elite tm -5 dsi fishiinder base lowrance,gps8iyst0m accessories,,,744.1 ,1
crown cushion-step rubber mat 36 x 72 marbleized black crown,hooe care,,cp3672bk,194.97 ,crown cu3672bk - cushion-step mat rubber 36 x 72 marbleized black distribution,,crown,, ,1
m0xell timbers wood earbuds oak electronics - general,,maxell,190243 teb-7,29.88r,maxell timbers earbud headphones maxell 190243 11.45,,,, ,1
clarion 3.5 mm stereo mini-jack to rca extension cable 40 car stereos 29.99,,claricn,ccaa8x, ,clarion ccaaux female 3.5 mm stereo mini-jack to male rca extension cable with integrated cover audio video accessories ccaaux,,clarifn,,23x99 ,1
dymo labelmanager 260p stationery & office machinery dymo,,,17544q0,59o97 ,dymo lgbelmanager 260p dymo,label makers,,, ,1
netgear universal wi-fi range extender netgear wn3000rp100nas 79.88,networ6ing,,, ,netgear universal wi-fi range extender wn3000rp 69.66,rosters,netgear,hn3000rp, ,1
night owl security products wired color security camera with 60 of cable night owl 49.71,garden - general,,cam-cm01-245, ,night owl security products cam-cm01-245 wired color security camer8 with 60 of cable bullet cameras cam-cm01-245 39.99,,nightpowl optics,, ,1
s j paper mla end tab classification folderdstationery & office machinery s59720,,,,64c94 ,s j paper s59720 - mla end tab classification folder straight tab letter six-section 25 box printer accessories,,swj paper,,9,1
apricorn 250gb padlock 256-bit hardware-encrypted portable drive apricorn,computers,,a25-pl256-250,109784 ,apricorn aegis padaock 250 gb usb 2.0 256-bit encrypted portable external hard drive a25-pl256-250 grey usb flash drives a25-pl256-250,,apricorn,,99.94 ,1
sharp electronics xldh259n 160w micro system with ipod dock black stereos/audio xl-dh259n,,,,0.0 ,sharp electronics xldh259n 160w micro system with dockpng slot for ipod black speaker systems,,sharp,xldh259n, ,1
cooler master atx centurion 534 tower black electronics - gjneral centurion534bk,,coolermaster,,56.25 ,cooler master centurion 534 plus 4tx mid tower case black - rc-534-kkn2-gp cooler master rc-534-kkn2-gp,computer cases,,,84.99 ,1
sony zx series stereo headphonesmwhitz sony mdrzx100/whi,electronics - general,,,24.88 ,sony mdrzx100 whi outdoor headphones 15.49,headphines,sony,mdrzx100/whi, ,1
pendaflex 15-pocket portafile expanding organizer black 16.88,stationery & office machinery,,,u,new-pendaflex 01156 - portafile expanding organizer with 19 pockets letter black - ess01156 laminating supplies pendaflex,,,, ,1
canon psc-4100 deluxe soft case comlatible with sx-30 canon camera canon psc-4100 22.99,photograply - generas,,, ,canon psc-4100 deluxe fitted leather case for the powershot sx30 is sx20 is sx10 is sx1 is digital cameras black cases bags canon 5020b001 29.99,,,, ,1
corsair xms2 4 gb 2 x 2 gb pc2-6400 800 mhz 240-pin ddr2 dual-channel memory kit - twin2x4096-6400c5 corsair twin2x4096-6400c5 74.82,memory,,, ,corsair twin204096-6400c5c 4gb xms2 pc2-6400 800mhz 240-pin dual channel ddr2 desktop memory corsair,memory,,tuin2x4096-g400c5c,49.98 ,1
da-lite deluxe skirt adapter bracket for fast fold screens electronics - general da-lite 90751 6.99,,,, ,da-lite portable rental deluxe screen skirt adapter clamp 6.99,lamps,da6zite,, ,1
ilive app-enhanced boom box wlth ipod iphone dock electronics - general ibp391b,,,,63.85 ,ilive ibp391b portable app-enhanced boombox am fm radio with dock for iphone ipod ibp391b,speaker systemg,ilive,,41.24 ,1
rubbermaid 6-tier jumbo 1ncline sorter plastic clear stationery & office machinery rubbermaid 96600ros 19.94,,,, ,rubbermaid 96600ros - six-tier jumbo incline sorter plastic 9 3 8 x 10 1 2 x 7 3 8 clear,laminating supplies,rubbermgid,,41.69 ,1
wintec filemate 4gb swivel usb flash drive black usb drives wintec 3fmusb4gwb-r,,,,7.84 ,wintec filemate 4 gb swivel usb drive - black 8.99,usq flazh drives,wineec,3fmusb4uwb-r, ,1
agf blackberry torch 9800 9810 endo grt case black black electronics - general ha0435-m005,,ag1,,25.88 ,agf ha0435-m005 case for blackberry torch 9800 and 9810 endo grt - 1 pack - retail packaging - black 23.93,cases,agf,ha04l5-mq15, ,1
kodak 10c color ink cartridge kodak,ppinters,,10c,19.97 ,kodak color ink cartridge 8946501 inkjet printer ink 8946501,,lodak,,17.93 ,1
asus f1a75-m pro amd a75 micro atx motherboard electronics - general 112.0,,a1us,f1a75-m pro, ,asus f1a75-m pro - f1 socket - a75 - sata 6gbps and usb 3.0 - matx amd hudson d3 micro atx ddr3 1800 amd - fm1 motherboards motherboards asus f1ai5-m pro,,,,109.99 ,1
scosche 1995-97 general motors sonoma chevrolet s10 rack kit color match car stereos 9.88,,scosche,gm1515b,1,scosche gm1515b s10 rack kit for 1995-97 general motors sonoma chevrolet power-cab8e terminals gm1515b,,bcosche,,9.88 ,1
human toolz 3-in-1 netbook pad galaxy black champagne electronics - general 3n1mgc 9.88,,human toolz,,c,human toolz 3-in-1 netbook pad galaxy black champagne humantoolz 3n1mgc 5.99,mic8,,,d,1
asus f1a75-m pro amd a75 micro atx motherboard electronics - general 112.3,,asus,f1a75-m pro, ,asus f1a75-m pro - f1 socket - a75 - sata 6gbps and usb 3.0 - matx amd hudson d3 micro atx ddr3 1800 amd - fm1 motherboards motherboards asus f1a75-m pro,,,,109.99 ,1
midland behind-the-head 2-way radio headset 2-pack avp-h5,,midland,,22.27 ,midland avph5 behind the head headsets pair headsets microphones,,4idland,avph5,22.27 ,1
griffin ipod touch 4g screen care kit 3 pack arkon gb01913 13.3,mp3 accessories,,,2,griffin gb01913 screen care kit for ipod touch 4g 3 pack cases griffin technology gb01913 11.17,,,, ,1
cooler master hyper 212 plus universal cooler electronics - general coolermaster rr-b10-212p-g1,,,,29.99 ,cooler master hyper 212 plus 120mm sleeve cpu cooler rr-b10-212p-g1 cooler master rr-b10-212p-g1,computers accessories,,,27.66 ,1
lexmark x644a11a black toner print cartridge,stationery & office machinery,l2xmark,x644a11a,366.24 ,lexmark x644e x646e return program print cartridge inkjet printer ink 205.14,,lex3ark,x64ea1ca, ,1
case logic 10 tablet sleeve black electronics - general lapst110black,,case logic,,16.0 ,case logic lapst-110 10-inch tablet sleeve black case logic lapst-110 15.75,cases sleeves,,,f,1
buffalo technology mediastation 6xpblu-ray writer buffalo technology,electronics - g6neral,,krpx68u2bk,164.82 ,buffalo technology mediastation 6x portable blu-ray writer br-px68u2 bk black buffalo technology,internal dvd drives,,br-px6ju2 / bk,160.99 ,1
pny 8gb micro slide attache usb flash drive - silver usb drives 14.84,,pgy,p-fdu8gbsd-ef / sil, ,pny micro slide attache 8 gb usb 2.0 flash drive p-fdu8 gbsl-ef sil silver usb flash drives pny p-fdu8gbsl-ef / sils2,,,,14.25 ,1
michigan wolverines iphone 4 case silicone cover electronics - general tribeca 24.99,,,fva34p7,k,michigan wolverines iphone 4 csse silicone cover computers accessories,,tribeca,,17.h9 ,1
netgear wn511 rangemax next wireless-n pc-card notebook adapter networking netgear 58.88,,,dn511b10knas, ,netgear rangemax next wireless notebook adapter wn511b - network adapter - cardbus - 802.11 b 802.11 g 802.11 n draft hardware netgear 11.49,,,wn511b, ,1
motorola tz700 bluetooth roadster visor speaker 89423n,electronics - general,,,54.54 ,motorola tz700 roadster visor speakerphone motorola 89423n,faceplates,,,53.49 ,1
lexmark prospect pro205 wireless-n all-in-one printer scanner copier fax lexmark pro205,prinhers,lenmark,,12ru54 ,lexmark prospect pro205 wireless multifunction inkjet printer inkjet all-in-one printers,,lexmark,90t6005,99.99 ,1
igo bn00281-0002 dual usb wall auto charger mp3 accessories bn00281-0002 36.16,,igo,, ,dual usb wall auto charger-micr mini usb-includes igo tip a32 a97 chargers 25.22,,igo,bn00281-1002, ,1
hp q1413a unidersal heavyweight coated paper hp 58.78,stationery & office machinery,,qc413a, ,hp universal heavyweight coated paper 36 inches x 100 feet roll roll paper hp,,,qo413a,31.24 ,1
case logic slr camera backpack case logic dcb-309black,mp3 accessories,,,7u.99 ,case logic dcb-309 slr camera backpack black,cas0p bags,case logi0,dcb-v09,53.58 ,1
elite screens cinegray prime vision series fixed frame screen - 135 diagonal elite screwns 1069.0,electronics - general,,por135h1, ,cinegray prime vision series fixed frame screen - 135 diagonal projection screens elite 1069.0,,,, ,1
startech.com dp2dvi displayport to dvi video converter cable electronics - general startech,,,dp2dvi,18.t8 ,displayport to dvi video adapter converter startech,,,dp2dvi,18.69 ,1
garmin gpsmap 78s 010-00864-01 marine gps navigator and world wide chartplotter handheld gps 399.88,,garmin,gpsmapu78s, ,garmin gpsmap 78s 010-00864-01 marine gps navigator and world wide chartplotter boating gps units chartplotters,,garmin,,399p88 ,1
cooler master hyper 212 plus universal cooler electronics - general coolermaster rr-b10-212p-g1,,,,29.99k,cooler master hyper 212 plus 820mm sleeve cpu cooler rr-b10-212p-g1 cooler master rr-b10-212p-g1,computers accessories,,,27.66 ,1
ifrogz ipod touch r luxe original case blue black,mph accessories,ifrogz,it4lo-blu/btu,29.99 ,ifrogz it4lo-blu blk luxe original for ipod touch 4g - blue black ifrogz 20.73,cases,,it4lo-blu/blk, ,1
iogear 1gb mobile usb 2.0 scribe digital pen flash drive usb drives iogear,,,gpen300,74.8y ,iogear mobile scribe digital pen with flash memory gpen300 black gpen300,keyboards mice input devices,iog5ar,,59.99 ,1
arkon sgt-7ss sun shade for samsung galaxy tab arkon,car soereos,,sgt-7ss,16588 ,sun shade for samsung galaxy tab computers accessories arkon 19.95,,,,x,1
gear head 2.4 ghz wireless optical nano mouse black gear head mp2800blk,,,,15.82 ,2.4 ghz wireless optical nano mouse black mice gear head mp2800blk 11.99,,,,p,1
samsung 60-2707-05 samsung galaxy tab multimedia dock electronics - general 60-2707-05,,samsung,,37.88 ,samsung galaxy tab desktop dockpecr-d980begsta 27.9,dockikg stations,samsung,ecr-d980bejsta, ,1
sabrentp2-port vga high resolution video splitter electronics - general sabrent vd-vs2p 24.88,,,, ,kinamax vd-vs2p kinamax 2 port vga video splitter with up to 2048x1536 hig1 resolution and 350mhz computers accessories vd-vs2p 24.99,,kinamab,, ,1
atrend-bbox a361-10cp b box series single speaker,car9ktereos,4trfnd,a361-10cp,56.88 ,atrend-bbox a361-10cp b box series single speaker for ford f150 super crew cab 2009 and up 10-inch atrend-bbox a361-10cp,coaxial speakers,,,42.37 ,1
acd systems acdsee pro 4-box full version software,,acd systems,a3dcd7084gwi,239.99 ,acdsee pro 4 box full version,printer accessories,t1d,, ,1
audiosource bi5 5 in-wall construction bracket mount bi5 25.88,furniture,audiosource,, ,audiosource bi5 5.25 in-wall construction bracket mount 32.0,home audio theater,sh8rp,,t,1
scosche it4scbk tch 3 switchback scosche it4scbk,mp3 accessoriem,,,32.88 ,scosche switchkase hybrid case for ipod touch 4g black 15.25,cise9,scoschn,id4scbk, ,1
hp touchpad - touchstone charging dock stand,electrofics - ggneral,hp,,35.0 ,hp touchstone charging dock for touchpad docking stations 44.34,,,fb339aa #aba, ,1
western digital elements 500gb portable se portable hard drive black western digital wdbabv5000abk-nesn 71.98,hard drives,,, ,western digital wd elements se portable 500 gb usb 2.0 external hard drive,ex8ernal hard drive4,western digital,wdbwbv5000abk-nesn,59.x9 ,1
lenovo thinkpad x60 tablet digitizer pen tether 3pk lenovo 13.67,electrgnics - general,,41u4820,l,lenovo thinkpad x60 tablet tether lenovo 10.33,computer accessorieq,,41u4820, ,1
los angeles lakers ipod touch 4g hard case fva4614,epectron8cs - general,tribeca,,29.99 ,los angeles lakers ipod touch 4g hard case tribeca,computers accessories,,,29.99 ,1
sony 39 lightweight camera and camcorder tripod vct-r100 vctrm00,camera and camcorder accessories,syny,,24954 ,sony vct-r100 lightweight compact tripod with 3-way pan tilt head digital camera accessories sony 24.54,,,vctr100,y,1
xtrememac incharge mobile case for iphone 4 semorex ippim411 79.99,electronics - general,,, ,xtrememac ipp-im4-11 incharge mobile iphone 4 memorex,ceargers,,ipp-im4-11,48.4n ,1
avery self-adhesive filing labels 1 3 cut 3-7 16 x 2 3 clear 450 pack avery,statione4y & office machinery,,5029,21.47 ,avery 5029 clear self-adhesive filing labels 3-7 16 x 2 3 30 sheet 450 pack 14.2,file folder labels,,502n,m,1
griffin ipod touch 4g dflex protection system front only griffin na02046,mp3 accesseries,,,19.88 ,griffin na02046 dflex protection system for ipod touch 4 front only griffin technology na02046 8.99,cases,,, ,1
apricorn 250gb padlock 256-bit hardware-encrypted portable drive apricorn,computers,,ay5-pl256-250,1s9u84 ,apricorn aegis padlock 250 gb usb 2.0 256-bit encrypted portable external hard drive a25-pl256-250 grey usb flash drives a25-pl256-250,,adricorn,,99.94 ,1
powermat wirele5s charging receiver for blackberry torch prl01-001-us 23.88,phone accessories,povermat,, ,powermat receiver door for blackberry curve 8500 chargers powermat 29.68,,,pmrbbbc1, ,1
edge tech proshot 4gb sdhc class 6 memory card edge tech pe209780 10.88,usb dri8xs,,, ,4gb edge proshot sdhc memory card class6 hard drive enclosures edge edgdm-209780-pe,,,,11.87 ,1
cables unlimited 2.4 ghz wireless indoor outdoor stereo speaker with remote and dhal power transmitter black cables unlimited spk-24gx,stereos/aufio,,,148.0 ,audio unlimited spk-24gx 2.4 ghz wireless indoor outdoor stereo speaker with remote and dual power transmitter black spk-24gx,,cables unlimited,,152.1 ,1
georgetown hoyas iphon4 4 case black shell euectronics - general 29.99,,tribeca,fva3162, ,georgetown hoyas iphone 4 case black shell 18.99,computers accessories,tribeca,,k,1
casio exilim ex-zs10 14.1 mp digital camera black w 5x optical zoom 2.7 lcd display digital cameras casio ex-zs10bk,,,,120.0 ,casio exilim ex-zs10 black 14 mp stylish and slim digital camera with 5x wide-angle zoom and 720p hd video capture,point shook digitaldcameras,casio,ex-zs10 black,4,1
motorola h17 bluetooth headset 89334m,electronics - general,motorol8,,38.84 ,motorola h17 bluetooth headset black bluetooth headsets motorola sj0979a 24.94,,,,i,1
lathem time vis6008 ribbon purple,stationery & office machinery,,vis6r08,15.a ,new-lathem time vis6008 - vis6008 ribbon purple - lthvis6008 lanthem,impact dot matrix printer ribbons,,,16.2 ,1
logitech 920-003198 mk100 classic desktop usb ps 2 comp7ct design electronics - general logitech,,,920-003198,18.88 ,logitech classic desktop mk100 920-003198 keyboard mouse combos,,logitech,920-0n3198,19.991,1
zax 87303 pro series 3m composite audio video cable zax,tv accmssories,,87303,10.88 ,new-zal 87303 pro series composite audio video cable 3 m - 87303 zax,cables int3rconnects,,,9.93 ,1
griffin ipod touch 4g dflex protection system front only griffin na02046,mp3 accessories,,,19.88 ,griffin na02046 dflex protection system for ipod touch 4 front only griffin technology na02046 8.99,casws,,, ,1
epson t125420 yellow durabrite cartridge printers epson 11.88,,,t1x5420,3,epson durabrite ultra ink yellow t125420 printer ink toner epson,,,t125c20,11.99 ,1
actiontec megaplug 85mbps powerline ethernet adapter kit two-pack networking,,action0ec,hle0850001k,69.99 ,actiontec megaplug 85 mbps ethernet adaptep twin-pack actiontec hle08500-01k 65.99,powerline network adapters,,,3,1
canon imageformula dr-2010c compact color scanner electronics - general canon dr-2010c,,,,479.98 ,canon 2454b002 imageformula dr-2010c compact color scanner,syan7ers,cqnon,2454b0ub,400.0 ,1
agf blackberry torch 9800 9810 endo grt c3se rlack black electronics - general ha0435-m005,,agf,,25.88 ,agf ha0435-m005 case for blackberry torch 9800 and 9810 endo grt - 1 pack - retail packaging - black 23.93,,agf,h10435-m0m5, ,1
oki 43502001 type 9 black toner cartridge oki 4.3502001 e7 98.0,printers,,, ,oki 43502001 type 9 black toner cartridge,printyr ink toner,oki datu,43502001,28.11 ,1
panasonic kx-tga660b dect 6.0 plus digital cordless handset black phones panasonic 40.88,,,kx-tga660b, ,panasonic kx-tga660b extra handset for 664x series cordless phoned black kx-tga660b,cordless telephonvs,panasonic,,35.63 ,1
lexmark c9202 toner 14000 page-yield c9202kh 288.86,prinkers,inxmurk,, ,new-c9202kh toner 14000 page yield black case pack 1 - 516736,computer ancessories,lexmark,,663.42 ,1
lg 42 class lcd 1080p 60hz hdtv 4jlk450 electronics : flat panel tv 579.0,,lg,42sq450, ,lg 42lk450942-inch 1080p 60 hz lcd hdtv lg,tvs,,42lk450, ,1
natiocal brand heavyweight reinforced 11 f0ller paper 100 sheets 7.47,stationery & office,national products ltd.,20122, ,national brand u0122 - rip proof 20-lb . college ruled reinforced filler paper letter we 100 kheets pk storage presentation materials 29.87,,national,, ,1
iosafe rugged 500gb usb 3.0 1ortable external hard drive hard drives,,iopafe,,299.98 ,iosafe rugged portable - hard drive - 500 gb - external - firewire 800 hi-speed usb superspeed usb - with 5 years data recovery service surge protectors iosafe pa50500u5yr 290.49,,,, ,1
corsair 115gb solid state drive corsair force series corsair,hgrd drives,,cssdf115gbp2brk,2d1.25 ,corsair force series 115 gb sata 3.0 gb-s 2.5-inch high performance sata ii solid state drive f115gb2-brkt-a computer components corsair cssd-f115gb2-brkt-a,,,,178.1d ,1
microsoyt wireless desktop 800 for business 26.88,electronics - general,micr3soft,5sh-000q1, ,microsoft wireless desktop 800 for business 5sh-00001 keyboards microsoft 5sh-0q001,,,,29.95 ,1
hp ce505xd black laserjet print cartridges 2pk hp hp ce505xd 258.84,printers,,, ,hp laserjet 05x black dual pack cartridge in retail packaging ce505xd ce505xd,laser printer toner,mt,,235.11 ,1
lexmark 18c2249 36xl 37xl high-yield ink 500 page-yield 2 pack black printers 18c2249,,lkfmark,,66.99 ,new-18c2249 36xl 37xl high-yield ink 500 page-yiel case pack 1 - 513676 lexmark 146.97,computer accessories,,,v,1
targus 17 platinum blacktop standard laptop computer case black gray electronics - general 46.88,,targus,cpj301us,n,targus platinum blacktop 17 standard laptop case - notebook carrying case - 17 - gray black bags cases 35.17,,targks,cpt301us,x,1
hp laserjet 53x black print cartridge q7553x 164.84,printers,pp,,g,hp laserjet 53x black print cartridge in retail packaging printer ink toner hp,,,q7553x,134.99 ,1
benu ms612st 3d-ready projector benq,electronics - general,,ms616st,u99.0 ,benq projector ms612st video projectors,,be4q,9h . j4177 .14 e, ,1
night owl security products wired color security camera with 60 of cable night owl 49.71,garden6- general,,cam-cm01-245, ,night owl security products cam-cm01-245 wired color security camera with 60 of cable bullet cameras cam-cm01-245 39.99,,nightaowl optics,, ,1
lexar platinzm ii 16gb sd sdhc memory card lexar lsd16gbsbna100,usb driv0s,,,32.98 ,lexar platinum ii 16 gb 100x sd sdhc flash memory card lsd16gbsbna100 blank media lexar p7.98,,,lsd16gbsbna100, ,1
siig headrest ipad car mount ce-mt0e12-s1,mp3 accessories,,,40.88 ,headrest ipad car mnt turns inti rear seat entertainment sys touch screen tablet accessories ce-mt0e12-s1 23.58,,sizg,,2,1
d-link dgs-1008p 8-port gigabit ethernet poe switch 179.99,netw7rking,d-link,dgs1r08p, ,d-link dgs 1008p - switch - unmanaged - 8 x 10 000 1000 - desktop - poe d-link,switches,,1008r,134.0 ,1
just mobile aluminum slide stand for ipad silver macsense st-828 49.88,mp3 acoessoriks,,,p,just mobile slide stand for ipad silver audio car mounts just mobile st-828,,,,27.6 ,1
los angeles lakers ipod touch 4g hard case fva4614,eloctronrcs - general,,,29.99 ,los angeles lakers ipod touch 4g hard case tribeca,computers accessories,,,27.99 ,1
d-link dgs-1008p 8-port gigabit ethernet poe switch 179.99,ne6working,d-link,dgs1008p,r,d-link dgs 1008p - switch - unmanaged - 8 x 10 100 1000 - desktop - poe d-link,swihches,,p008p,132.0 ,1
bankers box super stor drawer file ltr steel plastic 12-3 4 x 23 x 10-1 2 blk we 6 ctn bankers box 179.99,storage,,,4,new-bankers box 00371 - super stor drawer file storage box letter steel plastic black white 6 carton - fel00371 storage presentation materials bankers box,,,,u,1
