ltable_name,ltable_description,ltable_price,rtable_name,rtable_description,rtable_price,Truth
samsung 5 disc black home theater system htz410t,canon magenta photo ink cartridge cli8pm compatible with the pixma ip6600d printer,329.0 ,samsung dvd hm theater sys 5 disc nic ht-z410 / xaa,,39.36 ,1
polk audio csi a6 black center channel loudspeaker csia6bk,canon deluxe black digital camera case 2595b002 soft nylon case flip-down cover belt loop attachment for hands-free convenience compatible with canon powershot a series black finish, ,polkaudio csi a4 cherry high performance center channel loudspeaker am4412-a,, ,1
garmin nuvi 205w gps navigation system 0100071840,maytag jetclean ii mdb7851aw black undercounter dishwasher mdb7851bk 14-piece place setting oversize capacity plus steamclean option stainless steel tub interior dark duraguard adjustable and removable nylon rack quietseries 300ss sound package automatic temperature control 5 wash levels high pressure spray jets ventless dry system precision clean turbidity sensor control lockout energy star qualified nsf certified black finish, ,garmin nvi 255w automobile navigator 010-00718-20,, ,1
linksys etherfast4116 16-port 10/100 ethernet switch ef4116,transcend jetflash v10 8gb usb flash drive ts8gjfv10 hi-speed usb 2.0 capless sliding design protects the connector easy plug and play installation aes encryption databackup function keychain hook and neck strap black finish, ,linksys etherfast ef4124 ethernet switch,, ,1
panasonic 5.8 ghz black expandable digital cordless phone system kxtg4323b,panasonic nn-sn667b countertop microwave oven in black nnsn667bk 1.2 cubic foot 1300 watts high power 10 power levels 5 cooking stages quick minute one-touch sensor cooking inverter turbo defrost multi-lingual menu action screen popcorn key black finish, ,panasonic kx-tg4323b 5.8 ghz expandable digital cordless phone,, ,1
canon eos rebel xsi silver digital slr camera xsireb1855s,nikon graphite black 14.5 megapixel coolpix digital camera coolpixs710bk 14.5 effective megapixels 3.6 x zoom-nikkor lens 3.0 ' high-resolution wide-viewing angle lcd monitor optical lens shift vr image stabilization food and smile mode face-priority af camera red-eye fix d-lighting graphite black finish, ,canon eos rebel xsi digital slr camera with ef-s 18-55mm f/3 .5 -5.6 is lens silver 2757b003,, ,1
samsung 5 disc black home theater system htz410t,sanus 15 ' 32 ' flat panel tv black wall mount mf209b1 mf209b1 supports up to 60 lbs easy to install virtual axis 3d tilting system black finish, ,samsung htx810t home theater system htx810t,, ,1
sony 52 ' bravia w-series black lcd flat panel hdtv kdl52w4100,"skullcandy chops headphones in black chrome hh26skc01 15mm speaker hanger anchor design frequency range of 18 ? 20,000 hz 1.2 m cord length 3.5 mm gold plated plug black chrome finish",149.0 ,sony bravia w series kdl-46w4100 46 ' lcd tv kdl46w4100,,174.72 ,1
logitech quickcam vision pro for mac 960000254,logitech dinovo media desktop laser keyboard and mouse combo 967562 unique ultra-flat keyboard detached customizable mediapad precision rechargeable laser mouse tilt wheel plus zoom customizable hotkeys dedicated search buttons bluetooth wireless technology compatible black and gray finish, ,logitech quickcam pro 9000 webcam 960-000048,, ,1
canon dvd camcorder dc310,linksys wireless-g broadband router wrt54gl all-in-one internet-sharing router 4-port switch push button setup feature tkip and aes encryption wireless mac address filtering powerful spi firewall 54mbps wireless-g ( 802.11 g ) access point,69.0 ,canon dc320 digital camcorder 2691b001,,749.0 ,1
canon dvd camcorder dc320,"apple 8gb purple 4th generation ipod nano mb739lla holds up to 2,000 songs in 128-kbps aac format , 7,000 ipod-viewable photos and 8 hours of video 2 ' ( diagonal ) liquid crystal display with blue-white led backlight 320-by-240-pixel resolution give it a shake to shuffle your music turn it sideways to view cover flow mac and windows compatible purple finish",199.0 ,canon fs10 digital camcorder 2686b001,,16.99 ,1
sony bravia wireless home theater system in black davhdx576wf,"onkyo 7.1 channel home theater black receiver txsr876b 140w x 7 hdmi v1 .3 thx ultra2 plus certification all discrete circuitry optimum gain volume audyssey dynamic eq dolby digital plus , dolby truehd , dts-hd master audio decoder hdmi deep color capable ( 36bit ) 1080p upscaling via hdmi analog to hdmi upconversion permanent memory storage back-lit remote black finish",249.0 ,sony bravia dav-hdx576wf home theater system,,84.0 ,1
olympus ds40 digital voice recorder ds40r,sony 8 ' black lcd digital photo frame dpfd80 4:3 widescreen lcd display vga 800 x 600 resolution 256 mb internal memory portrait-landscape auto orientation sensor on-off backlit sony logo clock and calendar mode usb and memory card slots remote control black finish,499.0 ,olympus vn-4100pc 256mb digital voice recorder 141927,,458.0 ,1
canon printer yellow ink cartridge cli221yel,denon 7.1 channel home theater multimedia av receiver with networking in black avr3808ci 130 watts x 7 channels fully assignable channels for bi-amping rear panel rs-232c and ethernet ports network capable xm ready tuning dolby truehd and dts-hd master audio expanded hdmi v1 .3 a ports dual remotes black finish, ,canon cli-8y ink cartridge 0623b002,, ,1
escort passport radar and laser detector black finish 8500,pioneer wired marine remote control display cdmr80d compatible with pioneer headunits satellite radio text indications att ( volume attenuator ) button,24.99 ,escort x50 passport 8500 radar detector high intensity red display 8500x50red,,144.95 ,1
sony black camcorder tripod vct80av,canon vixia high definition camcorder hf10 2.7 ' color widescreen lcd 12x hd video zoom lens 3.3 megapixel digic dv ii image processor 200x digital zoom built in 16 gb memory sd card slot for expanded memory rgb primary color filter built-in electronic lens cover, ,sony lcs-x20 camcorder case lcsx20,, ,1
panasonic 5.8 ghz black expandable digital cordless phone system kxtg4323b,monster icarplay wireless 250 fm transmitter with autoscan for ipod and iphone aipfmch250 plays ipod or iphone music over any car stereo vibrant sound works with any fm car radio 3 programmable presets fm stations range from 88.1 to 107.9 easy to use convenient charging while you drive black finish,13.99 ,panasonic kx-tg9344t expandable digital cordless phone,,35.99 ,1
sony memory stick usb adaptor msacus40,pioneer 6.5 ' 2-way marine speakers tsmr1640 160 watts maximum power handling ( 30 watts nominal ) 1-1/8 ' poly-ether imide dome tweeter with magnetic fluid and equalizer tinsel lead wire and terminals are gold-plated for extra protection, ,sony memory stick duo replacement adapter msacm2,, ,1
lacie 1tb usb 2.0 external hard drive 301304u,pioneer deh-2000mp cd/mp3/wma in-dash receiver deh2000mp 50w x 4 built-in speaker power led display built-in front auxiliary input detachable face security remote control rotary volume control, ,lacie d2 quadra hard drive 301825u,, ,1
pioneer cd-i200 ibus interface cable for ipod cdi200,sony black vaio z series 13.1 ' notebook computer vgnz570nb 2.53 ghz intel core 2 duo p9500 processor 13.3 ' xbrite-duraview lcd integrated stereo a2dp bluetooth technology 320gb hard drive 3gb memory built-in motion eye camera and microphone genuine microsoft windows vista business with sp1/xp downgrade black finish, ,pioneer ibus interface cable for ipod cd-i200,, ,1
lacie little disk 250gb black portable hard drive 301278,logitech dinovo media desktop laser keyboard and mouse combo 967562 unique ultra-flat keyboard detached customizable mediapad precision rechargeable laser mouse tilt wheel plus zoom customizable hotkeys dedicated search buttons bluetooth wireless technology compatible black and gray finish, ,lacie little disk hard drive 301829,, ,1
sanus 15 ' 40 ' flat panel tv black wall mount vm400b,"sony dvp-fx820 white 8 ' portable dvd player dvpfx820w swivel & flip screen with dual sensor for remote control control buttons on screen bezel 12 bit video dac with 108 mhz processing removable , rechargeable battery & car adapter included white finish", ,sanus flat panel tv wall mount vmf,, ,1
omnimount wall speaker mount 20wlbk,"sony bravia black sxrd 1080p home theater front projector vplhw10 sxrd 1920 x 1080p full hd panels 30,000:1 dynamic contrast ratio fully digital signal processing 200watts ultra-high-pressure lamp whisper-quiet fan noise and noise reduction function two hdmi inputs bravia theatre sync remote commander black finish", ,sanus speaker mount wms3b black,, ,1
sony bravia wireless home theater system in black davhdx576wf,"sharp aquos black blu-ray disc player bdhp50u full 1080/24p resolution bd-rom profile 1.1 and bd-live support hdmi version 1.3 output x.v.color dolby digital plus , dolby true hd and dts-hd decoding aquos link function 192khz/24-bit audio d/a converter upconverting video signals to 720p , 1080i or 1080p with 4,096 steps of gradation using hdmi black finish",599.0 ,sony bravia dav-hdx576wf home theater system,,549.0 ,1
panasonic kx-tga820b black dect 6.0 cordless handset kxtga820b,"samsung dlp tv stand in black tr72bx designed to fit samsung hlt7288 hlt7288 , hl72a650 , and hl67a650 television sets tempered 6mm tinted glass shelves wide audio storage shelves to accommodate 4 or more components wire management system easy to assemble high gloss black finish",179.0 ,panasonic kx-tg9361b expandable digital cordless phone,,499.0 ,1
canon black leather camera case 1588b001,garmin 010-10702-00 black ga 25mcx remote gps antenna 0101070200 built-in magnetic mount includes a cable over 8 feet long and mcx connector, ,canon psc-4000 deluxe leather case n 3528b001,, ,1
sanus universal projector ceiling mount black finish vmpr1b,panasonic dect 6.0 black expandable digital cordless phone kxtg9361b drop and splash resistant multi-handset capability ringer id call waiting caller id voicemail hold mute clock alarm led lighting night mode call block speakerphone 11 days standby 5 hours talk time black finish, ,sanus universal projector ceiling mount vmpr1b,, ,1
denon stereo tuner tu1500rd,sony 40gb high definition hard disk drive handycam camcorder hdrsr10 1920 x 1080 recording face detection 2.3 megapixel clearvid cmos sensor bionz image processor exmor imaging sensor 15x optical/180x digital zoom 2.7 ' wide ( 16:9 ) hybrid touch panel clear photo lcd plus display dolby digital 5.1 ch recording dynamic range optimizer super nightshot infrared system x.v. color technology, ,denon tu-1500rd stereo radio tuner tu1500rd,, ,1
linksys wireless-g broadband router wrt54gl,denon d-m37 black cd/am/fm micro system dm37sbk 30 watts x 2 amplifier precision burr-brown audiophile quality dacs mp3 and wma tracks playback capability european engineered loudspeakers 120mm long-throw d.d.l double-layered cone woofer 25mm soft dome tweeter with extended response triadic noise reduction concept portable player connectivity black finish, ,linksys wrv54g wireless-g vpn broadband router,, ,1
speck seethru pink hard shell case for macbook air mbapnksee,apple ipod nano gray armband mb769ga compatible with 4th generation ipod nano has space for the nike + ipod sport kit receiver gray finish, ,speck products seethru case for apple macbook air mba-pnk-see,, ,1
panasonic kx-tg4500b black 5.8 ghz cordless phone system kxtg4500b,pioneer 6.5 ' 2-way marine speakers tsmr1640fm 160 watts maximum power handling ( 30 watts nominal ) 1-1/8 ' poly-ether imide dome tweeter with magnetic fluid and equalizer tinsel lead wire and terminals are gold-plated for extra protection call 888-228-5800 to purchase this clearance item <br> <b> original price : </b> <font color='#000000'> 120.00 </font> <br> <b> open/display item ( of ) : </b> <font color='#ff0000'> 62.00 </font>, ,panasonic kx-tg4324b 5.8 ghz expandable digital cordless phone,, ,1
yamaha ns-aw190bl all-weather pair speaker system nsaw190bk,omnimount 42 ' 63 ' wishbone cantilever extra large flat panel tv silver wall mount uclxb double stud mounting dual arm cantilever mount lift n lock for easy installation integrated cable management supports up to 200 lbs, ,yamaha outdoor ns-aw390 all-weather speaker system ns-aw390bl,, ,1
sony red cyber-shot digital camera dscw170r,logitech v-ubm46 quickcam pro 9000 black webcam for windows 960000048 carl zeiss optics autofocus hd video rightlight technology integrated microphone with rightsound technology ultra-wide field of view and intelligent face tracking logitech video effects downloadable fun filters universal monitor clip works with windows xp and vista black finish,129.99 ,sony cyber-shot dsc-w150 digital camera silver dscw150,,19.99 ,1
canon photo ink cartridge cl52,"sony memory stick duo replacement adaptor msacm2 compatible with memory stick duo and pro media stick compact , thin , and extremely lightweight",49.99 ,canon pgi-5bk black ink cartridge 0628b002,,910.91 ,1
panasonic dect 6.0 black expandable digital cordless phone kxtg9361b,"apple usb modem ma034za supports caller id , wake on ring , telephone answering ( v. 253 ) , modem on hold v. 92 software support", ,panasonic kx-tg9361b expandable digital cordless phone,, ,1
lacie little disk 320gb black portable hard drive 301829,panasonic laser toner cartridge kxfa83 used with fl511/f541 fax machines, ,lacie little disk hard drive 301278,, ,1
panasonic dect 6.0 silver digital cordless handset kxtga630s,sony silver digital voice recorder icdb600 512mb built-in flash memory up to 300 hours of recording time 3 recording modes 4 message folders large lcd display voice operated recording 250mw speaker output date and time stamp silver finish,98.0 ,panasonic kx-tg9361b expandable digital cordless phone,,359.0 ,1
sony soft cyber-shot carrying case lcscst,speck toughskin black case for 4th generation ipod nano nn4tsblk tough custom-fit protective case durable shock-absorbing material detachable rotating belt clip openings to all connections and controls black finish, ,sony lcs soft carrying case lcscst,, ,1
canon deluxe black digital camera case 2595b002,"canon yellow ink cartridge cli8y compatible with the pixma ip4200 , ip5200 , ip5200r , ip6600d , mp500 , mp800 printers",49.0 ,canon dc320 digital camcorder 2691b001,,39.0 ,1
canon vixia 120gb high definition hard disc drive black camcorder hg21,panasonic dect 6.0 black expandable digital cordless phone kxtg9361b drop and splash resistant multi-handset capability ringer id call waiting caller id voicemail hold mute clock alarm led lighting night mode call block speakerphone 11 days standby 5 hours talk time black finish, ,canon vixia hf100 high definition digital camcorder 2708b001,, ,1
canon black photo ink cartridge cli8b,linksys wireless-g broadband router wrt54gl all-in-one internet-sharing router 4-port switch push button setup feature tkip and aes encryption wireless mac address filtering powerful spi firewall 54mbps wireless-g ( 802.11 g ) access point,98.0 ,canon cli-8pm photo magenta ink cartridge 0625b002,,29.0 ,1
sony black 9 megapixel cyber-shot digital camera dsch50b,"escort passport x50 radar and laser detector 8500 x-band , k-band , ka-band operating bands algaas 280 led matrix/text display type 3-level dimming , plus dark mode auto mute city mode sensitivity compact size red display",299.0 ,sony cyber-shot dsc-w150 digital camera silver dscw150,,162.99 ,1
sony black 9 megapixel cyber-shot digital camera dsch50b,canon deluxe black digital camera case 2595b002 soft nylon case flip-down cover belt loop attachment for hands-free convenience compatible with canon powershot a series black finish, ,sony handycam dcr-hc52 digital camcorder dcrhc52,, ,1
yamaha ns-aw190bl all-weather pair speaker system nsaw190bk,"weber premium black grill cover 7550 heavy-duty vinyl compatible with spirit e-200 series , spirit 500 and genesis silver a gas grills black finish", ,yamaha ns-aw190 all-weather speaker system ns-aw190bl,, ,1
canon ef 75-300mm f/4 -5.6 iii telephoto zoom lens 6473a003,tomtom gps mount and usb car charger 9s00006 extra holder and car charger convenient for multi-vehicles user no need to transfer holder from one car to another easy installation compatible with tomtom one xl black finish, ,nikon 55-200mm f/4 -5.6 g ed af-s dx telephoto zoom lens 55200mmlens,, ,1
canon ef 75-300mm f/4 -5.6 iii telephoto zoom lens 6473a003,panasonic 2 line integrated corded phone system kxtsc14b 3-line lcd display automatic line selection call waiting caller id 3-way conferencing speakerphone navigator key black finish, ,canon ef 75-300mm f/4 -5.6 iii telephoto zoom lens 6473a003,, ,1
canon black ink cartridge black pg40bk,sony dvp-ns57p progressive scan silver dvd player dvpns57ps precision drive 3 system mp3 playback on screen display dolby digital decoding silver finish,299.0 ,canon pgi-5bk black ink cartridge 0628b002,,29.95 ,1
samsung sound bar home theater system htx810,transcend 4gb micro secure digital memory card ts4gusdhc6 4gb microsd card with adapter compatible with cell phones and mobile devices with microsd input mechanical write protection switch includes adapter to fit sdcard slot for data transfer compliant with secure digital music initiative black finish, ,samsung htx810t home theater system htx810t,, ,1
panasonic dect 6.0 silver digital cordless handset kxtga630s,samsung ht-bd2t 7.1-channel blu-ray home theater system htbd2txaa 1100 watts total system power dolby true hd and dts-hd compatibility 1080 dvd up-conversion with hdmi full hd 1080p/24p playback black finish, ,panasonic kx-tg1034s dect 6.0 cordless phone kx-tg1034s,, ,1
nikon d300 digital slr digital camera d300body,"samsung 32 ' series 6 lcd black flat panel hdtv ln32a650 full 1080p high definition resolution 16:9 widescreen aspect ratio 50,000:1 dynamic contrast ratio srs trusurround xt audio built-in digital tuner ( atsc/clear qam ) picture-in-picture auto volume leveler 4 hdmi slots swivel stand piano black with hint amber finish", ,nikon d300 digital slr camera 25432,, ,1
canon deluxe black digital camera case 2595b002,"sony bud style headphones in red mdred12lpred 16mm drivers crisp sound neodymium magnets offer powerful sound reproduction convenient cord slider reduces tangles 3.9 ft. cord length frequency response of 8-22 ,000 hz red finish",79.0 ,canon powershot sd890 is digital camera 2566b001,,299.0 ,1
canon deluxe black digital camera case 2595b002,sanus universal projector ceiling mount vmpr1b designed for dlp and lcd projectors quick release mechanism 50 lbs capacity black finish, ,canon fs11 digital camcorder 2685b001,, ,1
canon ef 75-300mm f/4 -5.6 iii telephoto zoom lens 6473a003,"canon printer yellow ink cartridge cli221yel fine technology for exceptional sharpness and detail compatible with pixma ip3600 , pixma ip4600 , pixma mp620 and pixma mp980", ,nikon nikkor 70-300mm f/4 .5 -5.6 g ed-if af-s vr telephoto zoom lens 2161,, ,1
panasonic stainless steel countertop microwave oven nnsd377ss,garmin nuvi 265wt gps navigation system 0100057510 4.3 ' widescreen sunlight-readable touchscreen display size turn-by-turn directions voice prompts speaks street names 2-d or 3-d maps bluetooth wireless technology avoid traffic tie-ups integrated fm traffic receiver sleek & slim design jpeg picture viewer world travel clock up to 4 hours of battery life garmin lock grey finish, ,panasonic nnsd667s 1.2 cu . ft. countertop microwave oven in stainless steel,, ,1
escort passport 9500i radar and laser detector 9500i,"lowepro rezo 15 digital camera case in black rezo15bk slim , sleek little pouch stretchy side gussets pocket for memory card adjustable shoulder strap water-resistant microfiber", ,escort passport 9500ix radar/laser detector,, ,1
denon black avr-1609 home theater surround sound receiver avr1609,"canon black bp-808 camcorder battery pack 2740b002 compatible with dual flash memory , flash memory and hard disk drive camcorders black finish", ,denon avr-1709 a/v receiver avr1709,, ,1
panasonic dect 6.0 silver expandable digital cordless phone system kxtg9332s,sony black component home theater system ht7200dh 900 watts 5.1 channels hdmi 1080p output dvd player hdmi active intellegence av receiver 5 satellite speakers xm ready black finish,186.0 ,panasonic kx-tg9361b expandable digital cordless phone,,318.72 ,1
sony 40 ' bravia z series black lcd flat panel hdtv kdl40z4100b,sony hd-handycam 3 meters ( 10 feet ) hdmi mini cable vmc30mhd gold plating plug hdmi-compliant high speed category 2 cable support full hd 1080p digital audio transfer 3 meters ( 10 feet ) black finish, ,sony bravia z series kdl-40z4100 40 ' lcd tv kdl40z4100/b,, ,1
tech craft avalon series tv stand swp48,nikon coolpix p80 digital camera in black coolpixp80 10.1 megapixels 18x optical wide-angle zoom-nikkor lens 2.7 ' high-resolution lcd electronic viewfinder auto adjusts up to iso 6400 in-camera red-eye fix face-priority af d-lighting high quality tv movies with sound black finish, ,techcraft veneto series swp48 tv stand,, ,1
sony vaio cs series pink notebook computer vgncs180jp,sony multi band digital tuner shower radio icfs79w splash resistant am/fm/weather band reception easy one button weather band select built-in digital clock selectable automatic-off timer quartz synthesized tuner built-in antennas, ,sony vaio cs180j/q notebook vgncs180j/q,, ,1
sony 42 ' bravia v series black lcd flat panel hdtv kdl42v4100,panasonic viera 37 ' 1080p lcd hdtv in black tc37lz85 ips alpha 1080p high-definition lcd panel 10000:1 contrast ratio 178 ° wide viewing angle 6.7 ms response intelligent scene controller built-in sd card slot 3 hdmi inputs and viera link hdavi control surround sound black finish, ,sony bravia z series kdl-40z4100 40 ' lcd tv kdl40z4100/b,, ,1
sony 7.1 channel black a/v receiver strdg820,universal ir/rf aeros remote control - mx850 laser etched buttons centrally located joystick memory back-up one hand ergonomics controls up to 20 components, ,sony str-dg520 a/v receiver strdg520,, ,1
netgear prosafe 24 port smart switch fs726tp,sony vaio rt series black all-in-one desktop computer vgcrt150y 2.66 ghz intel core 2 quad q9400 processor 8gb memory built-in compactflash media slot 1tb serial ata hard drive 25.5 ' xbrite-full hd lcd integrated stereo a2dp bluetooth technology 6mb l2 cache microsoft windows vista ultimate 64-bit black finish, ,netgear prosafe fs105 ethernet switch fs105na,, ,1
sony dvp-fx820 blue 8 ' portable dvd player dvpfx820li,panasonic silver rice cooker/warmer srtmb10 6 menu settings non-stick coated pan 13-hour preset timer 12-hour keep warm setting automatic rewinding cord reel steaming basket silver finish, ,sony dvp-fx820 portable dvd player dvpfx820,, ,1
canon eos rebel xsi silver digital slr camera xsireb1855s,kenwood sirius radio translator for in-dash head units kcasr50 provides full control of the sirius radio displays text on the stereo and supplies power to the satellite radio, ,canon eos rebel xsi digital slr camera with ef-s 18-55mm f/3 .5 -5.6 is lens silver 2757b003,, ,1
panasonic dect 6.0 black expandable digital cordless phone kxtg9361b,"samsung dlp tv stand in black tr72bx designed to fit samsung hlt7288 hlt7288 , hl72a650 , and hl67a650 television sets tempered 6mm tinted glass shelves wide audio storage shelves to accommodate 4 or more components wire management system easy to assemble high gloss black finish", ,panasonic kx-tg9391t dect 6.0 two-line corded/cordless phone combo kx-tg9391t,, ,1
sony memory stick pro duo adapter for compactflash slot admscf1,sanus 15 ' 40 ' flat panel tv black wall mount vm400b virtual axis tilt adjustment system hinged arm extend from 3.5 ' to 20 ' durable powder coated black finish, ,sony memory stick duo replacement adapter msacm2,, ,1
sony universal remote control rmez4,sony alpha digital slr black camera body dslra350 14.2 megapixels tiltable 2.7 ' clear photo lcd plus screen continuous shooting while viewing smart teleconverter 2x zoom expanded iso sensitivity super steadyshot in-camera image stabilization bionz image processor dynamic range optimizer anti-dust technology auto pop-up flash eye-start autofocus system 9-point center cross af sensor black finish, ,sony universal remote control rm-ez4,, ,1
polk audio csi a6 black center channel loudspeaker csia6bk,samsung nv30 black 8.1 megapixel digital camera ecnv30zbba 3x optical zoom lens 2.5 ' lcd display high resolution ccd sensor 20mb internal memory dual image stabilization face detection auto focus sd memory card slot black finish, ,polkaudio csi a6 black high performance center channel loudspeaker am6615-a,, ,1
canon dvd camcorder dc320,canon deluxe black digital camera case 2595b002 soft nylon case flip-down cover belt loop attachment for hands-free convenience compatible with canon powershot a series black finish, ,canon dc310 digital camcorder 2694b001,, ,1
garmin vehicle suction cup mount 0101093600,denon fully automatic analog turntable dp300f removable headshell automatic startup built-in phono equalizer dc servo motor and belt drive system mm cartridge, ,garmin suction cup mount 010-10815-00,, ,1
panasonic nnsd767s stainless steel countertop microwave oven nnsd767ss,"coby 7 ' black widescreen tft portable dvd cd mp3 player tfdvd7006 compact portable design 480 x 240 display resolution 16:9 widescreen tft color display dvd , dvd ± r/rw , cd , cd-r/rw , jpeg and mp3 compatible anti-skip circuitry dolby digital decoder digital and analog av outputs ntsc/pal video system black finish",139.0 ,panasonic nnsn667b 1.2 cu . ft. countertop microwave oven in black,,59.0 ,1
