ltable_name,ltable_description,ltable_price,rtable_name,rtable_description,rtable_price,Truth
canon eos rebel xsi silver digital slr camera xsireb1855s,denon d-m37 black cd/am/fm micro system dm37sbk 30 watts x 2 amplifier precision burr-brown audiophile quality dacs mp3 and wma tracks playback capability european engineered loudspeakers 120mm long-throw d.d.l double-layered cone woofer 25mm soft dome tweeter with extended response triadic noise reduction concept portable player connectivity black finish, ,canon eos rebel xsi digital slr camera with ef-s 18-55mm f/3 .5 -5.6 is lens silver 2757b003,, ,1
skullcandy chops headphones in black chrome hh26skc01,"linksys wireless-g ethernet bridge wet54g converts wired-ethernet devices to wireless-g network connectivity for windows , macintosh , linux , playstation consoles , xbox consoles , or anything with an ethernet port plug and play , no driver installation require", ,chops hanger headphone wired earbuds 18 20000 hz black and chrome hh26-skc01,, ,1
sony bravia wireless home theater system in black davhdx576wf,sony infolithium h series standard rechargeable battery pack npfh70 compatible with most handycam camcorders black finish, ,sony bravia dav-hdx576wf home theater system,, ,1
panasonic 5.8 ghz black expandable digital cordless phone system kxtg4323b,nikon 55-200mm zoom-nikkor lens accessory 2156 3.6 x zoom 55 200mm silent wave motor two ed glass elements focus mode switch, ,panasonic kx-tg9361b expandable digital cordless phone,, ,1
samsung minidv digital camcorder scdc382,"sony lithium-ion rechargeable battery pack npfd1 infolithium long-lasting lithium-ion battery compatilble with sony cyber-shot dsct2 series , dsc-t70 series , and dsc-t200 series", ,pure digital flip mino digital camcorder f360w,, ,1
sony digital slr camera with lens kit dslra200w,"microsoft office home and student 2007 for windows vista - 79g00007 included excel 2007 , onenote 2007 , powerpoint 2007 , word 2007 results-oriented user interface smartart diagramming and enhanced charting capabilities enhanced reliability and security features document inspector",49.99 ,sony alpha dslr-a350 digital slr camera dslra350,,449.0 ,1
transcend 4gb secure digital high-capacity ( sdhc ) class 6 memory card ts4gsdhc6,logitech driving force pro steering wheel with pedals set for sony playstation 2 9632930403 comfortable soft full rubber wheel realistically turn through 2.5 times wheel rotation 900 degrees of wheel steering state-of-the-art force feedback technology stick shifter responsive gas and brake pedals black finish, ,transcend 8gb secure digital high capacity ( sdhc ) card class 6 ts8gsdhc6,, ,1
logitech white v470 cordless laser mouse for apple notebooks 910000692,sennheiser rechargeable nickel-metal hydride battery ba151 rechargeable battery for wireless sennheiser headphones, ,logitech v470 cordless laser mouse for notebooks 910-000692,, ,1
canon ef-s 55-250mm f/4 -5.6 is telephoto zoom lens 2044b002,"sony dvd-r recordable camcorder media 3 pack 3dmr30l1h 30 minute , 1.4 gb accucore technology store digital video , audio and multimedia files 3 pack",319.0 ,nikon nikkor 70-300mm f/4 .5 -5.6 g ed-if af-s vr telephoto zoom lens 2161,,169.13 ,1
polk audio csi a6 black center channel loudspeaker csia6bk,"twenty20 vholdr mount adhesive 2200ma removable resists water , heat and cold",39.99 ,polkaudio tci series tc60i in-ceiling loudspeaker tc60iw,,292.92 ,1
canon deluxe black digital camera case 2595b002,"pioneer hd radio tuner gexp10hd compatible with fh-p800bt , fh-p8000bt , deh-p700bt , deh-p7000bt , deh-p600ub , deh-p6000ub ` external control ' capable", ,canon dc320 digital camcorder 2691b001,, ,1
panasonic dect 6.0 silver digital cordless handset kxtga630s,apple ipod nano gray armband mb769ga compatible with 4th generation ipod nano has space for the nike + ipod sport kit receiver gray finish, ,panasonic kx-tga630s cordless handset,, ,1
panasonic black lumix wide angle lens digital camera dmctz5k,sirius siriusconnect home tuner sch1 compact size analog and digital audio outputs display indicators connects to any sirius-ready home audio component, ,panasonic lumix dmc-fz28 digital camera black,, ,1
kenwood ipod mobile interface kcaip500,nikon coolpix p80 digital camera in black coolpixp80 10.1 megapixels 18x optical wide-angle zoom-nikkor lens 2.7 ' high-resolution lcd electronic viewfinder auto adjusts up to iso 6400 in-camera red-eye fix face-priority af d-lighting high quality tv movies with sound black finish, ,kenwood kca-ip500 ipod interface/controller kcaip500,, ,1
panasonic 40gb hard drive camcorder sdrh40,sony silver 1080p upscaling 5-disc dvd changer dvpnc800hs 5 disc dvd/cd changer 1080p upscaling video output through hdmi connection bravia sync high resolution jpeg output precision cinema progressive technology precision drive 3 system child lock multi disc resume multi brand tv remote control silver finish,25.0 ,panasonic palmcorder sdr-h60 digital camcorder sdr-h60s,,1288.0 ,1
nikon coolpix s210 plum 8.1 megapixels digital camera coolpixs210p,samsung black combo dvd/vhs player dvdv9800 progressive scan 1080p up-conversion via hdmi 10bit 54mhz digital-to-analog converter 4-head hi-fi vcr black finish no tuner,29.99 ,nikon coolpix s210 digital camera plum 26103,,69.99 ,1
apple 32gb black 2nd generation ipod touch mb533lla,sony msa2gd 2gb memory stick micro ( m2 ) msa2gu2 ultra-small size 2gb storage capacity with 1.85 gb available designed for use in compatible small devices such as mobile phone dual operating voltage m2 duo adaptor included black finish, ,apple 8gb ipod nano black ( 4th generation ) mb754ll/a,, ,1
panasonic dect 6.0 2-line digital expandable corded/cordless phone system kxtg9391t,"weber premium black grill cover 7550 heavy-duty vinyl compatible with spirit e-200 series , spirit 500 and genesis silver a gas grills black finish", ,panasonic kx-tg9391t dect 6.0 two-line corded/cordless phone combo kx-tg9391t,, ,1
sony 60gb handycam hard disk drive camcorder dcrsr85,denon progressive scan universal dvd player dvd2930ci ac 120 volts 60 hertz 45 watts infrared pulse remote control, ,sony handycam hdr-sr12 high definition digital camcorder hdrsr12,, ,1
sony soft cyber-shot carrying case lcscst,universal ir/rf aeros remote control - mx850 laser etched buttons centrally located joystick memory back-up one hand ergonomics controls up to 20 components, ,sony lcs soft carrying case lcscst,, ,1
yamaha 7.2 channel black digital home theater receiver rxv663bk,olympus silver 8 megapixel digital camera fe370s dual image stabilization 5x optical zoom face detection intelligent auto smile shot 2.7 ' high resolution lcd 18 shooting modes 8.0 megapixels silver finish, ,yamaha rx-v363 home theater receiver rxv363bl,, ,1
sony vaio ns series silver notebook computer vgnns190js,garmin nuvi 265wt gps navigation system 0100057510 4.3 ' widescreen sunlight-readable touchscreen display size turn-by-turn directions voice prompts speaks street names 2-d or 3-d maps bluetooth wireless technology avoid traffic tie-ups integrated fm traffic receiver sleek & slim design jpeg picture viewer world travel clock up to 4 hours of battery life garmin lock grey finish, ,sony vaio ns190j/s notebook vgnns190j/s,, ,1
sony 42 ' bravia v series black lcd flat panel hdtv kdl42v4100,toshiba black progressive scan dvd player sd4100 multiformat playback colorstream pro progressive scan component video outputs jpeg photo viewer slim chassis black finish, ,sony bravia w series kdl-52w4100 52 ' lcd tv kdl52w4100,, ,1
sony vaio lv series silver all-in-one desktop computer vgclv140j,toshiba black portable dvd player sdp71s 7 ' widescreen tft lcd display up to 3 hour lithium battery life jpeg viewer switchable audio/video input and output black finish, ,sony vaio lv140j desktop vgc-lv140j,, ,1
panasonic dect 6.0 black expandable digital cordless phone kxtg9361b,pioneer 6.5 ' 2-way marine speakers tsmr1640 160 watts maximum power handling ( 30 watts nominal ) 1-1/8 ' poly-ether imide dome tweeter with magnetic fluid and equalizer tinsel lead wire and terminals are gold-plated for extra protection, ,panasonic kx-tg9361b expandable digital cordless phone,, ,1
canon black leather camera case 1588b001,"samsung 40 ' series 5 lcd black flat panel hdtv ln40a550 full 1080p high definition resolution 16:9 widescreen aspect ratio 30,000:1 dynamic contrast ratio 5ms response time srs trusurround xt audio built-in digital tuner ( atsc/clear qam ) picture-in-picture sound leveler 3 hdmi slots swivel stand black finish", ,canon nb-5l lithium-ion digital camera battery 1135b001,, ,1
canon blue 8.0 megapixel powershot digital camera sd1100isb,panasonic hands free headset kxtca92 comfort fit with fold design noise cancelling microphone volume control mute standard 2.5 mm connection,499.0 ,canon powershot sd890 is digital camera 2566b001,,29.0 ,1
escort passport 9500ix radar detector 9500ix,motorola portable bluetooth car kit speaker phone t305 2.0 bluetooth wireless technology noise cancellation technology loud sound high speaker output convenient multi-function button up to 14 hours of talk time and 14 days of standby time mini-usb connector black finish,79.99 ,escort x50 passport 8500 radar detector high intensity red display 8500x50red,,278.95 ,1
sony soft camera carrying case lcsmx100,samsung s3 black multimedia player yps3jab 4 gb internal flash memory 1.8 ' tft lcd display touch-sensitive led controls multi-formats support dnse 2.0 sound engine fm tuner and recorder with presets up to 25 hours audio playback up to 4 hours video playback black finish, ,sony camcorder case lcsx30,, ,1
panasonic countertop microwave oven in black nnsn667bk,"yamaha rx-v363bl 5.1 channel digital home theater receiver in black rxv363bk 500 watts powerful surround sound ( 100w x 5 ) ipod and bluetooth audio compatibility dolby digital , dts and dolby pro logic ii decoding cinema dsp with 8 dsp programs compressed music enhancer 192khz/24-bit dacs for all channels remote control black finish", ,panasonic nnsn667b 1.2 cu . ft. countertop microwave oven in black,, ,1
canon black photo ink cartridge cli8b,panasonic digital camera battery cgas007a1b lithium ion type for digital camera dmctz1 and dmctz3, ,canon pgi-5bk black ink cartridge 0628b002,, ,1
uniden dect 6.0 cordless digital answering system dect20802,"pioneer voice command pack cdvc1 microphone and steering wheel remote control use your voice to control navigation , audio , and video functions compatible with avicn2 and avicn1", ,uniden dect 6.0 1.9 ghz cordless phone dect2080-2,, ,1
transcend 8gb sdhc card and compact card reader ts8gsdhc6s5w,whirlpool duet wfw9200sq white front load washer wfw9200swh 4.0 cu . ft. capacity 6th sense technology quiet wash plus noise reduction built-in water heater add-a-garment feature sanitary cycle 4 temperature selections white finish, ,transcend 8gb secure digital high capacity ( sdhc ) card class 6 ts8gsdhc6,, ,1
apple macbook pro 2.4 ghz intel core 2 duo silver notebook computer mb470lla,"samsung 32 ' black flat panel series 4 lcd hdtv ln32a450 10,000:1 dynamic contrast ratio 1366 x 768 true 720p resolution 6ms response time cold cathode fluorescent lamp ( ccfl ) hidden bottom speakers srs trusurround xt built-in atsc/clear qam tuner v-chip system swivel stand black finish", ,apple macbook pro notebook mb471ll/a,, ,1
pioneer wired marine remote control display cdmr80d,"garmin nuvi 205 gps navigation system 0100071740 3.5 ' antiglare display contiguous u.s. , canada or regional sections of europe preloaded maps voice prompts 3d map option auto re-route choice of route setup fm traffic compatible msn direct for u.s. compatible touchscreen microsd slot up to 4 hours of battery life anti-theft garmin lock grey finish", ,pioneer car audio remote control cdvc1,, ,1
toshiba black portable dvd player sdp71s,apple usb power adapter mb352llb compact convenient charges the ipod anywhere without a computer compatible with any ipods and iphone with a dock connector white finish, ,toshiba sd-p71s portable dvd player,, ,1
sanus 15 ' 32 ' flat panel tv black wall mount mf209b1,sony silver cyber-shot digital camera dscw150 8.1 megapixels 2.7 ' lcd display 15 mb internal memory carl zeiss 5x optical zoom lens 16:9 high-resolution mode 9-point auto focus automatic macro shooting high sensitivity mode burst mode face detection intelligent scene recognition mode in-camera retouching super steadyshot optical image stabilization with anti-blur solution music slideshow hdtv compatibility beginner-friendly function guide silver finish, ,sanus flat panel tv wall mount vmf,, ,1
kenwood ipod mobile interface kcaip500,canon deluxe black digital camera case 2595b002 soft nylon case flip-down cover belt loop attachment for hands-free convenience compatible with canon powershot a series black finish, ,kenwood ipod-video direct adapter kcaip300v,, ,1
delonghi magnifica super-automatic espresso/coffee machine esam3300,"coby 7 ' black widescreen tft portable dvd cd mp3 player tfdvd7006 compact portable design 480 x 240 display resolution 16:9 widescreen tft color display dvd , dvd ± r/rw , cd , cd-r/rw , jpeg and mp3 compatible anti-skip circuitry dolby digital decoder digital and analog av outputs ntsc/pal video system black finish", ,delonghi esam3300 esclusivo magnifica super-automatic espresso/coffee machine,, ,1
panasonic 5.8 ghz black expandable digital cordless phone system kxtg4324b,nintendo ds lite metallic rose portable gaming system ndsusgszpb dual 3 ' tft color lcd touchscreens slimmer design dual slot compatibility ( ds lite/game boy advance game paks ) twin ultra bright lcd screens up to 19 hours continuous gameplay nintendo wi-fi connection impressive 3d graphics dual stereo speakers metallic rose finish, ,panasonic kx-tg9344t expandable digital cordless phone,, ,1
panasonic genius countertop microwave in black nnh965bk,canon eos rebel xsi silver digital slr camera xsireb1855s 12.2 megapixel digic iii image processor extensive noise reduction technology auto optimization 3.0 ' lcd monitor compatible with compact sd and sdhc memory cards eos integrated cleaning system 18-55mm lens included 2756b003 silver finish, ,panasonic nnsn667w 1.2 cu . ft. countertop microwave oven in white,, ,1
bose lifestyle 48 series iv 43479 home entertainment system ls48ivwh,sanus 15 ' 40 ' visionmount flat panel tv black wall mount mt25b1 solid heavy-gauge steel construction durable powder-coated finish virtual axis tilt adjustment system up to 100 lbs support black finish, ,bose lifestyle 48 home theater system 43479,, ,1
sanus 15 ' 40 ' visionmount flat panel tv black wall mount mt25b1,nikon 55-200mm zoom-nikkor lens accessory 2156 3.6 x zoom 55 200mm silent wave motor two ed glass elements focus mode switch,13.99 ,sanus flat panel tv wall mount vm1b,,910.91 ,1
panasonic nnsd797s stainless steel countertop microwave oven nnsd797ss,sony silver 1080p upscaling 5-disc dvd changer dvpnc800hs 5 disc dvd/cd changer 1080p upscaling video output through hdmi connection bravia sync high resolution jpeg output precision cinema progressive technology precision drive 3 system child lock multi disc resume multi brand tv remote control silver finish, ,panasonic nnsd667s 1.2 cu . ft. countertop microwave oven in stainless steel,, ,1
kenwood ipod mobile interface kcaip500,denon 7.1 channel home theater multimedia av receiver with networking in black avr3808ci 130 watts x 7 channels fully assignable channels for bi-amping rear panel rs-232c and ethernet ports network capable xm ready tuning dolby truehd and dts-hd master audio expanded hdmi v1 .3 a ports dual remotes black finish,159.95 ,kenwood kca-ip500 ipod interface/controller kcaip500,,14.99 ,1
transcend 8gb sdhc card and compact card reader ts8gsdhc6s5w,canon photo ink cartridge cl52 compatible with pixma ip6210d and ip6220d printers,99.99 ,transcend 8gb secure digital high capacity ( sdhc ) card class 6 ts8gsdhc6,,910.99 ,1
canon ef 75-300mm f/4 -5.6 iii telephoto zoom lens 6473a003,panasonic 40gb hard drive camcorder sdrh40 advanced optical image stabilization 40gb internal hard drive up to 36 hours recording time anti-shock shield one-touch dvd copying wind noise reduction intelligent contrast control built-in sd slot 42x optical zoom silver finish, ,nikon nikkor 70-300mm f/4 .5 -5.6 g ed-if af-s vr telephoto zoom lens 2161,, ,1
sony red cyber-shot digital camera dscw150r,sony 8 ' black lcd digital photo frame dpfd80 4:3 widescreen lcd display vga 800 x 600 resolution 256 mb internal memory portrait-landscape auto orientation sensor on-off backlit sony logo clock and calendar mode usb and memory card slots remote control black finish, ,sony cyber-shot dsc-w120 digital camera pink dscw120/p,, ,1
samsung stereo bluetooth headset in black sbh500,escort passport 9500i radar and laser detector 9500i 360-degree radar and laser detection blistering all-band protection gps-powered truelock filter immune to the vg-2 ` detector-detector ' built-in earphone jack red display, ,blueant wireless z9i bluetooth headset black us-091010,, ,1
panasonic 40gb hard drive camcorder sdrh40,sony msa2gd 2gb memory stick micro ( m2 ) msa2gu2 ultra-small size 2gb storage capacity with 1.85 gb available designed for use in compatible small devices such as mobile phone dual operating voltage m2 duo adaptor included black finish, ,panasonic palmcorder sdr-h40 digital camcorder,, ,1
lacie little disk 250gb black portable hard drive 301278,transcend 8gb micro secure digital memory card ts8gusdhc6 8gb microsd card with adapter compatible with cell phones and mobile devices with microsd input mechanical write protection switch includes adapter to fit sdcard slot for data transfer sdhc class 6 compliant black finish, ,lacie little disk hard drive 301278,, ,1
panasonic dect 6.0 black expandable digital cordless phone kxtg9361b,samsung 22 ' black flat panel series 4 lcd hdtv ln22a450 1680 x 1050 resolution 3000:1 contrast ratio srs trusurround xt cold cathode fluorescent lamp ( ccfl ) 8ms response time hidden bottom speakers pc compatible black finish, ,panasonic kx-tg9361b expandable digital cordless phone,, ,1
sanus 13 ' 30 ' flat panel tv black wall mount vm1b,kitchenaid pasta roller and cutter kpra one pasta roller two pasta cutters cleaning brush chrome finish,199.0 ,sanus flat panel tv wall mount vmf,,549.0 ,1
samsung 46 ' series 7 lcd black flat panel hdtv ln46a750,"canon deluxe burgundy leather case 2350b001 genuine leather case designed for the powershot sd770 is , sd1100 and sd1000 burgundy finish",1999.0 ,samsung 7 series ln46a750 46 ' lcd tv ln46a750r1fxza,,13.99 ,1
universal ir/rf aeros remote control - mx850 mx850,"pioneer voice command pack cdvc1 microphone and steering wheel remote control use your voice to control navigation , audio , and video functions compatible with avicn2 and avicn1", ,universal aeros ir/rf remote control mx850,, ,1
apple 8gb black 4th generation ipod nano mb754lla,sony silver cyber-shot digital camera dscw150 8.1 megapixels 2.7 ' lcd display 15 mb internal memory carl zeiss 5x optical zoom lens 16:9 high-resolution mode 9-point auto focus automatic macro shooting high sensitivity mode burst mode face detection intelligent scene recognition mode in-camera retouching super steadyshot optical image stabilization with anti-blur solution music slideshow hdtv compatibility beginner-friendly function guide silver finish, ,apple 8gb ipod nano black ( 4th generation ) mb754ll/a,, ,1
canon dvd camcorder dc310,danby white countertop dishwasher ddw497wh 4 place settings quick connect to any kitchen tap automatic detergent and rinse agent dispenser quiet operation 5 wash cycles durable stainless steel spray arm and interior white finish, ,sony camcorder case lcsx30,, ,1
garmin vehicle adjustable suction cup mount 0101082303,"samsung black blu-ray player bdp1500 1080p with 24hz video output x.v.color connectivity ( hdmi v1 .3 option ) selectable dvd upconversion ( 720p/1080i/1080p ) anynet + ( hdmi-cec ) dolby digital , dolby digital plus , dolby truehd and dts-hd master audio ethernet port black finish", ,garmin suction cup mount 010-10936-00,, ,1
logitech mx air rechargeable cordless air mouse 931633,"sony vaio vgp-prsz1 sz series docking station vgpprsz1 compatible with sz series notebooks expand connectivity to your notebook 3 usb 2.0 , gigabit ethernet , vga , dvi-d and dc in black finish", ,logitech mx air rechargeable cordless air mouse 931633-0403,, ,1
denon blu-ray disc dvd/cd player dvd3800bdci,sennheiser rf wireless headphones rs140 switchable compression balance control for right/left volume adjustment high output level intelligent auto-tuning with memory function self-learning automatic level control easy recharging, ,denon dvd-3800bdci blu-ray disc player dvd3800bdci,, ,1
apple 8gb black 2nd generation ipod touch mb528lla,"linksys dual-band wireless-n usb network adapter wusb600n high-speed wireless-n ( draft 802.11 n ) networking mimo technology operates in the 2.4 and 5ghz radio bands connects to wireless-g , b and a networks", ,apple 8gb ipod nano black ( 4th generation ) mb754ll/a,, ,1
sony dvd-r recordable camcorder media 3dmr30l1h,"linksys dual-band wireless-n usb network adapter wusb600n high-speed wireless-n ( draft 802.11 n ) networking mimo technology operates in the 2.4 and 5ghz radio bands connects to wireless-g , b and a networks", ,sony mini dvd-r media 3dmr30l1h,, ,1
canon black ink cartridge black pg40bk,"sony black dvd recorder and vhs combo player rdrvx560 multiformat dvd compatible hdmi output with 1080p ,1080 i ,720 p upscaling usb one touch dubbing 4 video head stereo vhs with 19 micron heads virtual surround sound for dvd with stereo tv speakers black finish",139.0 ,canon cli-8y ink cartridge 0623b002,,397.77 ,1
logitech mx air rechargeable cordless air mouse 931633,"linksys dual-band wireless-n gaming adapter wga600n lag-free head-to-head or internet gaming converts wired-ethernet-ready game consoles to wireless-n network connectivity works without drivers on xbox , xbox 360 , playstation2 or 3 and gamecube dynamically changes channels and radio bands ( 2.4 or 5ghz ) works on any platform black finish", ,logitech mx air rechargeable cordless air mouse 931633-0403,, ,1
case logic vertical universal leather blackberry case clp104bb,sennheiser orange and silver in ear headphones cx380 massive sound despite their small size sweat-proof coating noise isolating design dynamic drivers guarantee impressive bass includes ear adapters & carrying case orange & silver finish, ,case logic universal vertical pda leather pouch clp104bb,, ,1
samsung s2 white 1gb flash mp3 player yps2zw,toshiba black dvd recorder/vcr combinaton with built-in digital tuner dvr660 built-in atsc/ntsc/qam digital/analog tuner multi-format recording and playback video upconversion up to 1080p resolution one touch recording camcorder controls auto finalize with undo bi-directional dubbing black finish, ,samsung yp-s2zw 1gb flash mp3 player yp-s2zw / xaa,, ,1
logitech quickcam communicate stx 961464,"delonghi twenty four seven coffee maker dc50b 4-cup capacity easy-access , washable filter basket black finish", ,logitech quickcam vision pro webcam 960-000254,, ,1
mitsubishi 835 diamond series 65 ' 1080p dlp rear projection hdtv wd65835,mitsubishi 835 diamond series 65 ' 1080p dlp rear projection hdtv wd65835 1920 x 1080 full hd resolution 6-color processor smooth 120hz x.v.color plush1080p 12-bit digital video processing color 4d video noise reduction 3d ready netcommand deepfield imager black finish, ,mitsubishi wd-65735 65 ' projection tv wd65735,, ,1
samsung minidv digital camcorder scdc382,applecare protection plan for ipod touch or ipod classic mb591lla extends your service coverage to up to two years includes both phone and in store techinical support, ,pure digital flip mino digital camcorder f360w,, ,1
logitech quickcam communicate stx 961464,toshiba black portable dvd player sdp71s 7 ' widescreen tft lcd display up to 3 hour lithium battery life jpeg viewer switchable audio/video input and output black finish, ,logitech quickcam vision pro webcam 960-000254,, ,1
sharp aquos black blu-ray disc player bdhp50u,"sony playstation 2 8mb memory card ( 2 pack ) 711719706700 save and load high scores , positions and replays magicgate encryption red/blue finish", ,sharp aquos bd-hp21u blu-ray disc player,, ,1
sanus 15 ' 37 ' visionmount full-motion flat panel tv black wall mount mf215b1,sharp 26 ' black lcd hdtv with built in dvd player lc26dv24u side loading progressive scan dvd player true 16:9 aspect ratio ( 1366 x 768 ) 500 cd/m2 brightness 800:1 contrast ratio 8ms response time 1 hdmi pc input black finish,120.0 ,sanus flat panel tv wall mount vm1b,,910.91 ,1
belkin pro series 16 ft. usb 2.0 cable f3u13316,sony switcher sbv40s eliminates disconnecting and reconnecting cables compact design 4 a/v inputs with s-video jacks 1 a/v output with s-video ( y/c ) jack 2 audio output, ,belkin pro series usb device cable 16 f3u133-16,, ,1
samsung minidv digital camcorder scdc382,sony remote control tripod vct60av a/v remote connector 4 stage leg extension extends from 18.9 ' to 57.6 ' in height guide frame feature available vertical position supplied carrying case black finish, ,canon dc310 digital camcorder 2694b001,, ,1
escort passport 9500ix radar detector 9500ix,apple macbook pro 2.53 ghz intel core 2 duo silver notebook computer mb471lla 2.53 ghz intel core 2 duo processor 320gb 5400-rpm serial ata hard drive 15.4 ' led-backlit glossy widescreen display built-in isight camera built-in airport extreme wi-fi and bluetooth nvidia geforce 9600m gt graphics processor dual display and video mirroring multi-touch trackpad 85w magsafe power adapter mini displayport mac os x v10 .5 leopard silver finish, ,escort x50 passport 8500 radar detector high intensity red display 8500x50red,, ,1
