ltable_name,ltable_description,ltable_price,rtable_name,rtable_description,rtable_price,Truth
transcend 4gb micro secure digital memory card ts4gusdhc6,"apple 32gb black 2nd generation ipod touch mb533lla holds up to 7,000 songs in 128-kbps aac format , 25,000 ipod-viewable photos and 40 hours of video wi-fi ( 802.11 b/g ) nike + ipod support built-in maps location-based service 3.5 ' ( diagonal ) widescreen multi-touch display 480x320-pixel resolution 480p and 576p component tv out mac and windows compatible black finish", ,transcend 8gb secure digital high capacity ( sdhc ) card class 6 ts8gsdhc6,, ,1
sony 16gb memory stick pro duo mark 2 media card msmt16g,sony vaio ns series silver notebook computer vgnns190js 2.0 ghz intel core 2 duo processor t5800 15.4 ' ( 1280 x 800 ) xbrite-eco widescreen display 250gb serial ata 5400rpm hard drive built-in 1.3 megapixel motion eye camera and microphone 4gb pc2-6400 ( 2gbx2 ) installed memory 800mhz front side bus speed 2mb l2 cache genuine microsoft windows vista home premium 64-bit blu-ray drive ( read only ) silver finish, ,sony 2gb memory stick micro ( m2 ) msa2gd,, ,1
logitech harmony one advanced universal remote control harmony1,"samsung 5 disc home theater surround sound system httz515 5.1 channel 5 disc capability usb host play ipod dock divx playback dolby digital , dolby pro logic and dts system black finish", ,sony universal remote control rm-ez4,, ,1
canon printer yellow ink cartridge cli221yel,"panasonic viera 50 ' 1080p plasma hdtv in black th50pz850u 1920 x 1080 resolution 1,000,000:1 dynamic contrast ratio viera cast internet tv capability viera link hdavi control surround sound bbe viva hd3d sound built-in closed caption decoder built-in sd card memory slot built-in ntsc/atsc/qam tuners black finish", ,canon pgi-5bk black ink cartridge 0628b002,, ,1
sony red cyber-shot digital camera dscw170r,sony black dvd recorder and vhs combo player rdrvxd655 multiformat dvd compatible hdmi output and 720p/1080i upscaling hdtv tuner 4 video head stereo vhs with 19 micron heads variable bit rate recording ( 7 speeds ) progressive scan playback dolby digital and dts decoding playback compatible tv virtual surround black finish,39.0 ,sony cyber-shot dsc-w150 digital camera red dscw150r,,699.0 ,1
speck seethru blue hard shell case for 13 ' macbook mb13bluseev2,tomtom gps mount and usb car charger 9s00006 extra holder and car charger convenient for multi-vehicles user no need to transfer holder from one car to another easy installation compatible with tomtom one xl black finish, ,speck products seethru case for apple 13 ' macbook mb13-blu-see-v2,, ,1
blueant supertooth light bluetooth handsfree in black supertooth,garmin gps carrying case 0101070400 protect your gps by absorbing the impact from routine drops prevent damage from scratches and spills, ,blueant supertooth light compact bluetooth speakerphone black 093744,, ,1
speck black toughskin ipod classic case icblkts,pioneer wired marine remote control display cdmr80d compatible with pioneer headunits satellite radio text indications att ( volume attenuator ) button,119.0 ,speck products toughskin for ipod classic ic-blk-ts,,995.0 ,1
panasonic nnsd797s stainless steel countertop microwave oven nnsd797ss,klipsch 5.25 ' thx ultra2 in-ceiling white loudspeaker ks7502thx 100w continuous/400w peak power handling dual 1 ' titanium diaphragm compression drivers mated to wdst tractrix horn array dual 5.25 ' high-output cerametallic cone woofers mdf and aluminum motorboard/abs shell enclosure white finish price per speaker, ,panasonic nnsn667b 1.2 cu . ft. countertop microwave oven in black,, ,1
canon photo ink cartridge cl52,panasonic kx-tg4500b black 5.8 ghz cordless phone system kxtg4500b frequency-hopping spread spectrum technology all-digital voice mail system handles up to 4 lines tollsaver 2-way recording black finish, ,canon cli-8pc photo cyan ink cartridge 0624b002,, ,1
canon ef 75-300mm f/4 -5.6 iii telephoto zoom lens 6473a003,logitech mx air rechargeable cordless air mouse 931633 laser-precise tracking and instant response freespace motion sensing scroll panel easy control of pc-based entertainment gesture controls li-ion battery 2.4 ghz wireless black finish, ,canon ef 75-300mm f/4 -5.6 iii telephoto zoom lens 6473a003,, ,1
lg 2.0 cu . ft. over-the-range white microwave oven lmvm2085wh,sony pink cyber-shot 7.2 megapixel digital camera dscw120p 7.2 megapixel 4x optical zoom 2.5 ' tft lcd 15 mb internal memory face detection super steadyshot image stabilization smile shutter mode smart zoom pink finish,186.0 ,lg 1.6 cu.ft . over the range microwave,,146.75 ,1
canon black photo ink cartridge cli8b,escort passport 9500ix radar detector 9500ix pre-loaded with thousands of saftey camera locations 360 degree radar & laser protection completely undetectable to all detector scanners variable-speed radar performance gps-powered truelock filter autolearn feature speed alert crystal-clear voice alerts 80 led matrix blue display 5 levels of brightness control black finish, ,canon pgi-5bk black ink cartridge 0628b002,, ,1
sanus 13 ' 30 ' flat panel tv black wall mount vm1b,"delonghi twenty four seven coffee maker dc50b 4-cup capacity easy-access , washable filter basket black finish", ,sanus flat panel ceiling mount sc1a-b1,, ,1
sony red cyber-shot digital camera dscw170r,griffin black iphone 3g clarifi protective case with built-in close-up lens 8245ip2mgnfi protective polycarbonate case close-up lens focuses close for incredible detail lens slides in place for close-ups no adapters or small pieces to lose black finish ( iphone not included ), ,sony handycam dcr-sr85 digital camcorder dcrsr85,, ,1
denon fully automatic analog turntable dp300f,"kenwood ipod mobile interface kcaip500 compatible with most kenwood receivers text display , multiple search mode powers and charges ipod", ,denon dp-300f analog record turntable dp300f,, ,1
canon deluxe black digital camera case 2595b002,logitech dinovo media desktop laser keyboard and mouse combo 967562 unique ultra-flat keyboard detached customizable mediapad precision rechargeable laser mouse tilt wheel plus zoom customizable hotkeys dedicated search buttons bluetooth wireless technology compatible black and gray finish,269.0 ,canon fs11 digital camcorder 2685b001,,149.0 ,1
sony silver cyber-shot digital camera dscw150,"bose second zone remote pmc2 controls lifestyle 38 or 48 media center tv , vcr , cable box , satellite receiver accesses digitally stored cds in umusic system", ,sony cyber-shot dsc-w150 digital camera red dscw150r,, ,1
sony 30gb handycam hard disk drive camcorder dcrsr45,mitsubishi 735 series 65 ' 1080p dlp rear projection black hdtv wd65735 1920 x 1080 full hd resolution xvcolor tru1080p processing plush1080p 4d video noise reduction 6-color processor 3d ready front usb input 3 rear hdmi 1.3 inputs black finish, ,sony handycam hdr-sr11 high definition digital camcorder hdrsr11,, ,1
sony alpha digital slr black camera body dslra350,yamaha ns-aw390wh all-weather speaker system nsaw390wh 6.5 ' high compliance pp mica filled woofers unique dual 1 ' pei dome tweeter configuration aluminum speaker grilles wall mountable white finish sold as a pair,399.0 ,sony alpha dslr-a350 digital slr camera dslra350,,348.0 ,1
sony red cyber-shot digital camera dscw150r,speck seethru aqua hard shell case for 13 ' macbook mb13aquseev2 translucent hard plastic shell gives great protection full access to all controls rubber feet for added support aqua finish, ,sony cyber-shot dsc-w150 digital camera red dscw150r,, ,1
canon black ink cartridge pg50,"canon pixma mx700 multifunction printer mx700c advanced 5 in 1 printer , scanner , copier , fax machine high resolution up to 4800 x 1200 color prints 2 way paper feed auto-image fix quick start memory card slot grey and black finish", ,canon cli-8pc photo cyan ink cartridge 0624b002,, ,1
tech craft avalon series tv stand black finish abs32,transcend jetflash v10 16gb usb flash drive ts16gjfv10 hi-speed usb 2.0 capless sliding design protects the connector easy plug and play installation aes encryption databackup function keychain hook and neck strap green finish, ,techcraft veneto series abs32 tv stand,, ,1
sony white cybershot t series digital camera jacket case with stylus lcjthcw,"universal rf base station mrf260 extends the reception range up to 100 feet away through walls , floors , doors , indoors or outdoors programmed to operate equipment at up to 15 locations black finish", ,sony cyber-shot dsc-h50 digital camera black dsch50b,, ,1
sony bravia black sxrd 1080p home theater front projector vplhw10,"sharp aquos 42 ' black lcd hdtv lc42d85u full hd 1080p ( 1920 x 1080 ) resolution aquos link 120hz fine motion enhanced built-in atsc/qam/ntsc tuners 60,000 hours lamp life 4ms response time hdmi inputs black finish",605.0 ,sony bravia vpl-hw10 digital projector vplhw10,,869.0 ,1
samsung sound bar home theater system htx810,ge platinum hdtv millennium tv antenna tv24734 vhf/uhf 34 ' dipoles for vhf reception 130 degree swivel uhf loop low-profile storage, ,panasonic sc-pt660 home theater system,, ,1
transcend 4gb secure digital high-capacity ( sdhc ) class 6 memory card ts4gsdhc6,"linksys etherfast 4124 24-port ethernet switch ef4124 24 autosensing 10/100 full duplex , auto mdi/mdi-x ports up to 200mbps address learning , aging and data flow control compact size", ,transcend 4gb microsdhc card ( class 6 ) ts4gusdhc6,, ,1
linksys etherfast4116 16-port 10/100 ethernet switch ef4116,sony 46 ' bravia xbr series black lcd flat panel hdtv kdl46xbr6 1920 x 1080 full hd 1080p resolution digital media extender ( dmex ) bravia engine ii technology advanced contrast enhancer ( ace ) 24p true cinema 120hz refresh rate with dejudder processing bottom-mounted speaker black finish, ,linksys etherfast ef4124 ethernet switch,, ,1
canon deluxe black digital camera case 2595b002,delonghi magnifica super-automatic espresso/coffee machine esam3300 stainless-steel removable double boiler instant reheat removable water tank and bean container integrated burr grinder cappuccino system cup tray silver finish, ,canon nb-5l lithium-ion digital camera battery 1135b001,, ,1
canon black leather case 3528b001,speck seethru orange hard shell case for 15 ' macbook mb15orgseev2 translucent hard plastic shell gives great protection full access to all controls rubber feet for added support orange finish, ,canon psc-55 deluxe leather camera case 1588b001,, ,1
uniden dect 6.0 cordless digital answering system dect20802,"canon pg-40 black ink cartridge twin pack pg40tbk compatible with canon fax-jx200 , pixma ip1600 , pixma ip1700 , pixma ip6000d , pixma mp150 , pixma mp160 , pixma mp170 , pixma mp180 , pixma mp450 , pixma mp460 black ink", ,uniden dect 6.0 1.9 ghz cordless phone dect2080-2,, ,1
sony vaio cs series black notebook computer vgncs180jq,elgato mac eyetv hybrid 10020630 built-in program guide export clips and entire episodes to your video-capable ipod records digital tv, ,sony vaio cs180j/q notebook vgncs180j/q,, ,1
canon kp-36ip color ink & paper set 7737a001,"canon pg-40 black ink cartridge twin pack pg40tbk compatible with canon fax-jx200 , pixma ip1600 , pixma ip1700 , pixma ip6000d , pixma mp150 , pixma mp160 , pixma mp170 , pixma mp180 , pixma mp450 , pixma mp460 black ink",78.0 ,canon kp 36ip print cartridge paper kit 7737a001,,57.0 ,1
twenty20 vholdr mount adhesive 2200ma,"canon black rechargeable battery 9612a001 lithium-ion technology compatible with canon digital rebel xt and powershot s series digital cameras also compatible with canon elura series , optura series and zr series camcorders black finish",180.0 ,vholdr 2200 mount adhesive ( black ),,910.91 ,1
sony 60gb high definition hard disk drive handycam camcorder hdrsr11,"samsung dlp tv stand in black tr72bx designed to fit samsung hlt7288 hlt7288 , hl72a650 , and hl67a650 television sets tempered 6mm tinted glass shelves wide audio storage shelves to accommodate 4 or more components wire management system easy to assemble high gloss black finish", ,sony handycam hdr-sr12 high definition digital camcorder hdrsr12,, ,1
apple 120gb black 7th generation ipod classic mb565lla,panasonic sr-na18 white deluxe fuzzy logic rice cooker srna18 compact design advanced fuzzy logic technology 8 menu settings non-stick coated pan with dimpled bottom 24-hour clock 12-hour keep warm feature white finish, ,applecare for ipod touch or ipod classic mb591ll/a,, ,1
sanus 13 ' 30 ' flat panel tv black wall mount vm1b,sony hd-handycam 3 meters ( 10 feet ) hdmi mini cable vmc30mhd gold plating plug hdmi-compliant high speed category 2 cable support full hd 1080p digital audio transfer 3 meters ( 10 feet ) black finish, ,sanus flat panel tv wall mount vmf,, ,1
canon black photo ink cartridge cli8b,panasonic black blu-ray disc theater sound system scbt100 full audio codec for blu-ray disc full-hd 1080p virtual 7.1 channel surround with 5 speakers integrated universal dock for ipod on-screen display for ipod music menu ipod video playback sd memory card slot powerful bass sound ` kelton subwoofer ' ` bamboo diaphragm ' center and front speakers wireless rear speaker system whisper-mode surround black finish, ,canon pgi-5bk black ink cartridge 0628b002,, ,1
sony black 13.6 megapixel cyber-shot digital camera dscw300,sony hd-handycam 3 meters ( 10 feet ) hdmi mini cable vmc30mhd gold plating plug hdmi-compliant high speed category 2 cable support full hd 1080p digital audio transfer 3 meters ( 10 feet ) black finish, ,sony cyber-shot dsc-w170 digital camera red dscw170r,, ,1
panasonic dect 6.0 black expandable digital cordless phone kxtg9361b,applecare protection plan for ipod touch or ipod classic mb591lla extends your service coverage to up to two years includes both phone and in store techinical support, ,panasonic kx-tg1034s dect 6.0 cordless phone kx-tg1034s,, ,1
sony progressive scan silver dvd player dvpns57ps,sony scph-98046 playstation 3 blu-ray dvd remote control 711719804604 full access to the playstation 3 systems disc features can be used without having to point directly at the system,119.0 ,sony dvpns57p dvd player dvpns57ps,,499.0 ,1
logitech digital precision pc gaming headset 981000040,toshiba 40 ' black flat panel lcd hdtv 40rv525u 1080p full hd ( 1920 x 1080 ) cinespeed display dynalight dynamic backlight control ntsc/atsc/qam built-in tuners 10-bit video processor 60hz video scan rate 3:2 pull-down cinema mode 24fps color temperature control black finish,69.99 ,logitech digital precision pc gaming headset 981-000040,,46.93 ,1
apple usb power adapter mb352llb,nikon black 13.5 megapixel coolpix digital camera coolpixp6000bk 13.5 effective megapixels 4x zoom-nikkor lens 2.7 ' high-resolution wide-viewing angle lcd monitor optical lens shift vr image stabilization wired lan connectivity built-in gps unit wireless remote control in-camera red-eye fix d-lighting black finish,249.0 ,usb power adapter accs mb352ll/b,,169.0 ,1
sony bravia wireless home theater system in black davhdx576wf,denon semi-automatic turntable dp29f metal platter built-in riaa equalizer dc servo motor 2 speed 33 + 45 rpm built-in phono preamp, ,sony bravia dav-hdx576wf home theater system,, ,1
canon ef 75-300mm f/4 -5.6 iii telephoto zoom lens 6473a003,"apple 16gb black 2nd generation ipod touch mb531lla holds up to 3,500 songs in 128-kbps aac format , 20,000 ipod-viewable photos and 20 hours of video wi-fi ( 802.11 b/g ) nike + ipod support built-in maps location-based service 3.5 ' ( diagonal ) widescreen multi-touch display 480x320-pixel resolution 480p and 576p component tv out mac and windows compatible black finish", ,canon ef-s 55-250mm f/4 -5.6 is telephoto zoom lens 2044b002,, ,1
apple macbook pro 2.53 ghz intel core 2 duo silver notebook computer mb471lla,"denon x-space surround bar home theatre system in black dhtfs3 22 watts x 5 ( 6 ohms ) supports all audio formats ( dolby digital , dts , dolby pro logic ii ) slim design includes dolby headphones included subwoofer features one-touch connection remote control black finish",329.0 ,apple macbook pro notebook mb471ll/a,,635.0 ,1
sony red cyber-shot digital camera dscw170r,denon stereo tuner tu1500rd rds radio data system am-fm 40 station random memory rotary tuning knob dot matrix fl display optional remote, ,sony handycam dcr-sr45 digital camcorder dcrsr45,, ,1
samsung minidv digital camcorder scdc382,"directed 50ft extension cable 14230 built-in signal amplifier smb connector indoor/outdoor use for home , rvs and boat black finish", ,samsung nv30 digital camera silver ec-nv30zsba / us,, ,1
sony digital slr camera with lens kit dslra200w,whirlpool cabrio wtw6400sw top loading white washer wtw6400swh 4.5 cu . ft. capacity direct inject wash system 6th sense technology care control temperature management ultra quiet wash noise reduction stainless steel wash drum 10 automatic cycles woolmark certified wool cycle automatic water level settings white finish,499.0 ,sony alpha dslr-a350k digital slr camera with 18-70mm zoom lens black dslra350k,,329.0 ,1
sony bravia wireless home theater system in black davhdx576wf,"sony 52 ' bravia w-series black lcd flat panel hdtv kdl52w4100 1920 x 1080 full hd resolution dmex motionflow 120hz technology advanced contrast enhancer ( ace ) bravia sync technology 24p true cinema 30,000:1 dynamic contrast ratio 3d comb filter cinemotion reverse 3:2 pulldown technology black finish", ,sony bravia dav-hdx576wf home theater system,, ,1
sony digital slr camera with lens kit dslra200w,"sony black usb stereo turntable system pslx300usb transfer classic vinyl to pc , walkman , or mp3 player usb and rca audio output 45 rpm record playback belt drive system dust cover black finish", ,sony alpha dslr-a200 digital slr camera with dual lens kit dslra200w,, ,1
panasonic dect 6.0 silver digital cordless handset kxtga630s,ge platinum hdtv millennium tv antenna tv24734 vhf/uhf 34 ' dipoles for vhf reception 130 degree swivel uhf loop low-profile storage, ,panasonic kx-tga820b cordless handset,, ,1
sony alpha digital slr black camera body dslra350,canon deluxe black digital camera case 2595b002 soft nylon case flip-down cover belt loop attachment for hands-free convenience compatible with canon powershot a series black finish,99.99 ,sony alpha dslr-a350 digital slr camera dslra350,,18.99 ,1
olympus ds40 digital voice recorder ds40r,"sony vaio vgp-prsz1 sz series docking station vgpprsz1 compatible with sz series notebooks expand connectivity to your notebook 3 usb 2.0 , gigabit ethernet , vga , dvi-d and dc in black finish", ,olympus fe-370 digital camera silver 226420,, ,1
sony red cyber-shot digital camera dscw150r,"logitech harmony one advanced universal remote control harmony1 one-touch access to your entertainment replaces up to 15 remotes full-color touch screen sculpted , backlighted buttons in logical zones ergonomic design rechargeable guided online setup world?s largest av control database/915 -000035", ,sony cyber-shot dsc-w150 digital camera silver dscw150,, ,1
samsung s2 white 1gb flash mp3 player yps2zw,canon vixia high definition camcorder hf10 2.7 ' color widescreen lcd 12x hd video zoom lens 3.3 megapixel digic dv ii image processor 200x digital zoom built in 16 gb memory sd card slot for expanded memory rgb primary color filter built-in electronic lens cover,49.0 ,samsung yp-s2zw 1gb flash mp3 player yp-s2zw / xaa,,229.0 ,1
canon ef 75-300mm f/4 -5.6 iii telephoto zoom lens 6473a003,sanus sc1a black visionmount series ceiling mount for small lcd flat panels sc1ab fits most 13 ' 26 ' lcd flat panel televisions vesa compatible tv bracket smoothlock technology built-in wire management system 50 lbs capacity black finish, ,nikon nikkor 70-300mm f/4 .5 -5.6 g ed-if af-s vr telephoto zoom lens 2161,, ,1
denon black avr-1609 home theater surround sound receiver avr1609,"sony 52 ' bravia v-series 1080p lcd flat panel hdtv kdl52v4100 1920 x 1080 full hd resolution digital media extender ( dmex ) advanced contrast enhancer ( ace ) 24p true cinema 25,000:1 dynamic contrast ratio mpeg noise reduction 3d comb filter cinemotion reverse 3:2 pulldown technology black finish", ,denon avr-1609 a/v receiver avr1609,, ,1
sony universal remote commander remote control rmv310,maytag jetclean ii mdb7851aw black undercounter dishwasher mdb7851bk 14-piece place setting oversize capacity plus steamclean option stainless steel tub interior dark duraguard adjustable and removable nylon rack quietseries 300ss sound package automatic temperature control 5 wash levels high pressure spray jets ventless dry system precision clean turbidity sensor control lockout energy star qualified nsf certified black finish,299.95 ,sony learning remote control rmvl600,,79.99 ,1
canon dvd camcorder dc320,sony 2gb memory stick pro duo mark 2 media card msmt2g 160 mbps transfer speed 1.85 gb actual capacity,499.0 ,canon dc310 digital camcorder 2694b001,,448.0 ,1
panasonic dect 6.0 silver digital cordless handset kxtga630s,tomtom one xl 330s car gps navigation system 1eg005201 4.3 ' lcd anti-glare touch screen pre-installed maps internal lithium-ion battery car speed linked volume automatic day/night mode quickgpsfix text-to-speech included,319.0 ,panasonic kx-tga630s cordless handset,,139.94 ,1
sanus 15 ' 37 ' visionmount full-motion flat panel tv black wall mount mf215b1,panasonic kx-tga820b black dect 6.0 cordless handset kxtga820b compatible with dect kx-tg8231 / 8232 series phone systems dect 6.0 technology answering system with compatible base unit call waiting caller id join in/privacy full color backlit lcd display black finish,46.0 ,sanus visionmount tilting flat panel tv wall mount mt25-b1,,1698.0 ,1
denon stereo tuner tu1500rd,panasonic black dvd home theater sound system scpt760 kelton subwoofer bamboo diaphragm center speakers 1080p up-conversion integrated universal dock and on-screen display for ipod ipod video playback wireless rear speaker system whisper-mode surround built-in dolby digital and dts decoder high speed 5-dvd/cd changer black finish, ,denon tu-1500rd stereo radio tuner tu1500rd,, ,1
danby white countertop dishwasher ddw497wh,"canon deluxe burgundy leather case 2350b001 genuine leather case designed for the powershot sd770 is , sd1100 and sd1000 burgundy finish", ,danby ddw497w countertop dishwasher,, ,1
panasonic 5.8 ghz black expandable digital cordless phone system kxtg4323b,"yamaha rx-v363bl 5.1 channel digital home theater receiver in black rxv363bk 500 watts powerful surround sound ( 100w x 5 ) ipod and bluetooth audio compatibility dolby digital , dts and dolby pro logic ii decoding cinema dsp with 8 dsp programs compressed music enhancer 192khz/24-bit dacs for all channels remote control black finish", ,panasonic kx-tg9361b expandable digital cordless phone,, ,1
blueant black bluetooth headset z9i,"samsung dlp tv stand in black tr72bx designed to fit samsung hlt7288 hlt7288 , hl72a650 , and hl67a650 television sets tempered 6mm tinted glass shelves wide audio storage shelves to accommodate 4 or more components wire management system easy to assemble high gloss black finish", ,blueant wireless z9i bluetooth headset black us-091010,, ,1
canon black leather camera case 1588b001,"samsung 63 ' black flat panel series 6 plasma hdtv pn63a650 1920 x 1080 full hd resolution 1,000,000:1 dynamic contrast ratio dnie pro picture-in-picture srs trusurroundxt ultra filterbright anti glare filter 100,000 hour panel life touch of color atsc/ntsc/clear qam built-in tuner black with red finish", ,canon black ink cartridge 0615b002,, ,1
speck seethru black hard shell case for 13 ' macbook mb13blkseev2,netgear prosafe 24 port smart switch fs726tp two gigabit ports plus easy browser prosafe network management software web based smart management features,719.0 ,speck products seethru case for apple macbook air mba-pnk-see,,369.0 ,1
sony dvd-r recordable camcorder media 3dmr30l1h,sennheiser rechargeable nickel-metal hydride battery ba151 rechargeable battery for wireless sennheiser headphones, ,sony mini dvd-r media 3dmr30l1h,, ,1
sony vaio black usb docking station vgpupr1,motorola portable bluetooth car kit speaker phone t305 2.0 bluetooth wireless technology noise cancellation technology loud sound high speaker output convenient multi-function button up to 14 hours of talk time and 14 days of standby time mini-usb connector black finish, ,sony vaio sz series docking station vgpprsz1,, ,1
panasonic black dvd home theater sound system scpt660,"belkin cush top for computer laptop f8n044org uniquely designed soft material for comfortable laptop use on the couch , bed , or floor convenient storage pocket center multi-sides accommodate any side laptop 6 colors to choose from orange finish", ,panasonic sc-pt660 home theater system,, ,1
canon deluxe black digital camera case 2595b002,sony black component home theater system ht7200dh 900 watts 5.1 channels hdmi 1080p output dvd player hdmi active intellegence av receiver 5 satellite speakers xm ready black finish, ,canon psc-4000 deluxe leather case n 3528b001,, ,1
applecare protection plan for ipod touch or ipod classic mb591lla,yamaha high performance subwoofer ystfsw100bk 130 watts dynamic power advanced yst ii ( yamaha active servo technology ) half pipe port powerful 6.5 ? multi-range driver magnetically shielded 16hz ultra low frequency reproduction slim design black finish,44.99 ,applecare for ipod touch or ipod classic mb591ll/a,,9.99 ,1
transcend 8gb micro secure digital memory card ts8gusdhc6,"samsung 22 ' black flat panel series 6 lcd hdtv ln22a650 1680 x 1050 true 720p resolution 5,000:1 dynamic contrast ratio srs trusurround xt built-in digital tuner ( atsc/clear qam ) wide color enhancer 8ms response time touch of color design black with red finish", ,transcend 2gb microsd card ts2gusd,, ,1
