ltable_name,ltable_description,ltable_price,rtable_name,rtable_description,rtable_price,Truth
panasonic dect 6.0 black metallic expandable digital cordless phone system kxtg9332t,canon vixia 120gb high definition hard disc drive black camcorder hg21 1920 x 1080 full hd recording record hd video directly to sdhc memory cards genuine canon 12x hd video lens 3.3 megapixel hd cmos image sensor digic dv ii image processor superrange optical image stabilization instant af 24mbps recording 24p cinema mode 30p progressive mode 2.7 ' multi-angle vivid widescreen lcd 3.1 megapixel photos microphone terminal with manual audio level control black finish,369.0 ,panasonic kx-tg9361b expandable digital cordless phone,,376.96 ,1
sharp aquos 37 ' lcd hdtv in black lc37d44u,"linksys dual-band wireless-n usb network adapter wusb600n high-speed wireless-n ( draft 802.11 n ) networking mimo technology operates in the 2.4 and 5ghz radio bands connects to wireless-g , b and a networks", ,sharp aquos lc-37d64u 37 ' lcd tv,, ,1
garmin vehicle suction cup mount 0101093600,sony 30gb handycam hard disk drive camcorder dcrsr45 1/8 ' advanced had ccd imager 40x optical/2000x digital zoom 2.7 ' wide ( 16:9 ) touch panel clear photo lcd plus display hybrid recording to hard disk drive or memory stick media built-in zoom microphone with 5.1 ch recording carl zeiss vario-tessar lens usb 2.0 interface super nightshot infrared system, ,garmin suction cup mount 010-10815-00,, ,1
canon pixma mx700 multifunction printer mx700c,"nikon enel3e rechargeable li-ion battery 25334 compatible d700 , d200 , d80 , d300 , d90 nikon digital cameras", ,canon pixma ip2600 inkjet photo printer 2435b002,, ,1
sony vaio cs series black notebook computer vgncs180jq,sanus 9 ' 17 ' visionmount series under cabinet flat panel tv silver wall mount vmuc1s tilting motion swivels left and right universal mounting bracket easy to install silver finish, ,sony vaio ns190j/s notebook vgnns190j/s,, ,1
sanus 13 ' 30 ' flat panel tv black wall mount vm1b,monster ps3 hdmi-2m playstation 3 gamelink hdmi digital video/audio cable ps3hdmi2m duraflex jacket all-in-one digital av cable 24k gold contacts, ,sanus flat panel tv wall mount vm1b,, ,1
sony silver digital voice recorder icdb600,"at & t aliph jawbone ii silver bluetooth headset jawbone2s voice activity sensor magnetic usb and wall charger includes 4 different ear loops and 3 ear buds over 4 hours talk time and 8 days standby time supports bluetooth 1.1 , 1.2 and 2.0 silver finish", ,canon fs10 digital camcorder 2686b001,, ,1
sony 8 ' black lcd digital photo frame dpfd80,sony vaio rt series black all-in-one desktop computer vgcrt150y 2.66 ghz intel core 2 quad q9400 processor 8gb memory built-in compactflash media slot 1tb serial ata hard drive 25.5 ' xbrite-full hd lcd integrated stereo a2dp bluetooth technology 6mb l2 cache microsoft windows vista ultimate 64-bit black finish, ,sony dpfd70 digital photo frame,, ,1
sony lcs-csq/b black soft carrying case lcscsqb,panasonic nn-sd667s countertop microwave oven in stainless steel nnsd667ss 1.2 cubic foot 1250 watts high power 10 power levels 5 cooking stages quick minute easy-to-use pop-out dial one-touch sensor cooking inverter turbo defrost multi-lingual menu action screen popcorn key stainless steel finish, ,sony lcs soft carrying case lcscst,, ,1
transcend 4gb secure digital high-capacity ( sdhc ) class 6 memory card ts4gsdhc6,sony 46 ' bravia xbr series black lcd flat panel hdtv kdl46xbr6 1920 x 1080 full hd 1080p resolution digital media extender ( dmex ) bravia engine ii technology advanced contrast enhancer ( ace ) 24p true cinema 120hz refresh rate with dejudder processing bottom-mounted speaker black finish,49.99 ,transcend 8gb secure digital high capacity ( sdhc ) card class 6 ts8gsdhc6,,910.91 ,1
canon ef 75-300mm f/4 -5.6 iii telephoto zoom lens 6473a003,"lg 52 ' black lcd flat panel hdtv 52lg50 full hd 1080p resolution 15,000:1 dynamic contrast ratio three hdmi v. 1.3 with deep color intelligent sensor av mode clear voice lg simplink connectivity invisible speaker system usb 2.0 black finish", ,nikon nikkor 70-300mm f/4 .5 -5.6 g ed-if af-s vr telephoto zoom lens 2161,, ,1
toshiba xde black 1080p upconversion extended detail dvd player xde500,tripp-lite pv375 powerverter 375-watt ultra-compact inverter pv375 12v dc input 120v ac output 2 outlets 375 watts continuous output 600 watts peak output convenient cigarette lighter plug, ,toshiba xd-e500 upconversion dvd player,, ,1
samsung 61 ' black dlp projection hdtv hl61a650,canon deluxe black digital camera case 2595b002 soft nylon case flip-down cover belt loop attachment for hands-free convenience compatible with canon powershot a series black finish, ,samsung 6 series hl56a650 56 ' projection tv,, ,1
tripp-lite pv375 powerverter 375-watt ultra-compact inverter pv375,sony remote control tripod vct60av a/v remote connector 4 stage leg extension extends from 18.9 ' to 57.6 ' in height guide frame feature available vertical position supplied carrying case black finish, ,tripp lite powerverter 375-watt ultra-compact inverter pv375,, ,1
sony white 8 ' portable dvd player dvpfx820w,"twenty20 vholdr mount adhesive 2200ma removable resists water , heat and cold", ,toshiba sd-p71s portable dvd player,, ,1
canon kp-36ip color ink & paper set 7737a001,escort passport 9500ix radar detector 9500ix pre-loaded with thousands of saftey camera locations 360 degree radar & laser protection completely undetectable to all detector scanners variable-speed radar performance gps-powered truelock filter autolearn feature speed alert crystal-clear voice alerts 80 led matrix blue display 5 levels of brightness control black finish, ,canon kp 36ip print cartridge paper kit 7737a001,, ,1
panasonic dect 6.0 silver expandable digital cordless phone system kxtg9332s,lacie 1tb usb 2.0 external hard drive 301304u up to 480mbits/s ( 60mb/s ) interface transfer rate smart fanless cooling system for quiet operation blue led for ambient underside glow 8mb cache compatible with windows and mac,159.95 ,panasonic kx-tg9361b expandable digital cordless phone,,14.95 ,1
panasonic 5.8 ghz black expandable digital cordless phone system kxtg4323b,"denon x-space surround bar home theatre system in black dhtfs3 22 watts x 5 ( 6 ohms ) supports all audio formats ( dolby digital , dts , dolby pro logic ii ) slim design includes dolby headphones included subwoofer features one-touch connection remote control black finish", ,panasonic kx-tg9361b expandable digital cordless phone,, ,1
apple macbook pro 2.53 ghz intel core 2 duo silver notebook computer mb471lla,tripp-lite pv375 powerverter 375-watt ultra-compact inverter pv375 12v dc input 120v ac output 2 outlets 375 watts continuous output 600 watts peak output convenient cigarette lighter plug,29.99 ,apple macbook pro notebook mb470ll/a,,910.91 ,1
sony dvp-fx820 black 8 ' portable dvd player dvpfx820,yamaha nx-u10 silver usb powered stereo speaker nxu10sil 20 watts output power powerstorage circuit sr-bass ( swing radiator bass ) technology magnetic shielding mac and windows compatible silver finish,49.99 ,sony dvp-nc800h / s dvd player dvp-nc800hs,,910.91 ,1
transcend jetflash v10 16gb usb flash drive ts16gjfv10,coby black 15 ' widescreen flat panel lcd hdtv tftv1514 15.4 ' tft lcd color display dual atsc/ntsc tuners av input jacks 15-pin vga interface full-range stereo speakers v-chip parental control closed-caption electronic program guide multi-language on-screen display black finish, ,transcend 16gb jetflash usb flash drive ts16gjfv10,, ,1
sony soft camera carrying case lcsmx100,sennheiser rechargeable nickel-metal hydride battery ba151 rechargeable battery for wireless sennheiser headphones, ,sony lcs soft carrying case lcscst,, ,1
panasonic dect 6.0 silver digital cordless handset kxtga630s,"universal mrf-350 rf black base station mrf350 no more pointing rf addressable ir routing expand operating range up to 100 feet compatible with mx-3000 , tx-1000 , mx-950 and mx-900 only black finish", ,panasonic kx-tga630s cordless handset,, ,1
canon ef 75-300mm f/4 -5.6 iii telephoto zoom lens 6473a003,sony vaio cs series pink notebook computer vgncs180jp 2.26 ghz intel core 2 duo processor p8400 14.1 ' ( 1280 x 800 ) xbrite-eco widescreen display 320gb serial ata 5400rpm hard drive built-in 1.3 megapixel motion eye camera and microphone 4gb pc2-6400 ( 2gbx2 ) installed memory integrated stereo a2dp bluetooth 1066mhz front side bus speed 3mb l2 cache blu-ray drive ( read only ) genuine microsoft windows vista home premium 64-bit pink finish, ,nikon nikkor 70-300mm f/4 .5 -5.6 g ed-if af-s vr telephoto zoom lens 2161,, ,1
panasonic dect 6.0 black expandable digital cordless phone kxtg9361b,"omnimount tv top shelf mount cch1p tv top shelf mount for crt , lcd & dlp tvs platinum finish", ,panasonic kx-tg9391t dect 6.0 two-line corded/cordless phone combo kx-tg9391t,, ,1
canon photo ink cartridge cl52,"apple 8gb black 2nd generation ipod touch mb528lla holds up to 1,750 songs in 128-kbps aac format , 10,000 ipod-viewable photos and 10 hours of video wi-fi ( 802.11 b/g ) nike + ipod support built-in maps location-based service 3.5 ' ( diagonal ) widescreen multi-touch display 480x320-pixel resolution 480p and 576p component tv out mac and windows compatible black finish", ,canon cli-8pc photo cyan ink cartridge 0624b002,, ,1
lacie little disk 250gb black portable hard drive 301278,sirius siriusconnect vehicle kit in black scvdoc1 compact design compatible with the next generation of siriusconnect interface adapters 3 interchangeable adapter plates black finish, ,lacie d2 quadra hard drive 301825u,, ,1
canon photo ink cartridge cl52,"samsung s2 green 1gb flash mp3 player yps2zg super compact pebble shape design supports mp3 , wma and ogg 1 gb internal flash memory multi-color led light effects embedded easy-to-use playback controls dnse 2.0 enabled usb connection up to 13 hours of playback green finish", ,canon cli-8pm photo magenta ink cartridge 0625b002,, ,1
canon deluxe black digital camera case 2595b002,"canon yellow ink cartridge cli8y compatible with the pixma ip4200 , ip5200 , ip5200r , ip6600d , mp500 , mp800 printers", ,canon dc320 digital camcorder 2691b001,, ,1
apple usb modem white finish ma034za,tech craft avalon series tv stand swp48 48 ' wide credenza for flat panel tvs and dlps 260 lbs tv weight capacity 50 lbs shelf weight capacity wood veneer finish,150.0 ,apple v. 92 data/fax usb modem ma034za,,35.0 ,1
sony digital slr camera with lens kit dslra200w,linksys wireless-g internet home monitoring camera wvc54gca sends high-quality live audio and video to your network wirelessly viewable from most web browsers anywhere in the world built-in video stream encoder and stand-alone web server ( no pc necessary ) security mode supports mpeg-4 and mjpeg video at up to 640x480 up to four simultaneous remote users, ,sony alpha dslr-a350 digital slr camera dslra350,, ,1
logitech harmony one advanced universal remote control harmony1,"delonghi twenty four seven coffee maker dc50b 4-cup capacity easy-access , washable filter basket black finish", ,logitech harmony one advanced universal remote control 915-000035,, ,1
nyko playstation 3 chargelink usb charging cable 743840830009,canon pgi-5bk black ink tank cartridge pgi5bk smudge resistant resists smearing caused by highlighters smudge resistant pigment ink formulation for long lasting prints, ,playstation 3 chargelink usb charging cable by nyko 83000,, ,1
lacie 2tb ethernet big disk external hard drive 301239u,canon ef-s 55-250mm f/4 -5.6 is telephoto zoom lens 2044b002 55-250mm focal length f/4 -5.6 maximum aperture optical image stabilizer technology 4-stop stabilization correction ud-glass lens element gear-driven focus adjustment black finish, ,lacie d2 quadra hard drive 301825u,, ,1
panasonic countertop microwave oven in black nnsn667bk,"sony dvd-r recordable camcorder media 3 pack 3dmr30l1h 30 minute , 1.4 gb accucore technology store digital video , audio and multimedia files 3 pack",24.99 ,panasonic nnsn667w 1.2 cu . ft. countertop microwave oven in white,,199.99 ,1
sony bravia wireless home theater system in black davhdx576wf,olympus pink 8 megapixel digital camera fe360pnk face detection digital image stabilization li-ion rechargeable battery 8.0 megapixels 3x zoom 2.5 ' lcd 20 shooting modes pink finish, ,sony bravia dav-hdx576wf home theater system,, ,1
apple usb modem white finish ma034za,sony scph-98046 playstation 3 blu-ray dvd remote control 711719804604 full access to the playstation 3 systems disc features can be used without having to point directly at the system, ,apple v. 92 data/fax usb modem ma034za,, ,1
sennheiser rf wireless headphones rs140,belkin f3h982-25 black 25 ft pro series high integrity vga/svga monitor replacement cable f3h98225 constructed of 3 coaxial and 5 twisted pair cable compatible with the pc aluminum undermold shield double shielding gold plated copper contacts, ,sennheiser rs 130 wireless headphone rs130,, ,1
logitech harmony one advanced universal remote control harmony1,sony vaio rt series black all-in-one desktop computer vgcrt150y 2.66 ghz intel core 2 quad q9400 processor 8gb memory built-in compactflash media slot 1tb serial ata hard drive 25.5 ' xbrite-full hd lcd integrated stereo a2dp bluetooth technology 6mb l2 cache microsoft windows vista ultimate 64-bit black finish, ,logitech harmony one advanced universal remote control 915-000035,, ,1
canon 2gb sd secure digital card 3505b001,nikon 55-200mm zoom-nikkor lens accessory 2156 3.6 x zoom 55 200mm silent wave motor two ed glass elements focus mode switch, ,canon dc320 digital camcorder 2691b001,, ,1
sony dvp-fx820 black 8 ' portable dvd player dvpfx820,sanus wms3b black small speaker wall mount wms3b holds up to an 8 pound speaker multiple pivot points weather resistant for indoor/outdoor use black finish priced per pair, ,sony dvp-fx820 portable dvd player dvpfx820,, ,1
danby white countertop dishwasher ddw497wh,kenwood sirius radio translator for in-dash head units kcasr50 provides full control of the sirius radio displays text on the stereo and supplies power to the satellite radio, ,danby ddw497w countertop dishwasher,, ,1
canon dvd camcorder dc320,canon pgi-5bk black ink tank cartridge pgi5bk smudge resistant resists smearing caused by highlighters smudge resistant pigment ink formulation for long lasting prints, ,canon dc310 digital camcorder 2694b001,, ,1
sony bravia wireless home theater system in black davhdx576wf,vmware fusion 2 for mac vmfm20bx2 run windows side-by-side with mac os x without rebooting 3d and high definition video acceleration usb device support multiple display support seamless keyboard mapping embedded antivirus and antispyware protection mac os x leopard integration boot camp support multiple cpu virtual machines, ,sony bravia dav-hdx576wf home theater system,, ,1
linksys wireless-g range expander wre54g,canon dvd camcorder dc320 image stabilization widescreen hr recording 2.7 ' lcd screen smooth zoom control built-in lens cover 9 digital effects/9 fades 21 selectable display languages 37x optical/2000x digital zoom silver finish, ,linksys g wireless-g wet54g wireless bridge,, ,1
canon pgi-5bk black ink tank cartridge pgi5bk,tomtom gps mount and usb car charger 9n00101 extra holder and car charger convenient for multi-vehicles user no need to transfer holder from one car to another easy installation compatible with tomtom one black finish, ,canon pgi-5bk black ink cartridge 0628b002,, ,1
panasonic 5.8 ghz black expandable digital cordless phone system kxtg4323b,polk audio csi a6 black center channel loudspeaker csia6bk dual 6-1/2 ' mid/woofers 1 ' silk/polymer dome tweeter dual rear powerport bass venting magnetic shielding mylar bypass capacitors acoustic resonance control ( arc port ) technology dual bi-ampable gold-plated 5-way binding post inputs butyl rubber surrounds floating anti-diffraction grilles all-mdf construction black finish sold as a single, ,panasonic kx-tg9361b expandable digital cordless phone,, ,1
sanus 13 ' 30 ' flat panel tv black wall mount vm1b,logitech white v470 cordless laser mouse for apple notebooks 910000692 laser precision side-to-side scrolling plus zoom bluetooth wireless technology protective pouch battery life indicator white finish, ,sanus flat panel tv wall mount vm1b,, ,1
panasonic dect 6.0 black expandable digital cordless phone kxtg9361b,escort passport 9500ix radar detector 9500ix pre-loaded with thousands of saftey camera locations 360 degree radar & laser protection completely undetectable to all detector scanners variable-speed radar performance gps-powered truelock filter autolearn feature speed alert crystal-clear voice alerts 80 led matrix blue display 5 levels of brightness control black finish, ,panasonic kx-tg9344t expandable digital cordless phone,, ,1
lacie little disk 320gb black portable hard drive 301829,toshiba black progressive scan dvd player sd4100 multiformat playback colorstream pro progressive scan component video outputs jpeg photo viewer slim chassis black finish, ,lacie usb 2.0 external hard drive 301302u,, ,1
garmin deluxe carrying case black finish 0101023101,"terk xm outdoor home antenna xm6 universal mounting roof , wall or mast for use with single-input receivers connects rg6 cable for easy routing up to 100 ft. ( optimal disatnce 75 ft. )", ,garmin canvas deluxe carry case 010-10231-01,, ,1
canon dvd camcorder dc320,"kingdom hearts ii video game for the sony ps2 662248904115 guide sora and friends in all-new locales based on disney films fight alongside classic final fantasy characters as well as modern disney heroes perform new character-specific double team attacks while battling enemies visit beasts castle , port royale , pride land , agrabah , halloween town , and more rated e for everyone 10 and older", ,canon fs11 digital camcorder 2685b001,, ,1
canon ef 75-300mm f/4 -5.6 iii telephoto zoom lens 6473a003,"sony black usb stereo turntable system pslx300usb transfer classic vinyl to pc , walkman , or mp3 player usb and rca audio output 45 rpm record playback belt drive system dust cover black finish", ,canon ef 75-300mm f/4 -5.6 iii telephoto zoom lens 6473a003,, ,1
sony 7.1 channel black a/v receiver strdg820,canon silver dual flash memory camcorder fs11 16gb internal flash drive sdhc card slot built-in electronic lens cover wireless remote control 2.7 ' widescreen lcd 1.07 megapixel ccd image sensor 48x advanced zoom moonstone silver finish, ,sony str-dg820 a/v receiver strdg820,, ,1
omnimount wall speaker mount 20wlwh,sony 400 disc megastorage cd changer cdpcx455 mp3 playback capability cd-r/cd-rw playback twin jog dial for easy disc access megachanger control optical digital output keyboard input remote commander ® remote control,29.99 ,omnimount universal wall speaker mounting kit 20.0 wall-b,,299.0 ,1
logitech quickcam communicate stx 961464,"samsung 22 ' black flat panel series 6 lcd hdtv ln22a650 1680 x 1050 true 720p resolution 5,000:1 dynamic contrast ratio srs trusurround xt built-in digital tuner ( atsc/clear qam ) wide color enhancer 8ms response time touch of color design black with red finish", ,logitech quickcam vision pro webcam 960-000254,, ,1
sony silver cyber-shot digital camera dscw150,sony vaio lv series silver all-in-one desktop computer vgclv140j 2.53 ghz intel core 2 duo e7200 processor 4gb memory built-in 1.3 mp motion eye camera and microphone 320gb serial ata hard drive 24 ' xbrite-full hd lcd integrated stereo a2dp bluetooth technology two built-in 5.5 watt stereo speakers microsoft windows vista home premium 64-bit silver finish, ,sony alpha dslr-a350 digital slr camera dslra350,, ,1
sony dslr-a350 digital camera and 18-70mm zoom lens dslra350k,transcend 4gb secure digital high-capacity ( sdhc ) class 6 memory card ts4gsdhc6 fully compatible with sd 2.0 standards compatible with all sdhc-labeled host devices plug-and-play operation built-in error correcting code mechanical write-protection switch, ,sony alpha dslr-a350 digital slr camera dslra350,, ,1
canon black leather camera case 1588b001,mitsubishi 835 diamond series 65 ' 1080p dlp rear projection hdtv wd65835 1920 x 1080 full hd resolution 6-color processor smooth 120hz x.v.color plush1080p 12-bit digital video processing color 4d video noise reduction 3d ready netcommand deepfield imager black finish, ,canon black ink cartridge 0615b002,, ,1
canon ef 75-300mm f/4 -5.6 iii telephoto zoom lens 6473a003,speck seethru aqua hard shell case for 20 ' imac im20aqusee adds color and style to imac easy and safe to use totally removable case does not cover the screen or camera fits 20 ' widescreen imac aqua finish, ,canon ef-s 55-250mm f/4 -5.6 is telephoto zoom lens 2044b002,, ,1
canon 2gb sd secure digital card 3505b001,panasonic nn-sd667s countertop microwave oven in stainless steel nnsd667ss 1.2 cubic foot 1250 watts high power 10 power levels 5 cooking stages quick minute easy-to-use pop-out dial one-touch sensor cooking inverter turbo defrost multi-lingual menu action screen popcorn key stainless steel finish, ,canon dc320 digital camcorder 2691b001,, ,1
sony silver cyber-shot digital camera dscw150,onkyo black cd receiver system cs325 14 watts per channel wide range amplifier technology plays audio cds and mp3s mp3 settings 4-mode timer ipod compatible with ri dock super bass function battery free memory backup black finish,1999.0 ,sony handycam dcr-hc52 digital camcorder dcrhc52,,449.0 ,1
panasonic dect 6.0 black expandable digital cordless phone kxtg9361b,"twenty20 vholdr mount adhesive 2200ma removable resists water , heat and cold", ,panasonic kx-tg9361b expandable digital cordless phone,, ,1
yamaha rx-v363bl 5.1 channel digital home theater receiver in black rxv363bk,linksys etherfast4116 16-port 10/100 ethernet switch ef4116 16 autosensing 10/100 full duplex auto mdi/mdi-x ports run blazing speeds up to 200mbps address learning and aging and data flow control, ,yamaha rx-v363 home theater receiver rxv363bl,, ,1
yamaha 7.2 channel black digital home theater receiver rxv663bk,lg 30 ' stainless steel freestanding gas range lrg30357ss 5.0 cu . ft. capacity oven superboil burner 5 burner system smoothtouch controls warming drawer electronic ignition system one piece recessed cooktop self-cleaning oven stainless steel finish, ,yamaha rx-v663 home theater receiver rxv663bl,, ,1
logitech harmony one advanced universal remote control harmony1,"apple 120gb black 7th generation ipod classic mb565lla holds up to 30,000 songs in 128-kbps aac format , 25,000 ipod-viewable photos and 150 hours of video 2.5 ' ( diagonal ) color lcd with led backlight 320-by-240-pixel resolution mac and windows compatible black finish", ,logitech harmony one advanced universal remote control 915-000035,, ,1
bracketron ipod docking kit ipm202bl,"coby 7 ' black widescreen tft portable dvd cd mp3 player tfdvd7006 compact portable design 480 x 240 display resolution 16:9 widescreen tft color display dvd , dvd ± r/rw , cd , cd-r/rw , jpeg and mp3 compatible anti-skip circuitry dolby digital decoder digital and analog av outputs ntsc/pal video system black finish", ,bracketron ipod docking kit,, ,1
canon black ink cartridge pg50,peerless 42 ' 71 ' articulating flat panel tv silver dual wall arm mount plav70unlps anti-lockout feature prevents joint binding vertical adjustment snap-cover cord management and mesh cord sheaths 200 lbs load capacity silver finish, ,canon cli-8pc photo cyan ink cartridge 0624b002,, ,1
sony 46 ' bravia w-series black lcd flat panel hdtv kdl46w4100,lg dle3733w white xl capacity electric dryer dle3733wh 7.3 cu . ft. capacity lodecibel quiet system 7 drying programs 5 temperature levels upfront electronic control panel with dial-a-cycle drum light transparent door glass white finish, ,sony bravia w series kdl-52w4100 52 ' lcd tv kdl52w4100,, ,1
lg stainless steel freestanding electric range lre30757ss,sanus 13 ' 30 ' flat panel tv black wall mount vm1b tilt and swivel motion rigid extruded aluminum construction supports up to 50 lbs black finish, ,lg 5.6 cu.ft . freestanding electric range,, ,1
canon black photo ink cartridge cli8b,nintendo ds lite cobalt/black portable gaming system ndsusgbmkb dual 3 ' tft color lcd touchscreens slimmer design dual slot compatibility ( ds lite/game boy advance game paks ) twin ultra bright lcd screens up to 19 hours continuous gameplay nintendo wi-fi connection impressive 3d graphics dual stereo speakers cobalt and black finish, ,canon black ink cartridge 0615b002,, ,1
canon deluxe black digital camera case 2595b002,sony vaio aw series titanium grey notebook computer vgnaw110jh 2.26 ghz intel core 2 duo processor p8400 18.4 ' ( 1680 x 945 ) xbrite-eco widescreen display 320gb serial ata 5400rpm hard drive built-in 1.3 megapixel motion eye camera and microphone with face-tracking technology 4gb pc2-6400 ( 2gbx2 ) installed memory integrated stereo a2dp bluetooth blu-ray drive ( read only ) titanium grey finish, ,canon psc-4000 deluxe leather case n 3528b001,, ,1
canon ef 75-300mm f/4 -5.6 iii telephoto zoom lens 6473a003,"apple 120gb black 7th generation ipod classic mb565lla holds up to 30,000 songs in 128-kbps aac format , 25,000 ipod-viewable photos and 150 hours of video 2.5 ' ( diagonal ) color lcd with led backlight 320-by-240-pixel resolution mac and windows compatible black finish",69.99 ,nikon nikkor 70-300mm f/4 .5 -5.6 g ed-if af-s vr telephoto zoom lens 2161,,139.94 ,1
sharp aquos black blu-ray disc player bdhp50u,lg dle5955w white xl capacity electric dryer dle5955wh 7.3 cu . ft. capacity 9 drying programs 5 temperature levels precise temperature control with variable heat source flowsense duct clogging indicator upfront electronic control panel with dual led display and dial-a-cycle lodecibel quiet operation white finish,99.0 ,samsung bdp-1500 blu-ray dvd player bdp1500,,998.72 ,1
